"course_custom_id","assignment_custom_id","assignment_week","assignment_day","assignment_name","assignment_description","assignment_teachersNote","assignment_linksUrl","assignment_type","assignment_duration","assignment_graded"
"alveary-rechYrgUHG14HsexU","alveary-recipaxSFZQFyzaCM","1","1","15m General Science: Grade 2 - Lesson 1","<p>Looking for Ants Activity<br>⍞ Materials: Nature Journal</p><p>PREP: Read Teacher Tip</p><p>➜ INTRO<br>Today, you will look for ants!</p><p>➜ OBSERVE<br>Some good places to look are under small rocks, around logs, and in cracks. Use a stick to safely lift rocks. If you find ants, take some time to observe them. Use a magnifier if you have one. How many sections of the body can you see? From which do the legs come? Describe its antennae, jaws, and eyes. If you give it a drop of honey or a few crumbs, what does it do? If you find something else that you want to observe, you may take the time to do so. Spend about 10 minutes looking for ants.</p><p>➜ NARRATE &amp; DISCUSS<br>Use a nature journal to record what the student(s) noticed.</p><p>• Did you find ants? If so, describe their habitat. How does it provide food and shelter for them?</p>","<p>★ TEACHER TIP<br>If students seem anxious or unsure about their nature journal, teachers can encourage them by modeling, showing them many different examples, journaling in tandem, or serving as a scribe.</p><p>★ TEACHER TIP<br>If students find ants, this is a great opportunity for an object lesson. Questions are embedded in the lesson to help, as needed. If preferred, teachers can instead refer to the Handbook of Nature Study or allow questions to flow naturally between student and teacher.</p><p>★ TEACHER NOTE<br>If you haven't ordered your caterpillars yet, don't forget!</p>","","Lesson","0","FALSE"
"alveary-rechYrgUHG14HsexU","alveary-recd8rhMs9738iVLg","2","1","15m General Science: Grade 2 - Lesson 2","<p>Insects and Plants <br>⍞ Materials: Monarch and Milkweed</p><p>PREP: Read Teacher Tip</p><p>➜ INTRO<br>Look at the picture on the cover. What kinds of butterflies have you noticed before? What did they look like? Where were they?</p><p>➜ READ, NARRATE, &amp; DISCUSS<br>Monarch and Milkweed  (whole book)</p><p>• The meadow where the flowers grow might be a good habitat for a butterfly, but they might also fly to other habitats to find flowers, as well. A 'biome' is all of the living things that live together in a community in neighboring habitats. Can you think of some different habitats in our biome, where we live, where butterflies might be able to find food and shelter?</p><p>• NATURE NOTEBOOK<br>Prompt for General Science in Outdoor Work Quick Link.</p>","<p>★ TEACHER TIP<br>Let students enjoy the artwork in this picture book. If you need to take a break and finish it another time, that is fine.</p>","","Lesson","0","FALSE"
"alveary-rechYrgUHG14HsexU","alveary-reclpGwNbSAiFHh25","3","1","15m General Science: Grade 2 - Lesson 3","<p>Observing Caterpillars Activity<br>⍞ Materials: Nature Journal, caterpillars</p><p>PREP: Read Teacher Tip</p><p>➜ INTRO<br>Let's take a close look at our caterpillars today.</p><p>➜ OBSERVE<br>Spend about 10 minutes observing your caterpillars in their habitat today and plan to check on them every day to watch them change. What parts are you able to notice? What is the caterpillar doing?</p><p>➜ NARRATE &amp; DISCUSS<br>Use a nature journal to record what the student(s) noticed.</p><p>• Do you recall in what stage of the life cycle the caterpillar is?</p>","<p>★ TEACHER TIP<br>Raising butterflies provides many opportunities for object lessons on several stages of the insect's life over the next 2 weeks or so.</p>","","Lesson","0","FALSE"
"alveary-rechYrgUHG14HsexU","alveary-recqQThrWVj6e2KXC","4","1","15m General Science: Grade 2 - Lesson 4","<p>Observing Caterpillars or Pupae Activity<br>⍞ Materials: Nature Journal, caterpillars/pupae</p><p>PREP: Read Teacher Tip</p><p>➜ INTRO<br>Have you noticed if your caterpillars are changing?  Take a close look today!</p><p>➜ OBSERVE<br>Spend about 10 minutes observing your caterpillars or pupae today, and plan to check on them every day to watch them change. What do you notice today?</p><p>➜ NARRATE &amp; DISCUSS<br>Use a nature journal to record what the student(s) noticed.</p><p>• NATURE NOTEBOOK<br>Prompt for General Science in Outdoor Work Quick Link.</p>","<p>★ TEACHER TIP<br>The time that it takes for the butterflies to emerge will vary slightly, so enjoy them while you have them and release them based on the instructions that came with them.</p>","","Lesson","0","FALSE"
"alveary-rechYrgUHG14HsexU","alveary-recnSOofSMhlk3r0W","5","1","15m General Science: Grade 2 - Lesson 5","<p>Observing Pupae or Butterflies? Activity<br>⍞ Materials: Nature Journal, pupae/butterflies</p><p>➜ INTRO<br>How have your caterpillars changed this week?  Take a close look today.</p><p>➜ OBSERVE<br>Spend about 10 minutes observing your pupae or butterflies today, if you have not yet released them. What parts are you able to notice on the adult butterfly? What does the butterfly do when it emerges from the chrysalis? If you have released them already, then spend your time noticing wildflowers. What colors and shapes do you notice? Do ants, butterflies, or other insects visit them? If so, what do the insects look like? What are the insects doing?</p><p>➜ NARRATE &amp; DISCUSS<br>Use a nature journal to record what the student(s) noticed.</p><p>• Tell about what you recorded.</p><p>• NATURE NOTEBOOK<br>Prompt for General Science in Outdoor Work Quick Link.</p>","","","Lesson","0","FALSE"
"alveary-rechYrgUHG14HsexU","alveary-recNzT4BV0DvflDC4","6","1","15m General Science: Grade 2 - Lesson 6","<p>Planting Host Plants Activity<br>⍞ Materials: resource link, seeds/plants for local butterfly species, pot with soil or place in the garden, trowel, water</p><p>PREP: Read Teacher Tip</p><p>➜ ACTIVITY<br>Plant one or more flowers for your local butterflies. You may plant seeds or seedlings, depending on what is most appropriate for your season and location.</p>","<p>★ TEACHER TIP<br>To find out more about good host plants for your locale, ask your local nature preserve, conservancy, or state/national park, OR check out the resources at the link:<br>∞ Resource Link: Xerces Society</p>","https://planning.alveary.org/links.html?id=rechYrgUHG14HsexU&term=1&week=6","Lesson","0","FALSE"
"alveary-rechYrgUHG14HsexU","alveary-recNKT1bKDb96bzdm","7","1","15m General Science: Grade 2 - Lesson 7","<p>Wildflower Watching Activity<br>⍞ Materials: Nature Journal</p><p>PREP: Read Teacher Tip</p><p>➜ INTRO<br>Let's notice the wildflowers that are growing this season! Do you suppose that butterflies visit your wildflowers?</p><p>➜ OBSERVE<br>Spend about 10 minutes noticing which wildflowers are growing this season. What colors and shapes do you notice? How many petals do they have? How are the petals arranged? Do ants, butterflies, or other insects visit them? If so, what do the insects look like? How many different types or sizes of insects? What are the insects doing?</p><p>➜ NARRATE &amp; DISCUSS<br>Use a nature journal to record what the student(s) noticed.</p><p>• Do you notice anyone already familiar to you? Do you notice anyone new?</p>","<p>★ TEACHER TIP<br>Today is a good opportunity for an object lesson on wildflowers. Questions are embedded in the lesson to help, as needed. If preferred, teachers can instead refer to the Handbook of Nature Study or allow questions to flow naturally between student and teacher.</p>","","Lesson","0","FALSE"
"alveary-rechYrgUHG14HsexU","alveary-recdlD8UsIOIrk4E8","8","1","15m General Science: Grade 2 - Lesson 8","<p>My Biome<br>⍞ Materials: A Walk in the [familiar biome]</p><p>PREP: Read Teacher Tip</p><p>➜ INTRO<br>Look at the picture on the cover. Do you recognize any of the living things on the cover? All of these (and more) live together in a community in our biome, so let's read about that today.</p><p>➜ READ, NARRATE, &amp; DISCUSS<br>A Walk in the [familiar biome]  (whole book)</p><p>• What different habitats did you recognize in the book?</p><p>• NATURE NOTEBOOK<br>Prompt for General Science in Outdoor Work Quick Link.</p>","<p>★ TEACHER TIP<br>Let students enjoy the photographs in this picture book. If you need to take a break and finish it another time, that is fine.</p>","","Lesson","0","FALSE"
"alveary-rechYrgUHG14HsexU","alveary-recstdS4ceLt8ke3H","9","1","15m General Science: Grade 2 - Lesson 9","<p>Observing a Community Activity<br>⍞ Materials: Nature Journal</p><p>➜ INTRO<br>Check on the wildflower that you planted for the butterflies.</p><p>➜ OBSERVE<br>How has your wildflower grown or changed? Are there any insects or spiders visiting? Has it made seeds? Spend some time noticing who else lives in its habitat. What other plants are nearby? What birds do you see or hear?</p><p>➜ NARRATE &amp; DISCUSS<br>Use a nature journal to record what the student(s) noticed.</p><p>• Tell about what you recorded.</p><p>• NATURE NOTEBOOK<br>Prompt for General Science in Outdoor Work Quick Link.</p>","","","Lesson","0","FALSE"
"alveary-rechYrgUHG14HsexU","alveary-rectd7WQHa5XxrXgq","10","1","15m General Science: Grade 2 - Lesson 10","<p>Noticing Insects Activity<br>⍞ Materials: Nature Journal</p><p>PREP: Read Teacher Tip</p><p>➜ INTRO<br>Notice a fly or other insect today.</p><p>➜ OBSERVE<br>Look at the insect closely with your magnifier. Describe its antennae, jaws, and eyes. How many wings does it have? From which sections do the wings come? The legs? What else do you notice?</p><p>➜ NARRATE &amp; DISCUSS<br>Use a nature journal to record what the student(s) noticed.</p><p>• Tell about what you found or what you recorded.</p><p>• NATURE NOTEBOOK<br>Prompt for General Science in Outdoor Work Quick Link.</p>","<p>★ TEACHER TIP<br>Leave a small piece of meat outside in a safe location a few hours before the lesson. This can be a good opportunity for an object lesson with an insect, hopefully, a fly.</p>","","Lesson","0","FALSE"
"alveary-rechYrgUHG14HsexU","alveary-rec5p8Uc7hUheoeWA","11","1","15m General Science: Grade 2 - Lesson 11","<p>Revisiting Your Host Plant Activity<br>⍞ Materials: Nature Journal</p><p>PREP: Read Teacher Tip</p><p>➜ INTRO<br>Spend about 10 minutes with your plant from earlier in the term.</p><p>➜ OBSERVE<br>How has your plant grown or changed? Are there any animals visiting your plant yet? Does it have flowers? Has it made seeds? Describe any leaves or stalks.</p><p>➜ NARRATE &amp; DISCUSS<br>Use a nature journal to record what the student(s) noticed.</p><p>• Tell about what you found or what you recorded.</p><p>• NATURE NOTEBOOK<br>Prompt for General Science in Outdoor Work Quick Link.</p>","<p>★ TEACHER TIP<br>If a student's particular plant will not sprout until next spring, then they might observe birds today instead.</p>","","Lesson","0","FALSE"
"alveary-rechYrgUHG14HsexU","alveary-rec7j9qctU8RA4JNv","12","1","15m General Science: Grade 2 - Lesson 12","<p>Exam Week</p><p>➜ EXAMS<br>Answer question(s) related to the course.</p><p>Questions will come from: <br>Nature Journal, Monarch and Milkweed, A Walk in the ......</p><p>• NATURE NOTEBOOK<br>Prompt for General Science in Outdoor Work Quick Link.</p>","<p>★ General Science: Grade 2 — TERM 1 EXAM QUESTIONS<br>· Tell about or draw 3 different habitats in your biome in which a butterfly lives.</p>","","Exam","0","FALSE"
"alveary-rechYrgUHG14HsexU","alveary-recGv2mB4nrdpoMp4","13","1","15m General Science: Grade 2 - Lesson 13","<p>Knowing a Tree Activity<br>⍞ Materials: Nature Journal</p><p>PREP: Read Teacher Tip</p><p>➜ INTRO<br>Let's spend some time to get to know a particular tree.  This will be your tree, so pick one that you can revisit often.</p><p>➜ OBSERVE<br>Choose a special tree near your home or school (i.e., one that you can visit regularly). Spend about 10 minutes getting to know your tree. You can even give it a special name. Does it have leaves on it right now, or have the leaves fallen? Look at them closely, so that you can see them with your eyes closed. What color are the leaves? Is their shape oval, heart-shaped, star-shaped, or something else? Are the edges smooth or jagged/ridged? With your eyes closed, touch the bark with your fingertips. What do you notice? Do you think you could tell this tree's bark from another without looking? If not, touch it again to get to know it better.</p><p>➜ NARRATE &amp; DISCUSS<br>Use a nature journal to record what the student(s) noticed.</p><p>• Tell about your tree.</p><p>• NATURE NOTEBOOK<br>Prompt for General Science in Outdoor Work Quick Link.</p>","<p>★ TEACHER TIP<br>If students notice trees during their outdoor time, this could be a good opportunity for an object lesson. Questions are embedded in the lesson to help, as needed. If preferred, teachers can instead refer to the Handbook of Nature Study or allow questions to flow naturally between student and teacher.</p>","","Lesson","0","FALSE"
"alveary-rechYrgUHG14HsexU","alveary-rec8vN2h1lV82ondH","14","1","15m General Science: Grade 2 - Lesson 14","<p>Meeting a Keystone Species <br>⍞ Materials: Desert Giant</p><p>PREP: Read Teacher Tip</p><p>➜ INTRO<br>Last term, you noticed that creatures in a community sometimes depend on each other, like butterflies and flowers. Have you ever noticed creatures other than butterflies and flowers that depend on each other? Look at the picture on the cover. This tree is a habitat for the birds, but so many other creatures depend on it, as well. So many creatures in its habitat depend on it that it is a &quot;keystone species.&quot; Let's read and find out about that.</p><p>➜ READ, NARRATE, &amp; DISCUSS<br>Desert Giant (whole book)</p><p>• Based on the story, what do you think is meant by &quot;keystone species&quot;? What creatures in your biome (or other creatures, if you are in the desert biome) seem to hold the whole community together?</p><p>➜ SUPPLEMENTAL<br>∞ Image Link: Wikipedia: Keystone</p><p>• NATURE NOTEBOOK<br>Prompt for General Science in Outdoor Work Quick Link.</p>","<p>★ TEACHER TIP<br>Some students will grasp the 'big picture' that a keystone holds the larger structure together, but others might need help or might get stuck on the word itself. Use the link or draw a diagram, if needed.</p>","https://planning.alveary.org/links.html?id=rechYrgUHG14HsexU&term=2&week=14","Lesson","0","FALSE"
"alveary-rechYrgUHG14HsexU","alveary-recqB1S7Gi20Fl8gU","15","1","15m General Science: Grade 2 - Lesson 15","<p>Observing a Seashell Activity<br>⍞ Materials: Nature Journal, seashells, optional: a rock</p><p>➜ INTRO<br>In the marine/saltwater biome, oysters are a keystone species. Oysters eat algae, balance nutrient levels in the water, provide food, and build habitats for other creatures. Like oysters, many ocean creatures live inside shells that give them a unique way of life.  It is amazing to think that the shells we find at the beach are the homes of other creatures!  Let's notice some of these beautiful creature homes today!</p><p>➜ OBSERVE<br>Spend about 10 minutes today noticing the beauty and uniqueness of one or more seashells. What colors and patterns do you notice? What is the texture? Where do you suppose the animal resides?</p><p>➜ NARRATE &amp; DISCUSS<br>Use a nature journal to record what the student(s) noticed.</p><p>• Tell about what you recorded. Compare a seashell with a rock. How are they similar or different?</p><p>• NATURE NOTEBOOK<br>Prompt for General Science in Outdoor Work Quick Link.</p>","","","Lesson","0","FALSE"
"alveary-rechYrgUHG14HsexU","alveary-recW7rdCrcFzTsbpB","16","1","15m General Science: Grade 2 - Lesson 16","<p>Knowing a Tree Activity<br>⍞ Materials: Nature Journal</p><p>PREP: Read Teacher Tip</p><p>➜ INTRO<br>Visit your tree again to learn something new about your friend.</p><p>➜ OBSERVE<br>Notice any twigs and/or fruit that you can collect. Study the twigs and/or fruit for about 10 minutes. What color is the twig? How does the bark compare to that of the tree? Is it straight or are there any bumps or shoots? If so, how are those bumps/shoots arranged?</p><p>➜ NARRATE &amp; DISCUSS<br>Use a nature journal to record what the student(s) noticed.</p><p>• Tell what you learned about your tree.</p>","<p>★ TEACHER TIP<br>This could be a good opportunity for an object lesson on twigs.</p>","","Lesson","0","FALSE"
"alveary-rechYrgUHG14HsexU","alveary-recDNMdBNj9HDmgIm","17","1","15m General Science: Grade 2 - Lesson 17","<p>Bird Watching Activity<br>⍞ Materials: Nature Journal</p><p>PREP: Read Teacher Tip</p><p>➜ INTRO<br>Have you noticed which birds are visiting this week?</p><p>➜ OBSERVE<br>Spend about 10 minutes bird watching. What colors, markings, and shapes do you notice? Do they visit particular plants or trees? What is the bird doing? What is its posture (i.e., how does it hold its body)?</p><p>➜ NARRATE &amp; DISCUSS<br>Use a nature journal to record what the student(s) noticed.</p><p>• Do you notice anyone already familiar to you? Do you notice anyone new?</p>","<p>★ TEACHER TIP<br>This could be a good opportunity for an object lesson on birds.</p>","","Lesson","0","FALSE"
"alveary-rechYrgUHG14HsexU","alveary-recbRuJPgwZPmQ01J","18","1","15m General Science: Grade 2 - Lesson 18","<p>Knowing a Tree Activity<br>⍞ Materials: Nature Journal</p><p>PREP: Read Teacher Tip</p><p>➜ INTRO<br>Sometimes we notice more when we compare.  Let's try this today to notice even more about our tree.</p><p>➜ OBSERVE<br>Collect twigs from your tree and a different tree, and spend about 10 minutes studying them. What color is the twig? How does the bark compare to that of the tree? Is it straight or are there any bumps or shoots? If so, how are those bumps/shoots arranged?</p><p>➜ NARRATE &amp; DISCUSS<br>Use a nature journal to record what the student(s) noticed.</p><p>• Tell what you learned about your tree.</p>","<p>★ TEACHER TIP<br>This could be a good opportunity for an object lesson on twigs. Questions are embedded in the lesson to help, as needed. If preferred, teachers can refer to the Handbook of Nature Study or allow questions to flow naturally between student and teacher.</p>","","Lesson","0","FALSE"
"alveary-rechYrgUHG14HsexU","alveary-recd7ViDdYJdouAau","19","1","15m General Science: Grade 2 - Lesson 19","<p>Birds and Their Nests <br>⍞ Materials: Mama Built a Little Nest</p><p>PREP: Read Teacher Tip</p><p>➜ INTRO<br>Have you ever found a bird nest? What was it made of? How was it made? Where was it? What trees or other plants were nearby? These are all clues to who built it because each bird lives differently within its community.</p><p>➜ READ, NARRATE, &amp; DISCUSS<br>Mama Built a Little Nest (whole book)</p><p>• Do you think anyone has had a nest in your tree? Why or why not?</p><p>• NATURE NOTEBOOK<br>Prompt for General Science in Outdoor Work Quick Link.</p>","<p>★ TEACHER TIP<br>Let students enjoy the artwork in this picture book. If you need to take a break and finish it another time, that is fine.</p>","","Lesson","0","FALSE"
"alveary-rechYrgUHG14HsexU","alveary-recpimSmUJcrtLant","20","1","15m General Science: Grade 2 - Lesson 20","<p>Knowing a Tree Activity<br>⍞ Materials: Nature Journal</p><p>➜ INTRO<br>Changing our perspective (our view) can also help us notice more.  Let's change our perspective and see what else we can notice about our tree.</p><p>➜ OBSERVE<br>Observe your tree from a distance and up close. How is your tree shaped? What is the land like around it? Do other plants or animals live near your tree? How do you think they help your tree? How do you suppose your tree helps them?</p><p>➜ NARRATE &amp; DISCUSS<br>Use a nature journal to record what the student(s) noticed.</p><p>• Tell what you learned about your tree.</p>","","","Lesson","0","FALSE"
"alveary-rechYrgUHG14HsexU","alveary-recta7CAA7O8TjkCB","21","1","15m General Science: Grade 2 - Lesson 21","<p>Nest Investigation Activity<br>⍞ Materials: Nature Journal</p><p>PREP: Read Teacher Tip</p><p>➜ INTRO<br>Spend about 10 minutes today looking for or studying a bird nest. If you don't find one, that's still a good observation! Note where you looked and what you did see during your search.</p><p>➜ OBSERVE<br>Since the songbirds are not nesting in the winter, any nests you find should be old and not in use, but observe them in place anyway. Another creature may reuse the nest or its material in the future. Discover as many clues as you can as to who built the nest. What was it made of? How was it made? Where was it? What trees or other plants were nearby?</p><p>➜ NARRATE &amp; DISCUSS<br>Use a nature journal to record what the student(s) noticed.</p><p>• If you found a nest, do you have an idea about who built it? You can ask a local naturalist or park ranger to confirm your guess - they love to help!</p>","<p>★ TEACHER TIP<br>This could be a good opportunity for an object lesson on a bird's nest.</p>","","Lesson","0","FALSE"
"alveary-rechYrgUHG14HsexU","alveary-recC6VAwePNB7rRMN","22","1","15m General Science: Grade 2 - Lesson 22","<p>Nest Investigation Activity<br>⍞ Materials: Nature Journal</p><p>PREP: Read Teacher Tip</p><p>➜ INTRO<br>Spend about 10 minutes today looking for or studying a bird nest. If you didn't find one last week, look in a different location or in different places today. You are a nature detective!</p><p>➜ OBSERVE<br>Since the songbirds are not nesting in the winter, any nests you find should be old and not in use, but observe them in place anyway. Another creature may reuse the nest or its material in the future. Discover as many clues as you can as to who built the nest. What was it made of? How was it made? Where was it? What trees or other plants were nearby?</p><p>➜ NARRATE &amp; DISCUSS<br>Use a nature journal to record what the student(s) noticed.</p><p>• If you found a nest, do you have an idea about who built it? You can ask a local naturalist or park ranger to confirm your guess - they love to help!</p>","<p>★ TEACHER TIP<br>This could be a good opportunity for an object lesson on a bird's nest.</p>","","Lesson","0","FALSE"
"alveary-rechYrgUHG14HsexU","alveary-recRO5yyM4JVZt6jP","23","1","15m General Science: Grade 2 - Lesson 23","<p>Bird Watching Activity<br>⍞ Materials: Nature Journal</p><p>PREP: Read Teacher Tip</p><p>➜ INTRO<br>Which birds are visiting this week?  Let's take notice!</p><p>➜ OBSERVE<br>Spend about 10 minutes bird watching. What colors, markings, and shapes do you notice? Do they visit particular plants or trees? What is the bird doing? What is its posture (i.e., how does it hold its body)?</p><p>➜ NARRATE &amp; DISCUSS<br>Use a nature journal to record what the student(s) noticed.</p><p>• Do you notice anyone already familiar to you? Do you notice anyone new?</p>","<p>★ TEACHER TIP<br>This could be a good opportunity for an object lesson on a bird.</p>","","Lesson","0","FALSE"
"alveary-rechYrgUHG14HsexU","alveary-recTTIGla3Wtnml3H","24","1","15m General Science: Grade 2 - Lesson 24","<p>Exam Week</p><p>➜ EXAMS<br>Answer question(s) related to the course.</p><p>Questions will come from:<br>Nature Journal, Mama Built a Little Nest, Desert Giant</p>","<p>★ General Science: Grade 2 — TERM 2 EXAM QUESTIONS<br>· Tell about or draw a tree in your biome with at least 3 ways that others depend upon it.</p>","","Exam","0","FALSE"
"alveary-rechYrgUHG14HsexU","alveary-recfZU9tvNTYPW752","25","1","15m General Science: Grade 2 - Lesson 25","<p>Meeting a Unique Mammal <br>⍞ Materials: The Secret Life of the Skunk</p><p>PREP: Read Teacher Tip</p><p>➜ INTRO<br>Look at the picture on the cover. Have you ever seen a skunk? What would you do if you came across one on a walk? We don't often get to learn about skunks or any of the wild mammals in our biome up close, so let's read to find out more.</p><p>➜ READ, NARRATE, &amp; DISCUSS<br>The Secret Life of the Skunk (whole book)</p><p>• Have you ever smelled a skunk before? Take note of any skunky smell this term. When and where does it occur? How long does it last? Foxes smell very similar to skunks during mating season, but their season is a little earlier than skunks, and their odor doesn't tend to 'stick' quite as long.</p><p>• NATURE NOTEBOOK<br>Prompt for General Science in Outdoor Work Quick Link.</p>","<p>★ TEACHER TIP<br>Let students enjoy the artwork in this picture book. If you need to take a break and finish it another time, that is fine.</p>","","Lesson","0","FALSE"
