"course_custom_id","assignment_custom_id","assignment_week","assignment_day","assignment_name","assignment_description","assignment_teachersNote","assignment_linksUrl","assignment_type","assignment_duration","assignment_graded"
"alveary-rechYrgUHG14HsexU","alveary-recHIRDE0U7jtyrUZ","26","1","15m General Science: Grade 2 - Lesson 26","<p>Mammal Investigation Activity<br>⍞ Materials: Nature Journal</p><p>PREP: Read Teacher Tip</p><p>➜ INTRO<br>Wild mammals usually hide from humans, but we can learn about them by following their tracks. Spots with soft or wet soil are good for footprints, but if your soil is very dry, then you might still be able to find other signs, like scat or leftover food.</p><p>➜ OBSERVE<br>Spend about 10 minutes today looking for or studying animal tracks (or other sign). What is the size and shape? Are there claws visible? How many toes? Is there more than one animal? Are they the same or different? Which way are they pointing? How would you describe this habitat? What other plants and animals live in this biome?</p><p>➜ NARRATE &amp; DISCUSS<br>Use a nature journal to record what the student(s) noticed.</p><p>• Do you know who made any tracks or left any sign that you found? If not, what other clues might help? If so, you can ask a local naturalist or park ranger to confirm your guess - they love to help!</p>","<p>★ TEACHER TIP<br>This could be a good opportunity for an object lesson on animal signs. Questions are embedded in the lesson to help, as needed. If preferred, teachers can instead refer to the Handbook of Nature Study or allow questions to flow naturally between student and teacher.</p>","","Lesson","0","FALSE"
"alveary-rechYrgUHG14HsexU","alveary-recaKCSJs2EeWuSmB","27","1","15m General Science: Grade 2 - Lesson 27","<p>Knowing a Tree Activity<br>⍞ Materials: Nature Journal</p><p>PREP: Read Teacher Tip</p><p>➜ INTRO<br>Revisit your tree today to see what has changed.</p><p>➜ OBSERVE<br>Closely examine its twigs and look carefully at the buds. What color is the twig? What color and shape are the buds? Study the form of the buds. Can you guess what the layers of the bud will look like when they open? How are those buds arranged? Bring a small twig inside to place in some water. Watch the buds throughout the day to observe any changes.</p><p>➜ NARRATE &amp; DISCUSS<br>Use a nature journal to record what the student(s) noticed.</p><p>• Tell what you learned about your tree.</p>","<p>★ TEACHER TIP<br>This could be a good opportunity for an object lesson on a twig.</p>","","Lesson","0","FALSE"
"alveary-rechYrgUHG14HsexU","alveary-rec1PJaLXTo2YpVeK","28","1","15m General Science: Grade 2 - Lesson 28","<p>Bird Watching Activity<br>⍞ Materials: Nature Journal</p><p>PREP: Read Teacher Tip</p><p>➜ INTRO<br>Today is a good day to notice which birds are visiting.</p><p>➜ OBSERVE<br>Spend about 10 minutes bird watching. What colors, markings, and shapes do you notice? Do they visit particular plants or trees? Do they visit particular plants or trees? If so, study the tree to see if you can find reasons for this. What is the bird doing?</p><p>➜ NARRATE &amp; DISCUSS<br>Use a nature journal to record what the student(s) noticed.</p><p>• Do you notice anyone already familiar to you? Do you notice anyone new?</p><p>• NATURE NOTEBOOK<br>Prompt for General Science in Outdoor Work Quick Link.</p>","<p>★ TEACHER TIP<br>This could be a good opportunity for an object lesson on a bird.</p>","","Lesson","0","FALSE"
"alveary-rechYrgUHG14HsexU","alveary-rec248SKMEBsUXJA5","29","1","15m General Science: Grade 2 - Lesson 29","<p>Looking for Beetles Activity<br>⍞ Materials: Nature Journal</p><p>PREP: Read Teacher Tip</p><p>➜ INTRO<br>Today, you will look for beetles, an insect that has a pair of hardened wings covering their flight wings.</p><p>➜ OBSERVE<br>Some good places to look are under small rocks, on plants, and in grass and leaf litter. Use a stick to safely lift rocks. If you find beetles, take some time to observe them. Use a magnifier if you have one. What parts of the body do you see? What colors are its hard shell? Describe its antennae, jaws, and eyes. If you give it a gentle nudge with a blade of grass or leaf, does it take off and let you see its wings? If you find someone else that you want to observe, you may take the time to do so. Spend about 10 minutes looking for beetles.</p><p>➜ NARRATE &amp; DISCUSS<br>Use a nature journal to record what the student(s) noticed.</p><p>• Did you find beetles? If so, describe their habitat. How does it provide food and shelter for them?</p><p>➜ SUPPLEMENTAL<br>∞ Video Link: Ladybug Wings (1:26)</p>","<p>★ TEACHER TIP<br>This could be a good opportunity for an object lesson on a beetle or other insect. Questions are embedded in the lesson to help, as needed. If preferred, teachers can refer to the Handbook of Nature Study or allow questions to flow naturally between student and teacher.</p>","https://planning.alveary.org/links.html?id=rechYrgUHG14HsexU&term=3&week=29","Lesson","0","FALSE"
"alveary-rechYrgUHG14HsexU","alveary-rec7xC0QpysOhkYE6","30","1","15m General Science: Grade 2 - Lesson 30","<p>Looking for Beetles Activity<br>⍞ Materials: Nature Journal</p><p>➜ INTRO<br>Today, you will look for beetles again. If you find beetles, take some time to observe them. Use a magnifier if you have one. If not, then observe whatever nature provides.</p><p>➜ OBSERVE<br>If you find a beetle, notice what parts of the body you see. What colors are its hard shell? Describe its antennae, jaws, and eyes. If you give it a gentle nudge with a blade of grass or leaf, does it take off and let you see its wings? If you find someone else that you want to observe, you may take the time to do so. Spend about 10 minutes looking for beetles.</p><p>➜ NARRATE &amp; DISCUSS<br>Use a nature journal to record what the student(s) noticed.</p><p>• Did you find beetles? If so, describe their habitat. How does it provide food and shelter for them?</p><p>• NATURE NOTEBOOK<br>Prompt for General Science in Outdoor Work Quick Link.</p>","","","Lesson","0","FALSE"
"alveary-rechYrgUHG14HsexU","alveary-reckKzlcwK4D2ltS4","31","1","15m General Science: Grade 2 - Lesson 31","<p>Your Biome <br>⍞ Materials: A Walk in the [different biome]</p><p>PREP: Read Teacher Tip</p><p>➜ INTRO<br>Look at the picture on the cover. Do you recognize any of the living things on the cover? This book is about a living community or biome that is different from ours, so let's read and find out the ways that it is similar, but unique.</p><p>➜ READ, NARRATE, &amp; DISCUSS<br>A Walk in the [different biome] (whole book)</p><p>• Did you recognize habitats in this book that are similar to some where you live? What plants and animals were the same or similar and which were different? Were there habitats or creatures (e.g. insects, birds, mammals, trees, etc) in them that were very different from anything where you live?</p>","<p>★ TEACHER TIP<br>Let students enjoy the photographs in this picture book. If you need to take a break and finish it another time, that is fine.</p>","","Lesson","0","FALSE"
"alveary-rechYrgUHG14HsexU","alveary-rec3cjsKffZVKzUZz","32","1","15m General Science: Grade 2 - Lesson 32","<p>Comparing Tracks Activity<br>⍞ Materials: Nature Journal</p><p>➜ INTRO<br>What kinds of tracks have you noticed? Let's compare different tracks today and think about what stands out.</p><p>➜ OBSERVE<br>Spend about 10 minutes studying and copying the tracks at the link (or some of them). Which ones stand out as being unique? Which ones might be easily confused? What features are distinctive about each one? <br>∞ Image Link: Track and Sign</p><p>➜ NARRATE &amp; DISCUSS<br>Use a nature journal to record what the student(s) noticed.</p><p>• Have you seen any of these tracks before?</p><p>• NATURE NOTEBOOK<br>Prompt for General Science in Outdoor Work Quick Link.</p>","","https://planning.alveary.org/links.html?id=rechYrgUHG14HsexU&term=3&week=32","Lesson","0","FALSE"
"alveary-rechYrgUHG14HsexU","alveary-recYlzz8eGRwCneS4","33","1","15m General Science: Grade 2 - Lesson 33","<p>Mammal Investigation Activity<br>⍞ Materials: Nature Journal</p><p>PREP: Read Teacher Tip</p><p>➜ INTRO<br>Spend some time studying and comparing any tracks that you have recorded so far, or look for more in the soft earth.</p><p>➜ OBSERVE<br>Do any of your tracks have the distinctive features you noticed last week? What is the size and shape? Are there claws visible? How many toes? What is the land like near the animal sign? Are there other signs of animal activity?</p><p>➜ NARRATE &amp; DISCUSS<br>Use a nature journal to record what the student(s) noticed.</p><p>• Do you know who made the tracks or left the signs that you found? If so, you can ask a local naturalist or park ranger to confirm your guess - they love to help!</p>","<p>★ TEACHER TIP<br>This could be a good opportunity for an object lesson on animal signs.</p>","","Lesson","0","FALSE"
"alveary-rechYrgUHG14HsexU","alveary-recHVV1b3k3pFVnJL","34","1","15m General Science: Grade 2 - Lesson 34","<p>Knowing a Tree Activity<br>⍞ Materials: Nature Journal</p><p>➜ INTRO<br>Revisit your tree again this week.</p><p>➜ OBSERVE<br>Closely examine your tree's twigs and look carefully at the buds if they remain. If they have already opened, look carefully at the new flowers and/or leaves. What is their color and texture? How many are grouped together? What is their shape? Do all of the flowers on your tree look the same, or are there different kinds of flowers on the same tree?</p><p>➜ NARRATE &amp; DISCUSS<br>Use a nature journal to record what the student(s) noticed.</p><p>• Tell what you learned about your tree.</p><p>• NATURE NOTEBOOK<br>Prompt for General Science in Outdoor Work Quick Link.</p>","","","Lesson","0","FALSE"
"alveary-rechYrgUHG14HsexU","alveary-recf1ggz2VhVx418H","35","1","15m General Science: Grade 2 - Lesson 35","<p>Noticing Insects Activity<br>⍞ Materials: Nature Journal</p><p>➜ INTRO<br>Notice flying insects today.</p><p>➜ OBSERVE<br>Are the bees active? Have you seen butterflies or beetles flying? Are you close enough to the water to see dragonflies, damselflies, or lacewings? What do you notice these insects doing? Where are they? Can you observe closely enough to examine their wings? Compare how different insects fly. How do they use their wings differently?</p><p>➜ NARRATE &amp; DISCUSS<br>Use a nature journal to record what the student(s) noticed.</p><p>• Tell about what you found or what you recorded.</p>","","","Lesson","0","FALSE"
"alveary-rechYrgUHG14HsexU","alveary-recWSWp7wNyxktjXN","36","1","15m General Science: Grade 2 - Lesson 36","<p>Exam Week</p><p>➜ EXAMS<br>Answer question(s) related to the course.</p><p>Questions will come from:<br>Nature Journal, A Walk in the ...., The Secret Life of the Skunk</p>","<p>★ General Science: Grade 2 — TERM 3 EXAM QUESTIONS<br>· Tell about or draw a creature from your biome and compare it to a creature from another biome.</p>","","Exam","0","FALSE"
