"course_custom_id","assignment_custom_id","assignment_week","assignment_day","assignment_name","assignment_description","assignment_teachersNote","assignment_linksUrl","assignment_type","assignment_duration","assignment_graded"
"alveary-rec9lkHl3pKY5QBnE","alveary-recIZH7WlPJRAwVYO","10","1","20m Geography: Grade 3 (U.S.) - Lesson 19","<p>Where is My Food From?<br>⍞ Materials: Globe or World Wall Map, U.S. Atlas</p><p>PREP: Go to the grocery store before class and make sure to find fresh fruit or vegetables with labels showing where they were grown.</p><p>➜ INTRO<br>Have you ever wondered where the food you eat at home was grown or raised?</p><p>➜ MAP QUESTIONS<br>⍞ Map Resource: globe or world map<br>⍞ Map Resource: United States Atlas<br>1\. Locate each state or country on the world or U.S. map where one of your fruits or vegetables grew. (You can do this by looking at the label to see where it was grown.)<br>2\. How far did each one travel to get to your local grocery store or farmers' market? (This is a good opportunity to practice using the scale bar on the map.)<br>3\. If it came from very far away, when do you think it was harvested? (Think calendar time as well as stage of ripeness.)<br>4\. Write the fruits and vegetables in your geography journal, along with where they were grown.</p><p>- You will need a state map for the next lesson.</p><p>- Have your child go to the local farmers' market or vegetable stand with you to help pick out fresh fruit and vegetables. Ask the farmer where their farm is, and make a note of it. Read the next lesson for more clarity.</p>","<p>★ TEACHER TIP<br>PREP for next lesson this week.</p>","","Lesson","0","FALSE"
"alveary-rec9lkHl3pKY5QBnE","alveary-recNO62A6L9QWOnKm","10","2","20m Geography: Grade 3 (U.S.) - Lesson 20","<p>Where is My Food From?<br>⍞ Materials: Local State Map</p><p>PREP: Have your child go to the local farmers' market or vegetable stand with you to help pick out fresh fruit and vegetables. Ask the farmer where their farm is, and make a note of it.<br>Use a local state map to find where the local farmer's market food is grown.</p><p>This lesson is scheduled in the fall for some people, so this can be postponed until the spring if a local market is closed for the season. This Winter Market list and map were updated in 2022. Additionally, a parent can give an oral lesson about this and even go visit some local farms or community gardens to see what they are growing now.<br>∞ Link: Winter Market</p><p>➜ MAP QUESTIONS<br>⍞ Map Resource: Your local state map<br>1\. Locate each city or rural area where your fruit or vegetables grew. (You will have to ask the farmer at the market stand and take note of it.)<br>2\. How far did each one travel to get to your local vendor or farmers' market? (You may use the map scale bar for this.)<br>3\. When do you think it was harvested?<br>4\. Write the fruits and vegetables in your geography journal, along with where they were grown.</p>","","https://planning.alveary.org/links.html?id=rec9lkHl3pKY5QBnE&term=1&week=10","Lesson","0","FALSE"
"alveary-rec9lkHl3pKY5QBnE","alveary-rec04lRG7Q0SGzdtU","11","1","20m Geography: Grade 3 (U.S.) - Lesson 21","<p>Mississippi River<br>⍞ Materials: Cross-Country, U.S. Atlas, My U.S. Map, 50 Adventures in 50 States</p><p>➜ INTRO<br>What is the difference between a lake and a river? How can you tell something is a river?</p><p>➜ MAP QUESTIONS<br>⍞ Map Resource: United States Atlas “Missouri” p.101<br>1\. What makes the eastern border of Missouri? (Mississippi River and a small portion of the Des Moines River)<br>2\. What river flows east across the state, going through Kansas City on the western border? (Missouri River)<br>3\. What river joins the Mississippi River just north of St. Louis? (Missouri River)<br>4\. Follow the Mississippi River south and see where it empties into the ocean. (You can use the U.S. wall map or p.8-11 in the United States Atlas.)</p><p>⍞ Map Resource: United States Atlas “Louisiana” p.69<br>1\. Locate the Mississippi River.<br>2\. What major city lies near the mouth of the river? (New Orleans)<br>3\. What does the river empty into? (Gulf of Mexico)<br>4\. What is the area called where the river joins the gulf? (The Mississippi River Delta; not to be confused with the Mississippi Delta region located approximately 300 miles to the north.)</p><p>➜ READ, NARRATE, &amp; DISCUSS<br>Cross-Country<br>p.82-84 ”The Pages had crossed” - “do all three.”</p><p>➜ MAP WORK<br>⍞ Map Resource: My U.S. Map<br>1\. Label St. Louis.<br>2\. Label the Mississippi River.<br>3\. Label Gulf of Mexico (where you have room).<br>4\. Label Illinois.</p><p>➜ VIEW<br>Take a few minutes to look at the Louisiana spread on p.40-41 of 50 Adventures in 50 States to learn about bayous.</p>","","","Lesson","0","FALSE"
"alveary-rec9lkHl3pKY5QBnE","alveary-recoDL2384Cvaapqz","11","2","20m Geography: Grade 3 (U.S.) - Lesson 22","<p>Deltas and Modeling<br>⍞ Materials: U.S. Atlas, see map work section below, and gather what you need to make a delta.</p><p>➜ MAP QUESTIONS<br>⍞ Map Resource: United States Atlas “The Physical United States: Physical Map” p.8-9<br>1\. What is the geographic name for the area where the Mississippi River joins the Gulf of Mexico? (Mississippi River Delta)<br>2\. If that’s where it empties, where does it begin? Follow the river upstream from the delta to where it begins—its source. (Minnesota)<br>3\. If you haven’t already identified it, name the source of the Mississippi. (Lake Itasca)</p><p>⍞ Map Resource: United States Atlas “Louisiana” p.69<br>1\. Locate the Mississippi River.<br>2\. What was the area called at the mouth of the river? (The Mississippi River Delta)<br>3\. We are going to do an activity to explain what a delta is.</p><p>➜ MAP WORK<br>Model: Make a delta.<br>1\. This can be done in a variety of ways, depending on what you have available. (It can be as simple as a pile of dirt or sand in the backyard with a hose, or you can build a model in a large pan or deep cookie sheet using dirt, sand, and a pitcher of water.)<br>2\. What is important is a visual of how water brings the sediment downstream and deposits it at the end of the model river.<br>3\. You probably don't have access to a stream table like the one in the video, but you can see a time-lapse of the creation of a stream, water running down the table, and creating a delta.<br>∞ Video Link: River Stream Table Time-lapse</p>","","https://planning.alveary.org/links.html?id=rec9lkHl3pKY5QBnE&term=1&week=11","Lesson","0","FALSE"
"alveary-rec9lkHl3pKY5QBnE","alveary-recJgtfAIHjx9e8uj","12","1","20m Geography: Grade 3 (U.S.) - Lesson 23","<p>Exam Week</p><p>➜ EXAMS<br>Answer question(s) related to course.</p><p>Questions will come from:<br>Cross-Country</p>","<p>★ Geography: Grade 3 (U.S.) — TERM 1 EXAM QUESTIONS<br>· Cross-Country: Based on your reading and model, tell what you know about the terrain and elevation of Kansas compared to Colorado. How does this affect what grows and lives in these different states?</p><p>· Tell what you know about your local waterway, including where it originates and empties into, OR about the Mississippi River.</p>","","Exam","0","FALSE"
"alveary-rec9lkHl3pKY5QBnE","alveary-recesdfRSRP06r7TI","12","2","20m Geography: Grade 3 (U.S.) - Lesson 24","<p>Exam Week</p><p>➜ EXAMS<br>Answer question(s) related to course.</p><p>Questions will come from:<br>Cross-Country</p>","<p>★ Geography: Grade 3 (U.S.) — TERM 1 EXAM QUESTIONS<br>· Cross-Country: Based on your reading and model, tell what you know about the terrain and elevation of Kansas compared to Colorado. How does this affect what grows and lives in these different states?</p><p>· Tell what you know about your local waterway, including where it originates and empties into, OR about the Mississippi River.</p>","","Exam","0","FALSE"
"alveary-rec9lkHl3pKY5QBnE","alveary-rec0iMwzVaGmDnUHc","13","1","20m Geography: Grade 3 (U.S.) - Lesson 25","<p>Rivers<br>⍞ Materials: Cross-Country, U.S. Atlas, Globe or Wall Map, My U.S. Map</p><p>➜ MAP QUESTIONS<br>Concept: Scale<br>1\. What is scale? (Based on previous lessons, you may mention the bar or line on the map used to measure distance. Let’s call that a map scale.)<br>2\. Open your left hand and stretch out your left arm as far as you can. Now study your left palm for a few seconds from that distance.<br>3\. Place your left palm just inches from your nose, close enough that you can still focus on it. Study the palm in this position for a few seconds, too.<br>4\. Both hand positions represent geographic scale. Another way to describe it is geographic extent. When the hand was far away, it looked smaller, but you saw the full extent of the hand; this is called small scale. When the hand was closer, you may have seen less of the hand, but the hand itself looked larger—large scale. Now let’s apply this concept to maps!</p><p>⍞ Map Resource: A globe or wall map<br>1\. Locate the U.S.<br>2\. Look for rivers in the U.S.</p><p>⍞ Map Resource: United States Atlas “The Midwest: Physical Map” p.84<br>1\. Locate Missouri.<br>2\. Look for rivers in Missouri.</p><p>⍞ Map Resource: United States Atlas “Missouri” p.101<br>1\. Now, how many rivers can you locate in Missouri?<br>2\. What changed as we worked our way from small-scale maps to large-scale maps? (The small-scale maps showed larger geographic extents and large real-world features, but they also represented those features as small and with fewer details. The large-scale maps showed smaller areas and more real-world features, and they also represented those features as larger and with more details.)</p><p>⍞ Map Resource: Globe or World Wall Map<br>Find large rivers on each continent. Name them.</p><p>➜ READ, NARRATE, &amp; DISCUSS<br>Cross-Country<br>p.85-88 “A river seems” - “has no rivers.”</p><p>➜ MAP WORK<br>⍞ Map Resource: My U.S. Map<br>Draw and label any large rivers you found on your maps. (The Ohio River and Kansas River have been mentioned this year as part of the lessons. The Colorado and Mississippi should already be labeled.)</p>","<p>★ TEACHER NOTE<br>Today’s text states that Antarctica has no rivers. Though this is true, Antarctica has a few glacial meltwater streams.</p>","","Lesson","0","FALSE"
"alveary-rec9lkHl3pKY5QBnE","alveary-recv8iy7aiNWnrpua","13","2","20m Geography: Grade 3 (U.S.) - Lesson 26","<p>Railroads<br>⍞ Materials: Cross-Country, U.S. Atlas, 50 Adventures in 50 States, ruler</p><p>➜ INTRO<br>Have you ever seen a train stopped at a railroad crossing? Have you ever wondered what the train was carrying?</p><p>➜ MAP QUESTIONS<br>⍞ Map Resource: United States Atlas “Illinois” p.89<br>1\. Locate the scale on the map.<br>2\. Mark on your ruler how far 50 miles is. (Almost 3 centimeters or approximately 1¼ inches)<br>3\. Locate East St. Louis and Chicago.<br>4\. We don’t know which highway the Pages are traveling on, but the inside front cover map of the book shows that they are traveling east across Illinois. Today, we will read that they stop at a train track. <br>5\. Since the map only shows interstate highways, we will choose Interstate 64 as the route closest to the Page family’s likely travels. Let’s imagine that the family stops in the city of Mt. Vernon. Can you trace Interstate 64 eastward from East St. Louis until you find Mt. Vernon? Great!<br>6\. Now, let’s use our ruler and measure how far it is from Mt. Vernon all the way up to Chicago on this map. How far is that? (6 inches)<br>7\. We know the cities are farther apart than 6 inches, so an adult may need to help you calculate how many miles the 6 inches on the map represent. (In order to calculate how far away Chicago would be from the Pages in Mt. Vernon, divide 6 by 1¼, and then multiply by 50 to get 240 miles.)</p><p>➜ READ, NARRATE, &amp; DISCUSS<br>Cross-Country<br>p.90-91 &quot;‘I'm hungry.’” - “‘I'm hungry.’”</p><p>➜ VIEW<br>The train in the story was heading south from Chicago, which is in Illinois. Take a few minutes to look at the Illinois spread on p.30-31 of 50 Adventures in 50 States to learn about ice skating in Chicago.</p>","","","Lesson","0","FALSE"
"alveary-rec9lkHl3pKY5QBnE","alveary-recaQzsgNh2J4U2Gs","14","1","20m Geography: Grade 3 (U.S.) - Lesson 27","<p>Population<br>⍞ Materials: Cross-Country, U.S. Atlas, My U.S. Map</p><p>➜ MAP QUESTIONS<br>⍞ Map Resource: United States Atlas “The Political United States: Population” p.16-17<br>1\. Locate Chicago, Illinois.<br>2\. Which color from the population density map key is around Chicago? (Red)<br>3\. Where are the counties with the largest population density? Or where is the darkest red? (The density colors are based on county population density, but the density values are depicted with dots as individual towns and cities. This makes it difficult to locate the actual highest densities—New York City. However, for this exercise, the dark red is barely noticeable near the Los Angeles-Long Beach-Santa Ana metropolitan area in California.)<br>4\. What does the square point symbol mean, according to the urban area population map key? (It will be acceptable to think the symbol represents a city with 5 million people or greater. For the teacher, however, be aware that ‘urban area’ includes all of the city’s neighboring incorporated and unincorporated areas that define the economic region.)<br>5\. How much of the U.S. has population densities of fewer than 1? (Most of the Midwest and West)<br>6\. Think back to the Pages driving through the prairie. What does low population density look like? (Houses are spread farther apart)<br>7\. Name three urban areas with a population of 5 million or greater. (Choices are Greater Los Angeles, Dallas-Fort Worth metroplex, Greater Houston, Chicago metropolitan area, Metro Atlanta, Miami metropolitan area, Greater Philadelphia, and New York City.)<br>8\. Name five urban areas with populations less than 5 million but no smaller than 1 million—the triangle symbol.<br>9\. Now, find approximately where you live. What is the population density there? Are you from a small town/city? Do people live far apart or near each other?<br>10\. Which city shown on this map is close to where you live? What is its urban area population?</p><p>➜ READ, NARRATE, &amp; DISCUSS<br>Cross-Country<br>p.92-94 “By the time” - “‘just like yours.’”</p><p>➜ MAP WORK<br>⍞ Map Resource: My U.S. Map<br>Label Indiana.</p>","<p>★ TEACHER NOTE<br>PREP for next lesson: Locate the local or street map of your area used in Term 1.</p>","","Lesson","0","FALSE"
"alveary-rec9lkHl3pKY5QBnE","alveary-recoFYbSXD1hnxpEg","14","2","20m Geography: Grade 3 (U.S.) - Lesson 28","<p>Your Town<br>⍞ Materials: Street map of your area (from previous lesson)</p><p>➜ MAP QUESTIONS<br>⍞ Map Resource: A map of your city, either a hard copy or a digital version<br>1\. Locate your street. (A parent will probably need to help.) Can you locate your home on this map?<br>2\. Do you live within the city limits?<br>3\. Locate any parks or outdoor areas in your city. What direction would you travel to get there? Are there any within walking distance from your home?<br>4\. Do you have a downtown or city center? If so, what direction would you travel from your home to get there?<br>5\. Locate your local seat of government—city hall, town hall, or municipal building. Do you live north, south, east, or west of it?<br>6\. How are the streets laid out in your city? Is any portion of your city laid out in a grid? (Older areas may utilize the grid; newer sections may utilize cul-de-sacs; and other patterns like loop roads and diagonals may be used.)<br>7\. If so, in what direction do the streets run? (North-south, east-west, etc.)<br>8\. What are the streets named in this area? Do you see any “streets”, “avenues”, or “lanes”? What other street types (e.g., way, court, parkway) can you find? Is there a pattern for when these names are used (such as cul-de-sacs being “courts”)?<br>9\. Are there differences in the way streets are laid out near the center city compared to near your home?<br>10\. Look for familiar places (grocery stores you go to, places of worship, friends' homes, etc.). How would you travel there from your home?<br>11\. Choose one of the familiar places you found and find at least 2 different routes to travel there from your home. Which one do you think is faster?</p><p>➜ NOTE<br>Keep the street map for the next lesson. Pay attention on walks/rides this week, noting things you saw on the map, or answering questions that came up during the map exercises.</p>","","","Lesson","0","FALSE"
"alveary-rec9lkHl3pKY5QBnE","alveary-recQiecSbg6Iu092I","15","1","20m Geography: Grade 3 (U.S.) - Lesson 29","<p>Your Town<br>⍞ Materials: Street map of your area (from previous lesson)</p><p>➜ MAP QUESTIONS<br>⍞ Map Resource: A map of your city, either a hard copy or a digital version<br>1\. Locate your street.<br>2\. Locate your local police department, fire station, and hospital. How would you travel there from your home?<br>3\. Do you have more than one police station, fire station, or hospital? If so, mark where they are located. Are they close to each other or far apart? What do you notice about how they are spaced?<br>4\. Can you find any bodies of water or watercourses? (oceans, lakes, reservoirs, ponds, wetlands, rivers, streams, creeks, and so forth)<br>5\. Using the scale, estimate the distance of the closest water feature to your house. How far is it? Could you walk there? Drive there? How long would it take?<br>6\. How many bodies of water are there in your city?<br>7\. If your map shows physical features, can you tell which direction the rivers, streams, or creeks run? Do they all flow in the same direction?<br>8\. Can you see smaller tributaries that flow into larger ones?<br>9\. What is the largest body of water in your city?</p>","","","Lesson","0","FALSE"
"alveary-rec9lkHl3pKY5QBnE","alveary-receFlwcIOFwxFNIX","15","2","20m Geography: Grade 3 (U.S.) - Lesson 30","<p>Coal Mine<br>⍞ Materials: Cross-Country, U.S. Atlas, My U.S. Map, 50 Adventures in 50 States</p><p>➜ INTRO<br>Do you wear the same clothes to school or church that you wear when playing sports? Do you wear different clothes or shoes during your nature walks?</p><p>➜ MAP QUESTIONS<br>⍞ Map Resource: United States Atlas “Kentucky” p.66-67 (See 5th ed. PDF, if needed.)<br>∞ PDF Link: 5th edition PDF<br>1\. Find the economy symbol for coal.<br>2\. Can you find this symbol on the map of Kentucky? If so, where? (Most are in the eastern side of Kentucky.)<br>3\. What is this general area called? (Cumberland Plateau)</p><p>⍞ Map Resource: United States Atlas “The Political United States: Energy” p.20-21<br>1\. Locate Kentucky.<br>2\. What is the major (nonrenewable) energy source in Kentucky? (coal)<br>3\. What other energy sources are found in Kentucky? (natural gas and petroleum)</p><p>➜ READ, NARRATE, &amp; DISCUSS<br>Cross-Country<br>p.95-97 “‘What funny-looking’” - “‘coal miners?’”</p><p>➜ MAP WORK<br>⍞ Map Resource: My U.S. Map<br>1\. Label Kentucky. <br>2\. Try drawing the coal economy symbol in the eastern part of the state.</p><p>➜ VIEW<br>The landscape that makes Kentucky good for the natural resources we read about also makes it good for other things. Take a few minutes to look at the Kentucky spread on p.38-39 of 50 Adventures in 50 States to learn about rock climbing.</p>","","https://planning.alveary.org/links.html?id=rec9lkHl3pKY5QBnE&term=2&week=15","Lesson","0","FALSE"
"alveary-rec9lkHl3pKY5QBnE","alveary-recdCHy9ssKsXIFNa","16","1","20m Geography: Grade 3 (U.S.) - Lesson 31","<p>Tennessee<br>⍞ Materials: U.S. Atlas, My U.S. Map</p><p>➜ MAP QUESTIONS<br>⍞ Map Resource: United States Atlas “The Political United States: Political Map” p.14-15<br>1\. Locate Kentucky.<br>2\. Name the state neighboring Kentucky to the south. (Tennessee)</p><p>⍞ Map Resource: United States Atlas “The Physical United States: Physical Map” p.8-9<br>1\. Locate Tennessee.<br>2\. What rivers with labels do you see either inside or along the borders of Tennessee? (Mississippi, Tennessee, and Cumberland)</p><p>⍞ Map Resource: United States Atlas “Tennessee” p.76-77<br>1\. What shapes the western border of Tennessee? (Mississippi River)<br>2\. What river runs through Nashville? (Cumberland River)<br>3\. What river runs through Chattanooga? (Tennessee River)<br>4\. What shapes the eastern border? (It’s not a river, but the line is still squiggly.) Look for the big text arching over the border. (Appalachian Mountains)</p><p>➜ MAP WORK<br>⍞ Map Resource: My U.S. Map<br>Label Tennessee.</p>","","","Lesson","0","FALSE"
"alveary-rec9lkHl3pKY5QBnE","alveary-recIWKSmPCcAnHKLh","16","2","20m Geography: Grade 3 (U.S.) - Lesson 32","<p>Nashville<br>⍞ Materials: Cross-Country, U.S. Atlas, My U.S. Map</p><p>➜ MAP QUESTIONS<br>⍞ Map Resource: United States Atlas “The Political United States: Political Map” p.14-15, then “Climate” p.10-11, and then “Physical Map” p.8-9<br>1\. Locate Nashville, Tennessee. Remember its location for the next two maps.<br>2\. What is the climate zone for Nashville? (temperate wet)<br>3\. What vegetation grows in Tennessee? (broadleaf forest)<br>4\. Locate Los Angeles, California. Remember its location for the next two maps.<br>5\. Compare the climate zones of Los Angeles and Nashville. (Los Angeles is dry summer, but Nashville is wet. However, both are listed as temperate.<br>6\. Compare the natural vegetation of Los Angeles and Nashville. (Los Angeles has grassland vegetation and is located at the base of mixed forests, which are a mixture of needleleaf and broadleaf trees. Nashville is located in a broadleaf forest area.)</p><p>➜ READ, NARRATE, &amp; DISCUSS<br>Cross-Country<br>p.98-100 “Ruth and Tom” - &quot;but he did.’”<br>Show students the picture on p.98, and ask what clue in the picture lets you know that the story takes place in the capital city. (Only one background building is shown in detail. It appears to be placed prominently on a hill and designed with elaborate architecture. Does this look like a Capitol building to you?)</p><p>➜ MAP WORK<br>⍞ Map Resource: My U.S. Map<br>Label Nashville.</p>","","","Lesson","0","FALSE"
"alveary-rec9lkHl3pKY5QBnE","alveary-rec0HZfDc4lgpjNdG","17","1","20m Geography: Grade 3 (U.S.) - Lesson 33","<p>Borders<br>⍞ Materials: Cross-Country, My U.S. Map</p><p>PREP: If you are reading this online, print a copy of the inside front map of Cross-Country to look at while the story is read today. If you have the printed copy, just reference the front map.</p><p>➜ INTRO<br>Before you read, place the inside front cover map before the students. Ask what the red line, red stars, squiggly blue lines, and dashed black lines represent. If they don't know, tell them that we will discover the answer(s) in today’s lesson.</p><p>➜ MAP QUESTIONS<br>1\. Look at the inside front cover map of Cross-Country. <br>2\. Read Tom’s questions from the first column of today’s reading as if you are actually asking those questions.<br>3\. Pause after each question to allow students to answer.<br>4\. For example, read, “Was Denver in Colorado or Kansas? A look at the map told him.” Now let the student check the map and respond before reading Tom’s next question.</p><p>➜ READ, NARRATE, &amp; DISCUSS<br>Cross-Country<br>p.101 “After two weeks” - “‘no river there.’”</p><p>➜ MAP WORK<br>⍞ Map Resource: My U.S. Map<br>Using a colored pencil, trace over any state borders formed by rivers. Use the Cross-Country map as your reference, and label the rivers.</p>","","","Lesson","0","FALSE"
