"course_custom_id","assignment_custom_id","assignment_week","assignment_day","assignment_name","assignment_description","assignment_teachersNote","assignment_linksUrl","assignment_type","assignment_duration","assignment_graded"
"alveary-recExExdfIdNRyBus","alveary-recVN3fLe7WxYiciM","1","1","30m Spiritual Formation: Grades 7-8 - Lesson 1","<p>⍞ Materials: Transformed By Truth, notebook</p><p>➜ INTRO<br>How would you answer someone who asks why you study the Bible? As the title indicates, the first half of Transformed by Truth will focus on the why of studying the Bible, while the second half will move into the how of Bible study. As we move through the book's second half, we will apply the lessons to a chapter from your reading in the book of Acts.</p><p>➜ READ &amp; NARRATE<br>Intro p.13-16</p><p>➜ NOTEBOOK<br>Take a moment to reflect on the author's statement, &quot;Teens need serious Bible study just as much as adults.&quot; Do you agree? Why or why not? What do you hope to learn about Bible study this year?</p>","","","Lesson","0","FALSE"
"alveary-recExExdfIdNRyBus","alveary-recv52d5YrHR8gRJL","2","1","30m Spiritual Formation: Grades 7-8 - Lesson 2","<p>⍞ Materials: Transformed By Truth, notebook</p><p>➜ RECAP<br>What did you read about last time?</p><p>➜ READ &amp; NARRATE<br>Ch.1 p.19-29</p><p>➜ NOTEBOOK<br>Choose one or more of the questions on p.29 to answer in your notebook.</p>","","","Lesson","0","FALSE"
"alveary-recExExdfIdNRyBus","alveary-recB3O16X0t6XxCYH","3","1","30m Spiritual Formation: Grades 7-8 - Lesson 3","<p>⍞ Materials: Transformed By Truth, notebook</p><p>➜ RECAP<br>What did you read about last time?</p><p>➜ INTRO<br>Part of Bible study starts with basic questions, such as, &quot;What does the Bible say about this matter?&quot; Rather than taking an author's opinion or statement as truth when claiming the Bible supports it, verifying and reading what the Bible says on the subject is important. As you read through Transformed by Truth, look up the Scripture references that are included as time allows. Today, those verses are assigned as part of the reading.</p><p>➜ READ, NARRATE &amp; DISCUSS<br>p.31-36 &quot;When I was&quot; - &quot;others. Praise God!&quot;<br>Also read the verses in the passage: Jer. 1:1-2; Ezek. 1:3; 2 Pet. 1:20-21; 2 Pet. 3:15-16; 2 Tim. 3:16; I Cor. 7:40</p><p>• Did reading the verses from the source (the Bible) help clarify or support the author's claim?</p><p>➜ NOTEBOOK<br>Take a moment to record new insights, copy quotes, or ask questions.</p>","","","Lesson","0","FALSE"
"alveary-recExExdfIdNRyBus","alveary-rec0zRYCLqZkg97cG","4","1","30m Spiritual Formation: Grades 7-8 - Lesson 4","<p>⍞ Materials: Transformed By Truth, notebook</p><p>➜ RECAP<br>What did you read about last time?</p><p>➜ READ &amp; NARRATE<br>p.36-44 &quot;The Bible's Books&quot; - &quot;the next chapter.&quot;</p><p>➜ NOTEBOOK<br>Choose one or more of the questions on p.44 to answer in your notebook.</p>","","","Lesson","0","FALSE"
"alveary-recExExdfIdNRyBus","alveary-rec3maHNmcXEMzfUe","5","1","30m Spiritual Formation: Grades 7-8 - Lesson 5","<p>⍞ Materials: Transformed By Truth, notebook</p><p>➜ RECAP<br>What did you read about last time?</p><p>➜ INTRO<br>You may have heard the Bible called The Greatest Story Ever Told. In today's reading, the author describes different elements of a story - elements you have most likely learned about in literature classes, but have you ever applied that framework to the Story of Scripture?</p><p>➜ READ &amp; NARRATE<br>p.45-51 &quot;The Bible has&quot; - &quot;all the others.&quot;</p><p>➜ NOTEBOOK<br>Take a moment to record new insights, copy quotes, or ask questions. Using the elements the author is explaining, begin a diagram or chart of the Story of Scripture (you'll continue it in the second half of the chapter).</p>","","","Lesson","0","FALSE"
"alveary-recExExdfIdNRyBus","alveary-recIQKUuzfqUVfVVl","6","1","30m Spiritual Formation: Grades 7-8 - Lesson 6","<p>⍞ Materials: Transformed By Truth, notebook</p><p>➜ RECAP<br>What did you read about last time?</p><p>➜ READ &amp; NARRATE<br>p.52-56 &quot;Most epic fantasies&quot; - &quot;only the beginning.&quot;</p><p>➜ NOTEBOOK<br>Choose one or more of the questions on p.56 to answer in your notebook. <br>Complete the diagram you began last week of the Story of Scripture. As the author mentions on p.55, mark where you are in the story (by drawing a stick figure, writing your name, or marking it however you want to signify YOU!). Copy Acts 1:8 into the chart above where you are marked. From your reading in Acts and the ideas presented in this chapter about the Story of Scripture, what would you say your mission is as a believer in the Lord?</p>","","","Lesson","0","FALSE"
"alveary-recExExdfIdNRyBus","alveary-receOhaJ6OT0O517I","7","1","30m Spiritual Formation: Grades 7-8 - Lesson 7","<p>⍞ Materials: Transformed By Truth, notebook</p><p>➜ RECAP<br>What did you read about last time?</p><p>➜ READ &amp; NARRATE<br>p.57-64 &quot;God's will for&quot; - &quot;faith? Do we?&quot;</p><p>➜ NOTEBOOK<br>Take a moment to record new insights, copy quotes, or ask questions.</p>","","","Lesson","0","FALSE"
"alveary-recExExdfIdNRyBus","alveary-rechGrg7xtJr6abhG","8","1","30m Spiritual Formation: Grades 7-8 - Lesson 8","<p>⍞ Materials: Transformed By Truth, notebook</p><p>➜ RECAP<br>What did you read about last time?</p><p>➜ READ &amp; NARRATE<br>p.64-72 &quot;While Moses was&quot; - &quot;the next chapter.&quot;</p><p>➜ NOTEBOOK<br>Choose one or more questions to answer in your notebook.</p>","","","Lesson","0","FALSE"
"alveary-recExExdfIdNRyBus","alveary-recJCgBNFRh4elNMt","9","1","30m Spiritual Formation: Grades 7-8 - Lesson 9","<p>⍞ Materials: Transformed By Truth, notebook</p><p>➜ RECAP<br>What did you read about last time?</p><p>➜ READ &amp; NARRATE<br>p.73-79 &quot;God's word commands&quot; - &quot;him will grow.&quot;</p><p>➜ NOTEBOOK<br>Take a moment to record new insights, copy quotes, or ask questions.</p>","","","Lesson","0","FALSE"
"alveary-recExExdfIdNRyBus","alveary-recOW01LCGsBNMiEj","10","1","30m Spiritual Formation: Grades 7-8 - Lesson 10","<p>⍞ Materials: Transformed By Truth, notebook</p><p>➜ RECAP<br>What did you read about last time?</p><p>➜ READ &amp; NARRATE<br>p.79-84 &quot;We saw earlier&quot; - &quot;transformed by truth.&quot;</p><p>➜ NOTEBOOK<br>Choose one or more questions to answer in your notebook.</p>","","","Lesson","0","FALSE"
"alveary-recExExdfIdNRyBus","alveary-recPB9wN67zHhleYf","11","1","30m Spiritual Formation: Grades 7-8 - Lesson 11","<p>⍞ Materials: Linked article</p><p>➜ RECAP<br>What did you read about last time?</p><p>➜ INTRO<br>As the author has discussed, part of studying the Bible is understanding the &quot;Big Story&quot; of the Bible and its metanarrative. What does it mean for the Bible to be read as literature? Instead of God giving us a bullet-point list of attributes about who he is and what he is like, he shows us his character through the stories of how he interacted with people. Just as fictional stories use different elements such as characters, setting, plot, climax, and resolution to tell a good story, the Bible uses the same elements to tell the true stories of God's people. When we understand these elements better, we can understand the Bible better. &quot;A book needs to be read in keeping with its author's intention. We can see from the Bible itself that it is a thoroughly literary book. God superintended its authors to write a very (though not wholly) literary book. Paying adequate attention to the literary qualities of the Bible not only helps to unlock the meanings of the Bible; it is also a way of honoring the literary intentions of its authors. Surely, biblical authors regarded everything they put into their writing as important. We also need to regard those things as important.&quot; (How Bible Stories Work, p.10) This quote is from Leland Ryken, a retired professor and author. Today's reading is an article Ryken wrote about reading the Bible as literature. <br> <br>➜ READ &amp; NARRATE <br>∞ Article Link: Ten Things You Should Know About the Bible as Literature</p><p>➜ NOTEBOOK<br>Add any notes, thoughts, or questions about the article in your notebook.</p>","","https://planning.alveary.org/links.html?id=recExExdfIdNRyBus&term=1&week=11","Lesson","0","FALSE"
"alveary-recExExdfIdNRyBus","alveary-recFiypbYnqQFIzYq","12","1","30m Spiritual Formation: Grades 7-8 - Lesson 12","<p>Exam Week</p><p>➜ EXAMS<br>Answer question(s) related to course.</p><p>Questions will come from:<br>Transformed by Truth</p>","<p>★ Spiritual Formation: Grades 7-8 — TERM 1 EXAM QUESTIONS<br>· Transformed by Truth: Explain how the Bible is a &quot;Big Story.&quot; What elements of story do we see in the Bible? Give examples of those elements from the Bible story.</p><p>· Transformed by Truth: Give two of the reasons the Bible should be studied, along with explanations of those reasons.</p>","","Exam","0","FALSE"
"alveary-recExExdfIdNRyBus","alveary-recvcGSH3cZlLs5VX","13","1","30m Spiritual Formation: Grades 7-8 - Lesson 13","<p>⍞ Materials: Transformed By Truth, notebook</p><p>➜ RECAP<br>What did you read about last time?</p><p>➜ INTRO<br>As we move into the second half of Transformed by Truth, we will look at the _how_ of Bible study.</p><p>➜ READ &amp; NARRATE<br>p.87-99 &quot;What's the right&quot; - &quot;about our God.&quot;</p><p>➜ NOTEBOOK<br>Answer the three questions on p.99.</p>","","","Lesson","0","FALSE"
"alveary-recExExdfIdNRyBus","alveary-recDbmRNmjyIj9AwQ","14","1","30m Spiritual Formation: Grades 7-8 - Lesson 14","<p>⍞ Materials: Transformed By Truth, notebook</p><p>➜ RECAP<br>What did you read about last time?</p><p>➜ READ &amp; NARRATE<br>p.101-107 &quot;I know I&quot; - &quot;to give it.&quot;</p><p>➜ NOTEBOOK<br>List the three pillars of inductive Bible study. Write down any quotes, phrases, or ideas that stand out from the reading.</p>","","","Lesson","0","FALSE"
"alveary-recExExdfIdNRyBus","alveary-recZwTseQueu0kflM","15","1","30m Spiritual Formation: Grades 7-8 - Lesson 15","<p>⍞ Materials: Transformed By Truth, notebook, Bible study supplies as needed (see below)</p><p>➜ RECAP<br>What did you read about last time?</p><p>➜ READ &amp; NARRATE<br>p.108-112 &quot;The first step&quot; - &quot;of a masterpiece.&quot;<br>As you read, jot down what the author recommends for supplies for Bible study. Gather these supplies and print out Acts 17 for your inductive Bible study. (If you want the chapter to be double-spaced as the author recommends, you will need to copy and paste the chapter into a separate document to adjust the line spacing there.) <br>∞ Link: Acts 17 (ESV)</p><p>➜ NOTEBOOK<br>Answer the three questions on p.112.</p>","","https://planning.alveary.org/links.html?id=recExExdfIdNRyBus&term=2&week=15","Lesson","0","FALSE"
"alveary-recExExdfIdNRyBus","alveary-reckfjVymVKG27Mqi","16","1","30m Spiritual Formation: Grades 7-8 - Lesson 16","<p>⍞ Materials: Transformed By Truth, notebook</p><p>➜ RECAP<br>What did you read about last time?</p><p>➜ READ &amp; NARRATE<br>Ch.8 p.113-124<br>(Instead of studying 3 John as the author suggests, we will study Acts 17 to go along with your New Testament reading beginning in the next lesson.)</p><p>➜ NOTEBOOK<br>Take notes on today's reading of chapter 8. Note the three types of context and what is included in each.</p>","","","Lesson","0","FALSE"
"alveary-recExExdfIdNRyBus","alveary-rectJ98PrmEJEzKlV","17","1","30m Spiritual Formation: Grades 7-8 - Lesson 17","<p>⍞ Materials: Transformed By Truth, notebook</p><p>➜ RECAP<br>What did you read about last time?</p><p>➜ INTRO<br>In today's lesson, we will apply the information from chapter 8 of Transformed by Truth to our study in Acts.</p><p>➜ READ<br>Using at least two different resources, look up and read an introduction to Acts to find information about the Historical, Biblical, and Cultural context of Acts. The Ultimate Bible Atlas, The Chronological Guide to the Bible, and the ESV Concise Study Bible you use in your Bible reading all contain contextual background information. Alternatively, you could use an online site such as Bible Project or Blue Letter Bible, or ask a parent what Bible commentaries or Bible dictionaries they may have that could be used. <br>∞ Link: Blue Letter Bible (click on Tools for commentaries)<br>∞ Link: The Bible Project</p><p>➜ NOTEBOOK<br>From your reading of two different resources, write three facts or points under each of the three types of context (Biblical, Historical, Cultural). (e.g., under Historical Context, you could write the date range of the acts that were written.)</p>","","https://planning.alveary.org/links.html?id=recExExdfIdNRyBus&term=2&week=17","Lesson","0","FALSE"
"alveary-recExExdfIdNRyBus","alveary-reciwAo8TB0pzTZIT","18","1","30m Spiritual Formation: Grades 7-8 - Lesson 18","<p>⍞ Materials: Transformed By Truth, notebook</p><p>➜ RECAP<br>What did you read about last time?</p><p>➜ READ<br>p.125-132 &quot;When I was&quot; - &quot;to them soon!&quot;<br>Take notes as you read about what questions are being answered when you look at the bigger picture or &quot;airplane window view,&quot; and then the close-up picture or the &quot;walking the streets&quot; view.</p><p>➜ NOTEBOOK<br>Using your notes on your reading, apply these questions to Acts as a whole (you have already done some, if not all, of this in the last lesson and in your reading of Acts). <br>Next, use your Acts 17 printout to answer the chapter's six close-up view questions (who, what, when, where, why, how).</p>","","","Lesson","0","FALSE"
"alveary-recExExdfIdNRyBus","alveary-rec1LtRKHzBAwSplB","19","1","30m Spiritual Formation: Grades 7-8 - Lesson 19","<p>⍞ Materials: Transformed By Truth, notebook</p><p>➜ RECAP<br>What did you read about last time?</p><p>➜ READ &amp; NARRATE<br>p.132-140 &quot;Now that we're&quot; - &quot;study so far.&quot;<br>Take notes as you read.</p><p>➜ NOTEBOOK<br>Using your Acts 17 printout, do the following: <br>• Read through Acts 17 looking for repeated words, themes, or phrases. Some examples are given below, but if you find any others on your own, mark those. <br>• Mark all words related to thinking, studying, and reasoning (synonyms or antonyms) in red. <br>• Mark all cities Paul travels to in green. <br>• Mark all names of people mentioned in brown. <br>• Mark any reactions of people listening to the message Paul is preaching in blue. Is there a difference in reactions from different groups or individuals? <br>• If you find any other themes you want to mark, do so now. Ideas might include action words (persuaded, joined, attacked, etc.), responses from women, or words referring to or having to do with God (Lord, word of God, etc.).<br>• What is the main issue that is making the people angry?</p>","","","Lesson","0","FALSE"
"alveary-recExExdfIdNRyBus","alveary-recB57dRkb3giu3gs","20","1","30m Spiritual Formation: Grades 7-8 - Lesson 20","<p>⍞ Materials: Transformed By Truth, notebook</p><p>➜ RECAP<br>What did you read about last time?</p><p>➜ READ &amp; NARRATE<br>p.141-146 &quot;What do you&quot; - &quot;makes it interpretation.&quot;</p><p>➜ NOTEBOOK<br>1\. Using the author's example on p.145, write a summary (paraphrase) of Acts 17. For instance, your first point might read: Paul and Silas arrive in Thessalonica, where Paul teaches in the synagogue (vs.1-3).<br>2\. Keeping in mind the main idea of Acts, which shows the growth of the early church, how does Acts 17 fit into the flow of the book? How does what Luke includes in his synopsis of events help support his main purpose in writing Acts?</p>","","","Lesson","0","FALSE"
"alveary-recExExdfIdNRyBus","alveary-recaXox5AIGEpVByE","21","1","30m Spiritual Formation: Grades 7-8 - Lesson 21","<p>⍞ Materials: Transformed By Truth, notebook</p><p>➜ RECAP<br>What did you read about last time?</p><p>➜ READ &amp; NARRATE<br>p.146-155 &quot;The heart of&quot; - &quot;the next chapter.&quot; <br>(Use the questions below as we focus on Acts 17, instead of the book's questions.)</p><p>➜ NOTEBOOK<br>1\. Read Acts 17 again. Read Paul's sermon in verses 22-31 again. Why does Paul focus on idols in his message? What had the philosophers (such as the Epicureans and Stoics) made an idol of? <br>2\. Look up the following cross-references for &quot;philosophers&quot; and write down any observations you may have: 1 Corinthians 1:20-21; Romans 1:22; Colossians 2:6-8.<br>3\. Pick another verse or passage from Acts 17 that you would like to study more closely. Use a Bible Dictionary, or footnotes in a Study Bible, to research the passage's meaning. (Blueletterbible.org links to study notes or dictionaries if you cannot access one.) Write observations in your notebook. <br>∞ Link: Blue Letter Bible<br>4\. Use either the online Blue Letter Bible or a Strong's Concordance to look up the Strong's number, Greek word, and definition for the word &quot;babbler&quot; found in Acts 17:18. <br>5\. Using a commentary from your home, church, or library, look up the passage and write down any notes about what you learn about the passage. (Blueletterbible.org also has links to commentaries.)</p>","","https://planning.alveary.org/links.html?id=recExExdfIdNRyBus&term=2&week=21","Lesson","0","FALSE"
"alveary-recExExdfIdNRyBus","alveary-recBiYdHsvyJdBhhx","22","1","30m Spiritual Formation: Grades 7-8 - Lesson 22","<p>⍞ Materials: Transformed By Truth, notebook</p><p>➜ RECAP<br>What did you read about last time?</p><p>➜ READ &amp; NARRATE<br>p.157-168 &quot;Can you imagine&quot; - &quot;and forevermore. Amen.&quot;</p><p>➜ NOTEBOOK<br>Answer the questions regarding the application on p.168 (based on Acts 17). Choose a verse or a short passage from Acts 17 to memorize if you would like.</p>","","","Lesson","0","FALSE"
"alveary-recExExdfIdNRyBus","alveary-recvxh8LdMRviKh1e","23","1","30m Spiritual Formation: Grades 7-8 - Lesson 23","<p>⍞ Materials: Transformed By Truth, notebook</p><p>➜ RECAP<br>What did you read about last time?</p><p>➜ INTRO<br>While you have reached the end of Transformed by Truth, what you have learned can be used to study any passage of the Bible. As you continue reading the book of Acts, remember the specific things you have learned from chapter 17 and apply that to the bigger context of Acts and, ultimately, to the overarching context of the entire Bible.</p><p>➜ READ &amp; NARRATE<br>Appendix B: Memorization Tips and Helps p.177-180</p><p>• Continue working on the verse or passage you have chosen to memorize from Acts 17.</p><p>➜ NOTEBOOK<br>Create a worksheet or outline highlighting the key points from Transformed by Truth about the how and why of Bible study. What information would you include if you were teaching a class about inductive Bible study?</p>","","","Lesson","0","FALSE"
"alveary-recExExdfIdNRyBus","alveary-recHbGTaNa7lkwqST","24","1","30m Spiritual Formation: Grades 7-8 - Lesson 24","<p>Exam Week</p><p>➜ EXAMS<br>Answer question(s) related to course.</p><p>Questions will come from:<br>Transformed by Truth</p>","<p>★ Spiritual Formation: Grades 7-8 — TERM 2 EXAM QUESTIONS<br>· Transformed by Truth: What are the three steps of inductive Bible study? Explain what each step involves.</p><p>· Transformed by Truth: How would you go about studying a chapter of the Bible?</p>","","Exam","0","FALSE"
"alveary-recExExdfIdNRyBus","alveary-recLy1RltRjBndlU1","25","1","30m Spiritual Formation: Grades 7-8 - Lesson 25","<p>⍞ Materials: This Changes Everything, notebook</p><p>➜ RECAP<br>What do you recall about the overall message of Transformed by Truth?</p><p>➜ INTRO<br>In this lesson, we will begin the book This Changes Everything: How the Gospel Transforms the Teen Years. The author states in her intro that this book is for young people who want to grow in their spiritual life. &quot;...Because we love Jesus. If we love Jesus, we'll love truth, and we'll want to grow&quot; (p.14). And - as the title states - the author shows how the gospel changes our entire life and touches every area of our existence.</p><p>➜ READ &amp; NARRATE<br>Ch.1 p.17-29</p><p>➜ NOTEBOOK<br>Choose two of the questions on p.29 to answer in your notebook.</p>","","","Lesson","0","FALSE"
"alveary-recExExdfIdNRyBus","alveary-recQOdawT4TM197qe","26","1","30m Spiritual Formation: Grades 7-8 - Lesson 26","<p>⍞ Materials: This Changes Everything, notebook</p><p>➜ RECAP<br>What do you recall about what you read last time about how the gospel changes our identity?</p><p>➜ READ &amp; NARRATE<br>Ch.2 p.31-42</p><p>• Toward the beginning of the year, lessons 5 and 6 covered the chapter in Transformed by Truth that focused on the Story of the Bible. Today's reading also covered the subject. Why is it good to be reminded of the overarching story of the Bible? Are you able to see yourself as part of that story? Why or why not? Is there any part of this subject you think the authors missed in their chapters?</p><p>➜ NOTEBOOK<br>Choose two of the questions from p.42-43 and answer them in your notebook.</p>","","","Lesson","0","FALSE"
"alveary-recExExdfIdNRyBus","alveary-recTgoIgm0I3h8V4e","27","1","30m Spiritual Formation: Grades 7-8 - Lesson 27","<p>⍞ Materials: This Changes Everything, notebook</p><p>➜ RECAP<br>What do you recall about what you read last time about the story of the Bible?</p><p>➜ INTRO<br>Would you consider yourself an introvert or an extrovert? Maybe the word &quot;community&quot; is a bit intimidating! Today's chapter is about how the gospel affects our relationship with the people in our church. And thankfully, there's space for both introverts and extroverts!</p><p>➜ READ &amp; NARRATE<br>p.45-56 &quot;The gospel is&quot; - &quot;change anybody's life.&quot;</p><p>➜ NOTEBOOK<br>The author points out that part of loving your church is praying for those who are in it. Create a prayer list or write out a prayer for people  - leaders, friends, other families, or kids your age - in your church. <br>Write out any other responses or thoughts about the author's points about community.</p><p>• EXTRA HELPING<br>View the video at the link where Bible teacher Mike Winger goes through Eight Reasons God Wants You to Go to Church. Write the reasons and excuses he gives and then write a short response in your notebook.<br>∞ Video Link: 8 Reasons God Wants You to Go to Church</p>","","https://planning.alveary.org/links.html?id=recExExdfIdNRyBus&term=3&week=27","Lesson","0","FALSE"
"alveary-recExExdfIdNRyBus","alveary-recbzrsIFgPK9YXIM","28","1","30m Spiritual Formation: Grades 7-8 - Lesson 28","<p>⍞ Materials: This Changes Everything, notebook</p><p>➜ RECAP<br>What do you recall about what you read last time?</p><p>➜ READ &amp; NARRATE<br>p.57-67 &quot;So make your&quot; - &quot;We are free.&quot;</p><p>➜ NOTEBOOK<br>Choose two of the questions on p.62 to answer in your notebook.</p>","","","Lesson","0","FALSE"
"alveary-recExExdfIdNRyBus","alveary-rec7m1Ow3jmJ12L5t","29","1","30m Spiritual Formation: Grades 7-8 - Lesson 29","<p>⍞ Materials: This Changes Everything, notebook</p><p>➜ RECAP<br>What do you recall about what you read last time?</p><p>➜ READ &amp; NARRATE<br>p.67-77 &quot;But even though&quot; - &quot;break his promises.&quot;</p><p>➜ NOTEBOOK<br>Choose two of the questions listed to answer in your notebook.</p>","","","Lesson","0","FALSE"
"alveary-recExExdfIdNRyBus","alveary-recflA8WvsfVl4W0M","30","1","30m Spiritual Formation: Grades 7-8 - Lesson 30","<p>⍞ Materials: This Changes Everything, notebook</p><p>➜ RECAP<br>What do you recall about what you read last time?</p><p>➜ READ &amp; NARRATE<br>p.79-89 &quot;Let's pretend there&quot; - &quot;our prayer life.&quot;</p><p>➜ NOTEBOOK<br>Take some time to consider the following questions, and write out your thoughts or answers in your notebook: Do you think of the word &quot;discipline&quot; in a positive or negative way? Or does it depend on the context? What spiritual disciplines have you implemented in your life? What spiritual discipline(s) would you like to focus on? Write out a prayer asking the Lord for help in doing so.</p>","","","Lesson","0","FALSE"
"alveary-recExExdfIdNRyBus","alveary-recGw8WdPCFePL4sK","31","1","30m Spiritual Formation: Grades 7-8 - Lesson 31","<p>⍞ Materials: This Changes Everything, notebook</p><p>➜ RECAP<br>What do you recall about what you read last time?</p><p>➜ READ &amp; NARRATE<br>p.89-95 &quot;Only recently have&quot; - &quot;our evangelizing: Jesus.&quot;</p><p>➜ NOTEBOOK<br>Choose two of the questions from p.95-96 to answer in your notebook.</p>","","","Lesson","0","FALSE"
"alveary-recExExdfIdNRyBus","alveary-rec2KrxNBg0cnApJA","32","1","30m Spiritual Formation: Grades 7-8 - Lesson 32","<p>⍞ Materials: This Changes Everything, notebook</p><p>➜ RECAP<br>What do you recall about what you read last time?</p><p>➜ READ &amp; NARRATE<br>Ch.6 p.97-110</p><p>• Did you notice C.H. Spurgeon's quote about books in today's reading? What have you learned about Spurgeon that would show he agrees with the author's main point of the book, which is that the gospel changes everything in life? How did Spurgeon himself live out a life that would support that point?</p><p>➜ NOTEBOOK<br>Answer question #1 on p.110 (because Spurgeon!) and choose either question 2 or 3 on p.111 to answer in your notebook.</p>","","","Lesson","0","FALSE"
