"course_custom_id","assignment_custom_id","assignment_week","assignment_day","assignment_name","assignment_description","assignment_teachersNote","assignment_linksUrl","assignment_type","assignment_duration","assignment_graded"
"alveary-recH6yJs8s683UEjb","alveary-recqqHco7wZrND7oP","1","1","10m Sol-fa: Musical Games - Lesson 1","<p>Moving and Music</p><p>➜ LISTEN &amp; PRACTICE<br>“Here We Go Round the Mulberry Bush.” Follow the movement directions, ensuring that larger groups or students with spatial perception differences have enough room.<br>∞ Video Link: Here We Go Round the Mulberry Bush</p><p>➜ SING<br>Now try singing the song and make up some new actions (possibilities: “this is the way we clap our hands,” “sweep the floor,” or “dance around”).</p><p>• AFTERNOON LISTENING<br>Along with the lesson's songs, read stories and/or listen to songs about Winnie the Pooh.<br>∞ Audio Link: Afternoons: Pooh Songs</p>","","https://planning.alveary.org/links.html?id=recH6yJs8s683UEjb&term=1&week=1","Lesson","0","FALSE"
"alveary-recH6yJs8s683UEjb","alveary-rec2K8o7fsWkmOz1g","2","1","10m Sol-fa: Musical Games - Lesson 2","<p>Join-in Rhymes</p><p>PREP: Print out and read over instructions.<br>∞ Link: &quot;The Owl&quot; and &quot;Here We Go&quot;</p><p>➜ LISTEN &amp; PRACTICE<br>Read “The Owl” and “Here We Go” aloud and tell the students what they are going to say with you (the italicized parts). You may want to read the poem aloud first and then have the students join in the second time. Tell the students to copy you closely. Exaggerate louds, softs, ascending, descending tones of your voice.</p><p>• AFTERNOON LISTENING<br>Along with the lesson's songs, read stories and/or listen to songs about Winnie the Pooh.<br>∞ Audio Link: Afternoons: Pooh Songs</p>","","https://planning.alveary.org/links.html?id=recH6yJs8s683UEjb&term=1&week=2","Lesson","0","FALSE"
"alveary-recH6yJs8s683UEjb","alveary-recRZrvZQLH3odX9u","3","1","10m Sol-fa: Musical Games - Lesson 3","<p>Acting</p><p>➜ LISTEN &amp; PRACTICE<br>Today's songs need your help. In the first one, you need to pretend to be a teapot, and for the second one, you're going to make a lot of animal noises.<br>∞ Audio Link: I'm a Little Teapot<br>∞ Audio Link: Old MacDonald Had a Farm</p><p>➜ SING<br>With any extra lesson time, make up some new verses about other animals to “Old MacDonald Had a Farm.&quot;</p><p>• AFTERNOON LISTENING<br>Along with the lesson's songs, read stories and/or listen to songs about Winnie the Pooh.<br>∞ Audio Link: Afternoons: Pooh Songs</p>","","https://planning.alveary.org/links.html?id=recH6yJs8s683UEjb&term=1&week=3","Lesson","0","FALSE"
"alveary-recH6yJs8s683UEjb","alveary-recelF21qS4mL5rWu","4","1","10m Sol-fa: Musical Games - Lesson 4","<p>Improvising</p><p>➜ RECAP<br>Sing as much of “I'm a Little Teapot” or “Old MacDonald Had a Farm” as you can without the music.</p><p>➜ SING<br>Sing along with the songs today. Make up verses or add any you made up last time.<br>∞ Audio Link: I'm a Little Teapot<br>∞ Audio Link: Old MacDonald Had a Farm</p><p>• AFTERNOON LISTENING<br>Along with the lesson's songs, read stories and/or listen to songs about Winnie the Pooh.<br>∞ Audio Link: Afternoons: Pooh Songs</p>","","https://planning.alveary.org/links.html?id=recH6yJs8s683UEjb&term=1&week=4","Lesson","0","FALSE"
"alveary-recH6yJs8s683UEjb","alveary-recEmYOzpIh2WYmzS","5","1","10m Sol-fa: Musical Games - Lesson 5","<p>Dwarfs and Giants</p><p>➜ LISTEN &amp; PRACTICE<br>Listen to &quot;In the Hall...&quot; by Edvard Grieg. Tiptoe with hands on hips when the music is soft. When it is loud, pretend to be a giant and march with your hands high in the air. During the second song, stand in one place, but move your body up and down as the music gets louder or softer. You can also swing your arms and twist with the music. Ensure that larger groups or students with spatial perception differences have enough room.<br>∞ Audio Link: In the Hall of the Mountain King<br>∞ Audio Link: Morning Mood</p><p>• AFTERNOON LISTENING<br>Along with the lesson's songs, read stories and/or listen to songs about Winnie the Pooh.<br>∞ Audio Link: Afternoons: Pooh Songs</p>","","https://planning.alveary.org/links.html?id=recH6yJs8s683UEjb&term=1&week=5","Lesson","0","FALSE"
"alveary-recH6yJs8s683UEjb","alveary-reckFNDX5PconwWLq","6","1","10m Sol-fa: Musical Games - Lesson 6","<p>Skipping</p><p>➜ LISTEN &amp; PRACTICE<br>Today we're going to have fun skipping! (Teacher should demonstrate how to skip to make sure students know how; if skipping is too challenging, teachers can model a shuffle instead.) Listen to “Skip to My Lou” and practice skipping with the music.<br>∞ Audio Link: Skip to My Lou</p><p>• AFTERNOON LISTENING<br>Along with the lesson's songs, read stories and/or listen to songs about Winnie the Pooh.<br>∞ Audio Link: Afternoons: Pooh Songs</p>","","https://planning.alveary.org/links.html?id=recH6yJs8s683UEjb&term=1&week=6","Lesson","0","FALSE"
"alveary-recH6yJs8s683UEjb","alveary-rec3ZplKnhBsdSZIH","7","1","10m Sol-fa: Musical Games - Lesson 7","<p>Skipping Part 2</p><p>➜ RECAP<br>Skip in a circle. If skipping is too challenging, students may shuffle instead.</p><p>➜ PRACTICE<br>We're going to skip more today, but this time, see if you can skip sideways! Try sideways skipping (left and right). (If there is a group of students, have them take hands and skip sideways in a ring.) Try to make up another way to skip (maybe backwards!). After you feel confident, skip and sing with the music.<br>∞ Audio Link: Skip to My Lou</p><p>• AFTERNOON LISTENING<br>Along with the lesson's songs, read stories and/or listen to songs about Winnie the Pooh.<br>∞ Audio Link: Afternoons: Pooh Songs</p>","","https://planning.alveary.org/links.html?id=recH6yJs8s683UEjb&term=1&week=7","Lesson","0","FALSE"
"alveary-recH6yJs8s683UEjb","alveary-recWmqKGqxnXLTRea","8","1","10m Sol-fa: Musical Games - Lesson 8","<p>Guessing Instruments</p><p>PREP: Think of how you want to imitate different instruments for your student to guess.</p><p>➜ PRACTICE<br>Imitate various instruments and have your students guess what they are. If students find this excessively difficult, do it together or make it a funny game of charades.</p><p>• AFTERNOON LISTENING<br>Along with the lesson's songs, read stories and/or listen to songs about Winnie the Pooh.<br>∞ Audio Link: Afternoons: Pooh Songs</p>","","https://planning.alveary.org/links.html?id=recH6yJs8s683UEjb&term=1&week=8","Lesson","0","FALSE"
"alveary-recH6yJs8s683UEjb","alveary-recEZCE9zjD3rHNza","9","1","10m Sol-fa: Musical Games - Lesson 9","<p>Echoing</p><p>➜ SING<br>You get to echo the singer in this song. (Sing with the kids in the audio.) Sing the song through a few times.<br>∞ Audio Link: My Aunt Came Back</p><p>➜ DISCUSS<br>Where are some of the places the aunt went? Look them up on your map. (Click on countries or islands to zoom in to find the cities/places mentioned in the song.)<br>∞ Map Link: Clickable World Map</p><p>• AFTERNOON LISTENING<br>Along with the lesson's songs, read stories and/or listen to songs about Winnie the Pooh.<br>∞ Audio Link: Afternoons: Pooh Songs</p>","","https://planning.alveary.org/links.html?id=recH6yJs8s683UEjb&term=1&week=9","Lesson","0","FALSE"
"alveary-recH6yJs8s683UEjb","alveary-recwvsyfDilyQIhKB","10","1","10m Sol-fa: Musical Games - Lesson 10","<p>“My Aunt Came Back” (cont.)</p><p>➜ RECAP<br>Keep practicing “My Aunt Came Back.” Can you hum the tune without the music?</p><p>➜ SING<br>Sing the song through a few times with the audio, then try singing it on your own.<br>∞ Audio Link: My Aunt Came Back</p><p>• AFTERNOON LISTENING<br>Along with the lesson's songs, read stories and/or listen to songs about Winnie the Pooh.<br>∞ Audio Link: Afternoons: Pooh Songs</p>","","https://planning.alveary.org/links.html?id=recH6yJs8s683UEjb&term=1&week=10","Lesson","0","FALSE"
"alveary-recH6yJs8s683UEjb","alveary-recIR0OPI4TUUI4lk","11","1","10m Sol-fa: Musical Games - Lesson 11","<p>Walking to a Beat</p><p>➜ PRACTICE<br>Can you walk at a very steady speed? Try to take steps so that your foot hits the ground with every tap of the stick in this song--you may want to play it more than once. If you can't walk with the taps perfectly, don’t worry. Some things take practice. After you're done walking, listen to the song again and see if you can learn the words.<br>∞ Audio Link: Hickory Dickory Dock<br>(Note: This song is on Spotify. You will need a free account to listen to it.)</p><p>• AFTERNOON LISTENING<br>Along with the lesson's songs, read stories and/or listen to songs about Winnie the Pooh.<br>∞ Audio Link: Afternoons: Pooh Songs</p>","","https://planning.alveary.org/links.html?id=recH6yJs8s683UEjb&term=1&week=11","Lesson","0","FALSE"
"alveary-recH6yJs8s683UEjb","alveary-recHut4QGajt53Qjz","12","1","10m Sol-fa: Musical Games - Lesson 12","<p>Exam Week</p><p>➜ EXAMS<br>Answer question(s) related to course.</p><p>Questions will come from: <br>Musical Games Coursework</p><p>➜ NOTE<br>Exams are optional for this course as the focus is on enjoyment and fun.</p>","<p>★ Sol-fa: Musical Games — TERM 1 EXAM QUESTIONS<br>· Sing a favorite song, do a favorite activity/dance, or draw/paint a favorite piece.</p>","","Exam","0","FALSE"
"alveary-recH6yJs8s683UEjb","alveary-recX7Otgklso3FdFT","13","1","10m Sol-fa: Musical Games - Lesson 13","<p>Meowing</p><p>➜ INTRO<br>Listen to these two cats. I bet they can “meow” better than any other cats you've ever heard.<br>∞ Audio Link: Duet for Two Cats</p><p>➜ PRACTICE<br>Now you meow too!<br>∞ Audio Link: Meow Game</p><p>• AFTERNOON LISTENING<br>Songs from the lesson and “Wee Sing Songs.&quot;<br>∞ Audio Link: Afternoons: Wee Sing Children's Songs &amp; Fingerplays<br>∞ Audio Link: Afternoons: Wee Sing Around the World</p>","","https://planning.alveary.org/links.html?id=recH6yJs8s683UEjb&term=2&week=13","Lesson","0","FALSE"
"alveary-recH6yJs8s683UEjb","alveary-recWQoX6KO1NW9Xyz","14","1","10m Sol-fa: Musical Games - Lesson 14","<p>Nutcracker and Imitating</p><p>➜ VIEW &amp; PRACTICE<br>Start watching the Nutcracker Ballet, and try to imitate the dancers’ moves.<br>∞ Video Link: Nutcracker Ballet</p><p>• AFTERNOON LISTENING<br>Songs from the lesson and “Wee Sing Songs.&quot;<br>∞ Audio Link: Afternoons: Wee Sing Children's Songs &amp; Fingerplays<br>∞ Audio Link: Afternoons: Wee Sing Around the World</p>","","https://planning.alveary.org/links.html?id=recH6yJs8s683UEjb&term=2&week=14","Lesson","0","FALSE"
"alveary-recH6yJs8s683UEjb","alveary-recxypQgJlKBgJhVf","15","1","10m Sol-fa: Musical Games - Lesson 15","<p>Nutcracker Ballet (cont.)</p><p>➜ VIEW &amp; PRACTICE<br>Keep watching the Nutcracker Ballet and try to imitate the dancers’ moves.<br>∞ Video Link: Nutcracker Ballet</p><p>• AFTERNOON LISTENING<br>Songs from the lesson and “Wee Sing Songs.&quot;<br>∞ Audio Link: Afternoons: Wee Sing Children's Songs &amp; Fingerplays<br>∞ Audio Link: Afternoons: Wee Sing Around the World</p>","","https://planning.alveary.org/links.html?id=recH6yJs8s683UEjb&term=2&week=15","Lesson","0","FALSE"
"alveary-recH6yJs8s683UEjb","alveary-recYTyTwP11tr1Nno","16","1","10m Sol-fa: Musical Games - Lesson 16","<p>Guessing Melodies</p><p>PREP: Select several songs/melodies with which your child is familiar. (Pick some that the student will know quickly and some that are harder to recognize.)</p><p>➜ LISTEN &amp; PRACTICE<br>Play each melody and ask the student to guess the melody. Intersperse lesser-known pieces with the more familiar ones until lesson time is over.<br>∞ Audio Link: Musical Games Playlist</p><p>• AFTERNOON LISTENING<br>Songs from the lesson and “Wee Sing Songs.&quot;<br>∞ Audio Link: Afternoons: Wee Sing Children's Songs &amp; Fingerplays<br>∞ Audio Link: Afternoons: Wee Sing Around the World</p>","","https://planning.alveary.org/links.html?id=recH6yJs8s683UEjb&term=2&week=16","Lesson","0","FALSE"
"alveary-recH6yJs8s683UEjb","alveary-rec2oWmdDVVhgcEHJ","17","1","10m Sol-fa: Musical Games - Lesson 17","<p>Fingerplay</p><p>➜PREP &amp; PRACTICE<br>Learn this fingerplay song, and then teach it to your students during the lesson.<br>∞ Video Link: Open, Shut Them</p><p>• AFTERNOON LISTENING<br>Songs from the lesson and “Wee Sing Songs.&quot;<br>∞ Audio Link: Afternoons: Wee Sing Children's Songs &amp; Fingerplays<br>∞ Audio Link: Afternoons: Wee Sing Around the World</p>","","https://planning.alveary.org/links.html?id=recH6yJs8s683UEjb&term=2&week=17","Lesson","0","FALSE"
"alveary-recH6yJs8s683UEjb","alveary-recj7LbUh3QT7CXaz","18","1","10m Sol-fa: Musical Games - Lesson 18","<p>Clapping and Marching in Time<br>⍞ Materials: Item to balance on head while marching</p><p>➜ LISTEN &amp; PRACTICE<br>Balance item on your head while doing the following:<br>• Clap with the music.<br>• Walk with the music.<br>• March with the music (lifting knees).<br>• Turn with directions (if the student knows directions, the teacher may<br>  call out “about right,” “about left,” etc.)<br>∞ Audio Link: Farewell to a Slavic Woman<br>∞ Audio Link: Pomp and Circumstance</p><p>• AFTERNOON LISTENING<br>Songs from the lesson and “Wee Sing Songs.&quot;<br>∞ Audio Link: Afternoons: Wee Sing Children's Songs &amp; Fingerplays<br>∞ Audio Link: Afternoons: Wee Sing Around the World</p>","","https://planning.alveary.org/links.html?id=recH6yJs8s683UEjb&term=2&week=18","Lesson","0","FALSE"
"alveary-recH6yJs8s683UEjb","alveary-rechnOSYXLl16Tmvu","19","1","10m Sol-fa: Musical Games - Lesson 19","<p>Singing and Imitating</p><p>➜ SING<br>Today we're going to start learning a song called “Over in the Meadow.” Imitate each of the animals that the singer describes. Listen to the song again and sing along where you can.<br>∞ Audio Link: Over in the Meadow</p><p>➜ DISCUSS<br>Do you think there should be more animals in the meadow? What would they be?</p><p>• AFTERNOON LISTENING<br>Songs from the lesson and “Wee Sing Songs.&quot;<br>∞ Audio Link: Afternoons: Wee Sing Children's Songs &amp; Fingerplays<br>∞ Audio Link: Afternoons: Wee Sing Around the World</p>","","https://planning.alveary.org/links.html?id=recH6yJs8s683UEjb&term=2&week=19","Lesson","0","FALSE"
"alveary-recH6yJs8s683UEjb","alveary-recXJt5GmniC3cfgC","20","1","10m Sol-fa: Musical Games - Lesson 20","<p>“Over in the Meadow” (cont.)</p><p>➜ RECAP<br>Hum/sing as much of “Over in the Meadow” as you can.</p><p>➜ LISTEN &amp; PRACTICE<br>Listen to and practice the song and imitate the animals; try to remember them all and sing by yourself.<br>∞ Audio Link: Over in the Meadow</p><p>• AFTERNOON LISTENING<br>Songs from the lesson and “Wee Sing Songs.&quot;<br>∞ Audio Link: Afternoons: Wee Sing Children's Songs &amp; Fingerplays<br>∞ Audio Link: Afternoons: Wee Sing Around the World</p>","","https://planning.alveary.org/links.html?id=recH6yJs8s683UEjb&term=2&week=20","Lesson","0","FALSE"
"alveary-recH6yJs8s683UEjb","alveary-recsncOrYxDWSt9me","21","1","10m Sol-fa: Musical Games - Lesson 21","<p>“Hokey Pokey” Dance</p><p>➜ RECAP<br>Review right and left hands, elbows, etc., with students.</p><p>➜ NOTE<br>Make a circle (large enough for all students to have plenty of room; an arm's length is a good rule).</p><p>➜ DANCE<br>Follow the directions in the song and put arms, legs, etc., in and out of the circle. When the song says “do the hokey pokey,” students turn around in a circle and clap their hands. Dance with students to demonstrate.<br>∞ Audio Link: Hokey Pokey</p><p>• AFTERNOON LISTENING<br>Songs from the lesson and “Wee Sing Songs.&quot;<br>∞ Audio Link: Afternoons: Wee Sing Children's Songs &amp; Fingerplays<br>∞ Audio Link: Afternoons: Wee Sing Around the World</p>","","https://planning.alveary.org/links.html?id=recH6yJs8s683UEjb&term=2&week=21","Lesson","0","FALSE"
"alveary-recH6yJs8s683UEjb","alveary-recNCdWLf3e8158kL","22","1","10m Sol-fa: Musical Games - Lesson 22","<p>“Hokey Pokey” Dance (cont.)</p><p>➜ RECAP<br>Do you remember the “Hokey Pokey”? Take a few minutes to do the dance.</p><p>➜ NOTE<br>Make a circle (large enough for all students).<br>∞ Audio Link: Hokey Pokey</p><p>➜ SING<br>Start learning a new song. First listen, then echo the singer.<br>∞ Audio Link: Bill Grogan's Goat</p><p>• AFTERNOON LISTENING<br>Songs from the lesson and “Wee Sing Songs.&quot;<br>∞ Audio Link: Afternoons: Wee Sing Children's Songs &amp; Fingerplays<br>∞ Audio Link: Afternoons: Wee Sing Around the World</p>","","https://planning.alveary.org/links.html?id=recH6yJs8s683UEjb&term=2&week=22","Lesson","0","FALSE"
"alveary-recH6yJs8s683UEjb","alveary-recBt47uXtVraz4rk","23","1","10m Sol-fa: Musical Games - Lesson 23","<p>Sing-Along Song</p><p>➜ SING<br>Hum &quot;Bill Grogan's Goat.&quot; Then listen and sing along.<br>∞ Audio Link: Bill Grogan's Goat</p><p>• AFTERNOON LISTENING<br>Songs from the lesson and “Wee Sing Songs.&quot;<br>∞ Audio Link: Afternoons: Wee Sing Children's Songs &amp; Fingerplays<br>∞ Audio Link: Afternoons: Wee Sing Around the World</p>","","https://planning.alveary.org/links.html?id=recH6yJs8s683UEjb&term=2&week=23","Lesson","0","FALSE"
"alveary-recH6yJs8s683UEjb","alveary-recH01NXPEp0HqD3b","24","1","10m Sol-fa: Musical Games - Lesson 24","<p>Exam Week</p><p>➜ EXAMS<br>Answer question(s) related to course.</p><p>Questions will come from: Musical Games Coursework</p><p>➜ NOTE<br>Exams are optional for this course as the focus is on enjoyment and fun.</p>","<p>★ Sol-fa: Musical Games — TERM 2 EXAM QUESTIONS<br>· Sing a favorite song, do a favorite activity/dance, or draw/paint a favorite piece.</p>","","Exam","0","FALSE"
"alveary-recH6yJs8s683UEjb","alveary-recxIVqT1VH98xOlx","25","1","10m Sol-fa: Musical Games - Lesson 25","<p>Marching Part 2<br>⍞ Materials: Item to balance on head while marching</p><p>➜ LISTEN &amp; PRACTICE<br>As you listen to these marches, lift your knees high like a soldier marching, shoulders back, chest out. <br>∞ Audio Link: Washington Post March</p><p>➜ VIEW<br>View soldiers marching. Try swinging your arms while marching and balancing something on your head. If the item keeps falling, students might use a hand to help or try a small, soft item.<br>∞ Video Link: Soldiers Marching</p><p>• AFTERNOON LISTENING<br>Songs from the lesson and the &quot;Hole in the Bucket&quot; and &quot;Had a Little Rooster&quot; playlists.<br>∞ Audio Link: Afternoons: Had a Little Rooster<br>∞ Audio Link: Afternoons: There's a Hole in the Bucket</p>","","https://planning.alveary.org/links.html?id=recH6yJs8s683UEjb&term=3&week=25","Lesson","0","FALSE"
"alveary-recH6yJs8s683UEjb","alveary-recqNGd7EsoQhyrRN","26","1","10m Sol-fa: Musical Games - Lesson 26","<p>Animal Guessing Game</p><p>➜ PRACTICE<br>Imitate different animals and have the students guess which animal you are imitating. Then allow students to act out their own versions of animals for you to guess. <br>Suggestions: strut like a turkey, hop like a rabbit, etc.</p><p>• AFTERNOON LISTENING<br>Songs from the lesson and the &quot;Hole in the Bucket&quot; and &quot;Had a Little Rooster&quot; playlists.<br>∞ Audio Link: Afternoons: Had a Little Rooster<br>∞ Audio Link: Afternoons: There's a Hole in the Bucket</p>","","https://planning.alveary.org/links.html?id=recH6yJs8s683UEjb&term=3&week=26","Lesson","0","FALSE"
"alveary-recH6yJs8s683UEjb","alveary-recCLEydILItcUMuy","27","1","10m Sol-fa: Musical Games - Lesson 27","<p>An Echoing Song</p><p>➜ SING<br>After the singer sings a line, sing it with the children in the recording. Listen several times to catch the words and melody.<br>∞ Audio Link: Purple Light<br>(Note: This song is on Spotify. You will need a free account to listen to it.)</p><p>• AFTERNOON LISTENING<br>Songs from the lesson and the &quot;Hole in the Bucket&quot; and &quot;Had a Little Rooster&quot; playlists.<br>∞ Audio Link: Afternoons: Had a Little Rooster<br>∞ Audio Link: Afternoons: There's a Hole in the Bucket</p>","","https://planning.alveary.org/links.html?id=recH6yJs8s683UEjb&term=3&week=27","Lesson","0","FALSE"
"alveary-recH6yJs8s683UEjb","alveary-recillfhM93WmmOoa","28","1","10m Sol-fa: Musical Games - Lesson 28","<p>Tongue Twisters</p><p>PREP: Select a few tongue twisters to teach your students.<br>∞ Link: Tongue Twisters</p><p>➜ DISCUSS<br>Explain what a tongue twister is, and then teach your students a few short ones. Speak slowly and clearly. Some students may benefit from repeating line by line; others may benefit from accentuating the rhythm with a 'sing-song' voice.</p><p>• AFTERNOON LISTENING<br>Songs from the lesson and the &quot;Hole in the Bucket&quot; and &quot;Had a Little Rooster&quot; playlists.<br>∞ Audio Link: Afternoons: Had a Little Rooster<br>∞ Audio Link: Afternoons: There's a Hole in the Bucket</p>","","https://planning.alveary.org/links.html?id=recH6yJs8s683UEjb&term=3&week=28","Lesson","0","FALSE"
"alveary-recH6yJs8s683UEjb","alveary-recRFM8weAfzTBX2j","29","1","10m Sol-fa: Musical Games - Lesson 29","<p>Moving to ¾ Time</p><p>➜ LISTEN &amp; PRACTICE<br>Listen to some of this collection of tunes. Every time the song changes, use a different movement. <br>∞ Audio Link: Waltz Music</p><p>➜ NOTE<br>Teachers should initially direct movements, then let students choose their own after a few tunes. Suggestions: swing arms back and forth, twirl around, pretend to be a conductor, march, tiptoe, etc. Encourage students to listen closely to music and try to make their movements “match” it.</p><p>• AFTERNOON LISTENING<br>Songs from the lesson and the &quot;Hole in the Bucket&quot; and &quot;Had a Little Rooster&quot; playlists.<br>∞ Audio Link: Afternoons: Had a Little Rooster<br>∞ Audio Link: Afternoons: There's a Hole in the Bucket</p>","","https://planning.alveary.org/links.html?id=recH6yJs8s683UEjb&term=3&week=29","Lesson","0","FALSE"
"alveary-recH6yJs8s683UEjb","alveary-rec1f2PfZVDP5goFT","30","1","10m Sol-fa: Musical Games - Lesson 30","<p>Fingerplay</p><p>➜ PRACTICE<br>We're going to learn a fingerplay called “The Eensy Weensy Spider” today. You may have heard the song before, but did you know that you can use your fingers to act it out?<br>∞ Video Link: Eensy Weensy Spider Fingerplay</p><p>• AFTERNOON LISTENING<br>Songs from the lesson and the &quot;Hole in the Bucket&quot; and &quot;Had a Little Rooster&quot; playlists.<br>∞ Audio Link: Afternoons: Had a Little Rooster<br>∞ Audio Link: Afternoons: There's a Hole in the Bucket</p>","","https://planning.alveary.org/links.html?id=recH6yJs8s683UEjb&term=3&week=30","Lesson","0","FALSE"
"alveary-recH6yJs8s683UEjb","alveary-reckGnl7GijpBLKZQ","31","1","10m Sol-fa: Musical Games - Lesson 31","<p>Spelling and Clapping</p><p>➜ SING<br>We're going to start learning a spelling-and-clapping song today. With each verse, the singer is going to drop a letter of BINGO, the dog’s name in the song. You need to clap or stomp your feet instead of singing the letter. By the end of the song, you'll be doing a lot of stomping and clapping. Listen to the song first, so you get an idea of how it goes.<br>∞ Video Link: BINGO with Lyrics</p><p>• AFTERNOON LISTENING<br>Songs from the lesson and the &quot;Hole in the Bucket&quot; and &quot;Had a Little Rooster&quot; playlists.<br>∞ Audio Link: Afternoons: Had a Little Rooster<br>∞ Audio Link: Afternoons: There's a Hole in the Bucket</p>","","https://planning.alveary.org/links.html?id=recH6yJs8s683UEjb&term=3&week=31","Lesson","0","FALSE"
"alveary-recH6yJs8s683UEjb","alveary-recXJeppB53JFhWed","32","1","10m Sol-fa: Musical Games - Lesson 32","<p>“BINGO” (cont.)</p><p>➜ RECAP<br>Can you sing BINGO from memory?</p><p>➜ SING<br>See if you can sing the song with the video and correctly stomp or clap every dropped letter.<br>∞ Video Link: BINGO with Lyrics</p><p>• AFTERNOON LISTENING<br>Songs from the lesson and the &quot;Hole in the Bucket&quot; and &quot;Had a Little Rooster&quot; playlists.<br>∞ Audio Link: Afternoons: Had a Little Rooster<br>∞ Audio Link: Afternoons: There's a Hole in the Bucket</p>","","https://planning.alveary.org/links.html?id=recH6yJs8s683UEjb&term=3&week=32","Lesson","0","FALSE"
"alveary-recH6yJs8s683UEjb","alveary-recgLiDJ7AG0JCeXx","33","1","10m Sol-fa: Musical Games - Lesson 33","<p>Basic Waltz Step</p><p>PREP: Use Waltz Step Instructions (see Appendix) to learn and teach the waltz step.</p><p>➜ NOTE<br>If you do this as a group activity in couples, couples should step sideways rather than forward. (The couple should move together, which means one of them will be moving with the opposite foot.)</p><p>➜ PRACTICE<br>Today, we're going to learn a waltz step.<br>∞ Audio Link: Moon River with Orchestra</p><p>• AFTERNOON LISTENING<br>Songs from the lesson and the &quot;Hole in the Bucket&quot; and &quot;Had a Little Rooster&quot; playlists.<br>∞ Audio Link: Afternoons: Had a Little Rooster<br>∞ Audio Link: Afternoons: There's a Hole in the Bucket</p>","","https://planning.alveary.org/links.html?id=recH6yJs8s683UEjb&term=3&week=33","Lesson","0","FALSE"
