"course_custom_id","assignment_custom_id","assignment_week","assignment_day","assignment_name","assignment_description","assignment_teachersNote","assignment_linksUrl","assignment_type","assignment_duration","assignment_graded"
"alveary-rec9lkHl3pKY5QBnE","alveary-recFfms2QrJjn3b4S","1","1","20m Geography: Grade 3 (U.S.) - Lesson 1","<p>Introduction<br>⍞ Materials: Cross-Country, U.S. Atlas</p><p>➜ INTRO <br>What do you remember from last year’s readings? (You can read the titles of sections or show a few illustrations from last year’s readings to help.) Let’s look at the map in the front of the Cross-Country book. What do you notice? Do you see the red line? Remember that this book is about a family that travels along that line (route) across the United States.</p><p>➜ MAP QUESTIONS<br>⍞ Map Resource: Inside front of Cross-Country<br>1\. Locate Los Angeles. Put your finger on it, and then trace with your finger the red line across the United States to Washington, D.C.<br>2\. Locate Denver, Colorado. Our journey will start just east of Denver, but let’s find out a little bit about the area before we read.</p><p>⍞ Map Resource: United States Atlas “The West: The Region” and “The West: Physical Map” p.126-127, 128<br>1\. First, locate Colorado on the Physical Map, and then find the outline of Colorado on the Region map.<br>2\. What do you notice about the terrain in the middle of Colorado? (Hopefully, you notice that the mountains end suddenly. You could start on the west coast and run your finger eastward to mid-Colorado, asking what changes there.)<br>3\. On the Physical Map, try to find a label for the region in eastern Colorado that extends from Montana to Texas. (Great Plains)</p><p>⍞ Map Resource: United States Atlas “The Physical United States: Climate” p.10-11<br>1\. Locate Colorado.<br>2\. Using the map legend, what can you tell about the climate in Colorado?<br>3\. How does it change from the western side to the eastern side of the state? (Cooler and wetter toward the west. The eastern part is more dry.)</p>","","","Lesson","0","FALSE"
"alveary-rec9lkHl3pKY5QBnE","alveary-recvNj0bZXERGQU37","1","2","20m Geography: Grade 3 (U.S.) - Lesson 2","<p>The Great Plains<br>⍞ Materials: Cross-Country, U.S. Atlas, My U.S. Map</p><p>PREP: Print Map: “My U.S. Map” (blank U.S. map) or use the one you made last year.<br>∞ Map Link: blank U.S. Map</p><p>➜ INTRO<br>Have you ever read Little House on the Prairie? What do you think the prairie looks like? (If needed, have students study the picture on p.61 of Cross-Country and discuss what they see.)</p><p>➜ MAP QUESTIONS<br>⍞ Map Resource: United States Atlas “The Physical United States: Physical Map” p.8-9<br>1\. Locate Colorado.<br>2\. Look at the map legend to identify the vegetation in eastern Colorado. <br>3\. What do you think grassland will look like?<br>4\. Locate your home state and your general location. (You may look at p.14-15 if needed to help find your state.)<br>5\. How does the vegetation of your home compare with that of eastern Colorado?</p><p>➜ READ, NARRATE, &amp; DISCUSS<br>Cross-Country<br>p.62-63 “Mother and Father” - “made the cattle fat.”</p><p>➜ MAP WORK<br>⍞ Map Resource: My U.S. Map<br>1\. Add the Blank US Map to your geography journal if not in there from last year.<br>2\. Add the title &quot;My US Map&quot; (making sure the title does not cover any states).<br>3\.  Label Colorado if not already labeled from last year.<br>4\.  Draw a cow in the eastern half of the state.</p><p>• TAKE A GEOGRAPHY WALK<br>Look for the vegetation found during Map Questions from today’s lesson.</p>","","https://planning.alveary.org/links.html?id=rec9lkHl3pKY5QBnE&term=1&week=1","Lesson","0","FALSE"
"alveary-rec9lkHl3pKY5QBnE","alveary-recvEKhpmpvbntwxv","2","1","20m Geography: Grade 3 (U.S.) - Lesson 3","<p>The Great Plains (cont.)<br>⍞ Materials: Cross-Country, U.S. Atlas, My U.S. Map</p><p>➜ INTRO<br>We read yesterday that the Pages drove on straight roads. Why do you think the roads were straight? (flat land) Do you remember what the roads were like in the mountains? (“winding” and “ran up and down” on p.42 of Cross-Country)</p><p>➜ MAP QUESTIONS<br>⍞ Map Resource: United States Atlas “The Physical United States: Physical Map” p.8-9<br>1\. Locate the Great Plains.<br>2\. Through which states does it run? (Montana, North Dakota, South Dakota, Wyoming, Nebraska, Colorado, Kansas, Oklahoma, Texas, and New Mexico)</p><p>➜ READ, NARRATE, &amp; DISCUSS<br>Cross-Country <br>p.64 “In a little town” - “very much alike.”</p><p>➜ MAP WORK<br>⍞ Map Resource: My U.S. Map<br>Similar to the Rocky Mountains label from last year, label the Great Plains so that the label slants across the map to mimic the plains stretching across multiple states. Be careful not to cover up Kansas, since that is the next stop for the Pages.</p>","","","Lesson","0","FALSE"
"alveary-rec9lkHl3pKY5QBnE","alveary-recNI7UphYHZJON6T","2","2","20m Geography: Grade 3 (U.S.) - Lesson 4","<p>Reading Maps<br>⍞ Materials: Student World Atlas, Cross-Country</p><p>➜ NOTE<br>The information in this lesson is a refresher from last year.</p><p>➜ MAP QUESTIONS<br>⍞ Map Resource: Student World Atlas “United States: Political” p.65<br>Based on the global grid, which direction is north on this map?</p><p>⍞ Map Resource: Inside front of Cross-Country<br>1\. What is to the west of Los Angeles? (Pacific Ocean)<br>2\. Which ocean is near Washington, D.C.? (Atlantic Ocean)<br>3\. Is the Atlantic Ocean to the east or west of Washington, D.C.? (east)<br>4\. If we travel from Los Angeles to Washington, D.C., which direction would you travel? (east)<br>5\. Where do you live? Which direction would you travel to get to Los Angeles? To get to Washington, D.C.? To get to Denver, Colorado?<br>6\. Come up with your own questions to give more practice on directions.</p><p>➜ READ, NARRATE, &amp; DISCUSS<br>Student World Atlas p.8<br>Direction and Scale</p>","","","Lesson","0","FALSE"
"alveary-rec9lkHl3pKY5QBnE","alveary-rec6WdMjD8kh8SYDA","3","1","20m Geography: Grade 3 (U.S.) - Lesson 5","<p>Grids and Maps<br>⍞ Materials: local map, Student World Atlas</p><p>PREP: Today you will need a map of your local area (or a state map, if the city cannot be found). If no options exist, print a map from a web mapping service (like Google Maps or OpenStreetMap) and draw your own grid.</p><p>➜ INTRO<br>Do you remember that globes and maps also have a grid?</p><p>➜ READ, NARRATE, &amp; DISCUSS<br>Student World Atlas p.8<br>“Reading Maps” and all captions—Latitude, Longitude, and Global Grid</p><p>➜ MAP QUESTIONS<br>⍞ Map Resource: Your local map<br>1\. Spend some time calling out grid cells; for example, “Locate G4.”<br>2\. When this is mastered, move on to specific places with the following types of questions.<br>3\. What grid cell is your home in?<br>4\. Where is your church, grocery store, bank, park, etc.? What grid cell is that in?</p><p>➜ NOTE<br>Save your map for later lessons.</p>","","","Lesson","0","FALSE"
"alveary-rec9lkHl3pKY5QBnE","alveary-recqXIoDuddYFpTZX","3","2","20m Geography: Grade 3 (U.S.) - Lesson 6","<p>Wheat Country<br>⍞ Materials: Cross-Country, My U.S. Map</p><p>➜ MAP QUESTIONS<br>∞ Map Link: Topography of the U.S. <br>1\. Familiarize yourself with the color ramp in the lower right corner.<br>2\. Locate Colorado and Kansas.<br>3\. What do you notice about elevation as you travel east across Colorado and Kansas? (elevation decreases)<br>4\. What do you think Kansas will look like?</p><p>➜ READ, NARRATE, &amp; DISCUSS<br>p.65-66 “Flat land” - “‘what threshing means.’”</p><p>➜ MAP WORK<br>⍞ Map Resource: My U.S. Map<br>Label Kansas.</p>","","https://planning.alveary.org/links.html?id=rec9lkHl3pKY5QBnE&term=1&week=3","Lesson","0","FALSE"
"alveary-rec9lkHl3pKY5QBnE","alveary-recW1aVHy1gfg7a61","4","1","20m Geography: Grade 3 (U.S.) - Lesson 7","<p>Kansas<br>⍞ Materials: Cross-Country, U.S. Atlas</p><p>➜ INTRO<br>Have you ever held raw wheat in your hands?</p><p>➜ MAP QUESTIONS<br>⍞ Map Resource: United States Atlas “Kansas” p.94-95 (See 5th ed. PDF, if needed.)<br>∞ PDF Link: 5th edition PDF<br>1\. Find the wheat symbol in the map key. See how many wheat symbols you can find in Kansas.<br>2\. Are the wheat symbols mainly found in certain areas of the state? (No, they are found throughout.)<br>3\. What does this tell you about Kansas? (Wheat grows really well there.)</p><p>⍞ Map Resource: United States Atlas “The Political United States: Political Map” p.14-15<br>1\. How would you describe the shape of the Kansas state borders? (straight)<br>2\. How would you describe the state borders for the previous two states, Colorado and Utah? (straight as well)<br>3\. What do you notice about the southern border of these three (3) states? (It’s the same line.)<br>4\. The southern border follows the 37° N latitude line. Why do you think the southern borders of Kansas, Colorado, and Utah follow the same line of latitude? (Simple answers could include that the states were broken out of the same territory, that a single easy-to-find line made it easy to chop up large territories, that the line was used as a compromise between neighboring territories, or that the line already served as the extent for something to the south. All of these assumptions would be correct.)</p><p>➜ READ, NARRATE, &amp; DISCUSS<br>Cross-Country<br>p.67 “Father got out” - “said Father.”</p><p>➜ VIEW<br>∞ Video Link: Wheat Threshing and Winnowing by Hand</p>","","https://planning.alveary.org/links.html?id=rec9lkHl3pKY5QBnE&term=1&week=4","Lesson","0","FALSE"
"alveary-rec9lkHl3pKY5QBnE","alveary-recC1ia04Llvt1W8o","4","2","20m Geography: Grade 3 (U.S.) - Lesson 8","<p>Dust Storm<br>⍞ Materials: Cross-Country, My U.S. Map, 50 Adventures in 50 States</p><p>➜ INTRO<br>What kind of storms have you seen? (Answers will vary: rain, hail, lightning, snow, etc.) Is there a difference between good storms and bad storms? (Students might find snow fun, for example, but too much can present a problem.)</p><p>➜ READ, NARRATE, &amp; DISCUSS<br>p.68-70 “If the Pages” - “shake the car.”</p><p>➜ MAP WORK<br>⍞ Map Resource: My U.S. Map<br>Add a symbol for wheat somewhere in (or near) Kansas.</p><p>➜ VIEW<br>Take a few minutes to look at the Kansas spread on p.36-37 of 50 Adventures in 50 States to see a tallgrass prairie. <br>Also, take a look at the illustration showing how deep natural prairie grasses grow in Kansas.<br>∞ Image Link: Root Systems of Prairie Grass</p>","","https://planning.alveary.org/links.html?id=rec9lkHl3pKY5QBnE&term=1&week=4","Lesson","0","FALSE"
"alveary-rec9lkHl3pKY5QBnE","alveary-rec7JzWZjSzy1ZNsX","5","1","20m Geography: Grade 3 (U.S.) - Lesson 9","<p>Dust Storm (cont.)<br>⍞ Materials: Cross-Country, U.S. Atlas</p><p>➜ MAP QUESTIONS<br>⍞ Map Resource: United States Atlas “The Physical United States: Natural Hazards” p.12-13<br>∞ Map Link: Annual Rainfall Map<br>1\. What do you see in Kansas? (tornadoes and droughts, average annual rainfall around the median for the U.S.)<br>2\. Do you think this area tends to be dry? Windy? Stormy?</p><p>➜ READ, NARRATE, &amp; DISCUSS<br>Cross-Country <br>p.70-71 “Then there was a new sound” - “shaking his head.”</p><p>➜ VIEW<br>Picture of a Dust Storm in Kansas in 2004. <br>∞ Image Link: Dust Storm</p>","","https://planning.alveary.org/links.html?id=rec9lkHl3pKY5QBnE&term=1&week=5","Lesson","0","FALSE"
"alveary-rec9lkHl3pKY5QBnE","alveary-recxs22jN2QtW1fkU","5","2","20m Geography: Grade 3 (U.S.) - Lesson 10","<p>Contour Map<br>⍞ Materials: Clay or homemade dough (See Geography Models in the Appendix for link to make dough and recommendation for clay), dental floss</p><p>PREP: Read about how to Create a Contour Map on Education.com. Prepare to narrate during Model section.<br>∞ Link: Create a Contour Map</p><p>➜ INTRO<br>We are going to do a lesson in topography today. What do you already know (if anything) about topography?</p><p>➜ MODEL<br>1\. Read the description of contour maps and narrate what else you have learned while referring to the two images of Half Dome from the website.<br>2\. How would you make a map of a mountain? Could you show how steep it is in different places? <br>3\. Using dough or clay, make your own mountain, being sure to make it with variable heights (peaks).</p><p>➜ MAP QUESTIONS<br>⍞ Map Resource: your contour map<br>Looking at your contour map, answer the following questions.<br>1\. What did you notice?<br>2\. What is the steepest area?<br>3\. How close are the lines in that area?<br>4\. Was there a certain area of the model that was difficult to work with?<br>5\. If so, what made that area difficult?</p><p>• TAKE A GEOGRAPHY WALK<br>Pay attention to topography on your walk, noticing elevation changes.</p>","","https://planning.alveary.org/links.html?id=rec9lkHl3pKY5QBnE&term=1&week=5","Lesson","0","FALSE"
"alveary-rec9lkHl3pKY5QBnE","alveary-reckJgORSrGYlRu5e","6","1","20m Geography: Grade 3 (U.S.) - Lesson 11","<p>Contour Map with Color<br>⍞ Materials: Clay or homemade dough (See Geography Models in the Appendix for link to make dough and recommendation for clay), paint, paintbrush, dental floss, ruler</p><p>➜ INTRO<br>We are going to do another lesson in topography today. This time, we will add color.</p><p>➜ MODEL<br>1\. Refer, if necessary, to the Create a Contour Map link.<br>∞ Link: Create a Contour Map<br>2\. Make a new mountain with multiple peaks.<br>3\. Use the same technique to separate the heights.<br>4\. Once your levels are separated, use paint or food coloring to color each layer a different color.  Make a key showing which heights are which colors.<br>5\. Replace the levels, and you can see which colors represent the highest and lowest points (elevations) of your mountain and valley model.<br>6\. Now you have created an elevation map, not just a topographic map.</p><p>➜ VIEW &amp; DISCUSS<br>Look at the linked Elevation Map of the United States. <br>∞ Map Link: Elevation Map<br>1\. What colors did they use for the lowest and highest elevations?<br>2\. Your model had heights divided every inch. How does that compare with this map?</p>","","https://planning.alveary.org/links.html?id=rec9lkHl3pKY5QBnE&term=1&week=6","Lesson","0","FALSE"
"alveary-rec9lkHl3pKY5QBnE","alveary-rec6HrzbP1btSIKj0","6","2","20m Geography: Grade 3 (U.S.) - Lesson 12","<p>Model of Colorado and Kansas<br>⍞ Materials: Materials for Model and Geography Models Resource found in the Appendix</p><p>➜ INTRO<br>Today, we will make a model of Colorado and Kansas, using elevation maps as a guide. We have a different elevation map to look at today.</p><p>➜ MAP QUESTIONS<br>∞ Map Link: Topography of the U.S.<br>1\. Zoom in to see Colorado and Kansas close up.<br>2\. What differences do you notice between the two states?<br>3\. Where are the mountains located? (Colorado, mostly in the middle of the state)<br>4\. Using the color ramp (key), what is the difference in height of eastern Kansas compared with western Colorado? (Depending on where you look, over 13,000 or 14,000 feet!)<br>5\. Where are the highest points? The lowest points? (The highest points are in the middle of Colorado, and the elevation decreases both to the east and west as you travel away from the mountains. The lowest points appear to be near the Kansas River/Kansas City area or southeastern Kansas.)</p><p>➜ MODEL <br>We are going to make a 3-dimensional map (model) of Colorado and Kansas together. You have two lessons to build it.<br>Follow instructions in the Appendix for making a basic model, using the Topography of the U.S. map as a guide.</p><p>➜ NOTE<br>Make it in the shape of the two states together, and use a tool to draw the boundary between Colorado and Kansas. Be mindful of the lowest areas by making them thinner, but don’t worry about adding the mountainous regions because that will be done in the next lesson.</p>","","https://planning.alveary.org/links.html?id=rec9lkHl3pKY5QBnE&term=1&week=6","Lesson","0","FALSE"
"alveary-rec9lkHl3pKY5QBnE","alveary-recUISUP2JNVxWzti","7","1","20m Geography: Grade 3 (U.S.) - Lesson 13","<p>Model of Colorado and Kansas (cont.)<br>⍞ Materials: Materials for Model and Geography Models in the Appendix</p><p>➜ NOTE<br>In case you are using additional maps not referenced in the lesson, note that the National Geodetic Survey adjusted the peak of Mt. Elbert 6.55 feet (to 14,440 feet) after adopting more accurate mapping methods.</p><p>➜ MAP QUESTIONS<br>∞ Map Link: Topography of the U.S.<br>1\. Locate the Rocky Mountains.<br>2\. Where is the highest ridge in the mountains? (Mt. Elbert. The linked topographic map lists the peak as 14,431 feet, but the atlas lists the peak as 14,433 feet. The elevation in meters is the same on both maps, so the discrepancy could be a rounding error.)<br>3\. How much of Colorado is covered by the Rocky Mountains? (half)</p><p>➜ MODEL<br>We are going to finish the 3-dimensional map (model) of Colorado and Kansas.<br>1\. Follow instructions for making a basic model, using the Topography of the U.S. map as a guide.<br>2\. Place a picture of your finished raised relief map in your geography journal as a memento.</p>","","https://planning.alveary.org/links.html?id=rec9lkHl3pKY5QBnE&term=1&week=7","Lesson","0","FALSE"
"alveary-rec9lkHl3pKY5QBnE","alveary-recEwMfgLy4k1GlRE","7","2","20m Geography: Grade 3 (U.S.) - Lesson 14","<p>Corn Country<br>⍞ Materials: Cross-Country, U.S. Atlas, My U.S. Map</p><p>➜ INTRO<br>Have you ever seen corn in a field? Do you know what it looks like before it gets to your grocery store?</p><p>➜ MAP QUESTIONS<br>∞ Map Link: Topography of the U.S.<br>1\. Look at the elevation differences between western Kansas and eastern Kansas and Missouri.<br>2\. What is the highest elevation? The lowest elevation? (The highest elevation is where the Great Plains meet Colorado in western Kansas. The lowest elevations are in eastern Missouri along the Mississippi River, in the southeastern corner downstream of the Ohio River confluence.)<br>3\. Does the low elevation stay constant? (The St. Francois Mountains, including Taum Sauk Mountain, interrupt the lower elevations lying west of the Mississippi River. Taum Sauk Mountain is labeled on “The Midwest: Physical Map” of United States Atlas p.84.)</p><p>⍞ Map Resource: United States Atlas “Missouri” p.101 (See 5th ed. PDF, if needed.)<br>∞ PDF Link: 5th edition PDF<br>1\. Can you find the corn symbol in the map key?<br>2\. Locate corn symbols in Missouri.<br>3\. How many did you find? What do you think this means?<br>4\. Did you notice an area of the map that has no corn symbols? (South Central Missouri) What stands out there? (National Forests and Ozark Plateau)</p><p>➜ READ, NARRATE, &amp; DISCUSS<br>Cross-Country<br>p.72-73 “The land seemed” - “‘ate him up.’”</p><p>➜ MAP WORK<br>⍞ Map Resource: My U.S. Map<br>Label Missouri and anything else you want (possibly a symbol for corn).</p>","","https://planning.alveary.org/links.html?id=rec9lkHl3pKY5QBnE&term=1&week=7","Lesson","0","FALSE"
"alveary-rec9lkHl3pKY5QBnE","alveary-reckaQ5bMvfBElj0i","8","1","20m Geography: Grade 3 (U.S.) - Lesson 15","<p>Thunderstorm<br>⍞ Materials: Cross-Country</p><p>➜ INTRO<br>Do you have thunderstorms where you live?</p><p>➜ MAP QUESTIONS<br>∞ Map Link: U.S. average Annual Rainfall Map<br>1\. Locate Missouri.<br>2\. Identify rainfall averages for Missouri.<br>3\. Compare rainfall averages in Missouri to those in California to those in your state. Which area gets the most rain? The least? (On average, Missouri receives more annual rainfall than California, except for some very high elevations in California.)</p><p>➜ READ, NARRATE, &amp; DISCUSS<br>p.74-75 “Back in Los Angeles” - “as big as Mr. Evans.”</p><p>➜ DISCUSS<br>The weather, landscape, and way of life in the plains of the central U.S. are different from what the Pages were accustomed to in Los Angeles.<br>1\. How were the dust storms and thunderstorms the same? How were they different?<br>2\. Why did Mr. Page have trouble opening a gate, whereas Joe Evans seemed to open it with ease?<br>3\. How are Mr. Evans’s clothes different from Mr. Page’s clothes? Why are they different? Why had Ruth never seen Father wear overalls?</p><p>➜ VIEW<br>Here is a cumulonimbus diagram showing how (thunderstorm) clouds form.<br>∞ Link: Cumulonimbus Diagram</p>","","https://planning.alveary.org/links.html?id=rec9lkHl3pKY5QBnE&term=1&week=8","Lesson","0","FALSE"
"alveary-rec9lkHl3pKY5QBnE","alveary-recIXFKjwVLF4T58P","8","2","20m Geography: Grade 3 (U.S.) - Lesson 16","<p>Farm Life<br>⍞ Materials: Cross-Country, U.S. Atlas</p><p>➜ INTRO<br>What comes to mind when I say farm? Today, we read about Tom and Ruth having fun on the farm. What would you expect children to do to have fun on a farm? Are these the same things children in the city can do for fun?</p><p>➜ MAP QUESTIONS<br>⍞ Map Resource: United States Atlas “Missouri” p.101 (See 5th ed. PDF, if needed.)<br>∞ PDF Link: 5th edition PDF<br>1\. Locate the map key. What are the animal economy symbols? (poultry, sheep, hogs, dairy cows, and beef cattle)<br>2\. Which animals do you find most on the map? (hogs and beef cattle)</p><p>➜ READ, NARRATE, &amp; DISCUSS<br>Cross-Country<br>p.76-77 “Mr. and Mrs. Evans” - “but I rode it!’”</p>","","https://planning.alveary.org/links.html?id=rec9lkHl3pKY5QBnE&term=1&week=8","Lesson","0","FALSE"
"alveary-rec9lkHl3pKY5QBnE","alveary-recMfLqOpngtBhZas","9","1","20m Geography: Grade 3 (U.S.) - Lesson 17","<p>Local Stream<br>⍞ Materials: Two pieces of cork or some other floating object, a timer that can time by the second, a map that includes the waterway you visit</p><p>PREP: Choose a local stream/creek/river to visit for the focus of this lesson. Briefly familiarize yourself with the Streamer app and the Trace Downstream and Trace Upstream buttons. During term 3, there are more lessons on rivers, but this will be an introduction.<br>For the afternoon occupation, you will need the materials listed above.</p><p>➜ MAP QUESTIONS<br>⍞ Map Resource: Find the creek or river you will be visiting (during the afternoon occupation) on the Streamer web mapping application.<br>∞ Link: Streamer<br>1\. Locate where you will visit the waterway on the map.<br>2\. Using the map, follow the waterway upstream to its source/head. How far away is it? Is it close enough to visit?<br>3\. Using the map, follow the waterway to its mouth. How far away is it? Is it close enough to visit?<br>4\. Which direction does the waterway flow where you visited? Which general direction does it flow? What large body of water does it empty into?</p><p>➜ MAP WORK<br>⍞ Map Resource: Blank map of county or state<br>1\. Draw the waterway you want to visit on your blank map. You may not be able to draw the head and mouth on this map, but draw what part of it is in your county or state. <br>2\. Indicate the flow of the water with arrows.<br>3\. Label the name(s) of the waterway. (The name may change as it joins other watercourses.)</p><p>➜ VIEW<br>Take a few minutes to look at the Missouri spread on p.54-55 of 50 Adventures in 50 States to see what happens to water underground.</p><p>• TAKE A GEOGRAPHY WALK<br>Go for a walk near a creek or river.<br>Try to find two spots on the creek/river where the water seems to move at different speeds. At each one, measure a distance of, say, 12 feet, and time how long it takes for a piece of cork or some other floating object to go the full 12 feet. Compare the speeds; were they different? If so, why?</p><p>Record your findings in your Geography Journal.</p>","","https://planning.alveary.org/links.html?id=rec9lkHl3pKY5QBnE&term=1&week=9","Lesson","0","FALSE"
"alveary-rec9lkHl3pKY5QBnE","alveary-recDAAwdAWue3hL2H","9","2","20m Geography: Grade 3 (U.S.) - Lesson 18","<p>Farm vs. City<br>⍞ Materials: Cross-Country, US Atlas</p><p>➜ INTRO<br>What do you think the differences are between life on a farm and in the city? Would you like to live on a farm or in the city? Why?</p><p>➜ MAP QUESTIONS<br>⍞ Map Resource: United States Atlas “Missouri” p.101 (See 5th ed. PDF, if needed.)<br>∞ PDF Link: 5th edition PDF<br>1\. What symbols are in the areas between towns? (You will likely notice livestock or crop symbols.)<br>2\. What symbols are near Kansas City and St. Louis (western and eastern ends of Interstate 70)? (technology, science, manufacturing, etc.) How are they different from the ones in the areas outside of big cities? Are there any in the big cities that are not found elsewhere? (Computers/electronics? Finance/insurance?)</p><p>➜ READ, NARRATE, &amp; DISCUSS<br>p.78-81  “Ruth's clothes&quot; - “'five years old!'”</p><p>- You will need to go to the grocery store with your student and find produce with labels showing where they were grown. Read the next lesson for more clarity.</p>","<p>★ TEACHER TIP<br>PREP for next lesson.</p>","https://planning.alveary.org/links.html?id=rec9lkHl3pKY5QBnE&term=1&week=9","Lesson","0","FALSE"
