"course_custom_id","assignment_custom_id","assignment_week","assignment_day","assignment_name","assignment_description","assignment_teachersNote","assignment_linksUrl","assignment_type","assignment_duration","assignment_graded"
"alveary-recnKzHCs6UvKzvtd","alveary-recqLIRsxt0nBcn3C","1","1","30m Shakespeare: Grades 5-8 - Lesson 1","<p>⍞ Materials: The Tempest</p><p>PREP: Read an overview of the play (one synopsis is located at the beginning of the Folger edition of the play). If you are not familiar with the play, you will want to read other retellings. We highly suggest Stories from Shakespeare by Marchette Chute. Resources are listed on the Extra Helpings Page. Also, be sure to read the note about mature content and language in Shakespeare in the Planning and Prep section.</p><p>➜ INTRO <br>The Tempest is not a traditional tragedy or comedy. It is often called a Tragicomedy because it has both comedic and tragic elements. Overall, the play has a happy ending which places it in the comedic category. The name of the play 'tempest,' means &quot;a violent storm.&quot; At the beginning, there is a violent storm which destroys a ship. Take time to review the elements of tragedy and comedy in the Genres link.<br>∞ Link: Genres of Shakespeare</p><p>➜ RATIONALE<br>This is a romantic comedy about an overthrown Duke and his daughter who are exiled on an island. The play addresses the themes of power, betrayal, magic, slavery, and the restoration of relationships.</p><p>➜ READ, NARRATE, &amp; DISCUSS<br>Act 1 Scene 1-2 p.7-25 &quot;Boatswain!&quot; - &quot;Approach, my Ariel. Come.&quot;</p><p>• How do each of the characters respond to the storm? What is the tone of this scene?</p><p>We recommend reading the summaries of each scene to briefly preview content.<br>Movie Recommendations: The Tempest (2010) PG-13</p><p>∞ Link: Course Hero Series (Each Scene Explained)<br>∞ Link: Genres of Shakespeare: See Tragedy &amp; Comedy</p>","<p>★ TEACHER TIP<br>Take turns reading the play aloud if using these lessons in a group.</p>","https://planning.alveary.org/links.html?id=recnKzHCs6UvKzvtd&term=1&week=1","Lesson","0","FALSE"
"alveary-recnKzHCs6UvKzvtd","alveary-recC3d5JILRYQWphZ","2","1","30m Shakespeare: Grades 5-8 - Lesson 2","<p>⍞ Materials: The Tempest</p><p>➜ RECAP<br>Recall: how did Prospero and Miranda come to be on the island?</p><p>➜ INTRO <br>The Tempest explores the theme of power, and we see this in Prospero's relationships. Watch a portion of Act 1, Scene 2, to learn more about Prospero's relationship to Ariel.<br>∞ Video Link: Act 1, Scene 2</p><p>➜ READ, NARRATE, &amp; DISCUSS<br>Act 1 Scene 2 p.25-39 &quot;All hail, great master!&quot; - &quot;So, slave, hence.&quot;</p><p>• How would you describe Prospero's relationship between Caliban and Ariel?</p><p>• EXTRA HELPING<br>Work with the students to finish quotes 1-2 on the character quote assignment.<br>∞ Link: Character Quotes</p>","","https://planning.alveary.org/links.html?id=recnKzHCs6UvKzvtd&term=1&week=2","Lesson","0","FALSE"
"alveary-recnKzHCs6UvKzvtd","alveary-recKYEfPI04RkiF9u","3","1","30m Shakespeare: Grades 5-8 - Lesson 3","<p>⍞ Materials: The Tempest</p><p>➜ RECAP<br>Think back on what you learn about Ariel and Caliban through Prospero's conversations with and about them. What is your opinion of Prospero at this point?</p><p>➜ READ, NARRATE, &amp; DISCUSS<br>Act 1 Scene 2 p.41-49 &quot;Come unto these&quot; - &quot;Speak not for him.&quot;</p><p>• What does Ferdinand think of Miranda? How do you think this relationship will develop or change?</p><p>• EXTRA HELPING<br>Work with the students to finish quotes 3-4 on the character quote assignment. <br>∞ Link: Character Quotes</p>","","https://planning.alveary.org/links.html?id=recnKzHCs6UvKzvtd&term=1&week=3","Lesson","0","FALSE"
"alveary-recnKzHCs6UvKzvtd","alveary-recX83WCmPdoKBEj1","4","1","30m Shakespeare: Grades 5-8 - Lesson 4","<p>⍞ Materials: The Tempest</p><p>➜ INTRO <br>The setting of The Tempest is unique. The play takes place on a remote island (meaning no one lives there) with the exception of Caliban and Ariel. This island is in the Mediterranean Sea. However, there are two important Italian Kingdoms mentioned-- Naples and Milan. Prospero and Miranda as well as the characters who crashed on the Island are from these kingdoms. Let's review the map and the character list to learn about where the characters are from.<br>∞ Map Link: Mediterranean Sea<br>∞ Link: Tempest and Kingdoms</p><p>➜ RECAP<br>• Why did Prospero create the storm and bring the ship to the island?</p><p>➜ READ, NARRATE, &amp; DISCUSS<br>Act 2 Scene 1 p.53-65 &quot;Beseech you, sir&quot; - &quot;Go sleep, and hear us.&quot;</p><p>• What does this scene show about the characters of Antonio and Sebastian? How does it compare to Alonso’s behavior?</p>","","https://planning.alveary.org/links.html?id=recnKzHCs6UvKzvtd&term=1&week=4","Lesson","0","FALSE"
"alveary-recnKzHCs6UvKzvtd","alveary-recWZSIVeNiwTZrDP","5","1","30m Shakespeare: Grades 5-8 - Lesson 5","<p>⍞ Materials: The Tempest</p><p>➜ RECAP<br>Unfold the reason for King Alonso's having sailed from Tunis. What does he think of ever setting out for Tunis in the first place?</p><p>➜ READ, NARRATE, &amp; DISCUSS<br>Act 2 Scene 1 p.65-75 &quot;What, all soon&quot; - &quot;to seek thy son.&quot;</p><p>• How would you describe Alonso and Antonio's relationship?</p>","","","Lesson","0","FALSE"
"alveary-recnKzHCs6UvKzvtd","alveary-recQ7eh3IicvKnDlL","6","1","30m Shakespeare: Grades 5-8 - Lesson 6","<p>⍞ Materials: The Tempest</p><p>➜ RECAP<br>What does Antonio propose that Sebastian do? How is this proposal similar to Antonio's actions towards his brother, Prospero?</p><p>➜ READ, NARRATE, &amp; DISCUSS<br>Act 2 Scene 2 p.77-87 &quot;All the infections&quot; - &quot;Lead the way.&quot;</p><p>• What is loyalty? How does loyalty motivate characters?</p><p>• EXTRA HELPING<br>At this point, students should be noting that Caliban does not like his master, Prospero. In fact, Caliban has valid reasons to resent Prospero. In this activity, students will try to visualize Caliban's cave. Seeing from another characters' point of view helps students learn with their imagination.<br>∞ Link: Caliban Visual</p>","","https://planning.alveary.org/links.html?id=recnKzHCs6UvKzvtd&term=1&week=6","Lesson","0","FALSE"
"alveary-recnKzHCs6UvKzvtd","alveary-recHloOJsFHpQxHu3","7","1","30m Shakespeare: Grades 5-8 - Lesson 7","<p>⍞ Materials: The Tempest</p><p>➜ INTRO<br>Act 3, Scene 2 highlights a lot of the conflict in The Tempest. Caliban and Ariel both use deception for different purposes. The Tempest Reporter activity will help guide your reading of the scene. If time permits at the end, you will report on your findings. <br>∞ Link: Tempest Reporter</p><p>➜ RECAP<br>Describe Trinculo's account of his meeting Caliban.</p><p>➜ READ, NARRATE, &amp; DISCUSS <br>Act 3 Scene 1-2 p.91-109 &quot;There be some&quot; - &quot;I'll follow, Stephano.&quot;</p><p>• Why do you think Caliban plots against his master?</p><p>• EXTRA HELPING<br>Have students watch a portion of Act 3, Scene 2.<br>∞ Video Link: Act 3, Scene 2</p>","","https://planning.alveary.org/links.html?id=recnKzHCs6UvKzvtd&term=1&week=7","Lesson","0","FALSE"
"alveary-recnKzHCs6UvKzvtd","alveary-recNZd4Iy2MMGkMnG","8","1","30m Shakespeare: Grades 5-8 - Lesson 8","<p>⍞ Materials: The Tempest</p><p>➜ RECAP<br>What plan does Caliban propose to Stephano?</p><p>➜ READ, NARRATE, &amp; DISCUSS<br>Act 3 Scene 3 - Act 4 Scene 1 p.109-125 &quot;By 'r lakin&quot; - &quot;All eyes. Be Silent.&quot;</p><p>• What is the purpose of the magical banquet? How do people respond to the banquet?</p>","","","Lesson","0","FALSE"
"alveary-recnKzHCs6UvKzvtd","alveary-rec8m1p5Upe7pjtOs","9","1","30m Shakespeare: Grades 5-8 - Lesson 9","<p>⍞ Materials: The Tempest</p><p>➜ RECAP<br>Recall the conversation Prospero has with Ferdinand about his daughter, Miranda. What is your opinion of him as a father?</p><p>➜ INTRO<br>This scene has a famous monologue with the phrase, &quot;Our revels now are ended.&quot; Let's take some time to watch the clip before reading the scene.<br>∞ Video Link: Act 4, Scene 1</p><p>➜ READ, NARRATE, &amp; DISCUSS<br>Act 4 Scene 1 p.125-141 &quot;Ceres, most bounteous&quot; - &quot;do me service.&quot;</p><p>• Prospero deals with a lot of inner conflict (conflict within himself). How do we see Prospero resolving these inner conflicts?</p>","","https://planning.alveary.org/links.html?id=recnKzHCs6UvKzvtd&term=1&week=9","Lesson","0","FALSE"
"alveary-recnKzHCs6UvKzvtd","alveary-recBOXitskLeJbjxk","10","1","30m Shakespeare: Grades 5-8 - Lesson 10","<p>⍞ Materials: The Tempest</p><p>➜ RECAP<br>Think back on what wishes Juno and Ceres bestow upon Ferdinand and Miranda at the masque. Reference Act 4 Scene 1 L119-130. What other blessings would you add if you were at their engagement party?</p><p>➜ READ, NARRATE, &amp; DISCUSS<br>Act 5 Scene 1 p.145-157 &quot;Now does my project&quot; - &quot;me my dukedom.&quot;</p><p>• Why does Prospero choose to forgive his enemies instead of seeking revenge? What does this say about his character?</p><p>• EXTRA HELPING<br>Have students watch a portion of Act 5, Scene 1. As students near the end of the play, have them consider concepts and characters. Use this fun, interactive activity from the Royal Shakespeare Company to get them thinking about these concepts.<br>∞ Video Link: Act 5, Scene 1<br>∞ Link: Tempest Shapes</p>","","https://planning.alveary.org/links.html?id=recnKzHCs6UvKzvtd&term=1&week=10","Lesson","0","FALSE"
"alveary-recnKzHCs6UvKzvtd","alveary-rec2SqUxYpsy8aXrB","11","1","30m Shakespeare: Grades 5-8 - Lesson 11","<p>⍞ Materials: The Tempest</p><p>➜ RECAP<br>Recollect the scene in which Prospero draws a charmed circle with his staff. What does he say to those brought into the circle?</p><p>➜ INTRO<br>Many consider The Tempest Shakespeare's final work. Therefore, Prospero's farewell is often double-read as Shakespeare's farewell to the audience. Before reading the scene, watch Prospero's epilogue. If time permits, read the article on the epilogue at the end.<br>∞ Video Link: Prospero's Epilogue<br>∞ Article Link: Epilogue</p><p>➜ READ, NARRATE, &amp; DISCUSS<br>Act 5 Scene 1 p.157-171 &quot;Sweet lord&quot; - &quot;indulgence set me free.&quot;</p><p>➜ READ, NARRATE, &amp; DISCUSS<br>EPILOGUE p.169 &amp; 171</p><p>• Why do you think Shakespeare chose to end the play with Prospero asking for the audience’s “indulgence” (approval)?</p><p>• EXTRA HELPING<br>The resolution of the Tempest is very complex. To help students connect the dots, have students play this review game. Students will be asked to fill in the quote, find answers, and escape the island!<br>∞ Link: Escape the Island Game</p>","","https://planning.alveary.org/links.html?id=recnKzHCs6UvKzvtd&term=1&week=11","Lesson","0","FALSE"
"alveary-recnKzHCs6UvKzvtd","alveary-recybe8jaeyfEmhcG","12","1","30m Shakespeare: Grades 5-8 - Lesson 12","<p>Exam Week</p><p>➜ EXAMS<br>Answer question(s) related to course. Questions will come from: The Tempest</p>","<p>★ Shakespeare: Grades 5-8 — TERM 1 EXAM QUESTIONS<br>· (GRADE 5-6) The Tempest: Describe your favorite scene or character from the story. Why did you like this particular scene/character? Provide details from the story in your response.</p><p>· (GRADE 5-6) The Tempest: (Optional) What lesson does Prospero learn by the end of the play, and how does it change his actions?</p><p>· (GRADE 7-8) The Tempest: Choose one and give as much detail as possible:<br>- What lesson does Prospero learn by the end of the play, and how does it change his actions?<br>- Is Caliban justified in his anger toward Prospero? What might motivate Caliban to plot against Prospero?  <br>- How does Prospero use magic to control the events on the island? Do you think he is fair in his use of magic? Why or why not?</p>","","Exam","0","FALSE"
"alveary-recnKzHCs6UvKzvtd","alveary-recgNFOzHqMoLpvcS","13","1","30m Shakespeare: Grades 5-8 - Lesson 13","<p>⍞ Materials: Henry IV Part 2</p><p>➜ RATIONALE: Henry IV Part 2 is a tale about Prince Hal falling into his father's footsteps as king. Hal's life will no longer be the same when he feels the weight of the crown.</p><p>➜ INTRO<br>Henry IV Part 2 is actually the third play in a tetralogy. The Henriad is all about Henry becoming the warrior king. Let's take time to review the first 6 slides on the Henriad plays to better understand the play.<br>∞ Link: Henriad</p><p>➜ READ, NARRATE, &amp; DISCUSS<br>Induction - Act 1 Scene 1 p.7-25 &quot;Open your ears,&quot; - &quot;yet more need.&quot;</p><p>• What role do you think Northumberland will play in this story?</p>","<p>★ TEACHER TIP<br>Pre-Teaching Materials: <br>Movies Recommendations: The Hollow Crown Season 1, Episode 3. Rated TV-14 (please consult a parental guide before watching, consider skipping graphic scenes).</p><p>★ TEACHER TIP<br>Refresh yourself if desired on Shakespeare's plays and biography to share &quot;by the way,&quot; especially the section on how Shakespeare structures his histories. Remember to read the summaries before a scene to help orient students and explore retellings if desired.<br>∞ Link: Genres of Shakespeare</p>","https://planning.alveary.org/links.html?id=recnKzHCs6UvKzvtd&term=2&week=13","Lesson","0","FALSE"
"alveary-recnKzHCs6UvKzvtd","alveary-recYgz2RApx6Hjtv5","14","1","30m Shakespeare: Grades 5-8 - Lesson 14","<p>⍞ Materials: Henry IV Part 2</p><p>➜ INTRO<br>While Shakespeare's plays rooted in history, there are differences in the historical characters. Let's review the historical prince Henry slide together.<br>∞ Link: Henriad</p><p>➜ READ, NARRATE, &amp; DISCUSS<br>Act 1 Scenes 2-3 p.27-49 &quot;Sirrah, your giant,&quot; - &quot;time bids begone.&quot;</p><p>• What is Falstaff's relationship with money and fame?</p>","","https://planning.alveary.org/links.html?id=recnKzHCs6UvKzvtd&term=2&week=14","Lesson","0","FALSE"
"alveary-recnKzHCs6UvKzvtd","alveary-recqnE43zhU2IXfiD","15","1","30m Shakespeare: Grades 5-8 - Lesson 15","<p>⍞ Materials: Henry IV Part 2</p><p>➜ READ, NARRATE, &amp; DISCUSS<br>Act 2 Scenes 1-2 p.53-75 &quot;Master Fang,&quot; - &quot;Follow me, Ned.&quot;</p><p>• If you were friends with Falstaff, what advice would you give him?</p><p>• EXTRA HELPING<br>Work with the student to translate Henry IV Part 2 Quotes.<br>∞ Link: Character Quotes</p>","","https://planning.alveary.org/links.html?id=recnKzHCs6UvKzvtd&term=2&week=15","Lesson","0","FALSE"
"alveary-recnKzHCs6UvKzvtd","alveary-recAVihJDAx5gz6Ru","16","1","30m Shakespeare: Grades 5-8 - Lesson 16","<p>⍞ Materials: Henry IV Part 2</p><p>➜ READ, NARRATE, &amp; DISCUSS<br>Act 2 Scenes 3-4 p.77-95 &quot;I pray thee,&quot; - &quot;at your belly.&quot;</p><p>• What do you think is Northumberland's motive to join the rebellion?</p><p>• EXTRA HELPING<br>Work with the student to translate Henry IV Part 2 Quotes.<br>∞ Link: Character Quotes</p>","","https://planning.alveary.org/links.html?id=recnKzHCs6UvKzvtd&term=2&week=16","Lesson","0","FALSE"
"alveary-recnKzHCs6UvKzvtd","alveary-recslDzX2IvMUTGMa","17","1","30m Shakespeare: Grades 5-8 - Lesson 17","<p>⍞ Materials: Henry IV Part 2</p><p>➜ INTRO<br>Have you ever been given a responsibility that you didn't want? Or maybe the task you were given made you nervous? In the clip we're about to watch, we see how being a king is a big responsibility.<br>∞ Video Link: Act 3, Scene 1</p><p>➜ READ, NARRATE, &amp; DISCUSS<br>Act 2 Scene 4 - Act 3 Scene 1 p.95-115 &quot;Have you turned&quot; - &quot;the Holy Land.&quot;</p><p>• How do we see the weight of the crown affecting King Henry?</p>","","https://planning.alveary.org/links.html?id=recnKzHCs6UvKzvtd&term=2&week=17","Lesson","0","FALSE"
"alveary-recnKzHCs6UvKzvtd","alveary-rechbdx4tgkIt28Mi","18","1","30m Shakespeare: Grades 5-8 - Lesson 18","<p>⍞ Materials: Henry IV Part 2</p><p>➜ INTRO<br>Before reading the scene, let's watch a famous monologue from Falstaff called &quot;The Chimes at Midnight.&quot; Keep in mind, Falstaff is about to lead a regiment into war.<br>∞ Video Link: The Chimes at Midnight</p><p>➜ READ, NARRATE, &amp; DISCUSS<br>Act 3 Scene 2 p.117-137 &quot;Come on, come on,&quot; - &quot;there an end.&quot;</p><p>• What do you think the chimes of midnight mean?</p><p>• EXTRA HELPING<br>Work with the student to translate Henry IV Part 2 Quotes.<br>∞ Link: Character Quotes</p>","","https://planning.alveary.org/links.html?id=recnKzHCs6UvKzvtd&term=2&week=18","Lesson","0","FALSE"
"alveary-recnKzHCs6UvKzvtd","alveary-recWB0JW5FyCaxg3s","19","1","30m Shakespeare: Grades 5-8 - Lesson 19","<p>⍞ Materials: Henry IV Part 2</p><p>➜ READ, NARRATE, &amp; DISCUSS<br>Act 4 Scene 1 p.141-167 &quot;What is this&quot; - &quot;yielder-up of breath.&quot;</p><p>• Who is John of Lancaster? What were some skills he demonstrated in the scene?</p><p>• EXTRA HELPING<br>Have students draw two circles, have them label one &quot;Sir John Falstaff,&quot; and the other &quot;Prince Hal.&quot; From there list other characters who are related or have a significant relationship with those two characters.</p>","","","Lesson","0","FALSE"
"alveary-recnKzHCs6UvKzvtd","alveary-rec3VUye8ujmD2UjB","20","1","30m Shakespeare: Grades 5-8 - Lesson 20","<p>⍞ Materials: Henry IV Part 2</p><p>➜ INTRO<br>The real-life Henry IV had health problems that Shakespeare hints at in the play. Let's review slide 13 to see how the king's health decline plays a role in the story.<br>∞ Link: Henriad</p><p>➜ READ, NARRATE, &amp; DISCUSS<br>Act 4 Scenes 2-3 p.167-187 &quot;What's your name,&quot; - &quot;(Softly, pray.)&quot;</p><p>• How has Hal and his father's relationship changed throughout the series? Do you think King Henry believes his son can be king?</p>","","https://planning.alveary.org/links.html?id=recnKzHCs6UvKzvtd&term=2&week=20","Lesson","0","FALSE"
"alveary-recnKzHCs6UvKzvtd","alveary-recc1stk85WbegDT7","21","1","30m Shakespeare: Grades 5-8 - Lesson 21","<p>⍞ Materials: Henry IV Part 2</p><p>➜ INTRO<br>As we have seen, the relationship between Prince Hal and King Henry is complicated. In the clip we will watch, we will see how the crown complicates the relationship between the father and son.<br>∞ Video Link: Act 4, Scene 3</p><p>➜ READ, NARRATE, &amp; DISCUSS<br>Act 4 Scene 3 p.187-203 &quot;Let there be&quot; - &quot;shall Harry die.&quot;</p><p>• Why is King Henry mad at Prince Hal?</p>","","https://planning.alveary.org/links.html?id=recnKzHCs6UvKzvtd&term=2&week=21","Lesson","0","FALSE"
"alveary-recnKzHCs6UvKzvtd","alveary-recY62JpOljbiPG0b","22","1","30m Shakespeare: Grades 5-8 - Lesson 22","<p>⍞ Materials: Henry IV Part 2</p><p>➜ INTRO<br>Let's take a few minutes to recall key events. Create a list or a series of stick figure drawings on some of the most important scenes in Henry IV Part 2.</p><p>➜ READ, NARRATE, &amp; DISCUSS<br>Act 5 Scenes 1-2 p.207-223 &quot;By cock and pie,&quot; - &quot;life one day.&quot;</p><p>• How would you describe Falstaff's relationship with Henry? Do you think Henry can remain friends with Falstaff?</p>","","","Lesson","0","FALSE"
"alveary-recnKzHCs6UvKzvtd","alveary-recB72ZWn00mjfi7J","23","1","30m Shakespeare: Grades 5-8 - Lesson 23","<p>⍞ Materials: Henry IV Part 2</p><p>➜ READ, NARRATE, &amp; DISCUSS<br>Act 5 Scene 3 - Epilogue p.223-245 &quot;Nay, you shall&quot; - &quot;bid you good night.&quot;</p><p>• Why does Henry say he doesn't know Falstaff?</p><p>• EXTRA HELPING<br>Have students review the PBS infographic to help the students tie the narrative together.<br>∞ Link: Henry Part 2 Map</p>","","https://planning.alveary.org/links.html?id=recnKzHCs6UvKzvtd&term=2&week=23","Lesson","0","FALSE"
"alveary-recnKzHCs6UvKzvtd","alveary-recWnI0cVQQj4sOVB","24","1","30m Shakespeare: Grades 5-8 - Lesson 24","<p>Exam Week</p><p>➜ EXAMS<br>Answer question(s) related to course.  Questions will come from: Henry IV Part 2</p>","<p>★ Shakespeare: Grades 5-8 — TERM 2 EXAM QUESTIONS<br>· (GRADE 5-6) Henry IV, Part 2: Describe your favorite scene or character from the story. Why did you like this particular scene/character? Provide details from the story in your response.</p><p>· (GRADE 5-6) Henry IV, Part 2: (Optional) What struggles does King Henry IV face in this play, and how do they affect his rule?</p><p>· (GRADE 7-8) Henry IV, Part 2: Choose one and give as much detail as possible:<br>- What struggles does King Henry IV face in this play, and how do they affect his rule?<br>- Do you think Prince Hal was ready to be King? Why or why not? <br>- How does Prince Hal’s relationship with Falstaff change by the end of the play? Why does he make this decision?</p>","","Exam","0","FALSE"
"alveary-recnKzHCs6UvKzvtd","alveary-recwRuLKbfCYCMbzu","25","1","30m Shakespeare: Grades 5-8 - Lesson 25","<p>⍞ Materials: The Winter's Tale</p><p>➜ RATIONALE<br>The Winter's Tale is a play divided into two halves: tragedy and redemption. Note the power of jealousy to destroy, but the greater power of love to restore.</p><p>➜ INTRO<br>The Winter's Tale is not a traditional tragedy or comedy. It is often called a Tragicomedy because it has both comedic and tragic elements. Overall, the play has a happy ending which places it in the comedic category. Let's take some time to review the elements of tragedy and comedy.<br>∞ Link: Genres of Shakespeare</p><p>➜ READ, NARRATE, &amp; DISCUSS<br>Act 1 Scenes 1-2 p.7-25 &quot;Archidamus, a Bohemian&quot; - &quot;an honest man.&quot;</p><p>• Why is Leontes suspicious of Hermione and Polixenes? What does this reveal about his character at the start of the play?</p>","<p>★ TEACHER TIP<br>Pre-Teaching Materials: <br>Movies Recommendations: <br>-The Winter's Tale BBC (1981)<br>-Branagh's The Winter's Tale (2015)</p><p>★ TEACHER TIP<br>Refresh yourself if desired on Shakespeare's plays and biography to share &quot;by the way,&quot; especially the section on how Shakespeare structures his tragedies and comedies. Remember to read the summaries before a scene to help orient students and explore retellings if desired.<br>∞ Link: Genres of Shakespeare<br>∞ Link: Course Hero</p>","https://planning.alveary.org/links.html?id=recnKzHCs6UvKzvtd&term=3&week=25","Lesson","0","FALSE"
"alveary-recnKzHCs6UvKzvtd","alveary-recgq4kTOwwjqVYgr","26","1","30m Shakespeare: Grades 5-8 - Lesson 26","<p>⍞ Materials: The Winter's Tale</p><p>➜ INTRO<br>Let's watch Act 1, Scene 2, and get an understanding of the conflict of the play. King Leontes' jealousy is the basis for the conflict of the play. Shakespeare uses the word 'cuckholded' to describe adultery. To gain a deeper understanding, consult the Oxford dictionary.<br>∞ Video Link: Act 1, Scene 2<br>∞ Link: Cuckolded Definition</p><p>➜ READ, NARRATE, &amp; DISCUSS<br>Act 1 Scene 2 p.25-43 &quot;Camillo, this great&quot; - &quot;Come, sir, away.&quot;</p><p>• How do Camilo's actions contrast with the kings'? What does this reveal about his character?</p>","","https://planning.alveary.org/links.html?id=recnKzHCs6UvKzvtd&term=3&week=26","Lesson","0","FALSE"
"alveary-recnKzHCs6UvKzvtd","alveary-recljoT8SsxE1HZuj","27","1","30m Shakespeare: Grades 5-8 - Lesson 27","<p>⍞ Materials: The Winter's Tale</p><p>➜ INTRO<br>Before reading, let's watch a clip from Act 2, Scene 1.<br>∞ Video Link: Act 2, Scene 1</p><p>➜ READ, NARRATE, &amp; DISCUSS<br>Act 2 Scenes 1-2 p.47-67 &quot;Take the boy&quot; - &quot;betwixt you and danger.&quot;</p><p>• How does Leontes’s treatment of Hermione affect those around him, especially Mamillius?</p>","","https://planning.alveary.org/links.html?id=recnKzHCs6UvKzvtd&term=3&week=27","Lesson","0","FALSE"
"alveary-recnKzHCs6UvKzvtd","alveary-recIzy8n3Dmqe47EF","28","1","30m Shakespeare: Grades 5-8 - Lesson 28","<p>⍞ Materials: The Winter's Tale</p><p>➜ READ, NARRATE, &amp; DISCUSS<br>Act 2 Scene 3 p.67-83 &quot;Nor night nor day&quot; - &quot;upon my bidding.&quot;</p><p>• What is internal conflict? How does internal conflict within Leontes lead to external conflicts?</p><p>• EXTRA HELPING<br>Have students work on character quotes 1-3.<br>∞ Link: Character Quotes</p>","","https://planning.alveary.org/links.html?id=recnKzHCs6UvKzvtd&term=3&week=28","Lesson","0","FALSE"
"alveary-recnKzHCs6UvKzvtd","alveary-rec0cnfiS3adRkSAX","29","1","30m Shakespeare: Grades 5-8 - Lesson 29","<p>⍞ Materials: The Winter's Tale</p><p>➜ INTRO<br>Before reading, let's watch a clip from Act 3, scene 2.<br>∞ Video Link: Act 3, Scene 2</p><p>➜ READ, NARRATE, &amp; DISCUSS<br>Act 3 Scenes 1-2 p.87-105 &quot;The climate's delicate&quot; - &quot;To these sorrows.&quot;</p><p>• Act 3 is considered a turning point in the play. What changes do we see in Leontes, in other characters, or in the plot?</p><p>• EXTRA HELPING<br>Have students work on character quotes 4-5.<br>∞ Link: Character Quotes</p>","","https://planning.alveary.org/links.html?id=recnKzHCs6UvKzvtd&term=3&week=29","Lesson","0","FALSE"
