"course_custom_id","assignment_custom_id","assignment_week","assignment_day","assignment_name","assignment_description","assignment_teachersNote","assignment_linksUrl","assignment_type","assignment_duration","assignment_graded"
"alveary-rechch3gkLaICGbWm","alveary-recrOjiaVrL5rDUva","1","1","20m Geography: Grade 2 (Canada) - Lesson 1","<p>Introduction<br>⍞ Materials: Atlas, Globe or Wall Map showing North America, My Canada, geography journal</p><p>PREP: Print Blank World Map, Blank North America Map, Blank Outline Map of Canada.<br>∞ Map Link: Blank World Map<br>∞ Map Link: Blank North America Map<br>∞ Map Link: Blank Outline Map of Canada (download the first option under &quot;Maps of Canada&quot;)</p><p>➜ INTRO<br>In geography this year, we will begin a two-year journey across Canada. Geography is learning about different places around the world. All kinds of maps are used to help us in the study of geography—globes, wall maps, and atlases.</p><p>➜ MAP QUESTIONS<br>⍞ Map Resource: Atlas, Globe, or Wall Map showing North America<br>1\. Find North America. <br>2\. Find the equator. Is Canada north or south of the equator? <br>3\. What is to the west of Canada? (Pacific Ocean) To the east? (Atlantic Ocean) To the north? (Arctic Ocean) To the south? (United States of America)</p><p>➜ MAP WORK<br>Add the Blank World Map (referred to moving forward as &quot;My World Map&quot;), the Blank North America Map (referred to moving forward as &quot;My North America Map&quot;), and the Blank Outline Map of Canada (referred to moving forward as &quot;My Canada Map&quot;) to your geography journal.</p><p>⍞ Map Resource: My World Map<br>1\. Add the title &quot;My World Map.&quot;<br>2\. Colour in Canada.</p><p>⍞ Map Resource: My North America Map<br>1\. Add title &quot;My North America Map.&quot;<br>2\. Label the borders of Canada. (Pacific Ocean, Atlantic Ocean, Arctic Ocean, United States of America)<br>3\. Label any other countries of interest, using a North American map or atlas as a reference (Greenland, Mexico, etc.).</p><p>➜ READ &amp; NARRATE<br>My Canada<br>&quot;Oh, Canada&quot; - &quot;polar bears.&quot;</p><p>• Which of these facts were new to you? What are you most excited to learn about Canada? The parent/teacher or the student (depending on ability) could write these down in the geography journal.</p><p>• TAKE A GEOGRAPHY WALK<br>Near the beginning of term 2, we will have some lessons about how water moves. Depending on where you live, it may rain often or not much at all. Please start to take notes on where the water goes when it rains. Look for where it goes near your home, and even see if you can follow it in your neighbourhood. The notes can go in your nature or geography journal.</p>","","https://planning.alveary.org/links.html?id=rechch3gkLaICGbWm&term=1&week=1","Lesson","0","FALSE"
"alveary-rechch3gkLaICGbWm","alveary-recwE2bWmyH14r5Tn","1","2","20m Geography: Grade 2 (Canada) - Lesson 2","<p>Canada<br>⍞ Materials: My Canada; The Kids Book of Canada; geography journal</p><p>PREP: Print the flag of Canada and Canada's Coat of Arms.<br>∞ Image Link: Colouring Book of Flags: Canada<br>∞ Image Link: Canada's Coat of Arms</p><p>➜ INTRO<br>Let's look at the whole map of Canada at the beginning of My Canada. What do you notice?</p><p>➜ MAP QUESTIONS<br>1\. Run your finger along the southern border of Canada. Most of Canada's population lives near this border. Can you name some of the cities you see there?<br>2\. Locate the capital city of Canada (Ottawa). Discuss what it means to be a capital city, and give some examples of other capital cities around the world.<br>3\. Locate your province or territory. How close do you live to the southern border? How close do you live to the capital city of Ottawa? Could you drive there, or would you have to fly?<br>4\. Looking at the map, point out places you've visited or places where your family and friends live.</p><p>➜ MAP WORK<br>⍞ Map Resource: My Canada Map<br>1\. Add title &quot;My Canada Map.&quot;<br>2\. Add Ottawa (with a star inside a circle) to the map and label it.</p><p>➜ READ, NARRATE, &amp; DISCUSS<br>The Kids Book of Canada<br>p.4 &quot;Canada's name&quot; - &quot;February 15, 1965.&quot;</p><p>• Facts about countries can change over time. Look up the current population of Canada and compare it to the number in the &quot;Quick Facts&quot; box. What might be some reasons that the population of Canada is getting bigger?</p><p>➜ MAP WORK<br>1\. Colour the flag of Canada and add it to your geography journal.<br>2\. Colour Canada's Coat of Arms and add it to your geography journal. Spend some time looking at all the figures there. Did you know Canada's Coat of Arms has a unicorn?</p><p>• EXTRA HELPING<br>Watch the Heritage Minute about the naming of Canada<br>∞ Video Link: Heritage Minutes: Jacques Cartier (1:00)</p>","","https://planning.alveary.org/links.html?id=rechch3gkLaICGbWm&term=1&week=1","Lesson","0","FALSE"
"alveary-rechch3gkLaICGbWm","alveary-reciCxd58Hec8Zprt","2","1","20m Geography: Grade 2 (Canada) - Lesson 3","<p>Compass<br>⍞ Materials: compass, paper, tape</p><p>➜ DISCUSS<br>There are naturally occurring magnetic rocks called magnetite, but modern compasses use a magnetized needle. Both magnetite and a modern magnetic needle, when allowed to move freely, will swing to point north. Today, we will use a compass to find direction in your classroom or room in your home.</p><p>➜ DEMONSTRATE<br>1\. Place the compass in the middle of the room and allow it to stop moving. <br>2\. The needle will be pointing north. You must move the N sign on the compass to line up with the point of the needle.<br>3\. On a piece of paper, write N for north and tape it to the wall that the compass is pointing to.<br>4\. When you face north, east will be on your right, west on your left, and south directly behind you.<br>5\. Using these directions, make more sheets with E, W, and S on them and tape them to your walls.</p><p>➜ PLAY<br>Using the directions on the walls, take turns with another student or teacher, following directions such as &quot;take 3 steps east&quot; or &quot;take 2 giant steps south.&quot; You can even make it into a Mother May I game.</p>","","","Lesson","0","FALSE"
"alveary-rechch3gkLaICGbWm","alveary-recVgaCnEr297A8PR","2","2","20m Geography: Grade 2 (Canada) - Lesson 4","<p>Compass Rose<br>⍞ Materials: compass, chalk</p><p>➜ DISCUSS<br>During the last lesson, we found direction inside, and today we will find direction outside and create a compass rose.</p><p>➜ DEMONSTRATE<br>1\. Draw a large circle on a paved area. Place the compass in the middle and allow it to stop moving. <br>2\. The needle will be pointing north. You must move the N sign on the compass to line up with the point of the needle.<br>3\. Draw a line from the N side of the compass straight to the edge of the circle, and mark it with an N.<br>4\. Do the same thing with E, W, and S.<br>5\. Today, we will add more directions to the compass rose. Halfway between the N and the E, you will write a NE, which stands for northeast, on the circle. Halfway between N and W, you will write NW, which stands for northwest. Continue by adding a SE between S and E, for southeast, and add SW between S and W, for southwest.<br>6\. You will notice that it is easier to give more accurate directions because you have more to refer to.</p><p>➜ PLAY<br>1\. Using the directions on the compass rose, take turns with another student or teacher, following directions such as &quot;take 3 steps northeast&quot; or &quot;take 2 giant steps southwest.&quot; This can be played like Mother May I.<br>2\. Another game you can play is to give directions to an object, like a tree, outside by saying things like &quot;take 5 steps west, and then 2 steps northwest. What is there?&quot;</p>","","","Lesson","0","FALSE"
"alveary-rechch3gkLaICGbWm","alveary-rec764GQsixuTsVzS","3","1","20m Geography: Grade 2 (Canada) - Lesson 5","<p>Compass Rose and Map Key<br>⍞ Materials: Making Your Own Maps</p><p>➜ READ, NARRATE, &amp; DISCUSS<br>p.4-7 &quot;You've moved&quot; - &quot;these tools!&quot;</p><p>➜ MAP QUESTIONS<br>⍞ Map Resource: Making Your Own Maps, various pages<br>1\. Can you find the compass rose on p.7? Which directions are on it?<br>2\. Locate the keys on p.5 and 7. What symbols do they use? How are they the same or different?<br>3\. Look at the keys on maps on p.15,16,19, 21. How are they the same or different?</p>","","","Lesson","0","FALSE"
"alveary-rechch3gkLaICGbWm","alveary-reclA8hIw3BztbMKU","3","2","20m Geography: Grade 2 (Canada) - Lesson 6","<p>Physical Geography &amp; Biomes<br>⍞ Materials: The Kids Book of Canada</p><p>➜ INTRO<br>As we will see, there are lots of different types of maps, and maps can show many different types of information. The map in My Canada we've been looking at for the past few weeks is a political map: it gives information about borders, boundaries, capital cities, and names. But it doesn't tell us much about what the land is like, what the temperature is, or what animals and plants we might find.</p><p>➜ READ &amp; NARRATE<br>p.5 &quot;Taiga landscape&quot; - &quot;in the valleys.&quot;</p><p>➜ MAP QUESTIONS<br>1\. How many different biomes can be found in Canada? (If you haven't studied biomes before, spend some extra time reading the descriptions in the book, or do some additional research about the characteristics of each.)<br>2\. What biome do you live in? What is the climate like throughout the year, and what is it like right now? What plants and animals are found in your area?<br>3\. How has the mapmaker chosen to represent what can be found in Canada? What images do you see? (When a map shows the landforms, natural regions, climate, and biomes of an area, it is an example of physical geography.)</p><p>• TAKE A GEOGRAPHY WALK<br>Go for a walk in your neighbourhood. What grows near you? What type of vegetation (trees, bushes, flowers, etc.) grows near you? What is the climate like right now? You could add this information to your Outdoor Work notebook.</p>","","","Lesson","0","FALSE"
"alveary-rechch3gkLaICGbWm","alveary-rec6S0SvYqv1LuCQT","4","1","20m Geography: Grade 2 (Canada) - Lesson 7","<p>Types of Maps Intro</p><p>➜ INTRO<br>Last week, we looked at a map that showed different aspects of Canada's physical geography. We are going to spend a few lessons learning about different types of maps.</p><p>➜ DISCUSS<br>1\. Today, we will look at two more types of maps. The first we will call a model or a 3-dimensional map. Last year, you used blocks (or some other objects) to make maps. You did this with your room, your home, your neighbours, etc. <br>2\. The second type of map we will call a pictorial view. It is a drawing of a street-level view of a home, building, etc. You also drew these last year when you drew your home and neighbouring homes/buildings.</p><p>➜ VIEW &amp; DISCUSS<br>Look at the linked map pictures.<br>1\. Look at the linked Room Model and Model Showing Orientation.<br>∞ Image link: Room Model<br>∞ Image link: Model Showing Orientation<br>2\. Make a quick model of a room in your home or school. If you have previously done this activity, choose a different room to model.<br>3\. Look at the linked pictorial view of a house. It will be at eye level, and drawn as if you are looking directly at it. <br>∞ Image link: Pictorial map<br>4\. If time permits, draw a pictorial view of your home from the outside.</p>","","https://planning.alveary.org/links.html?id=rechch3gkLaICGbWm&term=1&week=4","Lesson","0","FALSE"
"alveary-rechch3gkLaICGbWm","alveary-recXjDoIVZhjHWFFv","4","2","20m Geography: Grade 2 (Canada) - Lesson 8","<p>Types of Maps, Cont.<br>⍞ Materials: Making Your Own Maps</p><p>➜ RECAP<br>What types of maps did we discuss in the last lesson?</p><p>➜ DISCUSS<br>1\. Today, we will look at the next 2 types of maps. The first we will call a panoramic 3D map. Imagine you are a bird high up in a tree looking down at your home; what kind of drawing would that make? How would it look different from the street view of your home?<br>2\. The second type of map we will call an aerial view. This time, imagine you are a bird flying directly over your home; what kind of drawing would that make? (could only see the roof) How is this different from the panoramic view?</p><p>➜ VIEW &amp; DISCUSS<br>Look at the linked map pictures, as well as one in Making Your Own Maps.<br>1\. Look at the linked Panoramic 3D map and have the student identify its type.<br>∞ Map Link: Panoramic 3D map<br>2\. Look at the linked Aerial View map, and have the student identify its type.<br>∞ Map Link: Aerial View map<br>3\. Look at Making Your Own Maps p.16. What type of map is this, based on what we studied today? (panoramic)</p>","<p>★ TEACHER NOTE<br>If your student(s) has used Making Your Own Maps before, have them try to draw a panoramic 3D or an aerial view map of an area familiar to them.</p>","https://planning.alveary.org/links.html?id=rechch3gkLaICGbWm&term=1&week=4","Lesson","0","FALSE"
"alveary-rechch3gkLaICGbWm","alveary-recbNOWYmrWxdWGAu","5","1","20m Geography: Grade 2 (Canada) - Lesson 9","<p>Types of Maps, Cont.<br>⍞ Materials: Making Your Own Maps</p><p>➜ RECAP<br>What types of maps did we discuss in the last lesson?</p><p>➜ DISCUSS<br>Today, we will look at the last type of map we will be discussing this year. This type of map is a symbolic map. These can vary greatly. Making Your Own Maps is full of symbolic maps. As you read today, look for maps that are not models, pictorial, panoramic, or aerial.</p><p>➜ READ, NARRATE, &amp; DISCUSS<br>p.4-15 &quot;You've moved&quot; - &quot;stands for.&quot;</p><p>➜ DISCUSS<br>Did you find symbol maps? (p.5, 7, 8, 11, 13, 15) Note: If there is confusion about why some of those are not pictorial or panoramic, look back at the previous 2 lessons.</p><p>• TAKE A GEOGRAPHY WALK<br>Near the beginning of term 2, we will have some lessons about how water moves. Don't forget to keep an eye out when it rains. Try to pay attention to a light rain versus a hard rain. Don't forget to keep notes in your geography or nature journal.</p>","","","Lesson","0","FALSE"
"alveary-rechch3gkLaICGbWm","alveary-rechlrzmktcdoYOsx","5","2","20m Geography: Grade 2 (Canada) - Lesson 10","<p>People, Places, and Events<br>⍞ Materials: The Kids Book of Canada</p><p>➜ READ, NARRATE, &amp; DISCUSS<br>p.6-7 &quot;On November 7, 1885&quot; - &quot;markets for its goods.&quot;</p><p>• Discuss these events, the ones your student(s) know and the ones that might be new.</p><p>➜ ILLUSTRATE<br>Draw or find images of the events of most interest to add to your Picture Timeline. Be sure to add when your own province or territory joined Canada.</p>","","","Lesson","0","FALSE"
"alveary-rechch3gkLaICGbWm","alveary-recBtUl2Q8j3gSZaQ","6","1","20m Geography: Grade 2 (Canada) - Lesson 11","<p>Compass Rose and Directions<br>⍞ Materials: My Canada, My Map of Canada; geography journal</p><p>➜ INTRO<br>We have talked about directions in your room/classroom and outdoors. Today, we will learn about directions on a map.</p><p>➜ MAP QUESTIONS<br>1\. Find the compass rose on the map of Canada at the beginning of My Canada<br>2\. What direction is north? South? East? West?<br>4\. What is to the west of British Columbia? (Pacific Ocean)<br>5\. What ocean is east of Ontario? (Atlantic Ocean)<br>6\. If we travel from Victoria to Halifax, which direction would you travel? (east)<br>7\. Where do you live? Which direction would you go to get to Ottawa?</p><p>➜ MAP WORK<br>1\. Add a compass rose to My Map of Canada.</p>","","","Lesson","0","FALSE"
"alveary-rechch3gkLaICGbWm","alveary-recemiJ00xykCNeX8","6","2","20m Geography: Grade 2 (Canada) - Lesson 12","<p>Islands<br>⍞ Materials: World Wall Map or Globe</p><p>➜ MAP QUESTIONS<br>1\. Locate your home on the globe.<br>2\. Locate the Equator. Do you live north or south of it?<br>3\. Which continent do you live on?<br>4\. Which ocean is closest to you?<br>5\. What is an island? (A body of land surrounded by water.)<br>6\. Locate a very large island in the Atlantic Ocean. (The largest island is Greenland, which extends from the Arctic Ocean into the North Atlantic Ocean. Other islands are listed in the next question.)<br>7\. Can you locate any more islands in the Atlantic Ocean? (Possibilities include Iceland, Ireland, Great Britain, Newfoundland, and the Falklands, among others.)<br>8\. Some islands in the Pacific Ocean are isolated, while others exist in groups. Can you locate a group of islands in the Pacific Ocean? (Aleutian Islands, Hawaii, Galápagos Islands, Japan, Philippine Islands, Northern Mariana Islands, Marshall Islands, Micronesia, Solomon Islands, Cook Islands, French Polynesia, and New Zealand, among many others)<br>9\. Can you locate standalone islands in the Pacific that are not part of a group? (This question is more of a scavenger hunt, and the student may only name Vancouver Island and Taiwan. Searching for individual islands in the Pacific Ocean makes it apparent that almost all islands in this ocean are part of a larger group.)<br>10\. What is an island close to you?<br>11\. How many islands can you find on the east coast of Canada?</p>","","","Lesson","0","FALSE"
"alveary-rechch3gkLaICGbWm","alveary-recLCj3RIXGCuHSDo","7","1","20m Geography: Grade 2 (Canada) - Lesson 13","<p>Vancouver Island and British Columbia<br>⍞ Materials: My Canada, The Kids Book of Canada; geography journal</p><p>PREP: (Optional) Print off a blank map of British Columbia (see the teacher's note).<br>∞ Map Link: Outline Maps of Canada and Provinces (these maps have rivers and lakes)<br>∞ Map Link: Completely Blank Map of British Columbia</p><p>➜ INTRO<br>Charlotte Mason defined an island as follows in her book, Elementary Geography. &quot;The high parts of the ocean bed rise above water in many places in the Pacific. These are called islands. An island is just a piece of land with water all around it. On the map, you will find many islands scattered over the Pacific Ocean. They are mostly small and lie in groups; that is, several clustered together.&quot;</p><p>Have you ever been to an island? If you lived on an island, what are some things you could do for fun?</p><p>➜ MAP QUESTIONS<br>⍞ Map Resource: Kids Book of Canada, p.9 (Today, we are only looking at the islands on the west coast of British Columbia.)<br>1\. Locate Victoria, which is the capital of BC. What kind of landform is it on? (Vancouver Island)<br>2\. What body of water is to the west of British Columbia? (Pacific Ocean)<br>3\. Are there other islands on the west coast? (Queen Charlotte Islands, now called Haida Gwaii)<br>4\. From the city of Vancouver, in which direction do you travel to get to Victoria? (south)<br>5\.  From the city of Vancouver, in which direction do you travel to get to Nanaimo? (west)<br>6\. How could you travel from the mainland of British Columbia to the islands off its coast? (ferry or seaplane)<br> <br>➜ VIEW &amp; DISCUSS<br>⍞ Map Resource: My Canada (map of British Columbia)<br>Look at the two inset maps at the bottom about Vancouver Island. What places do you see there, and what activities might you do?</p><p>➜ MAP WORK<br>⍞ Map Resource: My Map of Canada <br>Mark Victoria with a star to show it is a capital city.</p><p>• EXTRA HELPING<br>Emily Carr (1871-1945) was a Canadian artist who found inspiration in the beauty of Vancouver Island.<br>∞ Link: Emily Carr</p>","<p>★ TEACHER NOTE<br>For students who have an extra interest in mapping, there will be an optional blank provincial or territorial map provided. Students can decide whether to do all their map work on &quot;My Map of Canada,&quot; or, if they want to add extra details and illustrations, they may wish to have one map for each province/territory.</p><p>★ TEACHER TIP<br>Lesson plans will include some Extra Helping links and suggestions connected to the places on the map. However, as the students spend time looking at the images in My Canada, take some additional time to look up any of the places, animals, natural features, or landmarks that are of interest.</p>","https://planning.alveary.org/links.html?id=rechch3gkLaICGbWm&term=1&week=7","Lesson","0","FALSE"
"alveary-rechch3gkLaICGbWm","alveary-recn9NLYlUjCqgtDz","7","2","20m Geography: Grade 2 (Canada) - Lesson 14","<p>British Columbia<br>⍞ Materials: The Kids Book of Canada; geography journal</p><p>➜ INTRO<br>We are going to spend some time exploring the rest of British Columbia.</p><p>➜ MAP QUESTIONS<br>⍞ Map Resource: The Kids Book of Canada &quot;Canada&quot; p.4-5<br>1\. Find the province of British Columbia on the map. What does it border? (Yukon, Northwest Territories, Alberta, and the USA)<br>2\. What are the crinkly lines that run north-south through the province? (Mountains)<br>3\. How many different geographical regions do we find in British Columbia? Each one has a number and a separate colour. (There are four: Pacific Coast, Western Cordillera, Boreal Forest, and Taiga.)<br>4\. From these regions, what might the climate be like in different parts of BC?</p><p>➜ READ, NARRATE, &amp; DISCUSS<br>p.8-9 &quot;British Columbia&quot; - &quot;dry, sunny slopes.&quot;</p><p>➜ MAP QUESTIONS<br>⍞ Map Resource: The Kids Book of Canada p.9<br>1\. What is the highest peak in the Rocky Mountains? (Mount Robson) Can you find it on the map?<br>2\. Follow the route of the Fraser River from the foot of the Rocky Mountains to the Pacific Ocean. Why do you think it turns the way it does? (Rivers can't flow over the mountain ranges.)</p><p>➜ MAP WORK<br>1\. Label British Columbia.<br>2\. Label Vancouver. While it isn't the capital of BC, it is one of Canada's largest cities.<br>3\. Draw in the mountains and label Mount Robson.<br>4\. Draw in and label any other features or illustrations of interest (bodies of water, cities, landmarks, natural features, etc.).</p><p>• EXTRA HELPING<br>All blank provincial and territorial flags can be found at the link below.<br>∞ Image Link: Colouring Book of Flags: Canada</p>","<p>★ TEACHER NOTE<br>There are many options for how students can record their learning about each province and territory in their geography journal. Some students might want to record relevant facts (population, size, motto, capital, provincial symbols, etc.); others may want to spend extra time mapping rivers, mountains, and cities on blank maps; still others may wish to colour blank flags and draw pictures. Choose what would appeal most to your individual student(s), and extra work could be done during afternoon occupations.</p>","https://planning.alveary.org/links.html?id=rechch3gkLaICGbWm&term=1&week=7","Lesson","0","FALSE"
"alveary-rechch3gkLaICGbWm","alveary-reccFZ3sxHpUkQ5G3","8","1","20m Geography: Grade 2 (Canada) - Lesson 15","<p>British Columbia, cont.<br>⍞ Materials: The Kids Book of Canada; geography journal</p><p>PREP: Print the flag of British Columbia.<br>∞ Image Link: Colouring Book of Flags: Canada</p><p>➜ RECAP <br>What did you learn about British Columbia in the previous lesson?</p><p>➜ READ, NARRATE, &amp; DISCUSS<br>p.10-11 &quot;At Barkerville&quot; - &quot;other natural resources.&quot;<br>• Spend some time today entering an item of interest into your Picture Timeline. Students could also continue to decorate their map of British Columbia. Students who are particularly interested in these activities can continue this work in the afternoons.</p><p>➜ READ, NARRATE, &amp; DISCUSS<br>As we learn about each province and territory, we will also study some animals that are found only in Canada. We will read the book Canada Wild out of order as we learn about Canada from west to east. <br>p.3 &quot;Introduction&quot; - &quot;keep them safe.&quot;<br>• The first endemic animal we will read about is from the coastal region of British Columbia.<br>p.14-17 &quot;Habitat: Coastal rainforests - &quot;Kermode bear.&quot;<br>• Can you find the Kermode Bear on the British Columbia map in My Canada?</p><p>➜ MAP WORK<br>Colour the flag of British Columbia and add it to your geography journal.</p><p>• EXTRA HELPING<br>Learn more about Terry Fox.<br>∞ Video Link: Why Terry Fox is a National Hero</p>","","https://planning.alveary.org/links.html?id=rechch3gkLaICGbWm&term=1&week=8","Lesson","0","FALSE"
"alveary-rechch3gkLaICGbWm","alveary-reckkjuwtRV89t7y7","8","2","20m Geography: Grade 2 (Canada) - Lesson 16","<p>British Columbia, cont.<br>⍞ Materials: My Canada; Canada Wild</p><p>➜ RECAP <br>What did you learn about British Columbia in the previous lesson?</p><p>➜ VIEW &amp; DISCUSS<br>British Columbia map in My Canada (pages not numbered)</p><p>➜ MAP QUESTIONS<br>1\. What are some of the animals that live in British Columbia? How many different ones can you find?<br>2\. Can you find a National Park in BC? What about some of the Provincial Parks?<br>3\. Looking at the images, what are some activities that people might like to do in British Columbia?<br>4\. In the last lesson, you read about the gold rush in Barkerville. Can you find it on the map?</p><p>➜ READ, NARRATE, &amp; DISCUSS<br>p.30-33 &quot;Pacific Steller's Jay&quot; - &quot;keep its numbers strong.&quot;</p><p>• EXTRA HELPING<br>Buy some Nanaimo Bars for a treat, or make your own!<br>∞ Link: Nanaimo Bar Recipe</p>","","https://planning.alveary.org/links.html?id=rechch3gkLaICGbWm&term=1&week=8","Lesson","0","FALSE"
