"course_custom_id","assignment_custom_id","assignment_week","assignment_day","assignment_name","assignment_description","assignment_teachersNote","assignment_linksUrl","assignment_type","assignment_duration","assignment_graded"
"alveary-recfcbGoR5uy9BcFf","alveary-recpQXjgOOFltqzsx","1","1","20m Canadian History: Grades 2-4 - Lesson 1","<p>Introduction, The War of 1812<br>⍞ Materials: The Kids Book of Canadian History, globe or world atlas</p><p>PREP: Print a copy of a map of Canada. You will use this throughout the course.<br>∞ Map Link: Outline Map of Canada</p><p>➜ INTRO<br>Do you know when your relatives came to Canada and what brought them here? Where did they move from? Where did they settle?<br>This year in Canadian history, we are learning all about Canada in the nineteenth century (between the years 1800 and 1900). At the beginning of this century, Canada was a collection of separate British colonies and was vulnerable to invasion by the newly independent nation of the United States to the south. Yet by the end of the century, Canada was a self-governing country of seven provinces and two territories, with a transcontinental railway that stretched from coast to coast. This class will explore many of the changes that took place during this time.</p><p>➜ LOCATE<br>On a globe or world atlas, find England. Find Canada. What ocean do you have to cross? <br>Find the United States of America. With your finger, trace the line of the border between the United States and Canada.</p><p>➜ READ, NARRATE, &amp; DISCUSS<br>p.31-32 &quot;While the fur traders&quot; - &quot;homes and families.&quot;</p><p>➜ VIEW<br>Map on p.32: &quot;Major battles in the War of 1812&quot;<br>Compare this map to a modern map of Canada. What differences do you notice?<br>Why do you think so many battles in the War of 1812 took place near Niagara Falls and the Great Lakes?</p><p>➜ MAPPING ACTIVITY<br>On your Map of Canada, label Queenston Heights, Toronto (called York in 1812), Montreal, the St. Lawrence River, and the Great Lakes (Lake Ontario, Lake Erie, Lake Huron, Lake Michigan, and Lake Superior).</p>","","https://planning.alveary.org/links.html?id=recfcbGoR5uy9BcFf&term=1&week=1","Lesson","0","FALSE"
"alveary-recfcbGoR5uy9BcFf","alveary-recLCdCVYVAvG4zKR","2","1","20m Canadian History: Grades 2-4 - Lesson 2","<p>War of 1812, cont.<br>⍞ Materials: Famous Canadian Stories, Spirit of Canada</p><p>➜ RECAP<br>What do you remember about why the War of 1812 started?</p><p>READ, NARRATE, &amp; DISCUSS<br>1\. Famous Canadian Stories<br>∞ PDF Link: The Battle of Queenston Heights<br>p.139-143 &quot;It was early&quot; - &quot;the United States of America.&quot;</p><p>2\. Spirit of Canada<br>p.58-59 &quot;The Battle of Queenston&quot; - &quot;know your name.&quot;</p><p>➜ LISTENING ACTIVITY<br>Listen to Stan Rogers sing his song &quot;MacDonnell on the Heights.&quot;<br>∞ Music Link: MacDonnell on the Heights</p><p>➜ VIEW<br>1\. Spend some time looking at this engraving of The Battle of Queenston Heights. The original engraving this one is based on is attributed to Captain James Dennis, who fought in the battle. The Americans (in blue) are crossing the Niagara River to Queenston (the right side) from Lewiston (the left side).<br>∞ Image Link: The Battle of Queenston Heights</p><p>2\. Visit Brock's Monument at Queenston Heights. You don't need to watch the whole video, but the drone footage provides an amazing view!<br>∞ Video Link: Canada's Most Imposing War Memorial</p><p>• EXTRA HELPING<br>Watch a Heritage Minute about how the Grand River warriors helped to defeat the Americans at Queenston Heights after the death of General Brock.<br>∞ Video Link: Heritage Minutes: Queenston Heights</p>","","https://planning.alveary.org/links.html?id=recfcbGoR5uy9BcFf&term=1&week=2","Lesson","0","FALSE"
"alveary-recfcbGoR5uy9BcFf","alveary-recD1G0nmf0GzCOB0","3","1","20m Canadian History: Grades 2-4 - Lesson 3","<p>Laura Secord<br>⍞ Materials: Kids Book of Canadian History, Famous Canadian Stories</p><p>➜ RECAP<br>What do you remember from last week about the Battle of Queenston Heights?</p><p>➜ READ, NARRATE, &amp; DISCUSS<br>1\. Kids Book of Canadian History<br>p.33 &quot;Laura Secord walked&quot; - &quot;in a common cause.&quot;</p><p>2\. Famous Canadian Stories<br>∞ PDF Link: Laura Secord<br>p.147-150 &quot;In a churchyard&quot; - &quot;heroines of Canadian history.&quot;</p><p>• How do you think Laura Secord must have felt on her long walk?</p><p>➜ VIEW<br>Visit the monument to Laura Secord.<br>∞ Image Link: Laura Ingersoll Secord Monument</p>","","https://planning.alveary.org/links.html?id=recfcbGoR5uy9BcFf&term=1&week=3","Lesson","0","FALSE"
"alveary-recfcbGoR5uy9BcFf","alveary-recGeGpsGnsFKDKth","4","1","20m Canadian History: Grades 2-4 - Lesson 4","<p>Laura Secord, cont.<br>⍞ Materials: Laura Secord's Brave Walk</p><p>➜ RECAP<br>What do you recall about Laura Secord from the last class?</p><p>➜ INTRO<br>Over the next two lessons, you will read _Laura Secord's Brave Walk, _an engaging and beautifully illustrated story book that brings this episode of Canadian history to life by introducing young readers to the War of 1812 through the courage of one Canadian.</p><p>➜ READ, NARRATE, &amp; DISCUSS<br>&quot;'Laura,' James Secord said&quot; - &quot;and up the stairs.&quot;</p><p>• What do you think life was like for Laura Secord and her family in Queenston? Spend some time looking at the illustrations today to look for clues that can help answer this question.</p>","","","Lesson","0","FALSE"
"alveary-recfcbGoR5uy9BcFf","alveary-recXmI74VDdaU8kKA","5","1","20m Canadian History: Grades 2-4 - Lesson 5","<p>Laura Secord, cont.; End of War<br>⍞ Materials: Laura Secord's Brave Walk, Kids Book of Canadian History</p><p>➜ RECAP<br>What did you read about Laura Secord last week?</p><p>PREP: Read the &quot;Author's Historical Note&quot; on the last page of the book and decide how much information you'd like to share with your students.</p><p>➜ READ, NARRATE, &amp; DISCUSS<br>1\. Laura Secord's Brave Walk<br>&quot;'James,' Laura whispered&quot; - &quot;She had done it!&quot;</p><p>2\. Kids Book of Canadian History<br>p.33 &quot;The War Ends&quot; - &quot;hide the burn marks.&quot;</p><p>• Why do you think the War of 1812 helped people living in the various British colonies to start thinking of themselves as Canadians?</p><p>➜ VIEW<br>Laura Secord took her message to Captain James FitzGibbon, an Irishman who served in the British army and was mentored by General Brock. FitzGibbon survived the war and eventually returned to England. He sat for a photo in his army uniform around 1860, when he was in his 80s. <br>∞ Image Link: Colonel James FitzGibbon<br>Did you know photographs have been around for nearly 200 years? Initially, photographs had very long exposure times, so people needed to sit very still with an unchanging expression.</p><p>• EXTRA HELPING<br>Watch a Heritage Minute about Laura Secord's journey.<br>∞ Video Link: Heritage Minutes: Laura Secord</p>","","https://planning.alveary.org/links.html?id=recfcbGoR5uy9BcFf&term=1&week=5","Lesson","0","FALSE"
"alveary-recfcbGoR5uy9BcFf","alveary-rec9tUQI9nDOWu9dY","6","1","20m Canadian History: Grades 2-4 - Lesson 6","<p>The Red River Settlement<br>⍞ Materials: Kids Book of Canadian History, Famous Canadian Stories, map or atlas of Canada</p><p>➜ RECAP<br>What did you read about Laura Secord last week?</p><p>➜INTRO<br>While the War of 1812 was at its height in Upper and Lower Canada to the east, a Scottish nobleman named Thomas Douglas, 5th Earl of Selkirk, was working to establish a colony on the prairies to the west, at the intersection of the Red and Assiniboine Rivers, near what is now Winnipeg. Selkirk had received a large grant of land from the Hudson Bay Company and wanted to create a farming community to support many poor Scottish highlanders and Irish peasants, who had lost their homes and livelihoods due to various upheavals at the end of the eighteenth century. This community, known as the Red River Settlement, would come to play a large role in the history of immigrants to the prairies, Métis peoples, the province of Manitoba, and the history of Canada as a nation.</p><p>➜ READ, NARRATE, &amp; DISCUSS<br>1\. The Kids Book of Canadian History<br>p.30 &quot;The Red River Settlement&quot; - &quot;centre of Métis life.&quot;</p><p>2\. Famous Canadian Stories<br>∞ PDF Link: The Selkirk Settlement<br>p.169-172 &quot;'My Lord'&quot; - &quot;one hundred and forty years ago.&quot;</p><p>➜ MAPPING ACTIVITY<br>Look at a map or atlas of Manitoba and locate the Red River and Fort Douglas (present-day Winnipeg). Find the Hudson Bay on the same map so you can see the route the settlers took.<br>Compare this modern map to a map of the land given to Selkirk:<br>∞ Map Link: Map showing the Selkirk Land Grant in 1811<br>On your Map of Canada, draw and label the Red River, and mark Winnipeg and Hudson's Bay.</p><p>• DEFINITIONS<br>Métis: from a French adjective meaning &quot;mixed,&quot; the word Métis refers to people who have both Indigenous and European ancestry. The Métis are one of three recognized Indigenous groups, the others being First Nations and Inuit.</p>","","https://planning.alveary.org/links.html?id=recfcbGoR5uy9BcFf&term=1&week=6","Lesson","0","FALSE"
"alveary-recfcbGoR5uy9BcFf","alveary-recA41YbHwjqolvOU","7","1","20m Canadian History: Grades 2-4 - Lesson 7","<p>Rebellions of 1837-1838<br>⍞ Materials: The Kids Book of Canadian History, Spirit of Canada</p><p>➜ RECAP<br>What did you learn last week about the Red River Settlement?</p><p>➜ INTRO<br>How do we choose our government in Canada and in our provinces and territories? Do you think it has always been this way in Canada? Today we will learn about frustrations towards the government in the 1830s, which would eventually lead to the form of government we recognize today.</p><p>➜ VIEW<br>Remember that in 1791, the large Province of Quebec was divided into Upper and Lower Canada, roughly corresponding to the provinces of Ontario and Quebec today.<br>∞ Link: Upper &amp; Lower Canada in 1791</p><p>➜ READ, NARRATE, &amp; DISCUSS<br>1\. The Kids Book of Canadian History<br>p.34-35 &quot;During the 1820s&quot; - &quot;given any more power.&quot;</p><p>2\. Spirit of Canada<br>p.60-62 &quot;In the years after&quot; - &quot;letter R in his pocket.&quot;</p>","","https://planning.alveary.org/links.html?id=recfcbGoR5uy9BcFf&term=1&week=7","Lesson","0","FALSE"
"alveary-recfcbGoR5uy9BcFf","alveary-recjsyaWMETTvZzyk","8","1","20m Canadian History: Grades 2-4 - Lesson 8","<p>Rebellions of 1837-1838, cont.<br>⍞ Materials: Kids Book of Canadian History, Spirit of Canada</p><p>➜ RECAP<br>Why were the settlers in Upper and Lower Canada unhappy?</p><p>➜ READ, NARRATE, &amp; DISCUSS<br>1\. The Kids Book of Canadian History<br>p.36-37 &quot;Rebellion in Lower Canada&quot; - &quot;Newfoundland in 1855.&quot;</p><p>• How did the colonies of British North America change after 1841 and again after 1848?</p><p>2\. The Spirit of Canada<br>p.63 &quot;William Lyon Mackenzie&quot; - &quot;the day and the hour.&quot;</p><p>3\. The Spirit of Canada<br>p.64-65 &quot;Un Canadien errant&quot; - &quot;last dying breath.&quot;<br>∞ Music Link: Un canadien errant</p><p>• EXTRA HELPING<br>Watch two Heritage Minutes about the reforms that were brought about by the rebellions in the 1830s:<br>∞ Video Link: Heritage Minutes: Baldwin &amp; LaFontaine <br>(Parents may wish to preview this one for younger students since it does dramatize a violent scene)</p><p>∞ Video Link: Heritage Minutes: Responsible Government<br>Queen Victoria voices her approval of the reforms.</p>","","https://planning.alveary.org/links.html?id=recfcbGoR5uy9BcFf&term=1&week=8","Lesson","0","FALSE"
"alveary-recfcbGoR5uy9BcFf","alveary-recgD81azhYTOYFKj","9","1","20m Canadian History: Grades 2-4 - Lesson 9","<p>Settlers - Canadian Crusoes<br>⍞ Materials: Spirit of Canada</p><p>➜ RECAP<br>What did you learn last week about responsible government?</p><p>➜ INTRO<br>Have you ever been camping? What do you need to bring with you if you are going to live outdoors? What if you didn't have any stores nearby? What would you use for clothing, shelter, and food?</p><p>➜ READ, NARRATE, &amp; DISCUSS<br>p.76-81 &quot;The first population boom&quot; - &quot;or any liquid.&quot;</p>","","","Lesson","0","FALSE"
"alveary-recfcbGoR5uy9BcFf","alveary-rec72OiiNe1M4xFLR","10","1","20m Canadian History: Grades 2-4 - Lesson 10","<p>Settlers - Roughing it in the Bush<br>⍞ Materials: Spirit of Canada</p><p>➜ RECAP<br>What do you remember about what you learned last week?</p><p>➜ READ, NARRATE, &amp; DISCUSS<br>p.82-85 &quot;Susanna Moodie&quot; - &quot;try to grow.&quot;</p><p>• Margaret Atwood's poem describes Susanna Moodie's experience of two different fires. How does she use repeated words and images in the poem to show the similarity of the two fires?</p>","","","Lesson","0","FALSE"
"alveary-recfcbGoR5uy9BcFf","alveary-rec6r4Cu5bznLqj5d","11","1","20m Canadian History: Grades 2-4 - Lesson 11","<p>The Northwest Passage<br>⍞ Materials: Famous Canadian Stories, Spirit of Canada</p><p>➜ RECAP<br>What do you remember about what you learned last week?</p><p>➜ INTRO<br>After the Treaty of Ghent (signed in 1814), which ended the war between Britain and the United States, and the Treaty of Paris (signed in 1815) that effectively ended the Napoleonic Wars, Britain was left with a large navy and fleet with much less to do. One new peacetime venture for the British Navy was scientific exploration, and numerous ships were sent to remote parts of the globe, including several ships attempting to find the Northwest Passage through the Arctic. Today we will read about one ill-fated voyage, Sir John Franklin's expedition.</p><p>➜ READ, NARRATE, &amp; DISCUSS<br>1\. Famous Canadian Stories<br>∞ PDF Link: Franklin Expedition<br>p.40-42 &quot;The greatest mystery&quot; - &quot;for another man.&quot;</p><p>2\. Spirit of Canada<br>p.44-45 &quot;The story of John Franklin&quot; - &quot;back home again&quot;<br>Listen to a recording of Stan Rogers singing his folk song about the search for the Northwest Passage.<br>∞ Music Link: Northwest Passage</p><p>• How many explorers' names do you recognize in the song?</p>","","https://planning.alveary.org/links.html?id=recfcbGoR5uy9BcFf&term=1&week=11","Lesson","0","FALSE"
"alveary-recfcbGoR5uy9BcFf","alveary-recYHQspJW3r57GpB","12","1","20m Canadian History: Grades 2-4 - Lesson 12","<p>Exam Week</p><p>➜ EXAMS<br>Answer question(s) related to the course.</p><p>Questions will come from:<br>Famous Canadian Stories<br>Laura Secord's Brave Walk<br>The Spirit of Canada</p>","<p>★ Canadian History: Grades 2-4 — TERM 1 EXAM QUESTIONS<br>· (Famous Canadian Stories and Laura Secord's Brave Walk) Tell the story of Laura Secord. OR (The Spirit of Canada) Describe how the characters in Catharine Parr Traill's Canadian Crusoes were able to survive in the forest.</p>","","Exam","0","FALSE"
"alveary-recfcbGoR5uy9BcFf","alveary-reciRrf6wfdmWPWMk","13","1","20m Canadian History: Grades 2-4 - Lesson 13","<p>Life at Mid-Century <br>⍞ Materials: Kids Book of Canadian History, Spirit of Canada</p><p>PREP: In The Spirit of Canada, parents and teachers may wish to preview the letter and decide how best to discuss its difficult topics with their younger students.</p><p>➜ INTRO<br>In Term 2, we will learn about what life was like around the time of Canada's Confederation on July 1, 1867.</p><p>➜ READ, NARRATE, &amp; DISCUSS<br>1\. The Kids Book of Canadian History<br>p.38-39 &quot;The 1840s to 1860s&quot; - &quot;to farm or start businesses.&quot;</p><p>2\. The Spirit of Canada<br>p.107-108 &quot;Shinguacouse was an Ojibwa&quot; - &quot;pale-faced bad brother.&quot;</p>","","","Lesson","0","FALSE"
"alveary-recfcbGoR5uy9BcFf","alveary-recjSfLzSLxNaFyev","14","1","20m Canadian History: Grades 2-4 - Lesson 14","<p>Life at Mid-Century - Underground Railroad<br>⍞ Materials: Kids Book of Canadian History, Spirit of Canada</p><p>➜ RECAP<br>What do you remember from last week about what life was like in the 1840s and 1850s?</p><p>➜ READ, NARRATE, &amp; DISCUSS<br>1\. The Kids Book of Canadian History<br>p.39 &quot;After 1834&quot; - &quot;others to safety.&quot;</p><p>2\. The Spirit of Canada<br>p.66-68 &quot;There were black slaves&quot; - &quot;the drinkin' gourd.&quot;<br>Listen to a recording of Follow the Drinkin' Gourd.<br>∞ Music Link: Eric Bibb: Follow the Drinking Gourd</p><p>3\. The Spirit of Canada<br>p.69-70 &quot;The Underground Railroad&quot; - &quot;coloured men are free.&quot;</p><p>4\. The Spirit of Canada<br>(This reading is optional, if you have extra time during the lesson. Parents and teachers may want to preview the story for younger students.)<br>p.71-75 &quot;Even in Canada&quot; - &quot;'My dearest friend,' it began....&quot;</p>","","https://planning.alveary.org/links.html?id=recfcbGoR5uy9BcFf&term=2&week=14","Lesson","0","FALSE"
"alveary-recfcbGoR5uy9BcFf","alveary-recYefz0ep1kDXaLW","15","1","20m Canadian History: Grades 2-4 - Lesson 15","<p>Life at Mid-Century, cont.; Logging<br>⍞ Materials: Kids Book of Canadian History, Spirit of Canada</p><p>➜ RECAP<br>What do you remember from the readings last week?</p><p>➜ INTRO<br>The 1840s and 1850s were a time of great changes in the colonies; as more and more people immigrated to Canada, the population grew, and with it grew industries, but also the need for finding places for people to live and work.</p><p>➜ READ, NARRATE, &amp; DISCUSS<br>1\. The Kids Book of Canadian History<br>p.40-41 &quot;Everything east of British Columbia&quot; - &quot;the Oregon Territory.&quot;</p><p>2\. The Spirit of Canada<br>p.86 &quot;Forest have long&quot; - &quot;their traditional homelands.&quot;<br>p.89-93 &quot;In the novel&quot; - &quot;such risks again.&quot;<br>p.94-95 &quot;Lumbering in British Columbia&quot; - &quot;run the hotcakes raw.&quot;<br>Listen along as you read the words to this song!<br>∞ Music Link: Way Up the Ucletaw</p><p>➜ VIEW<br>Spend a few moments looking at this painting of the Marco Polo clipper ship by the British painter Montague Dawson. How does he show the viewer that this ship is in motion?<br>∞ Image Link: The Marco Polo by Montague Dawson</p><p>• EXTRA HELPING<br>The sailing ship Marco Polo met its fate in a storm off the coast of Cavendish, and its running aground was witnessed by a young L.M. Montgomery, who later wrote an essay about it for the Montreal Daily Witness (March 5, 1891). You can read her essay here.<br>∞ PDF Link: The Wreck of the Marco Polo</p>","","https://planning.alveary.org/links.html?id=recfcbGoR5uy9BcFf&term=2&week=15","Lesson","0","FALSE"
"alveary-recfcbGoR5uy9BcFf","alveary-recGWKoqehuLcm8qp","16","1","20m Canadian History: Grades 2-4 - Lesson 16","<p>Confederation<br>⍞ Materials: The Kids Book of Canadian History, Born!</p><p>➜ RECAP<br>What do you remember from the readings from last week?</p><p>➜ INTRO<br>How did a group of colonies with so many differences—geographic, linguistic, cultural, historical, and ethnic—join together to form the country we now call Canada? Over the next few weeks, we will read about the events leading up to July 1, 1867, and see the famous Charlottetown Conference of 1864 through the eyes of nine-year old twins Gabriel and Grace, who are eagerly anticipating the birth of new kittens, a new foal, and a new country!</p><p>➜ READ, NARRATE, &amp; DISCUSS<br>1\. The Kids Book of Canadian History<br>p.42-43 &quot;By the 1860s&quot; - &quot;to the Pacific Ocean.&quot;</p><p>2\. Born!<br>p.2-8 &quot;Dear Reader&quot; - &quot;two buckets of fresh water.&quot;</p><p>• IMPORTANT DATES<br>George-Étienne Cartier (1814-1873)</p><p>Sir John A. Macdonald (1815-1891)</p><p>George Brown (1818-1880)</p>","","","Lesson","0","FALSE"
"alveary-recfcbGoR5uy9BcFf","alveary-recSBpOdluCJMD0gh","17","1","20m Canadian History: Grades 2-4 - Lesson 17","<p>Confederation, cont.<br>⍞ Materials: Born!</p><p>➜ RECAP<br>What do you remember from last week about the events leading up to Canada's Confederation?</p><p>➜ READ, NARRATE, &amp; DISCUSS<br>p.9-21 &quot;There was a commotion&quot; - &quot;if you need me, _ma chère_.&quot;</p><p>➜ VIEW<br>1\. Learn more about the artist Robert Harris, who appears as a character in Born!<br>∞ Link: Robert Harris - National Gallery of Canada<br>In 1883, Robert Harris was commissioned to paint a work commemorating the 1864 Quebec Conference, titled Meeting of the Delegates of British North America to Settle the Terms of Confederation, or, more commonly, The Fathers of Confederation. The original painting was destroyed in the Parliament Hill fire of 1916, but a preparatory sketch still exists. His other most famous painting - Meeting of the School Trustees - appeared on a Canadian postage stamp in 1980.<br>∞ Image Link: Meeting of the School Trustees</p><p>2\. A clearer view of the circus advertisement.<br>∞ Image Link: Slaymaker &amp; Nichols Olympic Circus</p>","","https://planning.alveary.org/links.html?id=recfcbGoR5uy9BcFf&term=2&week=17","Lesson","0","FALSE"
"alveary-recfcbGoR5uy9BcFf","alveary-recyDvtnXJyfGTBWh","18","1","20m Canadian History: Grades 2-4 - Lesson 18","<p>Confederation, cont.<br>⍞ Materials: Born!</p><p>➜ RECAP<br>What do you remember from the reading last week?</p><p>➜ READ, NARRATE, &amp; DISCUSS<br>p.22-32 &quot;Because of the great excitement&quot; - &quot;and went home.&quot;</p><p>➜ VIEW<br>Look at this map of what British North America looked like before the Confederation of Canada. What do you notice that is different from today?<br>∞ Map Link: British North America circa 1823 map</p>","","https://planning.alveary.org/links.html?id=recfcbGoR5uy9BcFf&term=2&week=18","Lesson","0","FALSE"
"alveary-recfcbGoR5uy9BcFf","alveary-recB105V6deBD93Tm","19","1","20m Canadian History: Grades 2-4 - Lesson 19","<p>Confederation, cont.<br>⍞ Materials: Born!</p><p>➜ RECAP<br>What do you remember from the reading last week?</p><p>➜ READ, NARRATE, &amp; DISCUSS<br>p.33-46 &quot;Late in the afternoon&quot; - &quot;Canada was only an idea.&quot;</p>","","","Lesson","0","FALSE"
"alveary-recfcbGoR5uy9BcFf","alveary-recO0FHPil1jkGBCs","20","1","20m Canadian History: Grades 2-4 - Lesson 20","<p>Confederation, cont.<br>⍞ Materials: Spirit of Canada</p><p>➜ RECAP<br>What do you remember from the reading last week?</p><p>➜ READ, NARRATE, &amp; DISCUSS<br>1\. p.114-116 &quot;On July 1, 1867&quot; - &quot;the north-west.&quot;</p><p>• How do you think you would have felt if you were alive back then to celebrate Canada's Confederation? What activities sound the most fun to you?</p><p>2\. p.117-118 &quot;When the Charlottetown Conference&quot; - &quot;birthright was sold.&quot;<br>Listen to a performance of the Anti-Confederation Song, recorded only ten years after Newfoundland joined Canada in 1949.<br>∞ Music Link: Alan Mills - Anti-Confederation Song (1959)</p>","","https://planning.alveary.org/links.html?id=recfcbGoR5uy9BcFf&term=2&week=20","Lesson","0","FALSE"
"alveary-recfcbGoR5uy9BcFf","alveary-rec15iaQjfaGW7Eoh","21","1","20m Canadian History: Grades 2-4 - Lesson 21","<p>Red River Rising - Manitoba<br>⍞ Materials: The Kids Book of Canadian History, The Spirit of Canada</p><p>➜ RECAP<br>What do you remember from the reading last week about July 1, 1867?</p><p>➜ READ, NARRATE, &amp; DISCUSS<br>1\. The Kids Book of Canadian History<br>p.45-46 &quot;Two years later&quot; - &quot;Nile River in Egypt.&quot;</p><p>2\. The Spirit of Canada (optional)<br>p.109-111 &quot;Willie Dunn&quot; - &quot;which it does entail.&quot; You can listen along at the link below:<br>∞ Music Link: Ballad of Crowfoot<br>As it is described in The Spirit of Canada, The Ballad of Crowfoot is a &quot;haunting&quot; reflection on how detrimental many of Canada's policies and treaties were for Indigenous people over the course of one man's life in the nineteenth century. This tragic song may be best suited for older students.</p><p>• IMPORTANT DATES<br>Louis Riel (1844-1885)</p>","","https://planning.alveary.org/links.html?id=recfcbGoR5uy9BcFf&term=2&week=21","Lesson","0","FALSE"
"alveary-recfcbGoR5uy9BcFf","alveary-recTAOTpsOMZ1VkOY","22","1","20m Canadian History: Grades 2-4 - Lesson 22","<p>From Sea to Sea<br>⍞ Materials: The Kids Book of Canadian History, Famous Canadian Stories</p><p>➜ RECAP<br>What do you remember from the reading last week?</p><p>➜ READ, NARRATE, &amp; DISCUSS<br>1\. The Kids Book of Canadian History<br>p.47-48 &quot;One year after&quot; - &quot;he could do it.&quot;</p><p>2\. Famous Canadian Stories <br>∞ PDF Link: Alexander Graham Bell<br>p.278-280 &quot;On March 10, 1876&quot; - &quot;the telephone had come.&quot;</p><p>• EXTRA HELPING<br>Learn more about the history of &quot;O Canada&quot; by reading the lyrics of previous versions.<br>∞ Article Link: O Canada</p><p>• IMPORTANT DATES<br>Alexander Graham Bell (1847-1922)</p>","","https://planning.alveary.org/links.html?id=recfcbGoR5uy9BcFf&term=2&week=22","Lesson","0","FALSE"
