"course_custom_id","assignment_custom_id","assignment_week","assignment_day","assignment_name","assignment_description","assignment_teachersNote","assignment_linksUrl","assignment_type","assignment_duration","assignment_graded"
"alveary-rech2GA4NRK0pGrqO","alveary-rec6TS5XDsrsmJm2h","8","1","30m Technology - Lesson 15","<p>Graphic Design Project: Logo Design<br>⍞ Materials: your Google Docs Learning Journal, HTML Word Journal, and paper/pencil</p><p>➜ THINK <br>Consider the Apple Logo, Nike Swoosh, Coca-Cola Logo, McDonald's Golden Arches, Google Logo, or WWF Panda Logo again.</p><p>➜ WATCH <br>∞ Video Link: Beginning Graphic Design: Branding and Identity (7 mins)</p><p>➜ DRAW        <br>Imagine you are starting a business of your own. On a blank piece of paper, sketch ideas for a logo for your business.</p><p>➜ WATCH <br>∞ Video Link: How to Make Your Own LOGO with Canva (Watch only the first 5 minutes)<br>You will be expected to write about what you watch in this course, so pause the video and jot down notes when you notice something noteworthy.</p><p>➜ NOTEBOOK        <br>Enter the term &quot;kerning&quot; into your HTML Word Journal</p><p>➜ DRAW        <br>∞ Link: Canva Logo Maker<br>Use Canva's logo maker and design a logo for your business.</p>","","https://planning.alveary.org/links.html?id=rech2GA4NRK0pGrqO&term=1&week=8","Lesson","0","FALSE"
"alveary-rech2GA4NRK0pGrqO","alveary-rec8W1WLQzFRetwjU","8","2","30m Technology - Lesson 16","<p>Graphic Designers: Paul Rand<br>⍞ Materials: your Google Docs Learning Journal and Google Slides Technology Timeline</p><p>➜ INTRO<br>Now that you know a little about graphic design and have had an introduction to creating designs in Canva, I want to introduce you to an influential American graphic designer, best known for creating iconic logos for brands such as IBM, ABC, and UPS: Paul Rand. He pioneered modern corporate design by combining simplicity with creative vision, emphasizing the power of images to communicate a brand’s essence. His work greatly influenced visual communication, advocating for design that was both functional and aesthetically pleasing. Rand believed in the importance of clear, simple designs to communicate complex ideas effectively.</p><p>➜ THINK<br>∞ Image Link: IBM, ABC, and UPS logos<br>Use the next lesson section of your Google Docs Learning Journal to answer the following question.<br>• Observe the IBM, ABC, and UPS logos. What do you notice?</p><p>➜ WATCH<br>∞ Video Link: Celebrating The Life Of The Greatest Graphic Designer-Paul Rand (16 mins)<br>You will be expected to write about what you watch in this course, so pause the video and jot down notes when you notice something noteworthy.</p><p>➜ NOTEBOOK        <br>Open your Google Slides Technology Timeline; navigate to the section corresponding to the relevant date, and create an entry about the person you studied.</p><p>➜ REFLECT<br>Use your Google Docs Learning Journal to reflect on what you are learning and to record any questions you have on the topic of graphic design.</p>","","https://planning.alveary.org/links.html?id=rech2GA4NRK0pGrqO&term=1&week=8","Lesson","0","FALSE"
"alveary-rech2GA4NRK0pGrqO","alveary-recpZVVFrgiVrzxqd","9","1","30m Technology - Lesson 17","<p>Graphic Design Project: Book Cover<br>⍞ Materials: paper/pencil</p><p>➜ INTRO        <br>Today, you will create a design for the cover of your favorite book.</p><p>➜ THINK <br>What is your favorite book?  On a blank piece of paper, brainstorm on the important words and images or icons that will appear in your design; then work out how you will lay it out.</p><p>➜ WATCH<br>∞ Video Link: Professional Book Cover Design (10 mins)<br>You will be expected to write about what you watch in this course, so pause the video and jot down notes when you notice something noteworthy.</p><p>➜ DRAW        <br>∞ Link: Canva Book Cover<br>Design the cover of your favorite book.</p>","","https://planning.alveary.org/links.html?id=rech2GA4NRK0pGrqO&term=1&week=9","Lesson","0","FALSE"
"alveary-rech2GA4NRK0pGrqO","alveary-rec5ZUKvbfsQq03La","9","2","30m Technology - Lesson 18","<p>Graphic Designers: Saul Bass<br>⍞ Materials: your Google Docs Learning Journal and Google Slides Technology Timeline</p><p>➜ INTRO<br>Now that you have learned about Paul Rand and had an introduction to creating logos and book covers in Canva, I want to introduce you to Saul Bass, who was a groundbreaking graphic designer and filmmaker, renowned for his work in movie posters and title sequences. His minimalist style transformed film graphics, making them integral to storytelling. Famous works include the logos for AT&amp;T and the Academy Awards, as well as iconic opening sequences for movies like Psycho and Anatomy of a Murder. Bass’s innovative approach combined art and design, creating visual masterpieces that conveyed deep meaning with simplicity.</p><p>➜ THINK<br>Use the next lesson section of your Google Docs Learning Journal to answer the following question: In your opinion, how might designing a movie poster be similar to designing a book cover, and how might it be different?</p><p>➜ WATCH<br>∞ Video Link: Saul Bass's Movie Posters (8 mins)<br>You will be expected to write about what you watch in this course, so pause the video and jot down notes when you notice something noteworthy.</p><p>➜ NOTEBOOK        <br>Open your Google Slides Technology Timeline; navigate to the section corresponding to the relevant date, and create an entry about the person you studied.</p><p>➜ REFLECT<br>Use your Google Docs Learning Journal to reflect on what you are learning and to record any questions you have on the topic of graphic design. If you have any time left over, consider updating your book cover from last week to reflect what you have learned from Saul Bass's designs.</p>","","https://planning.alveary.org/links.html?id=rech2GA4NRK0pGrqO&term=1&week=9","Lesson","0","FALSE"
"alveary-rech2GA4NRK0pGrqO","alveary-rec27PjEWPKxm8Sha","10","1","30m Technology - Lesson 19","<p>Graphic Design Project: Movie Poster<br>⍞ Materials: paper/pencil</p><p>➜ INTRO        <br>Similar to a previous lesson, you will design a poster of your favorite movie.</p><p>➜ THINK<br>What is your favorite movie? On a blank piece of paper, brainstorm on the important words and images or icons that will appear in your design; then work out how you will lay it out.</p><p>➜ WATCH<br> ∞ Video Link: Create Professional Hollywood Movie Posters (9 mins)<br>You will be expected to write about what you watch in this course, so pause the video and jot down notes when you notice something noteworthy.</p><p>➜ DRAW        <br>∞ Link: Canva Movie Poster<br>Design your poster for your favorite movie.</p>","","https://planning.alveary.org/links.html?id=rech2GA4NRK0pGrqO&term=1&week=10","Lesson","0","FALSE"
"alveary-rech2GA4NRK0pGrqO","alveary-recfPAjn0mmt6pnbe","10","2","30m Technology - Lesson 20","<p>Graphic Design: Typography and Color<br>⍞ Materials: your Google Docs Learning Journal and your HTML Word Journal</p><p>➜ THINK<br>Use your Google Docs Learning Journal to quickly consider the following question: Some logos are just icons, and some are just text; what are the advantages of each?</p><p>➜ WATCH:<br>∞ Video Link: Beginning Graphic Design: Typography (6 mins)<br>∞ Video Link: Beginning Graphic Design: Color (7 mins)<br>You will be expected to write about what you watch in this course, so pause the video and jot down notes when you notice something noteworthy.</p><p>➜ NOTEBOOK        <br>Enter 3 of the following terms or group of terms into your HTML Word Journal:<br>• serif<br>• hierarchy, leading, tracking, and kerning <br>• hue, saturation, and value<br>• monochromatic, analogous, complementary, and triadic color schemes</p><p>➜ REFLECT: <br>Use your Google Docs Learning Journal to reflect on how you can use and combine various fonts to make your media stand out.</p><p>• EXTRA HELPING<br>∞ Video Link: The Art of Typography</p>","","https://planning.alveary.org/links.html?id=rech2GA4NRK0pGrqO&term=1&week=10","Lesson","0","FALSE"
"alveary-rech2GA4NRK0pGrqO","alveary-rec0tNilo9ektSesJ","11","1","30m Technology - Lesson 21","<p>Graphic Design Project: Infographic on the Seven Fundamental Elements of Design<br>⍞ Materials: your Google Docs Learning Journal,  paper/pencil, and infographics 1, 2, and 3</p><p>➜ INTRO        <br>In Lesson 14, you were introduced to the seven fundamental elements of design. You will continue thinking and learning about how these elements can work together to create infographics.</p><p>➜ THINK<br>Use your Google Docs Learning Journal to consider how the seven fundamental elements of design are used in the following infographics: <br>∞ Image Link: Infographic #1<br>∞ Image Link: Infographic #2<br>∞ Image Link: Infographic #3</p><p>➜ WATCH<br>∞ Video Link: How to Create an Infographic  (10 mins)<br>You will be expected to write about what you watch in this course, so pause the video and jot down notes when you notice something noteworthy.</p><p>➜ BRAINSTORM        <br>Use a blank piece of paper/pencil to brainstorm how you can create an infographic that communicates the seven fundamental elements of design for future students. Use the headings LINE, SHAPE, COLOR, TEXTURE, SPACE, FORM, and VALUE in your infographic. Consider how the viewer's eye will travel from one element to the next. How will you incorporate a &quot;new angle&quot;?</p><p>➜ DRAW        <br>∞ Link: Canva Infographic Maker<br>Create your infographic communicating the seven fundamental elements of design.</p>","","https://planning.alveary.org/links.html?id=rech2GA4NRK0pGrqO&term=1&week=11","Lesson","0","FALSE"
"alveary-rech2GA4NRK0pGrqO","alveary-reckh7bVMOihv6BTS","11","2","30m Technology - Lesson 22","<p>Graphic Design: Layout, Composition, and Images<br>⍞ Materials: your Google Docs Learning Journal and your HTML Word Journal</p><p>➜ THINK<br>Use your Google Docs Learning Journal to quickly consider the following question: <br>• When designers talk about &quot;negative space,&quot; what do you think they mean?</p><p>➜ WATCH<br>∞ Video Link: Beginning Graphic Design: Layout and Composition (5 mins) <br>∞ Video Link: Beginning Graphic Design: Images (6 mins)<br>You will be expected to write about what you watch in this course, so pause the video and jot down notes when you notice something noteworthy.</p><p>➜ NOTEBOOK        <br>Enter 3 of the following terms or group of terms into your HTML Word Journal: &quot;Proximity,&quot; &quot;White space,&quot; &quot;Alignment,&quot; &quot;Contrast,&quot; and &quot;Repetition,&quot; &quot;raster graphics,&quot; &quot;vector graphics,&quot; &quot;cropping and resizing,&quot; and  &quot;brightness, saturation, contrast, and color.&quot;</p><p>➜ REFLECT<br>Use your Google Docs Learning Journal to reflect on what you believe to be the most important aspect, concept, or element to consider when designing media.</p>","","https://planning.alveary.org/links.html?id=rech2GA4NRK0pGrqO&term=1&week=11","Lesson","0","FALSE"
"alveary-rech2GA4NRK0pGrqO","alveary-recnEN7FvtDvwaG5Y","12","1","30m Technology - Lesson 23","<p>Exam Week</p><p>➜ EXAMS<br>Answer question(s) related to course. You will use this link during the exam: <br>∞ Link: Canva Infographic</p>","<p>★ Technology — TERM 1 EXAM QUESTIONS<br>· Do you remember learning about the invention of HTML and its creator, Sir Tim Berners-Lee, at the start of this term? Open your Google Slides Technology Timeline; navigate to the section corresponding to the relevant date, and create an entry about him.</p><p>· Using the Canva infographic maker, create an infographic about HTML for print and another one for sharing online. <br>1. Using your pencil and paper, brainstorm everything you know about HTML.  <br>2. Things to consider when planning your infographic: HTML facts and basic tags, describing what basic tags do, how you will use the seven fundamental elements of design, what fonts, colors, and images you will use, and how it will be laid out.<br>3. ∞ Quick Link: Canva Infographic Maker</p><p>· Share the media you created this term that best demonstrates the concepts we covered. <br>1. Demonstrate how you intentionally considered the concepts of line, shape, color, texture, space, value, and form<br>2. Explain your reason for your choice of fonts<br>3. Describe what color scheme is employed and how it is balanced.<br>4. Explain your intention with the layout.</p>","https://planning.alveary.org/links.html?id=rech2GA4NRK0pGrqO&term=1&week=12","Exam","0","FALSE"
"alveary-rech2GA4NRK0pGrqO","alveary-recdOkosBtkH1ljys","12","2","30m Technology - Lesson 24","<p>Exam Week</p><p>➜ EXAMS<br>Answer question(s) related to course. You will use this link during the exam: <br>∞ Link: Canva Infographic</p>","<p>★ Technology — TERM 1 EXAM QUESTIONS<br>· Do you remember learning about the invention of HTML and its creator, Sir Tim Berners-Lee, at the start of this term? Open your Google Slides Technology Timeline; navigate to the section corresponding to the relevant date, and create an entry about him.</p><p>· Using the Canva infographic maker, create an infographic about HTML for print and another one for sharing online. <br>1. Using your pencil and paper, brainstorm everything you know about HTML.  <br>2. Things to consider when planning your infographic: HTML facts and basic tags, describing what basic tags do, how you will use the seven fundamental elements of design, what fonts, colors, and images you will use, and how it will be laid out.<br>3. ∞ Quick Link: Canva Infographic Maker</p><p>· Share the media you created this term that best demonstrates the concepts we covered. <br>1. Demonstrate how you intentionally considered the concepts of line, shape, color, texture, space, value, and form<br>2. Explain your reason for your choice of fonts<br>3. Describe what color scheme is employed and how it is balanced.<br>4. Explain your intention with the layout.</p>","https://planning.alveary.org/links.html?id=rech2GA4NRK0pGrqO&term=1&week=12","Exam","0","FALSE"
"alveary-rech2GA4NRK0pGrqO","alveary-recGJDCtC1i5fyzta","13","1","30m Technology - Lesson 25","<p>Self-Assessment<br>⍞ Materials: your Google Docs Learning Journal and HTML Word Journal</p><p>➜ INTRO        <br>You will create your final entry in your Google Docs Learning Journal and reflect on your experience using this tool before exploring Adobe Express and using it to create a Webpage to use as a learning journal throughout this second term.</p><p>➜ THINK<br>Create your final entry in your Google Docs Learning Journal and answer the following question: <br>• What are 3 pros and 2 cons of using Google Docs for creating a learning journal or a weblog (aka blog)?</p><p>➜ WATCH:<br>∞ Video Link: Create an Adobe Express Webpage (12 mins)<br>• You will be expected to write about what you watch in this course, so pause the video and jot down notes when you notice something noteworthy.</p><p>➜ OPEN<br> ∞ Link: Adobe Express Online Journal Maker <br>• Create an Adobe Express Webpage to use as a learning journal throughout this term. Just like last term, each lesson will start with a “THINK” prompt; you will respond using this new Adobe Express journal instead of your Google Docs Learning Journal. Many lessons will end with an opportunity to reflect on what was covered. This is your journal; we encourage you to make it beautiful as you learn more about design throughout this course. Do not share any personal information. Send the URL (link or website address) to your educator so that they can see the updates you make as you go through the lessons.</p><p>➜ REFLECT<br>• Use your new Adobe Express Journal to review what you have learned and completed over the first term of this course, or just write about what you found most interesting or beautiful, and then write about which concepts you would like to learn more about during Term 2.</p>","","https://planning.alveary.org/links.html?id=rech2GA4NRK0pGrqO&term=2&week=13","Lesson","0","FALSE"
"alveary-rech2GA4NRK0pGrqO","alveary-recYioMM6ttI85F1e","13","2","30m Technology - Lesson 26","<p>Introduction to Coding<br>⍞ Materials: your Adobe Express Learning Journal and your HTML Word Journal</p><p>➜ THINK <br>Using your Adobe Express Learning Journal, spend 5 minutes making predictions about what sort of projects you will be working on as you learn the basics of computer coding.</p><p>➜ WATCH <br>∞ Video Link: What is Coding? (11 mins) <br>• You will be expected to write about what you watch in this course, so pause the video and jot down notes when you notice something noteworthy.</p><p>➜ WRITE        <br>Spend 9 minutes entering the following terms into your HTML Word Journal: &quot;coding (aka computer programming)&quot; and &quot;compiler.&quot;</p><p>➜ REFLECT <br>Complete your Adobe Express Learning Journal entry for today by spending 5 minutes answering one of the following questions:<br>• What can coding allow you to do? <br>• Why are there so many different coding languages?</p>","","https://planning.alveary.org/links.html?id=rech2GA4NRK0pGrqO&term=2&week=13","Lesson","0","FALSE"
"alveary-rech2GA4NRK0pGrqO","alveary-recJWadZBcfGA0Ec6","14","1","30m Technology - Lesson 27","<p>Introduction to Coding: Algorithms<br>⍞ Materials: your Adobe Express Learning Journal and your HTML Word Journal</p><p>➜ THINK <br>Using your Adobe Express Learning Journal, spend 5 minutes answering the following question: <br>• What do you think of when you think of the word algorithm?</p><p>➜ WATCH <br>∞ Video Link: Introduction to coding: what is an algorithm? (11 mins)<br>• You will be expected to write about what you watch in this course, so pause the video and jot down notes when you notice something noteworthy.<br>• Spend 9 minutes entering the following 3 terms into your HTML Word Journal: &quot;algorithm,&quot; &quot;pseudocode,&quot; and &quot;program.&quot;</p><p>➜ REFLECT<br>Complete your Adobe Express Learning Journal entry for today by spending 5 minutes answering one of the following questions:<br>• What is an algorithm? <br>• What is the relationship between a program and an algorithm?</p>","","https://planning.alveary.org/links.html?id=rech2GA4NRK0pGrqO&term=2&week=14","Lesson","0","FALSE"
"alveary-rech2GA4NRK0pGrqO","alveary-recw5aU9Os4izlPdM","14","2","30m Technology - Lesson 28","<p>Coding: Introduction to Scratch<br>⍞ Materials: Scratch</p><p>➜ INTRO        <br>You will be introduced to a visual programming language and community designed to help children and young people learn coding while exploring how block coding works.</p><p>➜ WATCH<br>∞ Video Link: Getting Started with Scratch (2 mins)<br>You will be expected to write about what you watch in this course, so pause the video and jot down notes when you notice something noteworthy.</p><p>➜ OPEN <br>∞ Link: Scratch <br>• Sign in using your Gmail account.<br>• Browse projects; click on the green flag to run the program; click on see inside to explore how the blocks work.</p><p>➜ WATCH and FOLLOW ALONG<br>∞ Video Link: How to Make an &quot;About Me&quot; Project in Scratch | Tutorial (9 mins)</p>","","https://planning.alveary.org/links.html?id=rech2GA4NRK0pGrqO&term=2&week=14","Lesson","0","FALSE"
"alveary-rech2GA4NRK0pGrqO","alveary-rec8SJpsVagrA07aw","15","1","30m Technology - Lesson 29","<p>Coding: Loops<br>⍞ Materials: your Adobe Express Learning Journal, HTML Word Journal, and Scratch</p><p>➜ INTRO        <br>You will explore how the loop blocks work in Scratch.</p><p>➜ THINK <br>Using the next lesson section of your Adobe Express Learning Journal, spend 5 minutes answering the following question:<br>• How might having a basic understanding of coding impact your future?</p><p>➜ WATCH <br>∞ Video Link: Intro to Programming: Loops (2 mins) and<br>∞ Video Link: Think like a Coder, Episode 1 (7 mins) <br>You will be expected to write about what you watch in this course, so pause the video and jot down notes when you notice something noteworthy.</p><p>➜ WRITE<br>• Add the term &quot;loops&quot; to your HTML Word Journal.</p><p>➜ OPEN<br>∞ Link: Scratch</p><p>➜ WATCH and FOLLOW ALONG <br>∞ Video Link:  How to Make a Jumping Game in Scratch | Tutorial (5 mins)<br>You will learn how Scratch does loops.</p><p>➜ REFLECT<br>Complete your Adobe Express Journal entry for today by spending 5 minutes answering the following question:<br>• How is block coding similar to building using physical blocks, and how is it different?</p>","","https://planning.alveary.org/links.html?id=rech2GA4NRK0pGrqO&term=2&week=15","Lesson","0","FALSE"
"alveary-rech2GA4NRK0pGrqO","alveary-recL34ivosD6p53jl","15","2","30m Technology - Lesson 30","<p>Coding: Conditionals<br>⍞ Materials: your HTML Word Journal and Scratch</p><p>➜ INTRO        <br>In English grammar, a conditional is a sentence that includes a dependent clause, which usually starts with “if” or &quot;when.&quot; In this lesson, you will explore how conditional blocks work in Scratch.</p><p>➜ WATCH<br>∞ Video Link: Think Like A Coder, Episode 2 (6 mins)</p><p>➜ OPEN<br>∞ Link: Scratch</p><p>➜ WATCH and FOLLOW ALONG <br>∞ Video Link:  How to Make a Clicker Game in Scratch | Tutorial (11 mins)<br>You will practice using conditionals.</p><p>➜ REFLECT<br>• Add the term &quot;conditionals&quot; to your HTML Word Journal.</p>","","https://planning.alveary.org/links.html?id=rech2GA4NRK0pGrqO&term=2&week=15","Lesson","0","FALSE"
"alveary-rech2GA4NRK0pGrqO","alveary-recnuHjpHJuO0uhpN","16","1","30m Technology - Lesson 31","<p>Coding: Variables<br>⍞ Materials: your HTML Word Journal and Scratch</p><p>➜ INTRO        <br>You are probably familiar with variables from algebra classes. It is helpful to think of them as placeholders. In this lesson, you will practice using variable Blocks in Scratch.</p><p>➜ WATCH<br>∞ Video Link: Think Like A Coder, Episode 3 (6 mins)<br>You will be expected to write about what you watch in this course, so pause the video and jot down notes when you notice something noteworthy.</p><p>➜ OPEN<br>∞ Link: Scratch</p><p>➜ WATCH and FOLLOW ALONG <br>∞ Video Link: What Are Variables and Lists in Scratch? (Part 1)| Tutorial - YouTube (4 mins) <br>∞ Video Link: Using Variables and Lists in Scratch (Part 2)| Tutorial - YouTube (7 mins)<br>• Add the term &quot;variable&quot; to your HTML Word Journal.</p>","","https://planning.alveary.org/links.html?id=rech2GA4NRK0pGrqO&term=2&week=16","Lesson","0","FALSE"
"alveary-rech2GA4NRK0pGrqO","alveary-receZNZs1OEZSzOOC","16","2","30m Technology - Lesson 32","<p>Coding: Scratch Project<br>⍞ Materials: your Adobe Express Learning Journal and Scratch</p><p>➜ THINK<br>Using the next lesson section of your Adobe Express Learning Journal, spend 10 minutes answering one of the following question sets:<br>• What stories have you read in the past year? How could you narrate one of those stories using Scratch?<br>• What is one interesting idea you have encountered in the past year? How could you introduce others to that idea in an engaging way using Scratch?</p><p>➜ OPEN <br>∞ Link: Scratch<br>• Create the Scratch program you described</p><p>➜ REFLECT <br>• Complete the Adobe Express Learning Journal entry you started today by spending 5 minutes describing your experience telling the story or sharing the idea using Scratch</p>","","https://planning.alveary.org/links.html?id=rech2GA4NRK0pGrqO&term=2&week=16","Lesson","0","FALSE"
"alveary-rech2GA4NRK0pGrqO","alveary-recPAIkLuQqn4RCtG","17","1","30m Technology - Lesson 33","<p>Coding: Introduction to MIT's App Inventor<br>⍞ Materials: your Adobe Express Learning Journal and MIT's App Inventor</p><p>➜ INTRO        <br>In this lesson, you will be introduced to a new tool for creating apps.</p><p>➜ THINK<br>Using the next lesson section of your Adobe Express Learning Journal, spend 5 minutes answering the following question:<br>• Scratch is beautifully designed, and you can use it to create some powerful programs; in what ways do you think it could be better?</p><p>➜ WATCH <br>∞ Video Link: Getting Started with App Inventor (9 mins)<br>You will be expected to write about what you watch in this course, so pause the video and jot down notes when you notice something noteworthy.</p><p>➜ OPEN<br>∞ Link: MIT App Inventor <br>• Sign up and spend 11 minutes exploring this powerful tool</p><p>➜ REFLECT<br>Complete your Adobe Express Learning Journal entry for today by spending 5 minutes answering the following questions:<br>• What apps do you use most? Why? <br>• What do you use them for?</p>","","https://planning.alveary.org/links.html?id=rech2GA4NRK0pGrqO&term=2&week=17","Lesson","0","FALSE"
"alveary-rech2GA4NRK0pGrqO","alveary-recW16WHz09ubV4Lj","17","2","30m Technology - Lesson 34","<p>Coding: Building an app using MIT's App Inventor<br>⍞ Materials: MIT's App Inventor and a mobile device</p><p>➜ INTRO<br>You will design an App using MIT's App Inventor by choosing one of the two tutorials below.  Ask yourself, would you rather make a bee buzz or a cat purr?</p><p>➜ OPEN <br>∞ Link: MIT App Inventor</p><p>➜ CHOOSE ONE<br>∞ Link: Hello Codi - the buzzing bee. Make the bee buzz.<br>∞ Link: HelloPurr. Make the cat purr!</p>","","https://planning.alveary.org/links.html?id=rech2GA4NRK0pGrqO&term=2&week=17","Lesson","0","FALSE"
