"course_custom_id","assignment_custom_id","assignment_week","assignment_day","assignment_name","assignment_description","assignment_teachersNote","assignment_linksUrl","assignment_type","assignment_duration","assignment_graded"
"alveary-rechch3gkLaICGbWm","alveary-recA0eqxoeM1mEk9c","18","2","20m Geography: Grade 2 (Canada) - Lesson 36","<p>Saskatchewan, cont.<br>⍞ Materials: My Canada</p><p>➜ RECAP <br>What did you learn about Saskatchewan in the previous lesson?</p><p>➜ VIEW &amp; DISCUSS<br>Saskatchewan map in My Canada (pages not numbered)</p><p>➜ MAP QUESTIONS<br>1\. What are some of the animals that live in Saskatchewan? How many different ones can you find?<br>2\. Can you find any National Parks in Saskatchewan? What about some of the Provincial Parks?<br>3\. Saskatchewan is a prairie province, and a major industry is farming. How many different crops can you find represented on the map?<br>4\. Each map in this book has a symbol in the corners. Can you find Saskatchewan's? Why might it have been chosen?<br>5\. Looking at the images, what are some activities that people might like to do in Saskatchewan?</p><p>• EXTRA HELPING<br>Learn more about Wanuskewin Heritage Park.<br>∞ Link: Wanuskewin</p>","","https://planning.alveary.org/links.html?id=rechch3gkLaICGbWm&term=2&week=18","Lesson","0","FALSE"
"alveary-rechch3gkLaICGbWm","alveary-recHzN4kBjkuw79mf","19","1","20m Geography: Grade 2 (Canada) - Lesson 37","<p>Manitoba<br>⍞ Materials: The Kids Book of Canada; geography journal</p><p>PREP: (Optional) Print off a blank map of Manitoba for more detailed mapping.<br>∞ Map Link: Outline Maps of Canada and Provinces (these maps have rivers and lakes)<br>∞ Map Link: Completely Blank Map of Manitoba</p><p>➜ INTRO<br>The next few lessons will be spent learning about the province of Manitoba.</p><p>➜ MAP QUESTIONS<br>⍞ Map Resource: The Kids Book of Canada &quot;Canada&quot; p.4-5<br>1\. Find the province of Manitoba on the map. What does it border? (Saskatchewan, Nunavut, Ontario, and USA)<br>2\. What large body of water forms a natural border for Manitoba? (Hudson Bay)<br>3\. How many different geographical regions do we find in Manitoba? Each one has a number and a separate colour. (There are four: the Interior Plains, the Boreal Forest, the Taiga, and the Hudson's Bay Lowland.)<br>4\. From these regions, what might the climate be like in different parts of Manitoba?</p><p>➜ READ, NARRATE, &amp; DISCUSS<br>p.20-21 &quot;Manitoba's name&quot; - &quot;area of the province.&quot;</p><p>➜ MAP WORK<br>⍞ Map Resource: My Map of Canada <br>1\. Label Manitoba.<br>2\. Label Winnipeg with a star to show it is a capital city.<br>3\. Label Lake Winnipeg (already drawn on the map).<br>4\. Draw in and label any other features or illustrations of interest (bodies of water, cities, landmarks, natural features, etc.).</p><p>• EXTRA HELPING<br>Learn more about Churchill, Manitoba.<br>∞ Video Link: 7 Wonders of Manitoba: Churchill (9:54)</p>","","https://planning.alveary.org/links.html?id=rechch3gkLaICGbWm&term=2&week=19","Lesson","0","FALSE"
"alveary-rechch3gkLaICGbWm","alveary-recvPa6MvNEsawEP9","19","2","20m Geography: Grade 2 (Canada) - Lesson 38","<p>Manitoba, cont.<br>⍞ Materials: The Kids Book of Canada; geography journal</p><p>PREP: Print the flag of Manitoba.<br>∞ Image Link: Colouring Book of Flags: Canada</p><p>➜ RECAP <br>What did you learn about Manitoba in the previous lesson?</p><p>➜ READ, NARRATE, &amp; DISCUSS<br>p.22-23 &quot;In the early days&quot; - &quot;most important industries.&quot;</p><p>• Spend some time today entering an item of interest into your Picture Timeline. Students could also continue to decorate their map of Manitoba.</p><p>➜ MAP WORK<br>Colour the flag of Manitoba and add it to your geography journal.</p><p>• EXTRA HELPING<br>Talk about Jackson Beardy's painting. Why do you think it is called &quot;Balance in Nature&quot;?<br>∞ Image Link: Jackson Beardy: Balance in Nature</p><p>Learn more about Nellie McClung.<br>∞ Video Link: Heritage Minutes: Nellie McClung (1:00)</p>","","https://planning.alveary.org/links.html?id=rechch3gkLaICGbWm&term=2&week=19","Lesson","0","FALSE"
"alveary-rechch3gkLaICGbWm","alveary-receLjM7jzexSmYNP","20","1","20m Geography: Grade 2 (Canada) - Lesson 39","<p>Manitoba, cont.<br>⍞ Materials: My Canada, Canada Wild</p><p>➜ RECAP <br>What did you learn about Manitoba in the previous lesson?</p><p>➜ VIEW &amp; DISCUSS<br>Manitoba map in My Canada (pages not numbered)</p><p>➜ MAP QUESTIONS<br>1\. What are some of the animals that live in Manitoba? How many different ones can you find?<br>2\. Can you find any National Parks in Manitoba? What about some of the Provincial Parks?<br>3\. Looking at the images, what are some activities that people might like to do in Manitoba?<br>4\. Winnipeg is located at the fork of what two rivers? (Red River and Assiniboine River)<br>5\. Each map in this book has a symbol in the corners. Can you find Manitoba's? Why might it have been chosen?</p><p>➜ READ, NARRATE, &amp; DISCUSS<br>p.42-45 &quot;Harris's Sparrow&quot; - &quot;capturing the sparrows.&quot;</p><p>➜ ILLUSTRATE (optional)<br>Draw a Harris's Sparrow using watercolours or another medium such as chalk, pastels, or crayons.</p><p>• EXTRA HELPING<br>Learn more about the ancient Bannock Point Petroforms<br>∞ Video Link: Bannock Point Petroforms (2:52)</p><p>Take a virtual tour of the New Iceland Heritage Museum<br>∞ Link: Virtual Tour - New Iceland Heritage Museum</p>","","https://planning.alveary.org/links.html?id=rechch3gkLaICGbWm&term=2&week=20","Lesson","0","FALSE"
"alveary-rechch3gkLaICGbWm","alveary-recGeyh4MbpLu79L7","20","2","20m Geography: Grade 2 (Canada) - Lesson 40","<p>Linear Map</p><p>➜ INTRO<br>Last year, you made a map of your room or schoolroom. Today, we will start a map of a hall or a linear area of your home or school.</p><p>➜ MAP DRAWING<br>1\. Choose an area to map that is in a line (referred to as linear). For example, a hall.<br>2\. Begin to draw your linear space in your Geography journal.<br>3\. Make sure to represent anything in the hall that takes up space on the floor. (any tables, bookshelves, carpet, etc.)<br>4\. Next lesson, we will add any doors that connect to the hall (or other linear space). This will take 2 lessons, so we will finish it next week.</p>","","","Lesson","0","FALSE"
"alveary-rechch3gkLaICGbWm","alveary-reci011IKAbZ3CpSw","21","1","20m Geography: Grade 2 (Canada) - Lesson 41","<p>Linear Map</p><p>➜ MAP DRAWING<br>1\. We are going to continue your “Linear map” in your geography journal.<br>2\. Now we will add any doors that connect to the hall (or other linear space). <br>3\. Make sure to look back at the real space as you draw to keep things in order.<br>4\. When you are done, feel free to colour your map, if desired.</p><p>➜ NOTE<br>If the student really enjoys this, feel free to do other spaces that they are familiar with, such as a hall at a friend’s or family member’s house. It might be a fun challenge to see what they remember about a familiar house, and then to go see it and map it. Did they remember the correct order of rooms off the hall?</p>","","","Lesson","0","FALSE"
"alveary-rechch3gkLaICGbWm","alveary-rec4oj5sYuEeCMEMF","21","2","20m Geography: Grade 2 (Canada) - Lesson 42","<p>Linear Street Map<br>⍞ Materials: wooden blocks, Duplos or Legos attached to each other, or small boxes (like the size of single-serving cereal boxes), paper, pencil, or coloured pencils</p><p>➜ NOTE<br>This map project will take 4 lessons. The focus again is to keep things in a linear order.</p><p>➜ INTRO<br>We are going to make another type of “linear” map. This time, we will be using blocks with pictures taped on them to make a 3-dimensional map.</p><p>➜ MAP DRAWING<br>1\. Choose an area that you can see from your home/school, or very close to it. (It can be the street where you live or possibly a small strip of stores.)<br>2\. Last year, you may have made a map of your house and a couple of neighbours. This year, you will draw more. Decide if you want to make a map of just one side of the street or both sides.<br>3\. Spend several minutes really looking at the area you chose. Ask questions like...How many buildings are there? Are the buildings all the same size? If not, which ones are bigger? And how much bigger? <br>4\. Pay attention to the order the buildings are in.<br>5\. Draw a simple picture of each home/building and tape it to a block.</p><p>➜ NOTE<br>Next week, the student will finish drawing the homes/buildings.</p>","","","Lesson","0","FALSE"
"alveary-rechch3gkLaICGbWm","alveary-recve41mKW0QeI09W","22","1","20m Geography: Grade 2 (Canada) - Lesson 43","<p>Linear Street Map, cont.<br>⍞ Materials: wooden blocks, Duplos or Legos attached to each other, or small boxes (like the size of single-serving cereal boxes), paper, pencil, or coloured pencils</p><p>➜ MAP DRAWING<br>(Street View Map) <br>1\. Finish drawing the pictures of homes/buildings and taping them to the blocks. <br>2\. Teacher and student work together to set up the blocks/boxes to match the street.</p><p>➜ NOTE<br>Next lesson, you will begin drawing a map of your “street.”</p>","","","Lesson","0","FALSE"
"alveary-rechch3gkLaICGbWm","alveary-recycFJI2CQ893jve","22","2","20m Geography: Grade 2 (Canada) - Lesson 44","<p>Linear Street Map, cont.<br>⍞ Materials: blocks with pictures from the previous lesson, geography journal, pencil or coloured pencils</p><p>➜ MAP DRAWING<br>(Street View Map) <br>1\. Set up your street view with the blocks again.<br>2\. Draw in your geography journal a simple map of your street (blocks). (Note: You can choose to draw only one side of the street or both sides.)<br>3\. Pay attention as you draw your map. Does it match the blocks? Are they in the right order?</p><p>➜ NOTE<br>The drawing of the Street View Map will continue next lesson. Also, we will move the blocks and set them up again just using the map from your geography journal.</p>","","","Lesson","0","FALSE"
"alveary-rechch3gkLaICGbWm","alveary-rec0dXKrUkCJVpy1F","23","1","20m Geography: Grade 2 (Canada) - Lesson 45","<p>Linear Street Map Conclusion<br>⍞ Materials: blocks with pictures from the previous lesson, a pencil, or coloured pencils</p><p>➜ MAP DRAWING<br>(Street View Map) <br>1\. Finish drawing into your geography journal a simple map of your street (blocks). (Note: You can choose to draw only one side of the street or both sides.)<br>2\. Pay attention as you draw your map. Does it match the blocks? Are they in the right order?<br>3\. Now, move the blocks and mix them up.<br>4\. Only using the Street View Map that you made in your geography journal, set up the blocks in the correct order again.<br>5\. If time allows, go outside and see if your drawn Street View Map matches the “real thing.”</p>","","","Lesson","0","FALSE"
"alveary-rechch3gkLaICGbWm","alveary-recIGwRJ4DbLA5dRv","23","2","20m Geography: Grade 2 (Canada) - Lesson 46","<p>Catch-Up Day</p><p>➜ CATCH UP<br>Use this time to catch up on lessons in this or another course, or explore Extra Helpings.<br>You can also have your student continue to decorate their maps.</p>","","","Lesson","0","FALSE"
"alveary-rechch3gkLaICGbWm","alveary-recB80paMYI8f6wMt","24","1","20m Geography: Grade 2 (Canada) - Lesson 47","<p>Exam Week</p><p>➜ EXAMS<br>Answer question(s) related to the course.</p><p>Questions will come from:<br>Activities from the lessons.</p>","<p>★ Geography: Grade 2 (Canada) — TERM 2 EXAM QUESTIONS<br>· Tell what you remember about the water cycle. OR Tell what you remember about how water moves.</p><p>· Locate on a blank map of Canada: the Rocky Mountains, Saskatchewan, and Ottawa, ON.</p>","","Exam","0","FALSE"
"alveary-rechch3gkLaICGbWm","alveary-recae7g4umioO7OW7","24","2","20m Geography: Grade 2 (Canada) - Lesson 48","<p>Exam Week</p><p>➜ EXAMS<br>Answer question(s) related to the course.</p><p>Questions will come from:<br>The Kids Book of Canada<br>My Canada</p>","<p>★ Geography: Grade 2 (Canada) — TERM 2 EXAM QUESTIONS<br>· Tell what you remember about the water cycle. OR Tell what you remember about how water moves.</p><p>· Locate on a blank map of Canada: the Rocky Mountains, Saskatchewan, and Ottawa, ON.</p>","","Exam","0","FALSE"
"alveary-rechch3gkLaICGbWm","alveary-rec5JiVLrKhsiljbj","25","1","20m Geography: Grade 2 (Canada) - Lesson 49","<p>Ontario<br>⍞ Materials: The Kids Book of Canada; geography journal</p><p>PREP: (Optional) Print off a blank map of Ontario for more detailed mapping.<br>∞ Map Link: Outline Maps of Canada and Provinces (these maps have rivers and lakes)<br>∞ Map Link: Completely Blank Map of Ontario</p><p>➜ INTRO<br>The next two weeks will be spent learning about the province of Ontario.</p><p>➜ MAP QUESTIONS<br>⍞ Map Resource: The Kids Book of Canada &quot;Canada&quot; p.4-5<br>1\. Find the province of Ontario on the map. What does it border? (Manitoba, Quebec, and the USA)<br>2\. What large body of water forms a natural border to the north? (Hudson Bay)<br>3\. What bodies of water form a natural border to the south? (The Great Lakes)<br>4\. What are the names of the Great Lakes? (Lake Superior, Lake Michigan, Lake Huron, Lake Erie, and Lake Ontario)<br>5\. How many different geographical regions do we find in Ontario? Each one has a number and a separate colour. (There are three: the Hudson Bay Lowland, the Boreal Forest, and the Mixed Wood Forest.)<br>6\. From these regions, what might the climate be like in different parts of Ontario?</p><p>➜ READ, NARRATE, &amp; DISCUSS<br>p.24-25 &quot;Ontario means 'beautiful lake'&quot; - &quot;fruit and vegetables.&quot;</p><p>➜ MAP WORK<br>⍞ Map Resource: My Map of Canada <br>1\. Label Ontario.<br>2\. Label Toronto with a star to show it is a capital city.<br>3\. Label each of the Great Lakes.<br>4\. Label Niagara Falls.<br>5\. Draw in and label any other features or illustrations of interest (bodies of water, cities, landmarks, natural features, etc.).|</p><p>• EXTRA HELPING<br>Watch a livestream of Niagara Falls.<br>∞ Video Link: EarthCam Live: Niagara Falls</p><p>See the monarch butterflies migrating at Point Pelee.<br>∞ Video Link: Monarch Migration at Point Pelee</p>","","https://planning.alveary.org/links.html?id=rechch3gkLaICGbWm&term=3&week=25","Lesson","0","FALSE"
"alveary-rechch3gkLaICGbWm","alveary-recfGjhzFcwu8a0d0","25","2","20m Geography: Grade 2 (Canada) - Lesson 50","<p>Ontario, cont.<br>⍞ Materials: The Kids Book of Canada, Canada Wild</p><p>➜ RECAP <br>What did you learn about Ontario in the previous lesson?</p><p>➜ READ, NARRATE, &amp; DISCUSS<br>1\. The Kids Book of Canada, p.26-27 &quot;In 1811&quot; - &quot;richly multicultural society.&quot;<br>• Spend some time today entering an item of interest into your Picture Timeline. Students could also continue to decorate their map of Ontario.</p><p>2\. Canada Wild, p.10-13 &quot;Eastern wolf&quot; - &quot;live and roam.&quot;</p><p>➜ ILLUSTRATE (optional)<br>Draw an eastern wolf using watercolours or another medium such as chalk, pastels, or crayons.</p><p>• EXTRA HELPING<br>Watch the following Heritage Minutes for more on some famous Ontarians.<br>∞ Video Link: Heritage Minutes: The Discovery of Insulin (1:00)<br>∞ Video Link: Heritage Minutes: Basketball (1:00)</p>","","https://planning.alveary.org/links.html?id=rechch3gkLaICGbWm&term=3&week=25","Lesson","0","FALSE"
"alveary-rechch3gkLaICGbWm","alveary-recfzdil2ughHoyJO","26","1","20m Geography: Grade 2 (Canada) - Lesson 51","<p>Ontario, cont.<br>⍞ Materials: My Canada; geography journal</p><p>➜ RECAP <br>What did you learn about Ontario in the previous lesson?</p><p>➜ VIEW &amp; DISCUSS<br>Ontario map in My Canada (pages not numbered)</p><p>➜ MAP QUESTIONS<br>1\. What are some of the animals that live in Ontario? How many different ones can you find?<br>2\. Can you find any National Parks in Ontario? What about some of the Provincial Parks?<br>3\. Looking at the images, what are some activities that people might like to do in Ontario?<br>4\. Each map in this book has a symbol in the corners - can you find Ontario's? Do you know what that flower is called? (White Trillium, Ontario's provincial flower)</p><p>• EXTRA HELPING<br>Learn more about the Josiah Henson Museum of African-Canadian History (formerly called Uncle Tom's Cabin Historic Site).<br>∞ Link: Josiah Henson Museum of African-Canadian History</p><p>Study this rock formation carefully: can you see why it is called the Sleeping Giant?<br>∞ Link: Sleeping Giant</p><p>Read about why Moonbeam, Ontario, has a giant UFO monument.<br>∞ Link: Moonbeam UFO Monument</p><p>Painters who formed Canada's Group of Seven frequently painted the area around Algonquin Park. View and discuss this painting by Lawren Harris. What are some clues that might tell us about what the weather was like when he painted this scene?<br>∞ Image Link: Lake, Algonquin Park (Harris)</p>","","https://planning.alveary.org/links.html?id=rechch3gkLaICGbWm&term=3&week=26","Lesson","0","FALSE"
"alveary-rechch3gkLaICGbWm","alveary-recJUpCBf4vUwG1mZ","26","2","20m Geography: Grade 2 (Canada) - Lesson 52","<p>Ontario, cont.<br>⍞ Materials: My Canada, The Kids Book of Canada; geography journal</p><p>PREP: Print the flag of Ontario.<br>∞ Image Link: Colouring Book of Flags: Canada</p><p>➜ MAP WORK<br>Colour the flag of Ontario and add it to your geography journal.</p><p>➜ MAPPING ACTIVITY<br>Spend today's lesson learning more about Ontario or any of the other provinces: check out some Extra Helpings, look up additional images, or add some more detail to your maps.<br>Today would also be a great day to check out a local landmark or take a nature walk!</p>","","https://planning.alveary.org/links.html?id=rechch3gkLaICGbWm&term=3&week=26","Lesson","0","FALSE"
"alveary-rechch3gkLaICGbWm","alveary-recCdv3ZhdX6lgMdt","27","1","20m Geography: Grade 2 (Canada) - Lesson 53","<p>Gulfs and Bays<br>⍞ Materials: Globe or World Wall Map, My Map of Canada; geography journal</p><p>➜ INTRO<br>Ontario, and the next province we will study - Quebec - both border on Hudson Bay. For the next two lessons, we will learn more about gulfs and bays.</p><p>➜ MAP QUESTIONS<br>∞ Map Link: Map of North America<br>1\. Locate the Gulf of Alaska, Hudson Bay, and Baffin Bay.<br>2\. Do you notice any differences between the bays and the gulf? (The gulf is more “open” or wider.)<br>3\. Can you find any more gulfs or bays on this map? (the Gulf of Mexico, the Gulf of St. Lawrence, the Gulf of California, and Chesapeake Bay, which is not labelled on the map, but located near Washington, DC)<br>4\. Take a few minutes to look at your world wall map or globe. See if you can find other bays or gulfs.<br>5\. What did you notice about the differences between them? (You may notice that some bays look like gulfs, and some gulfs look like bays. Typically, bays are smaller than gulfs. Both bays and gulfs are portions of larger bodies of water that extend into the land. They also have wide mouths where they join the larger body of water, but gulfs can sometimes have narrow mouths as well, like the Persian Gulf. The Bay of Biscay, north of Spain and France, is actually a gulf.)<br>6\. Read the following definition: National Geographic defines a bay as “a body of water partly surrounded by land. A bay is usually smaller and less enclosed than a gulf. The mouth of the bay, where [it] meets the ocean or lake, is typically wider than that of a gulf. “</p><p>➜ MAP WORK<br>⍞ Map Resource: My Map of Canada<br>1\. Label Baffin Bay and the Gulf of St. Lawrence on your map.<br>2\. Draw and label any other bodies of water that are of interest, using the Map of North America as a resource.</p>","","https://planning.alveary.org/links.html?id=rechch3gkLaICGbWm&term=3&week=27","Lesson","0","FALSE"
"alveary-rechch3gkLaICGbWm","alveary-recPHISlNyDM5NCBE","27","2","20m Geography: Grade 2 (Canada) - Lesson 54","<p>Model of Bay<br>⍞ Materials: pan, water, large rock(s); Canada Wild</p><p>➜ MODEL<br>Before doing this demonstration, how do you think waves from the ocean are different from waves from a bay? (Ocean waves are large, and bay waves are small.)<br>1\. Cover the bottom of a shallow pan with water—maybe halfway up.<br>2\. Blow across the pan and watch the waves.<br>3\. Next, place a big rock or other object in the pan so that it rises above the water.<br>4\. Now, blow across the pan where the object is now in the waves.<br>5\. Does the size or choppiness of the waves differ between open water wind and obstructed wind?<br>6\. Add a sketch to your journal diagramming ocean waves versus bay waves.</p><p>➜ READ, NARRATE, &amp; DISCUSS<br>p.18-21 &quot;Ungava Seal&quot; - &quot;to call home.&quot;</p><p>➜ VIEW &amp; DISCUSS<br>∞ Map Link: Nunavik Map<br>• Ungava Seals live in Nunavik, the northern third portion of Québec. Look at this map and notice how many lakes and rivers there are. Can you find a new bay we haven't seen on the smaller-scale maps so far? (Ungava Bay)</p>","","https://planning.alveary.org/links.html?id=rechch3gkLaICGbWm&term=3&week=27","Lesson","0","FALSE"
"alveary-rechch3gkLaICGbWm","alveary-recQ0qMYwSrTW8agj","28","1","20m Geography: Grade 2 (Canada) - Lesson 55","<p>Québec<br>⍞ Materials: The Kids Book of Canada; geography journal</p><p>PREP: (Optional) Print off a blank map of Québec for more detailed mapping.<br>∞ Map Link: Outline Maps of Canada and Provinces (these maps have rivers and lakes)<br>∞ Map Link: Completely Blank Map of Québec</p><p>➜ INTRO<br>For the next few lessons, we will learn more about the province of Québec.</p><p>➜ MAP QUESTIONS<br>∞ Map Link: Map of North America<br>1\. What bodies of water form natural borders for Québec? (Hudson Bay, Labrador Sea, the Gulf of St. Lawrence, St. Lawrence River)</p><p>⍞ Map Resource: The Kids Book of Canada &quot;Canada&quot; p.4-5<br>1\. Find the province of Québec on the map. What does it border? (Ontario, Newfoundland and Labrador, New Brunswick, and the USA)<br>2\. How many different geographical regions do we find in Québec? Each one has a number and a separate colour. (There are five: Tundra, Taiga, the Hudson Bay Lowland, the Boreal Forest, and the Mixed Wood Forest.)<br>3\. From these regions, what might the climate be like in different parts of Québec?</p><p>➜ READ, NARRATE, &amp; DISCUSS<br>p.28-29 &quot;Canada's largest province&quot; - &quot;reach the Great Lakes.&quot;</p><p>➜ MAP WORK<br>⍞ Map Resource: My Map of Canada<br>1\. Label Québec.<br>2\. Label Québec City with a star to show it is a capital city.<br>3\. Label the St. Lawrence River.<br>4\. Draw in and label any other features or illustrations of interest (bodies of water, cities, landmarks, natural features, etc.).</p><p>• EXTRA HELPING<br>Take a tour of Quebec City from above: <br>∞ Video Link: Quebec City - 4K Aerial Drone</p>","","https://planning.alveary.org/links.html?id=rechch3gkLaICGbWm&term=3&week=28","Lesson","0","FALSE"
"alveary-rechch3gkLaICGbWm","alveary-rec7Eep2039efOHdX","28","2","20m Geography: Grade 2 (Canada) - Lesson 56","<p>Québec, cont.<br>⍞ Materials: The Kids Book of Canada</p><p>➜ RECAP<br>What did you learn about Québec in the previous lesson?</p><p>➜ READ, NARRATE, &amp; DISCUSS<br>p.30-31 &quot;Quebec City is the only&quot; - &quot;nation within Canada.&quot;</p><p>• Spend some time today entering an item of interest into your Picture Timeline. Students could also continue to decorate their map of Québec.</p>","","","Lesson","0","FALSE"
"alveary-rechch3gkLaICGbWm","alveary-recXIeUbhBwyoSy19","29","1","20m Geography: Grade 2 (Canada) - Lesson 57","<p>Québec, cont.<br>⍞ Materials: My Canada, Canada Wild</p><p>➜ RECAP<br>What did you learn about Québec in the previous lesson?</p><p>➜ VIEW &amp; DISCUSS<br>Québec map in My Canada (pages not numbered)</p><p>➜ MAP QUESTIONS<br>1\. What are some of the animals that live in Québec? How many different ones can you find?<br>2\. Can you find any National Parks in Québec? What about some of the Provincial Parks?<br>3\. Looking at the images, what are some activities that people might like to do in Québec?<br>4\. Each map in this book has a symbol in the corners. Can you find Québec's? Do you know what that is, and why it might have been chosen? (Fleur de Lis: a stylized lily flower often found in French heraldry, such as flags, coats of arms, and art)</p><p>➜ READ, NARRATE, &amp; DISCUSS<br>p.50-53 &quot;Copper Redhorse&quot; - &quot;spawning grounds.&quot;</p><p>➜ ILLUSTRATE (optional)<br>Draw a copper redhorse using watercolours or another medium such as chalk, pastels, or crayons.</p><p>• EXTRA HELPING<br>Read more about the Manicouagan Reservoir.<br>∞ Article Link: Manicouagan Reservoir</p><p>Take a tour of the Biodome in Montreal.<br>∞ Video Link: Biodôme de Montréal (2:47)</p><p>Take a tour of the Botanical Gardens in Montreal.<br>∞ Video Link: Jardin botanique de Montréal (3:13)</p>","","https://planning.alveary.org/links.html?id=rechch3gkLaICGbWm&term=3&week=29","Lesson","0","FALSE"
