"course_custom_id","assignment_custom_id","assignment_week","assignment_day","assignment_name","assignment_description","assignment_teachersNote","assignment_linksUrl","assignment_type","assignment_duration","assignment_graded"
"alveary-rec7kjonSr0OBz5kh","alveary-rec53c7KKPL3I5J1v","1","1","45m Latin 1 (Independent Study) - Lesson 1","<p>Stage 1: CAECILIUS (Nominative Singular Nouns) and Cerberus <br>⍞ Materials: Cambridge Unit 1, Latin notebook, sticky notes</p><p>PREP: Read &quot;Introduction,&quot; “Model sentences,” and “Cerberus” Teacher's Manual p.18-23.</p><p>➜ INTRO<br>This is the story of a real person who lived in Pompeii. What do you know about Pompeii? Look at the picture on the front cover; this is Caecilius. What kind of person do you think he might have been?</p><p>➜ WRITE<br>Cover the definitions on p.14 with sticky notes. Copy &quot;Vocabulary Checklist 1.&quot; Infer and record meanings as you read the stories in Stage 1.</p><p>➜ READ, NARRATE, &amp; DISCUSS<br>Model Sentences p.2-5</p><p>➜ READ, NARRATE, &amp; DISCUSS<br>&quot;Cerberus&quot; p.6 <br>Preview vocabulary words that accompany the story. What might this story be about? Read and narrate each paragraph separately.</p><p>➜ EVALUATE<br>Check any new vocabulary words you defined today with Vocabulary Checklist 1 or the glossary beginning on p.193.</p><p>➜ DISCUSS<br>How is this family alike and different from yours? <br>Which words from today's lesson look or sound like words you know in English, Spanish, or French?</p>","<p>★ TEACHER TIP<br>The translations for all the model sentences and stories are in the digital Cambridge Unit 1 Teacher's Resource document, &quot;Student's Book Translations and Answers.&quot; The answers to &quot;About the language&quot; and &quot;Practicing the language&quot; exercises are also located here. This resource is part of the digital Teacher's Manual. The document can be downloaded as a single file containing all the Unit 1 translations and answers or as individual files for each stage.</p>","","Lesson","0","FALSE"
"alveary-rec7kjonSr0OBz5kh","alveary-recz7RUOsElKuyVsV","1","2","45m Latin 1 (Independent Study) - Lesson 2","<p>Stage 1: Cerberus and Caecilius<br>⍞ Materials: Cambridge Unit 1, Latin notebook</p><p>PREP: Read “About the language” and “Cultural context material: Caecilius” Teacher's Manual p.23-25.</p><p>➜ RECAP<br>Review Vocabulary Checklist words from Latin notebook.</p><p>➜ WRITE<br>Continue to infer and record meanings in Vocabulary Checklist 1 as you read the stories in Stage 1.</p><p>➜ READ, NARRATE, &amp; DISCUSS<br>Model Sentences p.2-5</p><p>➜ PRACTICE<br>Copy Model Sentences 1-4 on p.2-3 into Latin notebook. Translate into English and back into Latin. Check your translations against the originals; correct any mistakes.</p><p>➜ READ, NARRATE, &amp; DISCUSS<br>&quot;Cerberus&quot; p.6 and “Caecilius” p.8-9<br>Read and narrate each paragraph separately.</p><p>➜ READ, NARRATE, &amp; DISCUSS <br>“About the language&quot; p.7</p><p>➜ PRACTICE <br>Find sentences with similar patterns in “Model Sentences” or &quot;Cerberus.&quot;</p><p>➜ EVALUATE<br>Check any new vocabulary words you defined today with Vocabulary Checklist 1 or the glossary beginning on p.193.</p>","","","Lesson","0","FALSE"
"alveary-rec7kjonSr0OBz5kh","alveary-reck9kaOtCMUnLRSa","2","1","45m Latin 1 (Independent Study) - Lesson 3","<p>Stage 1: Metella and Houses of Pompeii<br>⍞ Materials: Cambridge Unit 1, Latin notebook</p><p>PREP: Read “Practicing the language,&quot; “Cultural context material: Metella,&quot; and “Cultural context material: Houses in Pompeii” Teacher's Manual p.23, 25-26.</p><p>➜ RECAP <br>• “About the language” p.7<br>• Review Vocabulary Checklist words from Latin notebook.</p><p>➜ READ, NARRATE, &amp; DISCUSS<br>“Metella” and “Houses in Pompeii” p.10-13</p><p>➜ PRACTICE<br>Complete Exercises 1 and 2 of &quot;Practicing the language&quot; on p.7.</p><p>➜ DISCUSS<br>How is this family alike and different from yours?</p>","","","Lesson","0","FALSE"
"alveary-rec7kjonSr0OBz5kh","alveary-recmdlcBa2zkczcL2","2","2","45m Latin 1 (Independent Study) - Lesson 4","<p>Stage 1: Cerberus<br>⍞ Materials: Cambridge Unit 1, Latin notebook</p><p>➜ RECAP<br>Review Vocabulary Checklist words from Latin notebook.</p><p>➜ PRACTICE<br>Translate lines 1-8 of “Cerberus” on p.6 into English.</p><p>➜ DISCUSS<br>How is this family alike and different from yours?</p>","","","Lesson","0","FALSE"
"alveary-rec7kjonSr0OBz5kh","alveary-recKF4ObObXRLh1t2","3","1","45m Latin 1 (Independent Study) - Lesson 5","<p>Stage 2: IN VĪLLĀ (Nominative and Accusative Singular Nouns) and Metella<br>⍞ Materials: Cambridge Unit 1, Latin notebook, sticky notes</p><p>PREP: Read &quot;Opening page&quot; and “Model sentences” Teacher's Manual p.29-30.</p><p>➜ INTRO<br>Look at the picture on p.15. How does this home resemble and differ from homes today? What happens at your house when company comes over? In the Model Sentences on p.18-19, Metella plays hostess.</p><p>➜ WRITE<br>Cover the definitions on p.26 with sticky notes. Copy “Vocabulary Checklist 2.&quot; Infer and record meanings as you read the stories in Stage 2.</p><p>➜ READ, NARRATE, &amp; DISCUSS<br>Model Sentences (&quot;amīcus”) p.16-17</p><p>➜ DISCUSS<br> In which tense are all these sentences written? (present)</p><p>➜ READ, NARRATE, &amp; DISCUSS<br>Model Sentences (&quot;Metella”) p.18-19</p><p>➜ DISCUSS<br>Name the subject of each of the sentences on p.18-19. (coquus, Metella, Grumiō, Metella, cibus, Metella, Grumiō, Metella, amīcus, &amp; Metella)</p><p>➜ DICTATE<br>Study Model Sentences 11 and 19 on p.18-19. Write sentences from dictation when ready.</p><p>➜ EVALUATE<br>Check any new vocabulary words you defined today with Vocabulary Checklist 2 or the glossary beginning on p.193.</p>","","","Lesson","0","FALSE"
"alveary-rec7kjonSr0OBz5kh","alveary-recS8sOiBa4kc84nK","3","2","45m Latin 1 (Independent Study) - Lesson 6","<p>Stage 2: Mercātor and About the Language <br>⍞ Materials: Cambridge Unit 1, Latin notebook</p><p>PREP: Read “mercātor” and “About the language” Teacher's Manual p.30-31, 32.</p><p>➜ RECAP<br>• Review Vocabulary Checklist words from Latin notebook.<br>• Model Sentences p.16-19</p><p>➜ WRITE<br>Continue to infer and record meanings in Vocabulary Checklist 2 as you read the stories in Stage 2.</p><p>➜ READ, NARRATE, &amp; DISCUSS<br>“mercātor” p.20<br>Preview vocabulary words that accompany the story. What might this story be about? Read and narrate each paragraph separately.</p><p>• Observe the endings of &quot;Caecilium,&quot; &quot;vīllam,&quot; &quot;mercātōrem,&quot; and &quot;tablīnum&quot; in the first paragraph. The endings are different from what students are used to (Caecilius, vīlla, mercātor, and tablīno).<br>• Find any other words in the story that have similar endings and speculate why they might be different.</p><p>➜ READ, NARRATE, &amp; DISCUSS<br>“About the language” p.21</p><p>➜ PRACTICE<br>• Using p.21 as a reference, write a narration explaining why word endings change in the nominative and accusative cases.<br>• Reread “mercātor” on p.20 and notice how word endings (nominative/accusative cases) affect the translation.</p><p>➜ EVALUATE<br>Check any new vocabulary words you defined today with Vocabulary Checklist 2 or the glossary beginning on p.193.</p>","","","Lesson","0","FALSE"
"alveary-rec7kjonSr0OBz5kh","alveary-rec05wAX6eP9TImRu","4","1","45m Latin 1 (Independent Study) - Lesson 7","<p>Stage 2: Practicing the Language and In Triclīniō<br>⍞ Materials: Cambridge Unit 1, Latin notebook</p><p>PREP: Read “in triclīniō” and &quot;Practicing the language&quot; Teacher's Manual p.31-33.</p><p>➜ RECAP<br>• Review Vocabulary Checklist words from Latin notebook.<br>• Review the nominative and accusative cases of nouns on p.21.</p><p>➜ PRACTICE<br>Complete Exercises 1 and 2 of &quot;Practicing the language&quot; on p.22. Then choose two sentences to translate back into Latin. Check your translations against the originals; correct any mistakes.</p><p>➜ WRITE<br>Continue to infer and record meanings in Vocabulary Checklist 2 as you read the stories in Stage 2.</p><p>➜ READ, NARRATE, &amp; DISCUSS<br>“in triclīniō” p.20<br>Preview vocabulary words that accompany the story. Read and narrate each paragraph separately.</p><p>➜ EVALUATE<br>Check any new vocabulary words you defined today with Vocabulary Checklist 2 or the glossary beginning on p.193.</p><p>➜ DISCUSS<br>Which words from today's lesson look or sound like words you know in English, Spanish, or French?</p>","","","Lesson","0","FALSE"
"alveary-rec7kjonSr0OBz5kh","alveary-recrHQ4A8dl17GIga","4","2","45m Latin 1 (Independent Study) - Lesson 8","<p>Stage 2: In Triclīniō and Practicing the Language<br>⍞ Materials: Cambridge Unit 1, Latin notebook</p><p>➜ RECAP<br>• Review Vocabulary Checklist words from Latin notebook.<br>• Review the nominative and accusative cases of nouns on p.21.<br>• “in triclīniō” p.20</p><p>➜ PRACTICE<br>Look for nouns in their nominative and accusative forms in the story “in triclīniō” on p.20.</p><p>➜ PRACTICE<br>Complete Exercise 3 of &quot;Practicing the language&quot; on p.22. Then choose two sentences to translate back into Latin. Check your translations against the originals; correct any mistakes. (Note: the student has two lessons to complete this activity.)</p><p>➜ EVALUATE<br>Are all words from Vocabulary Checklist 2 (p.26) correctly defined in Latin notebook?</p>","","","Lesson","0","FALSE"
"alveary-rec7kjonSr0OBz5kh","alveary-recA0jqFf1dYXkQ4O","5","1","45m Latin 1 (Independent Study) - Lesson 9","<p>Stage 2: Practicing the Language and Daily Life<br>⍞ Materials: Cambridge Unit 1, Latin notebook</p><p>PREP: Read “Cultural context material” Teacher's Manual p.33-34.</p><p>➜ RECAP<br>• Review Vocabulary Checklist words from Latin notebook.<br>• Review the nominative and accusative cases of nouns p.21.</p><p>➜ PRACTICE<br>Finish Exercise 3 of &quot;Practicing the language&quot; on p.22. Then choose two sentences to translate back into Latin. Check your translations against the originals; correct any mistakes.</p><p>➜ READ, NARRATE, &amp; DISCUSS<br>“Daily life” p.23-24</p><p>➜ VIEW &amp; DISCUSS<br>Look at the pictures and captions on p.24-25.</p>","","","Lesson","0","FALSE"
"alveary-rec7kjonSr0OBz5kh","alveary-recckTGZdENjCgGTK","5","2","45m Latin 1 (Independent Study) - Lesson 10","<p>Stage 2: In Triclīniō <br>⍞ Materials: Cambridge Unit 1, Latin notebook</p><p>➜ RECAP<br>Review Vocabulary Checklist words from Stage 1 and Stage 2 in Latin notebook.</p><p>➜ PRACTICE<br>Translate “in triclīniō” on p.20 into English. (The student has two lessons to complete this activity.)</p>","","","Lesson","0","FALSE"
"alveary-rec7kjonSr0OBz5kh","alveary-recv4BcQWatUS68Tc","6","1","45m Latin 1 (Independent Study) - Lesson 11","<p>Stage 2: In Triclīniō and Review<br>⍞ Materials: Cambridge Unit 1, Latin notebook</p><p>➜ RECAP<br>Review Vocabulary Checklist words from Stage 1 and Stage 2 in Latin notebook.</p><p>➜ PRACTICE<br>Finish translating “in triclīniō” on p.20 into English.</p><p>➜ CATCH UP<br>Complete any missed activities from Stage 1 or Stage 2. If you are caught up, practice translating Model Sentences into English and then back into Latin, or use this extra time for another subject.</p>","","","Lesson","0","FALSE"
"alveary-rec7kjonSr0OBz5kh","alveary-recj9u7otCw0g8VBU","6","2","45m Latin 1 (Independent Study) - Lesson 12","<p>Stage 3: NEGŌTIUM (Nominative and Accusative of 1st, 2nd, &amp; 3rd Declensions) and Artifex<br>⍞ Materials: Cambridge Unit 1, sticky notes, Latin notebook</p><p>PREP: Read “in forō” and “artifex” Teacher's Manual p.36-38.</p><p>➜ INTRO<br>• Look at the title of Stage 3 on p.27. What do you think it means? With what kinds of people would you negotiate? This stage is about several types of business dealings. <br>• Look at the pictures that accompany the story on p.29. What might this story be about?</p><p>➜ WRITE<br>Cover the definitions on p.38 with sticky notes. Copy &quot;Vocabulary Checklist 3.&quot; Infer and record meanings as you read the stories in Stage 3.</p><p>➜ READ, NARRATE, &amp; DISCUSS<br>“in forō” p.28<br>Preview vocabulary words that accompany the story. Read and narrate each paragraph separately.</p><p>➜ READ, NARRATE, &amp; DISCUSS<br>“artifex” p.29<br>Preview vocabulary words that accompany the story. Read aloud and narrate lines 1 to 8. Read silently and narrate lines 9 to the end.</p><p>➜ PRACTICE<br>Translate lines 9-15 of &quot;artifex&quot; on p.29 into English. Translate two sentences back into Latin. Check your translations against the originals and correct any mistakes.</p><p>➜ EVALUATE<br>Check any new vocabulary words you defined today with Vocabulary Checklist 3 or the glossary beginning on p.193.</p>","<p>★ TEACHER TIP<br>The translations for all the model sentences and stories are in the digital Cambridge Unit 1 Teacher's Resource document, &quot;Student's Book Translations and Answers.&quot; The answers to &quot;About the language&quot; and &quot;Practicing the language&quot; exercises are also located here. This resource is part of the digital Teacher's Manual. The document can be downloaded as a single file containing all the Unit 1 translations and answers or as individual files for each stage.</p>","","Lesson","0","FALSE"
"alveary-rec7kjonSr0OBz5kh","alveary-recWmJvoKzKrra1HM","7","1","45m Latin 1 (Independent Study) - Lesson 13","<p>Stage 3: Tōnsor and Vēnālīcius<br>⍞ Materials: Cambridge Unit 1, Latin notebook</p><p>PREP: Read “tōnsor&quot; and &quot;vēnālīcius&quot; Teacher's Manual p.38-41.</p><p>➜ RECAP<br>Review Vocabulary Checklist words from Latin notebook.</p><p>➜ INTRO<br>Look at the picture that accompanies the story on p.30. What might this story be about?</p><p>➜ WRITE<br>Continue to infer and record meanings from Vocabulary Checklist 3 as you read the stories in Stage 3.</p><p>➜ READ, NARRATE, &amp; DISCUSS<br>“tōnsor” p.30<br>Preview vocabulary words that accompany the story. Read and narrate in small sections.</p><p>➜ PRACTICE<br>Write the answers to the questions that accompany the story “tōnsor” on p.30 in Latin. Pay attention to spelling, capitalization, and accent marks.</p><p>➜ DICTATE<br>Study the last sentence of “tōnsor” on p.30. Write the sentence from dictation when ready.</p><p>➜ READ, NARRATE, &amp; DISCUSS<br>“vēnālīcius” p.31<br>Preview vocabulary words that accompany the story. What might this story be about? Read and narrate in small sections.</p><p>➜ PRACTICE<br>Translate the last paragraph of “vēnālīcius” on p.31 into English and then back into Latin. Check your translation against the original; correct any mistakes.</p><p>➜ EVALUATE<br>Check any new vocabulary words you defined today with Vocabulary Checklist 3 or the glossary beginning on p.193.</p><p>➜ DISCUSS<br>Which words from today's lesson look or sound like words you know in English, Spanish, or French?</p>","","","Lesson","0","FALSE"
"alveary-rec7kjonSr0OBz5kh","alveary-recI62RjurXsRcdcb","7","2","45m Latin 1 (Independent Study) - Lesson 14","<p>Stage 3: About the Language and The Town of Pompeii<br>⍞ Materials: Cambridge Unit 1, Latin notebook</p><p>PREP: Read “About the language,” &quot;Practicing the language,&quot; and &quot;Cultural context material&quot; Teacher's Manual p.41-44.</p><p>➜ RECAP<br>• Review Vocabulary Checklist words from Latin notebook.<br>• Review the nominative and accusative cases of nouns on p.21.</p><p>➜ READ, NARRATE, &amp; DISCUSS<br>“About the language” p.32</p><p>➜ PRACTICE<br>Using p.32 as a reference, write a narration explaining the following terms and how you can tell them apart: nominative, accusative, first declension, second declension, and third declension. Check your narration against the student text and make any corrections necessary.</p><p>➜ READ, NARRATE, &amp; DISCUSS<br>“The town of Pompeii” p.33-34 &quot;The town of&quot; - &quot;convenient crossing places.&quot;</p><p>➜ PRACTICE<br>Complete Exercise 1 of &quot;Practicing the language&quot; on p.33. Then choose one sentence to translate back into Latin. Check your translation against the original; correct any mistakes.</p>","","","Lesson","0","FALSE"
"alveary-rec7kjonSr0OBz5kh","alveary-recZYxDkLHsZE9XwU","8","1","45m Latin 1 (Independent Study) - Lesson 15","<p>Stage 3: The Town of Pompeii and Vēnālīcius<br>⍞ Materials: Cambridge Unit 1, Latin notebook</p><p>➜ RECAP<br>Review Vocabulary Checklist words from Latin notebook.</p><p>➜ INTRO<br>Study the map of Pompeii on p.34.</p><p>➜ READ, NARRATE, &amp; DISCUSS<br>“The town of Pompeii” p.35 &quot;In all the main&quot; - &quot;and religion.&quot;</p><p>➜ PRACTICE<br>Complete Exercise 2 of &quot;Practicing the language&quot; on p.33. Then choose one sentence to translate back into Latin. Check your translation against the original; correct any mistakes.</p><p>➜ RECAP<br>Look at the picture and recall the story of “vēnālīcius” on p.31.</p><p>➜ READ &amp; PRACTICE<br>“vēnālīcius” p.31<br>Reread the story aloud. Translate lines 11-17 into English. Translate the last sentence back into Latin. Check your translation against the original; correct any mistakes.</p><p>➜ EVALUATE<br>Are all words from Vocabulary Checklist 3 (p.38) correctly defined in Latin notebook?</p>","","","Lesson","0","FALSE"
"alveary-rec7kjonSr0OBz5kh","alveary-recj7RQt3jjrY98w8","8","2","45m Latin 1 (Independent Study) - Lesson 16","<p>Stage 3: Ad and Nōn<br>⍞ Materials: Cambridge Unit 1, Latin notebook</p><p>➜ RECAP<br>Review Vocabulary Checklist words from Latin notebook.</p><p>➜ INTRO<br>• What do the following words have in common: advise, adventure, and adverb? What does &quot;ad&quot; mean in Latin? (to)<br>• What do the following words have in common: nonsense, nondairy, and nonexistent? What does &quot;nōn&quot; mean in Latin? (not)</p><p>➜ PRACTICE (&quot;ad&quot;)<br>• Write a definition of these words that includes the Latin meaning of &quot;ad&quot;: advise, adventure, adverb.<br>• Write a list of English words that include the Latin prefix &quot;ad&quot; and their meanings. Use a dictionary to help you.</p><p>➜ PRACTICE (&quot;nōn&quot;)<br>• Write a definition of these words that includes the Latin meaning of &quot;nōn&quot;: nonsense, nondairy, nonexistent.<br>• Write a list of English words that include the Latin prefix &quot;nōn&quot; and their meanings. Use a dictionary to help you.</p><p>➜ PRACTICE (&quot;portat&quot;)<br>If there is time left, write a list of English words derived from the Latin word &quot;portat,&quot; which means carries.</p><p>➜ PRACTICE (&quot;magnus&quot;)<br>If there is time left, write a list of English words derived from the Latin word &quot;magnus,&quot; which means big, large, or great.</p>","","","Lesson","0","FALSE"
"alveary-rec7kjonSr0OBz5kh","alveary-rectsyHLsa3svN9V2","9","1","45m Latin 1 (Independent Study) - Lesson 17","<p>Review and Catch Up<br>⍞ Materials: Cambridge Unit 1, Latin notebook</p><p>➜ RECAP<br>Review Vocabulary Checklist words from Stage 1, Stage 2, and Stage 3 in Latin notebook.</p><p>➜ CATCH UP<br>Complete any missed activities from Stage 1, Stage 2, and Stage 3. If you are caught up, practice translating Model Sentences into English and then back into Latin, or use this extra time for another subject.</p>","","","Lesson","0","FALSE"
"alveary-rec7kjonSr0OBz5kh","alveary-rec8MMYtPwcEw5R0e","9","2","45m Latin 1 (Independent Study) - Lesson 18","<p>Stage 4: IN FORŌ (Interrogative Words, 1st &amp; 2nd Person Singular Present) and Model Sentences<br>⍞ Materials: Cambridge Unit 1, sticky notes, Latin notebook</p><p>PREP: Read “Model sentences” Teacher's Manual p.45-46.</p><p>➜ INTRO<br>Look at the picture on p.39. What kinds of activities do you think took place in the forum?</p><p>➜ WRITE<br>Cover the definitions on p.52 with sticky notes. Copy &quot;Vocabulary Checklist 4.&quot; Infer and record meanings as you read the stories in Stage 4.</p><p>➜ READ, NARRATE, &amp; DISCUSS<br>Model Sentences 1-6 p.40</p><p>➜ PRACTICE<br>• Look again at sentences 1-6 on p.40. What do they have in common? (first person: ego; ego sum)<br>• Make up similar sentences to describe yourself; use the glossary if needed.</p><p>➜ RECAP<br>Review the meanings of &quot;ego&quot; and &quot;ego sum.&quot; (I, I am)</p><p>➜ READ, NARRATE, &amp; DISCUSS<br>Model Sentences 7-15 p.41-42</p><p>➜ PRACTICE<br>• Look again at sentences 7-12 on p.41. What do they have in common? (quid tu; ego)<br>• Review the meanings of first, second, and third person in English. (I, you, he/she/it)<br>• Notice the word endings in sentences 7-12. How do they differ?</p><p>➜ PRACTICE (1st and 2nd person singular present)<br>• Write a chart of first and second-person word endings in the sentences on p.40-42. <br>• For example, #7: 1st person: ego coquō (I cook); 2nd person: tu coquīs (You cook)</p><p>➜ EVALUATE<br>Check any new vocabulary words you defined today with Vocabulary Checklist 4 or the glossary beginning on p.193.</p>","","","Lesson","0","FALSE"
"alveary-rec7kjonSr0OBz5kh","alveary-recwPXtoO3V0OYMum","10","1","45m Latin 1 (Independent Study) - Lesson 19","<p>Stage 4: Hermogenēs and In Basilicā<br>⍞ Materials: Cambridge Unit 1, Latin notebook</p><p>PREP: Read “Hermogenēs” and “in basilicā” Teacher's Manual p.46-48.</p><p>➜ RECAP<br>Review Vocabulary Checklist words from Latin notebook.</p><p>➜ WRITE<br>Continue to infer and record meanings in Vocabulary Checklist 4 as you read the stories in Stage 4.</p><p>➜ INTRO<br>• Look at the picture that accompanies the story on p.43. Imagine what the buildings looked like before they fell into ruin. How are they similar to and different from the shops we have today?<br>• What was a basilica in Ancient Rome? (a court of law)<br>• Knowing that a basilica was a court of law, what kinds of things would you expect to happen in this story?</p><p>➜ READ, NARRATE, &amp; DISCUSS<br>“Hermogenēs” and “in basilicā” p.43-44<br>Preview vocabulary words that accompany each story. Read and narrate each paragraph separately.</p><p>➜READ &amp; PRACTICE<br>Reread “Hermogenēs” on p.43, using appropriate inflection. Copy the last paragraph. Translate it into English and then back into Latin. Check your translation against the original; correct any mistakes.</p><p>➜ EVALUATE<br>Check any new vocabulary words you defined today with Vocabulary Checklist 4 or the glossary beginning on p.193.</p>","","","Lesson","0","FALSE"
"alveary-rec7kjonSr0OBz5kh","alveary-recgGx6OEMCevrFQN","10","2","45m Latin 1 (Independent Study) - Lesson 20","<p>Stage 4: About the Language<br>⍞ Materials: Cambridge Unit 1, Latin notebook</p><p>PREP: Read “About the language” Teacher's Manual p.48.</p><p>➜ RECAP<br>Review Vocabulary Checklist words from Latin notebook.</p><p>➜ READ, NARRATE, &amp; DISCUSS<br>“About the language” paragraphs 1-4 p.45<br>Read and narrate after each section. Review &quot;being verbs&quot; in English (e.g., I am, you are, he/she/it is) and compare to Latin.</p><p>➜ PRACTICE<br>Translate each sentence in paragraph 5 on p.45 into English; watch out for implied subjects. Choose two sentences to translate back into Latin. Check your translations against the originals; correct any mistakes.</p><p>➜ DICTATE<br>Study the dialogue of Lūcia and Caecilius in sentence 8 on p.41. Write their dialogue from dictation when ready.</p><p>➜ DISCUSS<br>Which words from today's lesson look or sound like words you know in English, Spanish, or French?</p>","","","Lesson","0","FALSE"
"alveary-rec7kjonSr0OBz5kh","alveary-recoLv1ZRyRTSFHhv","11","1","45m Latin 1 (Independent Study) - Lesson 21","<p>Stage 4: The Forum and Practicing the Language<br>⍞ Materials: Cambridge Unit 1, Latin notebook</p><p>➜ RECAP<br>• Review Vocabulary Checklist words from Latin notebook.<br>• “About the language” p.45</p><p>➜ READ, NARRATE, &amp; DISCUSS<br>“The forum” p.48-50</p><p>➜ PRACTICE<br>Complete Exercise 1 of &quot;Practicing the language&quot; on p.46. Then choose two sentences to translate back into Latin. Check your translations against the originals; correct any mistakes.</p>","","","Lesson","0","FALSE"
"alveary-rec7kjonSr0OBz5kh","alveary-recFKm9e22kgTfMnb","11","2","45m Latin 1 (Independent Study) - Lesson 22","<p>Stage 4: Practicing the Language<br>⍞ Materials: Cambridge Unit 1, Latin notebook</p><p>➜ RECAP<br>• Review Vocabulary Checklist words from Stages 1-3 in Latin notebook.<br>•&quot;About the language” p.45</p><p>➜ PRACTICE<br>Complete Exercise 2 of &quot;Practicing the language&quot; on p.47. Translate lines 1-12 of &quot;Grumiō et leō&quot; into English. Then translate the last sentence back into Latin. Check your translation against the original; correct any mistakes.</p><p>➜ READ, NARRATE, &amp; DISCUSS<br>“Forum - focus of life” p.50-51</p><p>➜ EVALUATE<br>Are all words from Vocabulary Checklist 4 (p.52) correctly defined in Latin notebook?</p>","","","Lesson","0","FALSE"
