"course_custom_id","assignment_custom_id","assignment_week","assignment_day","assignment_name","assignment_description","assignment_teachersNote","assignment_linksUrl","assignment_type","assignment_duration","assignment_graded"
"alveary-rec7kjonSr0OBz5kh","alveary-recuYXtedJEwSo8JW","12","1","45m Latin 1 (Independent Study) - Lesson 23","<p>Exam Week</p><p>➜ EXAMS<br>Answer question(s) related to course.</p><p>Questions will come from:<br>Cambridge Unit 1</p>","<p>★ Latin 1 (Independent Study) — TERM 1 EXAM QUESTIONS<br>· Cambridge Unit 1: Tell whether each of the following words is in the nominative or accusative case: pecūniam, ancilla, amīcus, canem.</p><p>Answers: accusative, nominative, nominative, accusative</p><p>· Cambridge Unit 1: Translate the first paragraph of &quot;Cerberus&quot; on p.6 into English. (Cover the vocabulary words at the top and bottom of the page.) Then close your book and translate your English paragraph back into Latin.</p>","","Exam","0","FALSE"
"alveary-rec7kjonSr0OBz5kh","alveary-recyTH4BmWf48o8eB","12","2","45m Latin 1 (Independent Study) - Lesson 24","<p>Exam Week</p><p>➜ EXAMS<br>Answer question(s) related to course.</p><p>Questions will come from:<br>Cambridge Unit 1</p>","<p>★ Latin 1 (Independent Study) — TERM 1 EXAM QUESTIONS<br>· Cambridge Unit 1: Tell whether each of the following words is in the nominative or accusative case: pecūniam, ancilla, amīcus, canem.</p><p>Answers: accusative, nominative, nominative, accusative</p><p>· Cambridge Unit 1: Translate the first paragraph of &quot;Cerberus&quot; on p.6 into English. (Cover the vocabulary words at the top and bottom of the page.) Then close your book and translate your English paragraph back into Latin.</p>","","Exam","0","FALSE"
"alveary-rec7kjonSr0OBz5kh","alveary-recKw0vuB1Nnv9mVx","13","1","45m Latin 1 (Independent Study) - Lesson 25","<p>Stage 5: IN THEĀTRŌ (Nominative Plural, 3rd Person Plural Present) and In Viā<br>⍞ Materials: Cambridge Unit 1, sticky notes, Latin notebook</p><p>PREP: Read “Model sentences” Teacher's Manual p.53-54.</p><p>➜ INTRO<br>Do you have an amphitheater in your town, or have you ever visited one? What does it look like? Compare it to the ancient amphitheater in the picture on p.65.</p><p>➜ WRITE<br>Cover the definitions on p.68 with sticky notes. Copy &quot;Vocabulary Checklist 5.&quot; Infer and record meanings as you read the stories in Stage 5.</p><p>➜ READ, NARRATE, &amp; DISCUSS<br>Model Sentences: &quot;in viā&quot; p.54-55</p><p>• Reread sentences 1-2. What is the difference between them? (1 is singular and 2 is plural) <br>• Notice the word endings and est/sunt.</p><p>➜ PRACTICE<br>Copy Model Sentences 1-10 on p.54-55. Translate them into English and then back into Latin. Check your translations against the originals; correct any mistakes.</p><p>➜ EVALUATE<br>Check any new vocabulary words you defined today with Vocabulary Checklist 5 or the glossary beginning on p.193.</p>","<p>★ TEACHER TIP<br>The translations for all the model sentences and stories are in the digital Cambridge Unit 1 Teacher's Resource document, &quot;Student's Book Translations and Answers.&quot; The answers to &quot;About the language&quot; and &quot;Practicing the language&quot; exercises are also located here. This resource is part of the digital Teacher's Manual. The document can be downloaded as a single file containing all the Unit 1 translations and answers or as individual files for each stage.</p>","","Lesson","0","FALSE"
"alveary-rec7kjonSr0OBz5kh","alveary-recPQZZH3K9G6NvJX","13","2","45m Latin 1 (Independent Study) - Lesson 26","<p>Stage 5: The Theater at Pompeii<br>⍞ Materials: Cambridge Unit 1, Latin notebook</p><p>PREP: Read “Cultural context material” Teacher's Manual p.57-58.</p><p>➜ RECAP<br>Review Vocabulary Checklist words from Latin notebook.</p><p>➜ READ, NARRATE, &amp; DISCUSS<br>“The theater at Pompeii” p.64-67</p><p>➜ WRITE<br>Continue to infer and record meanings in Vocabulary Checklist 5 as you read the stories in Stage 5.</p><p>➜ READ, NARRATE, &amp; DISCUSS<br>Model Sentences: &quot;in theātro&quot; p.56-57</p><p>➜ PRACTICE<br>Copy Model Sentences 11-20 on p.56-57. Underline the word endings that indicate that the nouns and verbs are plural. Translate the sentences into English and then back into Latin. Check your translations against the originals; correct any mistakes.</p><p>➜ EVALUATE<br>Check any new vocabulary words you defined today with Vocabulary Checklist 5 or the glossary beginning on p.193.</p><p>➜ DISCUSS<br>Which words from today's lesson look or sound like words you know in English, Spanish, or French?</p>","","","Lesson","0","FALSE"
"alveary-rec7kjonSr0OBz5kh","alveary-recSSTHNUQKypcbFF","14","1","45m Latin 1 (Independent Study) - Lesson 27","<p>Stage 5: Āctōrēs and Poppaea<br>⍞ Materials: Cambridge Unit 1, Latin notebook</p><p>PREP: Read “Āctōrēs,” “About the language 1,” and “Poppaea” Teacher's Manual p.54-56.</p><p>➜ RECAP<br>Review Vocabulary Checklist words from Latin notebook.</p><p>➜ INTRO<br>• Look at the mask on the title page on p.53 and the picture of actors that accompanies the story, āctōrēs, on p.58. How are the costumes similar to and different from those found in plays and movies today?<br>• Look at the picture of the actor studying his mask on p.60. What do you suppose he is thinking?</p><p>➜ WRITE<br>Continue to infer and record meanings in Vocabulary Checklist 5 as you read the stories in Stage 5.</p><p>➜ READ, NARRATE, &amp; DISCUSS<br>“āctōrēs” p.58<br>Preview vocabulary words that accompany this story. Read and narrate each paragraph separately.</p><p>➜ PRACTICE<br>Reread “āctōrēs” on p.58. Translate the last two sentences into English and then back into Latin. Check your translations against the originals; correct any mistakes.</p><p>➜ READ, NARRATE, &amp; DISCUSS<br>“Poppaea” p.61<br>Preview vocabulary words that accompany this story. Read and narrate the dialogue in segments.</p><p>➜ PRACTICE<br>Reread the dialogue on p.61 aloud, taking parts and using appropriate inflection.</p><p>➜ READ, NARRATE, &amp; DISCUSS<br>“About the language 1” p.59-60</p><p>➜ EVALUATE<br>Check any new vocabulary words you defined today with Vocabulary Checklist 5 or the glossary beginning on p.193.</p>","","","Lesson","0","FALSE"
"alveary-rec7kjonSr0OBz5kh","alveary-recWVxnbHtIZuQ0m7","14","2","45m Latin 1 (Independent Study) - Lesson 28","<p>Stage 5: About the Language 2 and Practicing the Language<br>⍞ Materials: Cambridge Unit 1, Latin notebook</p><p>PREP: Read “About the language 2” Teacher's Manual p.56.</p><p>➜ RECAP<br>• Review Vocabulary Checklist words from Latin notebook.<br>• Review “About the language 1” p.59-60.<br>• Review nominative and accusative cases p.21.</p><p>➜ READ, NARRATE, &amp; DISCUSS<br>“About the language 2” p.62</p><p>➜ PRACTICE<br>On p.62, translate the sentences in paragraph 5 into English and then back into Latin. Check your translations against the originals; correct any mistakes.</p><p>➜ RECAP<br>Review the nominative singular and plural in the three declensions on p.62.</p><p>➜ PRACTICE<br>Complete Exercise 1 of &quot;Practicing the language&quot; on p.63. Translate two sentences back into Latin. Check your translations against the originals; correct any mistakes.</p><p>➜ DICTATE<br>Study sentences 15 and 16 on p.57. Write sentences from dictation when ready.</p><p>➜ EVALUATE<br>Are all words from Vocabulary Checklist 5 (p.68) correctly defined in Latin notebook?</p>","","","Lesson","0","FALSE"
"alveary-rec7kjonSr0OBz5kh","alveary-recONiXUDYLAj9Csu","15","1","45m Latin 1 (Independent Study) - Lesson 29","<p>Stage 5: Practicing the Language and In Theātrō<br>⍞ Materials: Cambridge Unit 1, Latin notebook</p><p>➜ RECAP<br>• Review Vocabulary Checklist words from Latin notebook.<br>• Review the nominative singular and plural in the three declensions on p.62.</p><p>➜ PRACTICE<br>• Complete Exercise 2 of &quot;Practicing the language&quot; on p.63. Translate two sentences back into Latin. Check your translations against the originals; correct any mistakes. <br>• Preview the vocabulary words that accompany Exercise 3. Translate Exercise 3 into English; use the glossary only when necessary.</p>","","","Lesson","0","FALSE"
"alveary-rec7kjonSr0OBz5kh","alveary-recISvzsRBRdtbayV","15","2","45m Latin 1 (Independent Study) - Lesson 30","<p>Stage 6: FĒLĪX (Perfect and Imperfect Tenses), About the Language, and Pugna<br>⍞ Materials: Cambridge Unit 1, sticky notes, Latin notebook</p><p>PREP: Read “pugna” and “About the language” Teacher's Manual p.62-64.</p><p>➜ INTRO<br>Look at the pictures that accompany the model sentences on p.70-71. What might this story be about?</p><p>➜ WRITE<br>Cover the definitions on p.82 with sticky notes. Copy &quot;Vocabulary Checklist 6.&quot; Infer and record meanings as you read the stories in Stage 6.</p><p>➜ READ, NARRATE, &amp; DISCUSS<br>Model Sentences p.70-71</p><p>➜ PRACTICE<br>Cover the model sentences on p.70-71 with sticky notes. Try to tell the story in Latin using the pictures as a guide.</p><p>➜ READ, NARRATE, &amp; DISCUSS<br>“About the language” paragraphs 1-3 p.74 <br>Read and narrate each section separately. Discuss perfect and imperfect tenses in English; notice the endings in Latin.</p><p>➜ READ, NARRATE, &amp; DISCUSS<br>“pugna” p.72<br>Preview vocabulary words that accompany the story. Read and narrate in small sections.</p><p>➜ PRACTICE<br>In “pugna” on p.72, find and translate at least two examples of perfect and imperfect tense verbs from the story.</p><p>➜ EVALUATE<br>Check any new vocabulary words you defined today with Vocabulary Checklist 6 or the glossary beginning on p.193.</p>","","","Lesson","0","FALSE"
"alveary-rec7kjonSr0OBz5kh","alveary-reclO5IL614fq8ilx","16","1","45m Latin 1 (Independent Study) - Lesson 31","<p>Stage 6: Felix and About the Language<br>⍞ Materials: Cambridge Unit 1, Latin notebook</p><p>PREP: Read “Fēlīx” and “Fēlīx et fūr” Teacher's Manual p.62-63.</p><p>➜ RECAP<br>• Review Vocabulary Checklist words from Latin notebook.<br>• Review perfect and imperfect tenses and their endings on p.74.</p><p>➜ WRITE<br>Continue to infer and record meanings in Vocabulary Checklist 6 as you read the stories in Stage 6.</p><p>➜ READ, NARRATE, &amp; DISCUSS<br>“Fēlīx” and “Fēlīx et fūr” p.72-73<br>Preview vocabulary words that accompany these stories. What might these stories be about? Read and narrate each paragraph separately.</p><p>➜ PRACTICE<br>• Reread “Fēlīx” on p.72 aloud, using appropriate inflection. Then identify and translate at least three perfect and imperfect verbs.<br>• Translate lines 1-3 orally, paying attention to perfect and imperfect tenses.</p><p>➜ READ, NARRATE, &amp; DISCUSS<br>“About the language” paragraphs 4-6 p.75<br>Read and narrate each section separately.</p><p>• When is it appropriate to use perfect and imperfect tenses?</p><p>➜ EVALUATE<br>Check any new vocabulary words you defined today with Vocabulary Checklist 6 or the glossary beginning on p.193.</p>","","","Lesson","0","FALSE"
"alveary-rec7kjonSr0OBz5kh","alveary-recamZdIJujLZ0ctp","16","2","45m Latin 1 (Independent Study) - Lesson 32","<p>Stage 6: Practicing the Language: avārus<br>⍞ Materials: Cambridge Unit 1, Latin notebook</p><p>➜ RECAP<br>• Review Vocabulary Checklist words from Latin notebook.<br>• Review perfect and imperfect tenses and their endings on p.74.</p><p>➜ WRITE<br>Continue to infer and record meanings in Vocabulary Checklist 6 as you read the stories in Stage 6.</p><p>➜ READ, NARRATE, &amp; DISCUSS <br>“Practicing the language: avārus” p.76<br>Preview vocabulary words that accompany the story. Read and narrate each paragraph separately.</p><p>➜ PRACTICE<br>• On p.77, answer questions 1-10 in English.<br>• On p.76, translate lines 1-7 into English; pay attention to tense.</p><p>➜ EVALUATE<br>Check any new vocabulary words you defined today with Vocabulary Checklist 6 or the glossary beginning on p.193.</p><p>➜ DISCUSS<br>Which words from today's lesson look or sound like words you know in English, Spanish, or French?</p>","","","Lesson","0","FALSE"
"alveary-rec7kjonSr0OBz5kh","alveary-recE9U3oDK5plINCo","17","1","45m Latin 1 (Independent Study) - Lesson 33","<p>Stage 6: The Work and Treatment of Slaves and Freeing a Slave<br>⍞ Materials: Cambridge Unit 1, Latin notebook</p><p>➜ RECAP<br>Review Vocabulary Checklist words from Latin notebook.</p><p>➜ READ, NARRATE, &amp; DISCUSS<br>“The work and treatment of slaves” p.79</p><p>➜ RECAP<br>“About the language” p.74-75</p><p>➜ PRACTICE<br>Complete Exercise 2 of &quot;Practicing the language&quot; on p.77. Then translate two sentences back into Latin. Check your translations against the originals; correct any mistakes.<br> <br>➜ READ, NARRATE, &amp; DISCUSS<br>“Freeing a slave” p.80</p><p>➜ PRACTICE<br>Translate “pugna” on p.72 into English. (The student will have two lessons to complete this activity.)</p>","<p>★ TEACHER TIP<br>The translations for all the model sentences and stories are in the digital Cambridge Unit 1 Teacher's Resource document, &quot;Student's Book Translations and Answers.&quot; The answers to &quot;About the language&quot; and &quot;Practicing the language&quot; exercises are also located here. This resource is part of the digital Teacher's Manual. The document can be downloaded as a single file containing all the Unit 1 translations and answers or as individual files for each stage.</p>","","Lesson","0","FALSE"
"alveary-rec7kjonSr0OBz5kh","alveary-recOHPdG8msC2DgJj","17","2","45m Latin 1 (Independent Study) - Lesson 34","<p>Stage 6: Pugna and Review Day<br>⍞ Materials: Cambridge Unit 1, Latin notebook</p><p>➜ RECAP<br>Review Vocabulary Checklist words from Latin notebook.</p><p>➜ READ, NARRATE, &amp; DISCUSS<br>“Freedmen and freedwomen” p.80-81</p><p>➜ RECAP<br>“About the language” p.74-75</p><p>➜ PRACTICE<br>Finish translating “pugna” on p.72 into English. Translate the last sentence back into Latin. Check your translation against the original; correct any mistakes.</p><p>➜ EVALUATE<br>Are all words from Vocabulary Checklist 6 (p.82) correctly defined in Latin notebook?</p><p>➜ RECAP<br>Review words from Stage 1 and Stage 2 in Latin notebook.</p><p>➜ CATCH UP<br>Use any remaining time to complete any missed activities from Stage 5 or Stage 6. If you are caught up, translate Model Sentences into English and then back into Latin, or use this extra time for another subject.</p>","","","Lesson","0","FALSE"
"alveary-rec7kjonSr0OBz5kh","alveary-rec1ZBU0bbODqRRWe","18","1","45m Latin 1 (Independent Study) - Lesson 35","<p>Catch Up and Review<br>⍞ Materials: Cambridge Unit 1, Latin notebook</p><p>➜ RECAP<br>Review Vocabulary Checklist words from Stage 3 and Stage 4 in Latin notebook.</p><p>➜ CATCH UP<br>Complete any missed activities from Stage 5 or Stage 6. If you are caught up, translate Model Sentences into English and then back into Latin, or use this extra time for another subject.</p>","","","Lesson","0","FALSE"
"alveary-rec7kjonSr0OBz5kh","alveary-rectvmZPCOzflrwNw","18","2","45m Latin 1 (Independent Study) - Lesson 36","<p>Catch Up and Review<br>⍞ Materials: Cambridge Unit 1, Latin notebook</p><p>➜ RECAP<br>Review Vocabulary Checklist words from Stage 5 and Stage 6 in Latin notebook.</p><p>➜ CATCH UP<br>Complete any missed activities from Stage 5 or Stage 6. If you are caught up, translate Model Sentences into English and then back into Latin, or use this extra time for another subject.</p>","","","Lesson","0","FALSE"
"alveary-rec7kjonSr0OBz5kh","alveary-recuihhVDxcnmvP19","19","1","45m Latin 1 (Independent Study) - Lesson 37","<p>Stage 7: CĒNA (Singular and Plural Perfect Tense) and Fābula Mīrābilis<br>⍞ Materials: Cambridge Unit 1, Latin notebook, sticky notes</p><p>PREP: Read “Model sentences” and “fābula mīrābilis” Teacher's Manual p.68-69.</p><p>➜ INTRO<br>Look at the Stage 7 title page picture on p.83. The Romans often had images like this in their dining rooms to remind them to enjoy life's pleasures while they still could.</p><p>➜ WRITE<br>Cover the definitions on p.98 with sticky notes. Copy &quot;Vocabulary Checklist 7.&quot; Infer and record meanings as you read the stories in Stage 7.</p><p>➜ READ, NARRATE, &amp; DISCUSS<br>Model Sentences p.84-85</p><p>➜ READ, NARRATE, &amp; DISCUSS<br>“fābula mīrābilis” p.86 <br>Preview vocabulary words that accompany the story. Read and narrate in small sections.</p><p>➜ EVALUATE<br>Check any new vocabulary words you defined today with Vocabulary Checklist 7 or the glossary beginning on p.193.</p>","<p>★ TEACHER NOTE<br>Preview “fābula mīrābilis” p.86</p>","","Lesson","0","FALSE"
"alveary-rec7kjonSr0OBz5kh","alveary-recjIipP5lI4dou8y","19","2","45m Latin 1 (Independent Study) - Lesson 38","<p>Stage 7: About the Language and Decēns<br>⍞ Materials: Cambridge Unit 1, Latin notebook</p><p>PREP: Read “About the language 1” and “Decēns” Teacher's Manual p.69-70.</p><p>➜ RECAP<br>• Review Vocabulary Checklist words in Latin notebook.<br>• “fābula mīrābilis” p.86</p><p>➜ READ, NARRATE, &amp; DISCUSS<br>“About the language 1” paragraphs 1-3 p.87</p><p>➜ PRACTICE<br>Translate the examples in paragraph 4 on p.87 into English.</p><p>➜ INTRO<br>Look at the picture on p.89 and translate the caption. Why might Decēns be very afraid?</p><p>➜ READ, NARRATE, &amp; DISCUSS<br>“Decēns” p.88 <br>Preview vocabulary words that accompany the story. Read and narrate the dialogue in sections.</p><p>➜ PRACTICE<br>Reread “Decēns” on p.88 aloud, taking parts and using appropriate inflection.</p><p>➜ EVALUATE<br>Check any new vocabulary words you defined today with Vocabulary Checklist 7 or the glossary beginning on p.193.</p><p>➜ DISCUSS<br>Which words from today's lesson look or sound like words you know in English, Spanish, or French?</p>","<p>★ TEACHER NOTE<br>Preview “Decēns” p.88-89</p>","","Lesson","0","FALSE"
"alveary-rec7kjonSr0OBz5kh","alveary-recVznfgWZXW05Rzp","20","1","45m Latin 1 (Independent Study) - Lesson 39","<p>Stage 7: Post Cēnam and About the Language 2<br>⍞ Materials: Cambridge Unit 1, Latin notebook</p><p>PREP: Read “post cēnam,&quot; “About the language 2,” and “Practicing the language&quot; Teacher's Manual p.70-73.</p><p>➜ RECAP<br>• Review Vocabulary Checklist words in Latin notebook.<br>• Review implied subjects on p.87.</p><p>➜ WRITE<br>Continue to infer and record meanings in Vocabulary Checklist 7 as you read the stories in Stage 7.</p><p>➜ READ, NARRATE, &amp; DISCUSS<br>“post cēnam” p.89<br>Preview vocabulary words that accompany the story. What might this story be about? Read and narrate each paragraph separately.</p><p>➜ PRACTICE<br>Create a chart of present, perfect singular, and perfect plural tense verbs from the first paragraph of “post cēnam” on p.89. Translate each verb in your chart.</p><p>➜ READ, NARRATE, &amp; DISCUSS<br>“About the language 2” p.90</p><p>➜ PRACTICE<br>Complete Exercise 2 of &quot;Practicing the language&quot; on p.94.</p><p>➜ EVALUATE<br>Check any new vocabulary words you defined today with Vocabulary Checklist 7 or the glossary beginning on p.193.</p>","","","Lesson","0","FALSE"
"alveary-rec7kjonSr0OBz5kh","alveary-rec076wRolm8Cpp13","20","2","45m Latin 1 (Independent Study) - Lesson 40","<p>Stage 7: Practicing the Language and Metella et Melissa<br>⍞ Materials: Cambridge Unit 1, Latin notebook</p><p>PREP: Read “Metella et Melissa” Teacher's Manual p.72.</p><p>➜ RECAP<br>• Review Vocabulary Checklist words in Latin notebook.<br>• Review &quot;About the language 2” p.90</p><p>➜ PRACTICE<br>Complete Exercise 3 of &quot;Practicing the language&quot; on p.94. Translate two sentences back into Latin. Check your translations against the originals; correct any mistakes.</p><p>➜ DICTATE<br>Study Model Sentence 9 on p.85. Write from dictation when ready.</p><p>➜ INTRO<br> Look at the picture that accompanies the story on p.91. Why do you think Melissa is crying?</p><p>➜ READ, NARRATE, &amp; DISCUSS<br>“Metella et Melissa” p.91<br>Preview vocabulary words that accompany the story. Read and narrate each paragraph separately.</p><p>➜ PRACTICE<br>Translate the last paragraph of “Metella et Melissa” on p.91 into English.</p><p>➜ EVALUATE<br>Check any new vocabulary words you defined today with Vocabulary Checklist 7 or the glossary beginning on p.193.</p>","","","Lesson","0","FALSE"
"alveary-rec7kjonSr0OBz5kh","alveary-recmYLJ5H9OByrsyu","21","1","45m Latin 1 (Independent Study) - Lesson 41","<p>Stage 7: Animal Ferōx and Roman Beliefs<br>⍞ Materials: Cambridge Unit 1, Latin notebook</p><p>PREP: Read “Practicing the language” and “Cultural context material” Teacher's Manual p.72-74.</p><p>➜ RECAP<br>Review Vocabulary Checklist words in Latin notebook.</p><p>➜ INTRO<br>This is a story about a hunting expedition.</p><p>➜ READ, NARRATE, &amp; DISCUSS<br>“animal ferōx” p.92<br>Preview vocabulary words that accompany the story. Read and narrate each paragraph separately.</p><p>➜ WRITE<br>Write a narration of “animal ferōx”on p.92 in English.</p><p>➜ READ, NARRATE, &amp; DISCUSS<br>“Roman beliefs about life after death” p.95-97<br>Preview the pictures that accompany the text. Read and narrate.</p><p>➜ EVALUATE<br>Are all words from Vocabulary Checklist 7 (p.98) correctly defined in Latin notebook?</p>","<p>★ TEACHER NOTE<br>Preview “Roman beliefs about life after death” p.95-97</p>","","Lesson","0","FALSE"
"alveary-rec7kjonSr0OBz5kh","alveary-rec7AO2Q3h3WMXcFI","21","2","45m Latin 1 (Independent Study) - Lesson 42","<p>Catch-Up Day<br>⍞ Materials: Cambridge Unit 1, Latin notebook</p><p>➜ RECAP<br>Review Vocabulary Checklist words from Stage 7 in Latin notebook.</p><p>➜ CATCH UP<br>Complete any missed activities from Stage 7. If you are caught up, translate Model Sentences into English and then back into Latin, or use this extra time for another subject.</p>","","","Lesson","0","FALSE"
"alveary-rec7kjonSr0OBz5kh","alveary-reckaC9SFGhYteOok","22","1","45m Latin 1 (Independent Study) - Lesson 43","<p>Stage 8: GLADIĀTŌRĒS (Accusative Plural Nouns and Superlative Adjectives)<br>⍞ Materials: Cambridge Unit 1, Latin notebook, sticky notes</p><p>PREP: Read “Model sentences” and “gladiātōrēs” Teacher's Manual p.76-78.</p><p>➜ INTRO<br>• Look at the Stage 8 title page picture on p.99. What do you know about gladiators? <br>• Look at the picture of the amphitheater on p.102. How is it similar to and different from arenas and stadiums today?</p><p>➜ WRITE<br>Cover the definitions on p.114 with sticky notes. Copy &quot;Vocabulary Checklist 8.&quot; Infer and record meanings as you read the stories in Stage 8.</p><p>➜ READ, NARRATE, &amp; DISCUSS<br>Model Sentences p.100-101</p><p>➜ READ, NARRATE, &amp; DISCUSS<br>“gladiātōrēs” p.102<br>Preview vocabulary words that accompany the story. What might this story be about? Read and narrate each paragraph separately.</p><p>➜ EVALUATE<br>Check any new vocabulary words you defined today with Vocabulary Checklist 8 or the glossary beginning on p.193.</p>","","","Lesson","0","FALSE"
"alveary-rec7kjonSr0OBz5kh","alveary-recHKIDoGG3MpOzMk","22","2","45m Latin 1 (Independent Study) - Lesson 44","<p>Stage 8: In Arēnā and About the Language 1<br>⍞ Materials: Cambridge Unit 1, Latin notebook</p><p>PREP: Read “in arēnā” and “About the language I” Teacher's Manual p.78-79.</p><p>➜ RECAP<br>• Review Vocabulary Checklist words in Latin notebook.<br>• Look at the picture of the retiarius (net fighter) on p.103. How do you think the items listed in the caption were used in the arena?</p><p>➜ WRITE<br>Continue to infer and record meanings in Vocabulary Checklist 8 as you read the stories in Stage 8.</p><p>➜ READ, NARRATE, &amp; DISCUSS<br>“in arēnā” p.103<br>Preview vocabulary words that accompany the story. What might this story be about? Read and narrate each paragraph separately.</p><p>➜ READ, NARRATE, &amp; DISCUSS<br>“About the language 1” paragraphs 1-3 p.104</p><p>➜ PRACTICE<br>Translate the examples in paragraph 4 on p.104 into English. Translate two sentences back into Latin. Check your translations against the originals; correct any mistakes.</p><p>➜ EVALUATE<br>Check any new vocabulary words you defined today with Vocabulary Checklist 8 or the glossary beginning on p.193.</p><p>➜ DISCUSS<br>Which words from today's lesson look or sound like words you know in English, Spanish, or French?</p>","","","Lesson","0","FALSE"
