"course_custom_id","assignment_custom_id","assignment_week","assignment_day","assignment_name","assignment_description","assignment_teachersNote","assignment_linksUrl","assignment_type","assignment_duration","assignment_graded"
"alveary-recMYadcz9N8jmHYs","alveary-recqc5xLiIpQ61Uhx","1","1","20m General Science: Grade 4 - Lesson 1","<p>Zooming In<br>⍞ Materials: The Universe in You, penny/dime, ruler, hand lens, image link</p><p>➜ INTRO<br>What's the smallest Thing you've ever seen? Do you think there is anything smaller? Look at the picture on the cover. What do you think you are seeing? Did you know that there are such Things that are so small that we can't usually see them? This book is about the smallest Things we know of. You can use your ruler to track how small Things are for the first few pages.</p><p>➜ READ<br>p.1-8 &quot;The Calliope Hummingbird&quot; - &quot;of a vellus hair.&quot;</p><p>➜ ACTIVITY<br>Can you see your skin cells or bacteria? How can we know they exist? Sometimes we can sense the effect of something we can't see, like the wind; sometimes we can use a tool to make it visible. To look closer at small Things, scientists use a tool called a microscope. We do 2 things with a microscope: magnify and focus.<br>• Look at ∞ Image Link: Penny &amp; Salt or Dime &amp; Salt<br>• This image has been magnified. Compare it to your coin. What does it mean to be magnified? How much bigger is it? How many of your coins could fit across this image? <br>• Did you notice that there are some salt crystals on the magnified coin? How much has the salt been magnified? (same as the coin)<br>• Use your hand lens to look at your coin. What details do you notice that you couldn't see without the hand lens? Look at the other side: <br>Penny: Can you find the little man between the columns of the building? Notice what happens as you move the penny and lens closer together/farther apart. What does it mean to focus?<br>Dime: Notice that the plants on either side of the torch are different. One is an olive and the other an oak. Can you tell the difference? Notice what happens as you move the dime and lens closer together/farther apart. What does it mean to focus?</p><p>➜ NARRATE &amp; DISCUSS</p>","<p>★ TEACHER TIP<br>Spend as much time as is wanted looking at the artwork in this book before going on to each successive page. Share the captioned facts, as desired.</p><p>★ TEACHER NOTE<br>Note that next week is an activity day. Check your supplies!</p>","https://planning.alveary.org/links.html?id=recMYadcz9N8jmHYs&term=1&week=1","Lesson","0","FALSE"
"alveary-recMYadcz9N8jmHYs","alveary-rec1vx4JUITzExv6S","2","1","20m General Science: Grade 4 - Lesson 2","<p>The Microscope<br>⍞ Materials: video/image links, microscope, flashlight, slide, salt crystals</p><p>➜ INTRO<br>What did we learn about in the last lesson? How do we see very small Things? What two things does a microscope do? Let's look at a very old microscope, and then we'll compare that to ours. Watch for him to show you the tube where the magnifying lenses are and the mirrors that direct the light.</p><p>➜ VIEW<br>∞ Video Link: A 1750s Compound Microscope (5:06)</p><p>➜ ACTIVITY<br>• Where is the tube and where are the lenses on your microscope? Refer to the diagram that came with your microscope. The one at the link may help for comparison. How much does the lens at your eyepiece (the ocular lens) magnify? How much do the lenses at the bottom of your tube (the objective lenses) magnify?<br>∞ Image Link: Compound Microscope Parts<br>• How did he use the mirror? Where is your light source? Place a slide with a few salt crystals on the stage. Does this direct light through the specimen or onto the surface? Look at the crystals and describe/draw what you see.<br>• Turn the light source off and instead shine the flashlight down onto the surface of the salt crystals. Adjust the flashlight to point as much light onto the surface as you can. Look at the crystals and describe how this is different from the lower light source.</p><p>➜ NARRATE &amp; DISCUSS</p>","","https://planning.alveary.org/links.html?id=recMYadcz9N8jmHYs&term=1&week=2","Lesson","0","FALSE"
"alveary-recMYadcz9N8jmHYs","alveary-recT7EquFdW2z18Q1","3","1","20m General Science: Grade 4 - Lesson 3","<p>Zooming in Further<br>⍞ Materials: The Universe in You</p><p>PREP: Read Teacher Tip</p><p>➜ INTRO<br>What did the girl in this book see last time? Look at the pictures, as needed.</p><p>➜ READ, NARRATE, &amp; DISCUSS<br>p.9-end &quot;The smallest hairs&quot; - &quot;the universe within.&quot;</p>","<p>★ TEACHER TIP<br>Students don't need to remember all of the scientific language. Just let them hear it &quot;by the way.&quot;</p>","","Lesson","0","FALSE"
"alveary-recMYadcz9N8jmHYs","alveary-recubRuRw0NbOCTmY","4","1","20m General Science: Grade 4 - Lesson 4","<p>Imagining<br>⍞ Materials: poem link, image links</p><p>PREP: Read Teacher Tip</p><p>➜ INTRO<br>We've been learning about very small Things. Tell me about Things too small to see. How can we know they are there? Some of the Things in your book (and in the lab) are so small that you won't be able to see them even with your microscope. Sometimes, when we first begin looking very closely and using a microscope, it can be hard to know what we are looking at.  Read our poem for today. What do you think the author would say about the strange images we see under the microscope?</p><p>➜ READ, DISCUSS, &amp; REREAD<br>∞ Website Link: The Microbe</p><p>➜ ACTIVITY<br>Even while we keep looking and asking questions, imagining what the image reminds us of can help us think about what we're seeing. Check out the imaginings at the link, and then draw or describe some of your own using the images in the Science Photo Gallery or some that you have seen under your microscope.<br>∞ Image Link: Microscope Imaginings<br>∞ Image Link: Science Photo Gallery</p><p>• DEFINITIONS<br>sanguine: marked by eager hopefulness : confidently optimistic</p>","<p>★ TEACHER TIP<br>Students who find copywork/dictation challenging may be anxious or unsure about today's activity. Encourage them to dictate, work in tandem, or even try a digital drawing program, if this is available.</p>","https://planning.alveary.org/links.html?id=recMYadcz9N8jmHYs&term=1&week=4","Lesson","0","FALSE"
"alveary-recMYadcz9N8jmHYs","alveary-recZCLevxVllsI07x","5","1","20m General Science: Grade 4 - Lesson 5","<p>Louis Pasteur<br>⍞ Materials: video link</p><p>PREP: Read Teacher Tip</p><p>➜ INTRO<br>Tell me what we were thinking about in the last lesson. The invention of the microscope allowed many scientists to begin looking closer and asking questions. Louis Pasteur is one of the most famous. Let's hear his story today.</p><p>➜ VIEW, NARRATE, &amp; DISCUSS<br>∞ Video Link: Louis Pasteur (10:36)</p><p>• Pasteur said, &quot;Do not let yourself be tainted with barren skepticism.&quot; What does that mean? How do we ask questions, like the poet who wrote the Microbe suggests, without being &quot;tainted with barren skepticism&quot;?</p>","<p>★ TEACHER TIP<br>Are your learner(s) demonstrating more ease in using the microscope? More interest/ease in describing what they see with it or how it works? If not, consider practicing together more often, exploring extra helpings, or taking a field trip to a museum or lab with microscopes. Reach out through Contact Us if you need help.</p>","https://planning.alveary.org/links.html?id=recMYadcz9N8jmHYs&term=1&week=5","Lesson","0","FALSE"
"alveary-recMYadcz9N8jmHYs","alveary-recAaBWgXJr3OVBD3","6","1","20m General Science: Grade 4 - Lesson 6","<p>Microscopy Questions Today<br>⍞ Materials: video link</p><p>➜ INTRO<br>What have we been learning about? Who was Louis Pasteur, and what kinds of questions did he ask? What kinds of questions do you think people ask with their microscopes today? For the next few weeks, we'll learn about some of today's questions.</p><p>➜ VIEW, NARRATE, &amp; DISCUSS<br>∞ Video Link: We Don't Know Why Moth Wings Glow (10:09)</p>","<p>★ TEACHER NOTE<br>The lesson video mentions evolution and adaptation during 5:37-6:40. Teachers might choose to introduce the terms by the way, forward through that portion, or watch without some or all of the narration.</p>","https://planning.alveary.org/links.html?id=recMYadcz9N8jmHYs&term=1&week=6","Lesson","0","FALSE"
"alveary-recMYadcz9N8jmHYs","alveary-recFxOAgUunMxQAiv","7","1","20m General Science: Grade 4 - Lesson 7","<p>Microscopy Questions Today<br>⍞ Materials: video link</p><p>➜ INTRO<br>What did we see last week? Today we have another question that scientists are using microscopes to investigate.</p><p>➜ VIEW, NARRATE, &amp; DISCUSS<br>∞ Video Link: The Cryptic Origins of Yogurt (10:21)</p>","","https://planning.alveary.org/links.html?id=recMYadcz9N8jmHYs&term=1&week=7","Lesson","0","FALSE"
"alveary-recMYadcz9N8jmHYs","alveary-recUVNM8XcjztGRsh","8","1","20m General Science: Grade 4 - Lesson 8","<p>Microscopy Questions Today<br>⍞ Materials: video link</p><p>➜ INTRO<br>Tell me about our video from last week. Let's learn about one more question today.</p><p>➜ VIEW, NARRATE, &amp; DISCUSS<br>∞ Video Link: Tiny Mysteries from the Black Sea (8:07)</p>","","https://planning.alveary.org/links.html?id=recMYadcz9N8jmHYs&term=1&week=8","Lesson","0","FALSE"
"alveary-recMYadcz9N8jmHYs","alveary-recAscQCHzDIPFahI","9","1","20m General Science: Grade 4 - Lesson 9","<p>The Universe in You<br>⍞ Materials: The Universe in You</p><p>➜ INTRO<br>Tell me about some of the questions that scientists are using microscopes to investigate. Now that you've seen your own cells in the lab, let's read our book one more time.</p><p>➜ READ, NARRATE, &amp; DISCUSS<br>The Universe in You (whole book)</p>","","","Lesson","0","FALSE"
"alveary-recMYadcz9N8jmHYs","alveary-recB0y3HMQpkdoIxC","10","1","20m General Science: Grade 4 - Lesson 10","<p>Zooming In Even More<br>⍞ Materials: website link, printable</p><p>PREP: Read Teacher Tip</p><p>➜ INTRO<br>What are some of the most interesting Things you've looked at with your microscope? What else would you like to see? You may have noticed that when you zoom in as much as you can, the image starts to get blurry. Once they zoom in that far, scientists have to use another kind of microscope to zoom in even more. The Science Photo link contains a gallery of images using these special microscopes. The scientist who prepared these images added color to help draw our attention to certain features. Explore the gallery.</p><p>➜ VIEW<br>∞ Website Link: Science Photo Gallery</p><p>➜ ACTIVITY<br>The links below contain a collection of original images without color that a scientist shared especially for you. You may choose images from this collection to add your own color.  Which features do you find most interesting? Which ones do you want your viewer to notice?<br>∞ Printable Link: Electron Microscope Coloring Pages</p>","<p>★ TEACHER TIP<br>Students who find copywork/dictation challenging may be anxious or unsure about today's coloring activity. Encourage them to dictate, work in tandem, or even try a digital coloring program, if this is available.</p>","https://planning.alveary.org/links.html?id=recMYadcz9N8jmHYs&term=1&week=10","Lesson","0","FALSE"
"alveary-recMYadcz9N8jmHYs","alveary-recJxjuHNYS1QzbFb","11","1","20m General Science: Grade 4 - Lesson 11","<p>Catch Up</p><p>PREP: Read Teacher Tip</p><p>➜ CATCH UP<br>Use this time to catch up on lessons in this or another course, or explore Extra Helpings.</p>","<p>★ TEACHER TIP<br>When student(s) take exams next week, evaluate what they recall, but more importantly, whether the microscope, people, or Things they have seen are more familiar or have possibly even become a particular friend! If no relational growth is observed, consider why: do they need more hands-on time, more reading support, less business, etc? Reach out through Contact Us if you need help.</p>","","Lesson","0","FALSE"
"alveary-recMYadcz9N8jmHYs","alveary-recYqkmiuK6P47vPD","12","1","20m General Science: Grade 4 - Lesson 12","<p>Exam Week</p><p>➜ EXAMS<br>Answer question(s) related to course.</p><p>Questions will come from:<br>The Universe in You and multimedia content</p>","<p>★ General Science: Grade 4 — TERM 1 EXAM QUESTIONS<br>· The Universe in You: Tell about or draw what microscopes do. OR Tell about or draw something that you or another scientist has seen with microscopes.</p><p>· Share what you learned about using the microscope. Tell about a challenge in using this tool and how you worked to overcome this challenge.</p>","","Exam","0","FALSE"
"alveary-recMYadcz9N8jmHYs","alveary-reci1FTi73VOiub85","13","1","20m General Science: Grade 4 - Lesson 13","<p>Inspiration<br>⍞ Materials: To Fly</p><p>PREP: Read Teacher Tip</p><p>➜ INTRO<br>Look at the picture on the cover. Do you know who the Wright Brothers are? What do you know about them? Read and discuss the poem called &quot;Crazy Boys&quot; in the early pages of the book.</p><p>➜ READ, NARRATE, &amp; DISCUSS<br>p.7 &quot;People had always&quot; - &quot;For a time.&quot;</p><p>• How do you think the toys that inspired the Wrights worked? Can you tell from the picture? Compare to this image from the Smithsonian Museum:<br>∞ Image Link: Smithsonian: Orville's Sketch of Penaud's Helicopter</p><p>➜ SUPPLEMENTAL<br>Notice how many times the craftsman in the video fails before he gets it right, but how wonderfully it works when he does.<br>∞ Video Link: YouTube: Making a Penaud Helicopter (5:04)</p>","<p>★ TEACHER TIP<br>As you read, notice the purpose of the passage. Then, if students struggle to narrate, you can prompt them by helping them identify the purpose. Is it describing a scene or a person? Telling a sequence of events? Explaining an idea?</p><p>★ TEACHER TIP<br>Supplemental links for optional support are provided at the END of the lesson. They can be used at any point to help generate interest during the introduction, to enliven the lesson itself, or to add to the discussion later. They are NOT required and should NOT take away from the narration and discussion. Experiment and see what works best for your student(s).</p>","https://planning.alveary.org/links.html?id=recMYadcz9N8jmHYs&term=2&week=13","Lesson","0","FALSE"
"alveary-recMYadcz9N8jmHYs","alveary-rec68M5Qvq8uQRl0l","14","1","20m General Science: Grade 4 - Lesson 14","<p>Observing Motion<br>⍞ Materials: To Fly</p><p>PREP: Read Teacher Tip</p><p>➜ INTRO<br>Recall how the story began. Do you think the propeller on their toy helicopter is a simple machine? If so, which might it be?</p><p>➜ READ, NARRATE, &amp; DISCUSS<br>p.8 &quot;Wilbur and Orville&quot; - &quot;than flat ones.&quot;</p><p>• Do you think the kites that Orville built were simple machines? If so, which one? If not, why not? Spend any remaining lesson time noticing objects or tools that make work and motion easier. This is a good indication that there is probably a simple machine at work.</p>","<p>★ TEACHER TIP<br>Hinges, knives, jar lids, any piece of playground equipment, the pulley on a flagpole, garage doors, stairs, scissors, etc., are all simple machines. Help students notice that they are everywhere while discussing.</p>","","Lesson","0","FALSE"
"alveary-recMYadcz9N8jmHYs","alveary-recSVd5ecbF9fNaYG","15","1","20m General Science: Grade 4 - Lesson 15","<p>Learning Together<br>⍞ Materials: To Fly</p><p>➜ INTRO<br>Tell me about the Wrights so far. Let's find out what happens when they grow up.</p><p>➜ READ, NARRATE, &amp; DISCUSS<br>p.10-13 &quot;In time, Orville&quot; - &quot;the right answer.&quot;</p><p>• Disagreeing and arguing seemed to help Orville and Wilbur. Do you feel the same way when someone disagrees with you? If so, how does it help you? If not, why not? When you disagree with someone, do you feel like you are trying to help them?</p>","","","Lesson","0","FALSE"
"alveary-recMYadcz9N8jmHYs","alveary-recSATHAvi2KaEdGd","16","1","20m General Science: Grade 4 - Lesson 16","<p>Kites Become Gliders<br>⍞ Materials: To Fly</p><p>➜ INTRO<br>Where did we leave the Wrights? Recall what happened. How do you think they got from bicycles to airplanes?</p><p>➜ READ, NARRATE, &amp; DISCUSS<br>p.15-18 &quot;In 1896, Orville&quot; - &quot;was build it.&quot;</p><p>• Describe the 3 movements described in the passage. You can tell, draw, or use your body to do this. Show the special mechanism that would allow the Wrights to control the movements.</p>","","","Lesson","0","FALSE"
"alveary-recMYadcz9N8jmHYs","alveary-recxyuJTcvjDQy81w","17","1","20m General Science: Grade 4 - Lesson 17","<p>Experiments<br>⍞ Materials: To Fly</p><p>PREP: Read Teacher Tip</p><p>➜ INTRO<br>Recall what happened in the last passage.</p><p>➜ READ, NARRATE, &amp; DISCUSS<br>p.19-22 &quot;Wilbur wrote to&quot; - &quot;problems of flight.&quot;</p><p>• There were many highs and lows during the Wrights' engineering process. Have you ever worked at something that got you both excited and frustrated? Did you want to give up?</p>","<p>★ TEACHER TIP<br>Are your learner(s) demonstrating more ease in exploring how Things work? More interest/ease in thinking about the Wright Brothers or their work? If not, consider playing with mechanical toys together, exploring extra helpings, or taking a field trip to a park to observe the equipment. Reach out through Contact Us if you need help.</p>","","Lesson","0","FALSE"
"alveary-recMYadcz9N8jmHYs","alveary-recUtBgNFCErcQ7T6","18","1","20m General Science: Grade 4 - Lesson 18","<p>Using the Right Information<br>⍞ Materials: To Fly</p><p>➜ INTRO<br>Recall what happened in the last passage.</p><p>➜ READ, NARRATE, &amp; DISCUSS<br>p.24-27 &quot;The brothers began&quot; - &quot;self-propelled flying machine.&quot;</p><p>• What do you think helped the Wrights to persevere and keep going even though they had been so frustrated in the last reading?</p>","","","Lesson","0","FALSE"
"alveary-recMYadcz9N8jmHYs","alveary-recja2SfZX7EAD1io","19","1","20m General Science: Grade 4 - Lesson 19","<p>Designing a Flyer<br>⍞ Materials: To Fly</p><p>➜ INTRO<br>Recall what happened in the last passage.</p><p>➜ READ, NARRATE, &amp; DISCUSS<br>p.28-32 &quot;During the winter&quot; - &quot;a homemade engine?&quot;</p>","","","Lesson","0","FALSE"
"alveary-recMYadcz9N8jmHYs","alveary-recAdkJfdUamQvVrY","20","1","20m General Science: Grade 4 - Lesson 20","<p>The First Attempt<br>⍞ Materials: To Fly</p><p>PREP: Read Teacher TIp</p><p>➜ INTRO<br>Recall what happened in the last passage.</p><p>➜ READ, NARRATE, &amp; DISCUSS<br>p.33-34 &quot;On Monday, December&quot; - &quot;a successful flight.&quot;</p><p>➜ SUPPLEMENTAL<br>Examine the photographs in the link, especially photos 1, 2, and 5. Notice what the differences were between their gliders and the airplane. If interested, draw or diagram any or all of them, showing the important features. <br>∞ Image Link: Wright Brothers Memorial</p>","<p>★ TEACHER TIP<br>Supplemental links for optional support are provided at the END of the lesson. They can be used at any point to help generate interest during the introduction, to enliven the lesson itself, or to add to the discussion later. They are NOT required and should NOT take away from the narration and discussion. Experiment and see what works best for your student(s).</p>","https://planning.alveary.org/links.html?id=recMYadcz9N8jmHYs&term=2&week=20","Lesson","0","FALSE"
"alveary-recMYadcz9N8jmHYs","alveary-recUASxbBTIk746eg","21","1","20m General Science: Grade 4 - Lesson 21","<p>The First Flight<br>⍞ Materials: To Fly</p><p>➜ INTRO<br>Recall what happened in the last passage. Do you think they will try again?</p><p>➜ READ, NARRATE, &amp; DISCUSS<br>p.36-41 &quot;It took two&quot; - &quot;Aviation had begun.&quot;</p><p>• Their friend said they seemed like two people &quot;who weren't sure they'd ever see each other again.&quot; What does it say about their characters that they kept trying even though they knew they could die? Why would they do this?</p><p>➜ SUPPLEMENTAL<br>∞ Image Link: Library of Congress: First Flight</p><p>• NATURE NOTEBOOK <br>Prompt for General Science: Grade 4 in Outdoor Work Quick Link.</p>","","https://planning.alveary.org/links.html?id=recMYadcz9N8jmHYs&term=2&week=21","Lesson","0","FALSE"
"alveary-recMYadcz9N8jmHYs","alveary-reczUALBbvoAf0S6C","22","1","20m General Science: Grade 4 - Lesson 22","<p>Lessons from their Story<br>⍞ Materials: To Fly</p><p>➜ INTRO<br>Recall what happened in the last passage. What do you think the world thought about this news?</p><p>➜ READ, NARRATE, &amp; DISCUSS<br>p.42-44 &quot;The brothers packed&quot; - &quot;actually did it.&quot;</p><p>• Everyone has strengths and challenges, even the Wright Brothers. Talk about how you have noticed this in yourself or your friends and family.</p><p>• NATURE NOTEBOOK <br>Prompt for General Science: Grade 4 in Outdoor Work Quick Link.</p>","","","Lesson","0","FALSE"
"alveary-recMYadcz9N8jmHYs","alveary-recPESt22EY0gssR2","23","1","20m General Science: Grade 4 - Lesson 23","<p>Catch Up</p><p>PREP: Read Teacher Tip</p><p>➜ CATCH UP<br>Use this time to catch up on lessons in this or another course, or explore Extra Helpings.</p><p>• FIELD TRIP<br>Visit a location that has airplanes. The Wright Brothers National Memorial, an Air and Space museum, or an airport observation deck are examples.</p>","<p>★ TEACHER TIP <br>When student(s) take exams next week, evaluate what they recall, but more importantly, whether the airplane, the Wright Brothers, any mechanical Things, or any Things that they have met are more familiar or have possibly even become a particular friend! If no relational growth is observed, consider why: do they need more hands-on time, more reading support, less business, etc? Reach out through Contact Us if you need help.</p>","","Lesson","0","FALSE"
"alveary-recMYadcz9N8jmHYs","alveary-reccqhGIbC1eEcLOZ","24","1","20m General Science: Grade 4 - Lesson 24","<p>Exam Week</p><p>➜ EXAMS<br>Answer question(s) related to course.</p><p>Questions will come from:<br>To Fly</p>","<p>★ General Science: Grade 4 — TERM 2 EXAM QUESTIONS<br>· To Fly: Tell about or draw how the Wright Brothers made their plane fly when no one else could. OR Tell how the Wright Brothers helped each other when they got frustrated.</p><p>· Explain how you did an investigation in the science lab this term and what you learned from it.</p>","","Exam","0","FALSE"
"alveary-recMYadcz9N8jmHYs","alveary-recKaCYnMwTGVAN75","25","1","20m General Science: Grade 4 - Lesson 25","<p>It Reminds Me Of<br>⍞ Materials: The Elephant Scientist, globe</p><p>➜ INTRO<br>Look at the picture on the cover and the title. Have you seen elephants at a zoo? What do you remember about them? Do you think they communicate with each other? If so, how? This is a story about scientists who are trying to explain how they communicate and what they are saying. Most of the elephants in this book live at Etosha National Park and Mushara Waterhole. You can find it on the map on the page just before the Table of Contents. Can you find the location on your globe?</p><p>➜ READ, NARRATE, &amp; DISCUSS<br>p.1-3 &quot;Caitlin O'Connell peered&quot; - &quot;sense their environment.&quot;</p>","","","Lesson","0","FALSE"
"alveary-recMYadcz9N8jmHYs","alveary-rec9iR0HB2AaySsGC","26","1","20m General Science: Grade 4 - Lesson 26","<p>Becoming a Scientist<br>⍞ Materials: The Elephant Scientist</p><p>PREP: Read Teacher Tip</p><p>➜ INTRO<br>Recall what happened in the last passage.</p><p>➜ READ &amp; NARRATE<br>p.4-6 &quot;Caitlin O'Connell studies&quot; - &quot;her animal studies.&quot;</p><p>➜ READ, NARRATE, &amp; DISCUSS<br>p.7-10 &quot;After working with&quot; - &quot;she never anticipated.&quot;</p><p>• Do you think it would be challenging to study and learn about something that you cannot see? Why or why not? How can technology, like you see in the link, help scientists study the invisible?<br>∞ Video Link: What does Sound look like? (2:32)</p>","<p>★ TEACHER TIP<br>Some students may be able to read the entire passage and narrate the scientist's journey, but others may benefit from having it broken into smaller portions, as it is presented here. Do whatever is most appropriate for the student(s).</p>","https://planning.alveary.org/links.html?id=recMYadcz9N8jmHYs&term=3&week=26","Lesson","0","FALSE"
"alveary-recMYadcz9N8jmHYs","alveary-recwhmswtDaFXsK93","27","1","20m General Science: Grade 4 - Lesson 27","<p>To Be an Elephant<br>⍞ Materials: The Elephant Scientist</p><p>PREP: Read Teacher Tip</p><p>➜ INTRO<br>Recall what happened in the last passage.</p><p>➜ READ, NARRATE, &amp; DISCUSS<br>p.11-16 &quot;African elephants reign&quot; - &quot;consume enough food.&quot;</p><p>➜ SUPPLEMENTAL<br>∞ Video Link: Learning to be an Elephant (1:51)</p><p>➜ NOTE <br>Read &quot;Elephant Species&quot; on p.17, if desired.</p>","<p>★ TEACHER TIP<br>Supplemental links for optional support are provided at the END of the lesson. They can be used at any point: to help generate interest during the introduction, to enliven the lesson itself, or to add to the discussion later. They are NOT required and should NOT take away from the narration and discussion. Experiment and see what works best for your student(s).</p>","https://planning.alveary.org/links.html?id=recMYadcz9N8jmHYs&term=3&week=27","Lesson","0","FALSE"
