"course_custom_id","assignment_custom_id","assignment_week","assignment_day","assignment_name","assignment_description","assignment_teachersNote","assignment_linksUrl","assignment_type","assignment_duration","assignment_graded"
"alveary-rec9lkHl3pKY5QBnE","alveary-recuoD3CbT6FPGZnu","17","2","20m Geography: Grade 3 (U.S.) - Lesson 34","<p>Capitals<br>⍞ Materials: Cross-Country, U.S. Atlas, My U.S. Map</p><p>➜ INTRO<br>Ask students if they have ever ridden in a car to a different state. What did the state line look like?</p><p>➜ MAP QUESTIONS<br>⍞ Map Resource: United States Atlas “The Political United States: Political Map” p.14-15<br>1\. Locate state capitals.<br>2\. What symbol represents a state capital? (a star within a single circle)<br>3\. How is this different from the symbols for other cities? (Other cities are depicted as solid black dots of varying size, dependent upon population. Washington, D.C. is shown as a star within a double circle.)<br>4\. Identify the state capitals for every state the Pages have traveled through. These are the states: California, Nevada, Arizona, Utah, Colorado, Kansas, Missouri, Illinois, Indiana, Kentucky, and Tennessee.</p><p>⍞ Map Resource: Inside front cover of Cross-Country<br>1\. Can you find the state capitals on this map? What are they marked with? (A red star within a white circle)<br>2\. Which state capitals have the Pages traveled through so far? (Salt Lake City, Utah; Denver, Colorado; Topeka, Kansas; Jefferson City, Missouri; and Nashville, Tennessee)</p><p>➜ READ, NARRATE, &amp; DISCUSS<br>Cross-Country<br>p.102-103 “‘We have been’&quot;- &quot;'Movie stars!’”</p><p>➜ MAP WORK<br>⍞ Map Resource: My U.S. Map<br>Label the capital city of the state you live in, and also add the capitals the Pages drove through. (If drawing a symbol different from regular cities, do not use a star within a double circle since lesson 2 of the previous year used it for Washington, D.C. Previous lessons involved labeling Denver and Nashville, but drawing symbols representing capitals was not specified. If adding Raleigh, Richmond, or Annapolis to the map, leave room for North Carolina, Virginia, or Maryland to be labeled in future lessons.)</p>","","","Lesson","0","FALSE"
"alveary-rec9lkHl3pKY5QBnE","alveary-reckgzXHGqIjdKiFe","18","1","20m Geography: Grade 3 (U.S.) - Lesson 35","<p>Appalachian Mountains<br>⍞ Materials: Cross-Country, United States Atlas, Grandma Gatewood</p><p>➜ INTRO<br>Have you ever visited the mountains? Or seen them from a car or plane? Or even traveled up a mountain? If so, do you know where the mountains were? Are you able to describe the mountain(s)?</p><p>➜ MAP QUESTIONS<br>⍞ Map Resource: Inside front of Cross-Country<br>1\. Locate Nashville, Tennessee.<br>2\. Locate Great Smoky Mountains National Park nearby.<br>3\. What direction do you travel to get from Nashville to the Great Smoky Mountains National Park? (east)<br>4\. What larger mountain range is this national park a part of? (Appalachian Mountains)</p><p>⍞ Map Resource: United States Atlas “The Physical United States: Physical Map” p.8-9<br>1\. Explore the topography cross-section located at the bottom of these pages. This is what you would see if you drew a straight line from San Francisco, California, to Washington, D.C., cut along the line, and then tilted the top portion so you could view it from the side instead of from the top. <br>2\. Compare the height of the Appalachian Mountains with the Rocky Mountains. Based on this observation, what do you think the Appalachian Mountains will be like?<br>3\. Looking now at the main map, what vegetation would you expect in the Appalachian Mountains along the eastern Tennessee border? (broadleaf forests)</p><p>⍞ Map Resource: Inside cover of Grandma Gatewood<br>1\. Read the title of the key. How many smaller ranges are a part of the Appalachian Mountains? (8)<br>2\. Locate the Great Smoky Mountains on the southern end.</p>","","","Lesson","0","FALSE"
"alveary-rec9lkHl3pKY5QBnE","alveary-recchgUOAUyJ5GYYo","18","2","20m Geography: Grade 3 (U.S.) - Lesson 36","<p>Appalachian Mountains<br>⍞ Materials: Grandma Gatewood</p><p>➜ NOTE        <br>Grandma Gatewood pages are not numbered, so consider page 2 to start &quot;Between eleven children&quot; and number accordingly from there.</p><p>➜ INTRO<br>We are going to read a book together that will teach us a good bit about the Appalachian Mountains.</p><p>➜ READ, NARRATE, &amp; DISCUSS<br>p.1-6 &quot;Between eleven children&quot; - &quot;entire trail!&quot;</p><p>➜ MAP QUESTIONS<br>⍞ Map Resource: p.5-6 of Grandma Gatewood<br>1\. Find where Emma started. What is it named? (Mt. Oglethorpe)<br>2\. In what state did she start? (Georgia)<br>3\. What 3 states does this map show? (Georgia, North Carolina, Tennessee)<br>4\. Locate Great Smoky Mountains National Park.<br>5\. The AT (Appalachian Trail) goes through many National Forests. How many can you find on this map? (5)</p>","","","Lesson","0","FALSE"
"alveary-rec9lkHl3pKY5QBnE","alveary-recGjmdsD1ikP9S5G","19","1","20m Geography: Grade 3 (U.S.) - Lesson 37","<p>Great Smoky Mountains<br>⍞ Materials: Cross-Country, 50 Adventures in 50 States</p><p>PREP: Test both the NPS interactive map and the NPS PDF map from the U.S. National Park Service to see which one works best for you. The PDF map can also be viewed in the interactive map by changing the upper left drop-down menu from Park Tiles to Brochure. <br>∞ Map Link: NPS interactive map<br>∞ Map Link: NPS PDF map</p><p>➜ INTRO<br>We will get back to Grandma Gatewood in a couple of weeks, but we are going to spend some time hearing more about one of the places she hiked through, the Great Smoky Mountains. The Great Smoky Mountains National Park is consistently the most visited national park in the U.S. (The next most visited national park is Grand Canyon National Park, but it only attracts about half as many visitors yearly.) Even when Cross-Country was published in 1950, Great Smoky Mountains National Park was still the most visited national park. If millions of people annually visit this national park more than any other, we should probably spend a few days exploring what it has to offer. Enjoy your visit!</p><p>➜ MAP QUESTIONS<br>⍞ Map Resource: NPS interactive map or NPS PDF map of Great Smoky Mountains National Park<br>1\. What is the highest elevation you can find in the park? (Clingmans Dome at 6,643 feet above sea level)<br>2\. In which two states is the park located? (Tennessee and North Carolina)<br>3\. Can you find the state line on the map?</p><p>➜ READ, NARRATE, &amp; DISCUSS<br>p.104-105 “As soon as” - “anywhere in the United States.”</p><p>➜ VIEW<br>Take a few minutes to look at the Tennessee spread on p.88-89 of 50 Adventures in 50 States to read about something that happens in the Great Smoky Mountains in late spring.</p>","","https://planning.alveary.org/links.html?id=rec9lkHl3pKY5QBnE&term=2&week=19","Lesson","0","FALSE"
"alveary-rec9lkHl3pKY5QBnE","alveary-recXjrhWsdOuQGd9U","19","2","20m Geography: Grade 3 (U.S.) - Lesson 38","<p>Great Smoky Mountains<br>⍞ Materials: Cross-Country</p><p>➜ MAP QUESTIONS<br>⍞ Map Resource: NPS interactive map or the NPS PDF map of Great Smoky Mountains National Park<br>∞ Map Link: NPS interactive map or NPS PDF map<br>1\. Where do you think the most trees will be located? What about fish? <br>2\. Can you find the creeks, rivers, and lakes?<br>3\. Change the upper right drop-down menu (if using the interactive map) from Park Tiles to Park Tiles Imagery if you want to see the real trees and water.</p><p>∞ Map Link: Species Mapper<br>1\. Look at the National Park Service’s Species Mapper. You choose an animal or tree from the drop-down list entitled “SELECT A SPECIES”. For example, choose American Beech to see its spatial distribution inside the park.<br>2\. Next, use the “COMPARE WITH ANOTHER SPECIES IN THE PARK” drop-down list to select American Elm. How does its distribution compare?<br>3\. Select American Mountain Ash as the second tree to compare.<br>4\. Now, select a Brown Trout in the drop-down list to see where they are located.<br>5\. Now, select a flower from the “SELECT A SPECIES” drop-down list. (Be sure to check out rosebay rhododendron, and choose mountain laurel from the “COMPARE WITH SPECIES WITH SIMILAR DISTRIBUTION” drop-down list.)</p><p>➜ READ, NARRATE, &amp; DISCUSS<br>p.106-108 “We'll see lots&quot; - &quot;look like smoke.&quot;</p>","","https://planning.alveary.org/links.html?id=rec9lkHl3pKY5QBnE&term=2&week=19","Lesson","0","FALSE"
"alveary-rec9lkHl3pKY5QBnE","alveary-reczhewNsRYcrY2t8","20","1","20m Geography: Grade 3 (U.S.) - Lesson 39","<p>Model of Mountain Landscape<br>⍞ Materials: Cross-Country, Materials for Model, and Geography Models Document in Appendix</p><p>PREP: Students are building a mountain landscape out of clay. The landscape must be big enough for students to observe water flowing down slopes, valleys, and rivers in the next lesson.</p><p>➜ READ, NARRATE, &amp; DISCUSS<br>p.109 “Here is a picture” - “of the earth.”</p><p>➜ MODEL<br>1\. Follow instructions for making a basic model.<br>2\. Your landscape should include: mountains, valleys, canyons, rivers, and a large body of water (lake, sea, or ocean)<br>3\. After it has dried, paint the model to help seal the clay. (Do this during an afternoon before your next geography lesson.)</p>","","","Lesson","0","FALSE"
"alveary-rec9lkHl3pKY5QBnE","alveary-rec9ZQVJLGr8wfDMT","20","2","20m Geography: Grade 3 (U.S.) - Lesson 40","<p>Model with Mountains and Rivers<br>⍞ Materials: Cross-Country, completed model, watering can</p><p>PREP: Note If the painted model is not dry, you may do this lesson during an afternoon later in the week. The model has to be dry and sealed with paint for it to work at its best. You may even continue the project during your assessment week.<br>Bookmark maps on p.58-60, 86-88, and 110-112 in Cross-Country.</p><p>➜ MODEL<br>1\. By now, your landscape should be formed and painted. <br>2\. If your mountain model is thoroughly dry, you may use a watering can to rain on your landscape. Notice where the water runs, and where it gathers. Did it do what you expected?</p><p>➜ MAP QUESTIONS<br>⍞ Map Resource: Physical feature hemisphere maps on p.58-60, 86-88, and 110-112 in Cross-Country<br>1\. Rivers empty into larger bodies of water, and most of the largest rivers flow into an ocean. If you look at only the maps on p.58-60, can you guess where some rivers may begin? (in higher elevations or mountains)<br>2\. Now, look at only the rivers on p.86-88. If you look only at this map, and you know that a river empties into an ocean, where would you guess the mountains would be on this map? (where those rivers begin)<br>3\. When geographers want to study spatial relationships between different observations, they will overlay (or stack on top of one another) maps of the different phenomena. This makes it so much easier to understand how rivers and mountains are interconnected. Let’s look at overlays of these Cross-Country maps today.</p><p>➜ READ, NARRATE, &amp; DISCUSS<br>p.110-112 “On this map” to “do not melt.”</p><p>➜ MAP QUESTIONS<br>⍞ Map Resource: Physical map of the Western Hemisphere on p.110 of Cross-Country<br>1\. Which general direction do rivers in Tennessee flow? (The Tennessee River does not appear to prefer any single cardinal direction other than West. Rivers on the western side of the Appalachians flow westward, with most eventually joining the Mississippi River before reaching the Gulf of Mexico.)<br>2\. Which general direction will the rivers in North Carolina flow? (east toward the Atlantic Ocean)</p>","","","Lesson","0","FALSE"
"alveary-rec9lkHl3pKY5QBnE","alveary-recXZqPlKDUVrXvDY","21","1","20m Geography: Grade 3 (U.S.) - Lesson 41","<p>Appalachian Trail<br>⍞ Materials: Grandma Gatewood, U.S. Atlas</p><p>➜ MAP QUESTIONS<br>⍞ Map Resource: United States Atlas &quot;Tennessee&quot; p.77<br>⍞ Map Resource: Grandma Gatewood map p.5-6<br>1\. Locate the Appalachian Mountains in the U.S. Atlas.<br>2\. Locate the Great Smoky Mountains, and find the highest point in Tennessee there. What is it? (Clingman's Dome) What is its height? (6,643 ft.)<br>3\. Look in Grandma Gatewood and locate Clingman's Dome. <br>4\. Looking at both maps, what seems to be the boundary between Tennessee and North Carolina? (Appalachian Mountains)</p><p>➜ READ, NARRATE, &amp; DISCUSS<br>Grandma Gatewood<br>p.6-10 &quot;The Appalachian Trail&quot; - &quot;known as 'Grandma' Gatewood.&quot;</p>","","","Lesson","0","FALSE"
"alveary-rec9lkHl3pKY5QBnE","alveary-recuMvYQrMgqChogI","21","2","20m Geography: Grade 3 (U.S.) - Lesson 42","<p>Appalachian Trail<br>⍞ Materials: Grandma Gatewood, U.S. Atlas, 50 Adventures in 50 States</p><p>➜ MAP QUESTIONS<br>⍞ Map Resource: United States Atlas &quot;Virginia&quot; p.78-79<br>⍞ Map Resource: Grandma Gatewood map p.11-12<br>1\. Locate the Appalachian Mountains in the U.S. Atlas.<br>2\. Locate the yellow National Park unit area along the Tennessee border, and find the highest point in Virginia there. What is it? (Mt. Rogers) What is its height? (5,729 ft.)<br>3\. Look in Grandma Gatewood and locate Mt. Rogers. <br>4\. Looking at both maps, what seems to be the boundary between Virginia and West Virginia? (Appalachian Mountains)<br>5\. Name the national parks and national forests that are near the trail. (Jefferson National Forest, George Washington National Forest, Shenandoah National Park)<br>6\. What river does Emma have to cross going into Maryland? (Potomac River)</p><p>➜ READ, NARRATE, &amp; DISCUSS<br>Grandma Gatewood<br>p.11-16 &quot;Harpers Ferry&quot; - &quot;known as 'went on forever.&quot;</p><p>➜ VIEW<br>Take a few minutes to look at the Virginia and West Virginia spreads on p.96-97, 100-101 of 50 Adventures in 50 States to learn a little more about the world's longest trail as well as New River Gorge.<br>(Look at similarities on p.97 with Grandma Gatewood on p.16)</p>","","","Lesson","0","FALSE"
"alveary-rec9lkHl3pKY5QBnE","alveary-rec9Sreu0IZZHMTXC","22","1","20m Geography: Grade 3 (U.S.) - Lesson 43","<p>Appalachian Trail<br>⍞ Materials: Grandma Gatewood, U.S. Atlas, 50 Adventures in 50 States</p><p>➜ MAP QUESTIONS<br>⍞ Map Resource: United States Atlas &quot;Pennsylvania&quot; p.46-47<br>⍞ Map Resource: Grandma Gatewood map on p.17-18<br>1\. Locate the Appalachian Mountains in the U.S. Atlas. <br>2\. Locate the Allegheny Mountains. These are not listed in Grandma Gatewood but are another portion of the Appalachian Mountains.<br>3\. The highest point in Pennsylvania is in the Allegheny Mountains. What is it? (Mt. Davis) What is its height? (3,213 ft.)<br>4\. Have you noticed anything about the highest points in the last few states? (Maybe that they are all in the App. Mtns; maybe they are noticing that the numbers are going down.)<br>5\. If you have not noticed, you can look back at the heights of the mountains in the last few states and see that they are decreasing. Take some time to wonder about that.<br>6\. On the Grandma Gatewood map, what rivers do you see? (Susquehanna River, Delaware River, Hudson River) I wonder how Emma will get across them?</p><p>➜ READ, NARRATE, &amp; DISCUSS<br>Grandma Gatewood<br>p.18-22 &quot;Pennsylvania is&quot; - &quot;East Coast.&quot;</p><p>➜ VIEW<br>Take a few minutes to look at the Pennsylvania, New York, and New Jersey spreads on p.80-81, 68-69, and 64. 65 of 50 Adventures in 50 States to learn a little more about the other wonderful things in these states.</p>","","","Lesson","0","FALSE"
"alveary-rec9lkHl3pKY5QBnE","alveary-recviJTkhn0s5i7ek","22","2","20m Geography: Grade 3 (U.S.) - Lesson 44","<p>Appalachian Trail<br>⍞ Materials: Grandma Gatewood, U.S. Atlas, 50 Adventures in 50 States</p><p>➜ MAP QUESTIONS<br>⍞ Map Resource: United States Atlas &quot;Connecticut&quot; p.31, &quot;Massachusetts&quot; p.38-39, and &quot;Vermont&quot; p.51<br>⍞ Map Resource: Grandma Gatewood map on the inside cover<br>1\. On the inside cover map of Emma's journey, locate the Taconics on the key and on the map.<br>2\. Look at the 3 state maps in the United States Atlas and see if you can find the Taconic Range on each one.<br>3\. On the inside cover map of Emma's journey, locate the Green Mountains on the key and on the map. See if you can find them on the Vermont Map, p.51.<br>4\. On the Massachusetts Map, p.38-39, locate the highest point in the state. (Mt. Greylock) What is its height? (1,064 m (3,491 ft)) Is it lower than the last mountain we checked? (no)<br>5\. On the Vermont Map p.51, locate the highest point. (It is near the &quot;i&quot; in the Green Mountains. Mt. Mansfield) What is its height? (4,393 ft! It is much higher than it has been in a while. Wonder about that.)</p><p>➜ READ, NARRATE, &amp; DISCUSS<br>Grandma Gatewood<br>p.23-30 &quot;The writer Herman&quot; - &quot;alone again.&quot;</p><p>➜ VIEW<br>Take a few minutes to look at the Connecticut and Massachusetts spreads on p.18-19 and 46-47 of 50 Adventures in 50 States to learn a little more about the other wonderful things in these states.</p>","","","Lesson","0","FALSE"
"alveary-rec9lkHl3pKY5QBnE","alveary-reczo4NE9wAyzcMdG","23","1","20m Geography: Grade 3 (U.S.) - Lesson 45","<p>Appalachian Trail<br>⍞ Materials: Grandma Gatewood, U.S. Atlas, 50 Adventures in 50 States</p><p>➜ MAP QUESTIONS<br>⍞ Map Resource: United States Atlas &quot;New Hampshire&quot; p.41, &quot;Maine&quot; p.35<br>⍞ Map Resource: Grandma Gatewood map on the inside cover<br>1\. On the inside cover map of Emma's journey, locate the White Mountains on the key and on the map.<br>2\. Look at the New Hampshire map in the United States Atlas and see if you can find the White Mountains.<br>3\. In that area, locate the highest point in New Hampshire. (Mt. Washington) What is its height? (6,288 ft)<br>4\. On the inside cover map of Emma's journey, locate the Mahoosucs on the key and on the map. They are not marked on the Maine map, p.35, but another one is named. Can you find it? (Longfellow Mountains)<br>5\. On the Maine Map, p.35, locate the highest point in the state. (Mt. Katahdin) What is its height? (5,268 ft) Is it lower or higher than the last mountain we checked? (higher)<br>6\. What state park is Mt. Katahdin located in? (Baxter State Park)<br>7\. On p.31-32 in Grandma Gatewood, locate Mt. Washington, Mt Katahdin, and Baxter State Park.</p><p>➜ READ, NARRATE, &amp; DISCUSS<br>Grandma Gatewood<br>p.31-38 &quot;The second-fastest&quot; - &quot;said Emma.&quot;</p><p>➜ READ<br>Take a few minutes to look at the New Hampshire and Vermont spreads on p.62-63 and 94-95 of 50 Adventures in 50 States to learn a little more about Mt. Washington and Fall in Vermont.</p>","","","Lesson","0","FALSE"
"alveary-rec9lkHl3pKY5QBnE","alveary-rec5e9SmNJ2QL3od6","23","2","20m Geography: Grade 3 (U.S.) - Lesson 46","<p>Catch-Up Day</p><p>➜ CATCH-UP<br>Use today to finish any work or walks from the term.</p>","","","Lesson","0","FALSE"
"alveary-rec9lkHl3pKY5QBnE","alveary-recHz57EEm6jsbvq9","24","1","20m Geography: Grade 3 (U.S.) - Lesson 47","<p>Exam Week</p><p>➜ EXAMS<br>Answer question(s) related to course.</p><p>Questions will come from:<br>Cross-Country</p>","<p>★ Geography: Grade 3 (U.S.) — TERM 2 EXAM QUESTIONS<br>· Cross-Country: Regarding a river, tell what you know about how water moves. Use what you observed in your model this term to help explain the process.</p><p>· Grandma Gatewood: Describe some things you would like to see if you traveled the Appalachian Trail.</p>","","Exam","0","FALSE"
"alveary-rec9lkHl3pKY5QBnE","alveary-recQTzvMi8LHSCoBb","24","2","20m Geography: Grade 3 (U.S.) - Lesson 48","<p>Exam Week</p><p>➜ EXAMS<br>Answer question(s) related to course.</p><p>Questions will come from:<br>Grandma Gatewood</p>","<p>★ Geography: Grade 3 (U.S.) — TERM 2 EXAM QUESTIONS<br>· Cross-Country: Regarding a river, tell what you know about how water moves. Use what you observed in your model this term to help explain the process.</p><p>· Grandma Gatewood: Describe some things you would like to see if you traveled the Appalachian Trail.</p>","","Exam","0","FALSE"
"alveary-rec9lkHl3pKY5QBnE","alveary-recTltTqxCEWJt9d8","25","1","20m Geography: Grade 3 (U.S.) - Lesson 49","<p>The Forest<br>⍞ Materials: Cross-Country, My U.S. Map, 50 Adventures in 50 States</p><p>➜ INTRO<br>What sounds do you think you might hear in a forest?</p><p>➜ READ, NARRATE, &amp; DISCUSS<br>p.114-116 “A forest does something” - “it is you.”</p><p>➜ MAP WORK<br>⍞ Map Resource: My U.S. Map<br>Label North Carolina.</p><p>➜ LISTEN &amp; DISCUSS<br>We are going to practice listening for a few minutes, and next lesson we will make a sound map.<br>1\. What different kinds of sounds do you hear in different rooms/areas of your home or school?<br>2\. If your eyes were closed, do you think you would know which room you were in based just on the sounds?<br>3\. Test your hearing sense by choosing to:<br>    a-Close your eyes, have someone lead you to different rooms, and you guess which room you are in; OR<br>    b-Have someone record sound for 15 seconds (on a phone or recorder of some type) in various rooms, play each one for you to hear, and you guess the respective room.<br>4\. Draw pictures to represent each of the places you “heard.&quot;</p><p>➜ VIEW<br>Take a few minutes to look at the North Carolina spread on p.70-71 of 50 Adventures in 50 States to learn about something underwater off the coast of North Carolina.</p>","","","Lesson","0","FALSE"
"alveary-rec9lkHl3pKY5QBnE","alveary-recyCjWBPtAT2xpVY","25","2","20m Geography: Grade 3 (U.S.) - Lesson 50","<p>Outdoor Sound Map</p><p>PREP: John Muir Laws has a Nature Journal Connection video about making sound maps. The video is 14 minutes long, so it may be good to watch it ahead of time and use the time today to do the actual sound map.<br>∞ Video Link: JML Sound Map</p><p>➜ LISTEN &amp; PRACTICE<br>1\. Find a spot outside where you can listen. Take a paper and a pencil.<br>2\. Face north, and draw yourself or a symbol to represent yourself in the middle of your paper.<br>3\. Spend time (per the video) listening.<br>4\. Add to your map the sounds you hear.</p>","","https://planning.alveary.org/links.html?id=rec9lkHl3pKY5QBnE&term=3&week=25","Lesson","0","FALSE"
"alveary-rec9lkHl3pKY5QBnE","alveary-recK6Gk5zYwCPGeKG","26","1","20m Geography: Grade 3 (U.S.) - Lesson 51","<p>The Forest (cont.)<br>⍞ Materials: Cross-Country</p><p>➜ INTRO<br>Name some things made of wood. I wonder where the wood came from to make those things?</p><p>➜ READ, NARRATE, &amp; DISCUSS<br>p.116-117 “Yet the forest” to “smoke anyway.”</p>","","","Lesson","0","FALSE"
"alveary-rec9lkHl3pKY5QBnE","alveary-rec3vOK869HcqklmY","26","2","20m Geography: Grade 3 (U.S.) - Lesson 52","<p>The Forest (cont.)<br>⍞ Materials: Cross-Country, U.S. Atlas</p><p>➜ MAP QUESTIONS<br>⍞ Map Resource: United States Atlas “The Physical United States: Natural Hazards” p.12-13<br>1\. Find the symbol for wildfire.<br>2\. Where have there been large wildfires in the past 40 years?<br>3\. Today’s reading is also about a wildfire. It is not as big as the ones on this map, but wildfires happen in many forests.</p><p>⍞ Map Resource: United States Atlas “North Carolina” p.72-73<br>1\. Locate the Great Smoky Mountains. What color is it on the map? (yellow)<br>2\. To the south and east are green shaded areas. What are they? (National Forests)</p><p>➜ READ, NARRATE, &amp; DISCUSS<br>Cross-Country<br>p.117-118 “Yes, the forest ranger” - “glad it’s there.”</p><p>• TAKE A GEOGRAPHY WALK<br>Take a walk in a nearby forest. The Discover the Forest website will help you locate a forest near your ZIP Code.<br>∞ Link: Discover the Forest</p>","","https://planning.alveary.org/links.html?id=rec9lkHl3pKY5QBnE&term=3&week=26","Lesson","0","FALSE"
"alveary-rec9lkHl3pKY5QBnE","alveary-recOM830oz1lL5gni","27","1","20m Geography: Grade 3 (U.S.) - Lesson 53","<p>North Carolina Crops<br>⍞ Materials: Cross-Country, U.S. Atlas</p><p>➜ NOTES<br>1\. When Cross-Country was published in 1950, North Carolina ranked first in the U.S. in tobacco production, second in peanuts, and seventh in cotton. Seventy years later, North Carolina still ranks first in tobacco, fifth in peanuts, and tenth in cotton.<br>2\. Based on when the book was written, there is no mention of the health effects of tobacco. Teachers should use their discretion when discussing tobacco and responding to related questions.</p><p>➜ MAP QUESTIONS<br>⍞ Map Resource: United States Atlas “North Carolina” p.72-73 (See 5th ed. PDF, if needed.)<br>∞ PDF Link: 5th edition PDF<br>1\. Look at the map key and find the symbols for cotton and tobacco.<br>2\. Find them on the map. What do you notice about where they are? (Cotton symbols appear mostly in the eastern half of the state, with a few in the south-central portion. Tobacco production is distributed across the entire state, except in the national forests of the mountains.)</p><p>➜ READ, NARRATE, &amp; DISCUSS<br>Cross-Country<br>p.119-120 “Some of the crops” - “dress or a shirt.”</p>","","https://planning.alveary.org/links.html?id=rec9lkHl3pKY5QBnE&term=3&week=27","Lesson","0","FALSE"
