"course_custom_id","assignment_custom_id","assignment_week","assignment_day","assignment_name","assignment_description","assignment_teachersNote","assignment_linksUrl","assignment_type","assignment_duration","assignment_graded"
"alveary-rec7kjonSr0OBz5kh","alveary-recsY0PFYfvE6nIfs","23","1","45m Latin 1 (Independent Study) - Lesson 45","<p>Stage 8: Vēnātiō<br>⍞ Materials: Cambridge Unit 1, Latin notebook</p><p>PREP: Read “vēnātiō” Teacher's Manual p.79.</p><p>➜ RECAP<br>• Review Vocabulary Checklist words in Latin notebook.<br>• Review accusative singular and accusative plural nouns on p.104.</p><p>➜ WRITE<br>Continue to infer and record meanings in Vocabulary Checklist 8 as you read the stories in Stage 8.</p><p>➜ READ, NARRATE, &amp; DISCUSS<br>“vēnātiō” p.105<br>Preview vocabulary words that accompany the story. Read and narrate each paragraph separately.</p><p>➜ PRACTICE<br>• Answer questions 1-10 on p.105 in English.<br>• Translate the third paragraph of “vēnātiō” into English.</p><p>➜ EVALUATE<br>Check any new vocabulary words you defined today with Vocabulary Checklist 8 or the glossary beginning on p.193.</p>","","","Lesson","0","FALSE"
"alveary-rec7kjonSr0OBz5kh","alveary-reckLZBJoPZuZix33","23","2","45m Latin 1 (Independent Study) - Lesson 46","<p>Catch-Up Day<br>⍞ Materials: Cambridge Unit 1, Latin notebook</p><p>➜ RECAP<br>Review Vocabulary Checklist words from Stage 8 in Latin notebook.</p><p>➜ CATCH UP<br>Complete any missed activities from Stage 8. If you are caught up, translate Model Sentences into English and then back into Latin, or use this extra time for another subject.</p>","","","Lesson","0","FALSE"
"alveary-rec7kjonSr0OBz5kh","alveary-recrpaPwNBGpHpt1C","24","1","45m Latin 1 (Independent Study) - Lesson 47","<p>Exam Week</p><p>➜ EXAMS<br>Answer question(s) related to course.</p><p>Questions will come from:<br>Cambridge Unit 1</p>","<p>★ Latin 1 (Independent Study) — TERM 2 EXAM QUESTIONS<br>· Cambridge Unit 1: Translate into Latin: <br>a. I am angry.<br>b. You walk.<br>c. The slave sits.</p><p>Answers:<br>a. Ego sum iratus.<br>b. Tū ambulās.<br>c. Servus sedet.</p><p>· Cambridge Unit 1: Translate the first paragraph of Hermogenēs on p.43 into English. (Cover the vocabulary words at the bottom of the page.) Then close your book and translate your English paragraph back into Latin.</p>","","Exam","0","FALSE"
"alveary-rec7kjonSr0OBz5kh","alveary-rec9ZPFVSGXIUNztK","24","2","45m Latin 1 (Independent Study) - Lesson 48","<p>Exam Week</p><p>➜ EXAMS<br>Answer question(s) related to course.</p><p>Questions will come from:<br>Cambridge Unit 1</p>","<p>★ Latin 1 (Independent Study) — TERM 2 EXAM QUESTIONS<br>· Cambridge Unit 1: Translate into Latin: <br>a. I am angry.<br>b. You walk.<br>c. The slave sits.</p><p>Answers:<br>a. Ego sum iratus.<br>b. Tū ambulās.<br>c. Servus sedet.</p><p>· Cambridge Unit 1: Translate the first paragraph of Hermogenēs on p.43 into English. (Cover the vocabulary words at the bottom of the page.) Then close your book and translate your English paragraph back into Latin.</p>","","Exam","0","FALSE"
"alveary-rec7kjonSr0OBz5kh","alveary-recIoOtVvxNP1XtHH","25","1","45m Latin 1 (Independent Study) - Lesson 49","<p>Stage 8: Pāstor et Leō and About the Language 2<br>⍞ Materials: Cambridge Unit 1, Latin notebook</p><p>PREP: Read “pāstor et leō” and “About the language 2” Teacher's Manual p.79-81.</p><p>➜ RECAP<br>• Review Vocabulary Checklist words in Latin notebook.<br>• Review accusative singular and accusative plural nouns on p.104.</p><p>➜ WRITE<br>Continue to infer and record meanings in Vocabulary Checklist 8 as you read the stories in Stage 8.</p><p>➜ READ, NARRATE, &amp; DISCUSS<br>“pāstor et leō” p.106<br>Preview vocabulary words that accompany the story. What might this story be about? Read and narrate each paragraph separately.</p><p>➜ PRACTICE<br>Look at the chart of cases in paragraph 3 of &quot;About the language 1&quot; on p.104. Find at least one example of each in the story &quot;pāstor et leō.&quot;</p><p>➜ RECAP<br>List the superlative adjectives for the following English words: good (best), tall (tallest), beautiful (most beautiful).</p><p>➜ READ, NARRATE, &amp; DISCUSS<br>“About the language 2&quot; paragraph 1 p.107</p><p>➜ PRACTICE<br>Translate the examples in paragraph 2 on p.107 into English.</p><p>➜ EVALUATE<br>Are all words from Vocabulary Checklist 8 (p.114) correctly defined in Latin notebook?</p>","<p>★ TEACHER TIP<br>The translations for all the model sentences and stories are in the digital Cambridge Unit 1 Teacher's Resource document, &quot;Student's Book Translations and Answers.&quot; The answers to &quot;About the language&quot; and &quot;Practicing the language&quot; exercises are also located here. This resource is part of the digital Teacher's Manual. The document can be downloaded as a single file containing all the Unit 1 translations and answers or as individual files for each stage.</p>","","Lesson","0","FALSE"
"alveary-rec7kjonSr0OBz5kh","alveary-recHNCKEyzRw5eZkA","25","2","45m Latin 1 (Independent Study) - Lesson 50","<p>Stage 8: Gladiatorial Shows, Animal Hunts, and The Riot at Pompeii<br>⍞ Materials: Cambridge Unit 1, Latin notebook</p><p>PREP: Read &quot;Practicing the language&quot; Teacher's Manual p.81.</p><p>➜ RECAP<br>Review vocabulary words from Stage 7 and Stage 8 in Latin notebook.</p><p>➜ READ, NARRATE, &amp; DISCUSS<br>“Gladiatorial shows,” “Animal hunts,&quot; and &quot;The riot at Pompeii” p.109-113</p><p>➜ PRACTICE &amp; DICTATE<br>Complete Exercise 1 of &quot;Practicing the language&quot; on p.108. Then study sentences a and f. Write sentences from dictation when ready.</p><p>➜ PRACTICE<br>Complete Exercise 2 of &quot;Practicing the language&quot; on p.108. Then choose two sentences to translate back into Latin. Check your translations against the originals; correct any mistakes.</p><p>➜ DISCUSS<br>Which words from today's lesson look or sound like words you know in English, Spanish, or French?</p>","<p>★ TEACHER NOTE<br>Preview ”Gladiatorial shows” and “Animal hunts” p.109-112</p>","","Lesson","0","FALSE"
"alveary-rec7kjonSr0OBz5kh","alveary-recwrVvpYksv0vMFs","26","1","45m Latin 1 (Independent Study) - Lesson 51","<p>Stage 8: Practicing the Language, Review, and Catch-Up Day<br>⍞ Materials: Cambridge Unit 1, Latin notebook</p><p>➜ RECAP<br>Review Vocabulary Checklist words from Stage 7 and Stage 8 in Latin notebook.</p><p>➜ PRACTICE<br>Complete Exercise 3 of &quot;Practicing the language&quot; on p.108.</p><p>➜ CATCH UP<br>Complete any missed activities from Stage 7 or Stage 8. If you are caught up, translate Model Sentences into English and then back into Latin, or use this extra time for another subject.</p>","","","Lesson","0","FALSE"
"alveary-rec7kjonSr0OBz5kh","alveary-recYvnNQqSJSYrR9B","26","2","45m Latin 1 (Independent Study) - Lesson 52","<p>Stage 9: THERMAE (Dative Singular and Plural) and The Baths<br>⍞ Materials: Cambridge Unit 1, Latin notebook, sticky notes</p><p>PREP: Read “Model sentences” and “in palaestrā” Teacher's Manual p.85-86.</p><p>➜ INTRO<br>This chapter is about public baths. This sounds strange to us, but as you read, think about what places and practices today are similar to the Roman baths.</p><p>➜ WRITE<br>Cover the definitions on p.130 with sticky notes. Copy &quot;Vocabulary Checklist 9.&quot; Infer and record meanings as you read the stories in Stage 9.</p><p>➜ READ, NARRATE, &amp; DISCUSS<br>Model Sentences p.116-117</p><p>➜ PRACTICE<br>Copy sentences 1-3 on p.116 and translate them into English.</p><p>➜ READ, NARRATE, &amp; DISCUSS<br>“The baths” p.126-128 &quot;About the middle&quot; - &quot;with his towel.&quot;</p><p>➜ READ, NARRATE, &amp; DISCUSS<br>“in palaestrā” p.118 <br>Preview vocabulary words that accompany the story. Read and narrate lines 1-15.</p><p>➜ PRACTICE<br>Translate the first paragraph of “in palaestrā” on p.118 into English.</p><p>➜ EVALUATE<br>Check any new vocabulary words you defined today with Vocabulary Checklist 9 or the glossary beginning on p.193.</p>","","","Lesson","0","FALSE"
"alveary-rec7kjonSr0OBz5kh","alveary-rec0wbDfussEUABwm","27","1","45m Latin 1 (Independent Study) - Lesson 53","<p>Stage 9: In Palaestrā<br>⍞ Materials: Cambridge Unit 1, Latin notebook</p><p>➜ RECAP <br>Review Vocabulary Checklist words in Latin notebook.</p><p>➜ READ, NARRATE, &amp; DISCUSS<br>“The baths” p.128 &quot;Metella, too&quot; - &quot;to the din.&quot;</p><p>➜ WRITE<br>Continue to infer and record meanings as you read the stories in Stage 9.</p><p>➜ READ, NARRATE, &amp; DISCUSS<br>“in palaestrā” p.118<br>Review vocabulary words that accompany the story. Read and narrate lines 16-end.</p><p>• Answer the questions on p.119 in English.</p><p>➜ PRACTICE<br>Translate lines 25-27 of “in palaestrā” on p.118 into English.</p><p>➜ READ, NARRATE, &amp; DISCUSS<br>“A visit to the baths” p.126-127</p><p>➜ EVALUATE<br>Check any new vocabulary words you defined today with Vocabulary Checklist 9 or the glossary beginning on p.193.</p>","","","Lesson","0","FALSE"
"alveary-rec7kjonSr0OBz5kh","alveary-recI2U5uK2yYdL5z0","27","2","45m Latin 1 (Independent Study) - Lesson 54","<p>Stage 9: Heating the Baths and About the Language<br>⍞ Materials: Cambridge Unit 1, Latin notebook</p><p>PREP: Read “About the language” Teacher's Manual p.86-87.</p><p>➜ RECAP<br>• Review Vocabulary Checklist words in Latin notebook.<br>• Review definitions of nominative and accusative (see p.21).</p><p>➜ READ, NARRATE, &amp; DISCUSS<br>&quot;Heating the baths&quot; and &quot;Plan of the Forum Baths, Pompeii” p.129</p><p>➜ READ, NARRATE, &amp; DISCUSS<br>“About the language” paragraphs 1-2 p.120<br>Read and narrate each section separately.</p><p>• Explain the difference between nominative, accusative, and dative cases and how noun endings tell you which is which.</p><p>➜ WRITE &amp; DISCUSS<br>Copy the chart in paragraph 3 on p.121.</p><p>• Notice that the singular dative can look like the plural nominative (puellae). How will you be able to tell whether &quot;puellae&quot; is nominative or dative when used in a sentence?<br>• What are the English equivalents to nominative, accusative, and dative cases? (subject, direct object, and indirect object)</p><p>➜ READ, NARRATE, &amp; DISCUSS<br>“About the language” paragraph 5 p.121</p><p>➜ WRITE<br>Copy the chart in paragraph 5 on p.121 into your Latin notebook.</p><p>➜ PRACTICE<br>Copy the examples in paragraph 4 on p.121. Label nominative nouns with an N, accusative nouns with an A, and dative nouns with a D. Then translate each sentence into English.</p>","","","Lesson","0","FALSE"
"alveary-rec7kjonSr0OBz5kh","alveary-reccUC5u0Nlu61dE1","28","1","45m Latin 1 (Independent Study) - Lesson 55","<p>Stage 9: In Tabernā and Practicing the Language<br>⍞ Materials: Cambridge Unit 1, Latin notebook</p><p>PREP: Read “in tabernā” Teacher's Manual p.87.</p><p>➜ RECAP<br>• Review Vocabulary Checklist words in Latin notebook.<br>• Review nominative, accusative, and dative cases (see p.21 and p.120).</p><p>➜ WRITE<br>Continue to infer and record meanings as you read the stories in Stage 9.</p><p>➜ READ, NARRATE, &amp; DISCUSS<br>“in tabernā” p.122<br>Preview vocabulary words that accompany the story. Read and narrate each paragraph separately.</p><p>➜ PRACTICE<br>Translate the first three sentences of “in tabernā” on p.122 into English. Then translate one sentence back into Latin. Check your translation against the original; correct any mistakes.</p><p>➜ PRACTICE &amp; DICTATE<br>• Complete Exercise 1 of &quot;Practicing the language&quot; on p.123. Then translate one sentence back into Latin. Check your translation against the original; correct any mistakes. <br>• Study sentence e. Write from dictation when ready.</p><p>➜ EVALUATE<br>Check any new vocabulary words you defined today with Vocabulary Checklist 9 or the glossary beginning on p.193.</p>","","","Lesson","0","FALSE"
"alveary-rec7kjonSr0OBz5kh","alveary-recAkjXwV54fnBJIj","28","2","45m Latin 1 (Independent Study) - Lesson 56","<p>Stage 9: Practicing the Language and In Apodytēriō<br>⍞ Materials: Cambridge Unit 1, Latin notebook</p><p>PREP: Read “Cultural context material” Teacher's Manual p.88-90.</p><p>➜ RECAP<br>• Review Vocabulary Checklist words in Latin notebook.<br>• Review nominative, accusative, and dative cases (see p.21 and p.120).</p><p>➜ PRACTICE<br>Complete Exercise 2 of &quot;Practicing the language&quot; on p.123. Translate one sentence back into Latin. Check your translation against the original; correct any mistakes.</p><p>➜ EVALUATE<br>Are all words from Vocabulary Checklist 9 (p.130) correctly defined in Latin notebook?</p><p>➜ RECAP<br>Review nominative singular and plural and the three declensions (see p.62).</p><p>➜ READ, NARRATE, &amp; DISCUSS<br>“in apodytēriō” p.124-125<br>Preview vocabulary words that accompany the story. What might this story be about? Read and narrate each paragraph separately.</p><p>➜ PRACTICE<br>Reread the dialogue of “in apodytēriō” on p.124-125 aloud, taking parts and using appropriate inflection.</p><p>➜ DISCUSS<br>Which words from today's lesson look or sound like words you know in English, Spanish, or French?</p>","<p>★ TEACHER NOTE<br>Preview “in apodytēriō” p.125</p>","","Lesson","0","FALSE"
"alveary-rec7kjonSr0OBz5kh","alveary-recY5r5ltcZCHi3NP","29","1","45m Latin 1 (Independent Study) - Lesson 57","<p>Stage 10: RHĒTOR (1st and 2nd Persons Plural Present and Comparative Adjectives) and Contrōversia<br>⍞ Materials: Cambridge Unit 1, Latin notebook, sticky notes</p><p>PREP: Read “Model sentences” and “contrōversia” Teacher's Manual p.91-94.</p><p>➜ WRITE<br>Cover the definitions on p.146 with sticky notes. Copy &quot;Vocabulary Checklist 10.&quot; Infer and record meanings as you read the stories in Stage 10.</p><p>➜ READ, NARRATE, &amp; DISCUSS<br>Model Sentences p.132-135</p><p>➜ INTRO<br>• What do you know about the differences between the ancient Roman culture and the ancient Greek culture? Today's story highlights the kinds of things each culture valued.<br>• Look at the title of the story on p.136. What might this story be about?</p><p>➜ READ, NARRATE, &amp; DISCUSS<br>“contrōversia” lines 1-17 p.136<br>Preview vocabulary words that accompany the story. Read and narrate each paragraph separately.</p><p>➜ PRACTICE<br>Translate the first paragraph of “contrōversia” on p.136-137 into English.</p><p>➜ EVALUATE<br>Check any new vocabulary words you defined today with Vocabulary Checklist 10 or the glossary beginning on p.193.</p>","","","Lesson","0","FALSE"
"alveary-rec7kjonSr0OBz5kh","alveary-recCtAm1KIJgKjuHm","29","2","45m Latin 1 (Independent Study) - Lesson 58","<p>Stage 10: Contrōversia and Statuae<br>⍞ Materials: Cambridge Unit 1, Latin notebook</p><p>PREP: Read “statuae” Teacher's Manual p.94-95.</p><p>➜ RECAP<br>Review Vocabulary Checklist words in Latin notebook.</p><p>➜ INTRO<br>In the last lesson, you talked about some of the differences between the Romans and the Greeks. What similarities can you think of?</p><p>➜ WRITE<br>Continue to infer and record meanings as you read the stories in Stage 10.</p><p>➜ READ, NARRATE, &amp; DISCUSS<br>“contrōversia” lines 18-end p.136-137 <br>Preview vocabulary words that accompany the story. Read and narrate each paragraph separately.</p><p>➜ DICTATE<br>Study the last line of “contrōversia” on p.137. Write from dictation when you are ready. <br> <br>➜ READ, NARRATE, &amp; DISCUSS<br>“Schools: The first stage of education” p.143</p><p>➜ READ, NARRATE, &amp; DISCUSS<br>“statuae” lines 1-18 p.139 <br>Preview vocabulary words that accompany the story. Read and narrate each paragraph separately.</p><p>➜ PRACTICE<br>Translate the first paragraph of “statuae” on p.139  into English. Choose one sentence to translate back into Latin. Check your translation against the original; correct any mistakes.</p><p>➜ EVALUATE<br>Check any new vocabulary words you defined today with Vocabulary Checklist 10 or the glossary beginning on p.193.</p>","","","Lesson","0","FALSE"
"alveary-rec7kjonSr0OBz5kh","alveary-rec1J7xoK2Sbq4Yqd","30","1","45m Latin 1 (Independent Study) - Lesson 59","<p>Stage 10: Statuae and About the Language 1<br>⍞ Materials: Cambridge Unit 1, Latin notebook</p><p>PREP: Read “About the language 1” Teacher's Manual p.94.</p><p>➜ RECAP<br>Review Vocabulary Checklist words in Latin notebook.</p><p>➜ READ, NARRATE, &amp; DISCUSS<br>“Writing materials” and “The second stage” p.143-144</p><p>➜ WRITE<br>Continue to infer and record meanings as you read the stories in Stage 10.</p><p>➜ READ, NARRATE, &amp; DISCUSS<br>“statuae” lines 19-end p.139 <br>Preview vocabulary words that accompany the story. Read and narrate each paragraph separately.</p><p>➜ DICTATE<br>Study the last line of “statuae” on p.139. Write from dictation when ready.</p><p>➜ EVALUATE<br>Check any new vocabulary words you defined today with Vocabulary Checklist 10 or the glossary beginning on p.193.</p><p>➜ READ, NARRATE, &amp; DISCUSS<br>“About the language 1” paragraphs 1-3 p.138</p><p>➜ PRACTICE<br>• Translate the examples in paragraph 4 on p.138 into English.<br>• Copy the chart in paragraph 5.<br>• Write a sentence in Latin with each form of &quot;sum&quot; using implied subjects.</p>","","","Lesson","0","FALSE"
"alveary-rec7kjonSr0OBz5kh","alveary-recBVjbGfDmNdb4lV","30","2","45m Latin 1 (Independent Study) - Lesson 60","<p>Stage 10: About the Language 2 and Practicing the Language<br>⍞ Materials: Cambridge Unit 1, Latin notebook</p><p>PREP: Read “About the language 2” Teacher's Manual p.95.</p><p>➜ RECAP<br>Review Vocabulary Checklist words in Latin notebook.</p><p>➜ READ, NARRATE, &amp; DISCUSS<br>“The third stage” p.145 and “About the language 2” p.140</p><p>➜ PRACTICE<br>Translate the examples in paragraph 2 on p.140 into English. Then translate one sentence back into Latin. Check your translation against the original; correct any mistakes.</p><p>➜ RECAP<br>“About the language 1 and 2” p.138, 140</p><p>➜ PRACTICE<br>Complete Exercise 1 of “Practicing the language&quot; on p.142. Then translate two sentences back into Latin. Check your translations against the originals; correct any mistakes.</p><p>➜ EVALUATE<br>Are all words from Vocabulary Checklist 10 (p.146) correctly defined in Latin notebook?</p>","<p>★ TEACHER TIP<br>The translations for all the model sentences and stories are in the digital Cambridge Unit 1 Teacher's Resource document, &quot;Student's Book Translations and Answers.&quot; The answers to &quot;About the language&quot; and &quot;Practicing the language&quot; exercises are also located here. This resource is part of the digital Teacher's Manual. The document can be downloaded as a single file containing all the Unit 1 translations and answers or as individual files for each stage.</p>","","Lesson","0","FALSE"
"alveary-rec7kjonSr0OBz5kh","alveary-rec1PNeBvZX0PQZZN","31","1","45m Latin 1 (Independent Study) - Lesson 61","<p>Review and Catch-Up Day<br>⍞ Materials: Cambridge Unit 1, Latin notebook</p><p>➜ RECAP<br>Review Vocabulary Checklist words from Stage 9 and Stage 10 in Latin notebook.</p><p>➜ CATCH UP<br>Complete any missed activities from Stage 9 or Stage 10. If you are caught up, translate Model Sentences into English and then back into Latin, or use this extra time for another subject.</p>","","","Lesson","0","FALSE"
"alveary-rec7kjonSr0OBz5kh","alveary-recinuFTG2c6uZPB0","31","2","45m Latin 1 (Independent Study) - Lesson 62","<p>Stage 11: CANDIDĀTĪ (Intransitive Verbs, Questions) and Quīntus et Lūcia<br>⍞ Materials: Cambridge Unit 1, Latin notebook, sticky notes</p><p>PREP: Read “Model sentences” and “Quīntus et Lūcia” Teacher's Manual p.99-101.</p><p>➜ INTRO<br>Look at the title and picture at the beginning of this stage on p.147. What might this person be doing?</p><p>➜ WRITE<br>Cover the definitions on p.162 with sticky notes. Copy &quot;Vocabulary Checklist 11.&quot; Infer and record meanings as you read the stories in Stage 11.</p><p>➜ READ, NARRATE, &amp; DISCUSS<br>Model Sentences p.148-149</p><p>➜ READ, NARRATE, &amp; DISCUSS<br>“Quīntus et Lūcia” p.150<br>Preview vocabulary words that accompany the story. Read and narrate each paragraph separately.</p><p>➜ PRACTICE<br>Translate the last four lines of “Quīntus et Lūcia” on p.150  into English.</p><p>➜ EVALUATE<br>Check any new vocabulary words you defined today with Vocabulary Checklist 11 or the glossary beginning on p.193.</p>","","","Lesson","0","FALSE"
"alveary-rec7kjonSr0OBz5kh","alveary-rec8GCtM7o7qPnHYn","32","1","45m Latin 1 (Independent Study) - Lesson 63","<p>Stage 11: Sulla and Local Government and Elections<br>⍞ Materials: Cambridge Unit 1, Latin notebook</p><p>PREP: Read “Sulla” Teacher's Manual p.101.</p><p>➜ RECAP<br>Review Vocabulary Checklist words in Latin notebook.</p><p>➜ READ, NARRATE, &amp; DISCUSS<br>“Local government and elections” p.159-160 &quot;The Pompeians took&quot; - &quot;for ten years.&quot;</p><p>• How is our election season the same and different?</p><p>➜ WRITE<br>Continue to infer and record meanings in Vocabulary Checklist 11 as you read the stories in Stage 11.</p><p>➜ READ, NARRATE, &amp; DISCUSS<br>“Sulla” p.151<br>Preview vocabulary words that accompany the story. Read and narrate the story.</p><p>➜ PRACTICE<br>Translate the last paragraph of “Sulla” on p.151 into English.</p><p>➜ EVALUATE<br>Check any new vocabulary words you defined today with Vocabulary Checklist 11 or the glossary beginning on p.193.</p><p>➜ DISCUSS<br>Which words from today's lesson look or sound like words you know in English, Spanish, or French?</p>","","","Lesson","0","FALSE"
"alveary-rec7kjonSr0OBz5kh","alveary-reczH5KXrA3XONHGF","32","2","45m Latin 1 (Independent Study) - Lesson 64","<p>Stage 11: About the Language 1 and In Vīllā<br>⍞ Materials: Cambridge Unit 1, Latin notebook</p><p>PREP: Read “About the language 1,” “Lūcius Spurius Pompōniānus,” and “in vīllā” Teacher's Manual p.101-102.</p><p>➜ RECAP<br>Review Vocabulary Checklist words in Latin notebook.</p><p>➜ WRITE<br>Continue to infer and record meanings in Vocabulary Checklist 11 as you read the stories in Stage 11.</p><p>➜ READ, NARRATE, &amp; DISCUSS<br>“Election notices” p.160-161</p><p>➜ READ, NARRATE, &amp; DISCUSS<br>“About the language 1” p.152</p><p>➜ PRACTICE &amp; DICTATE<br>• Translate the examples in paragraph 4 on p.152 into English.<br>• Study sentence b. Write from dictation when ready.</p><p>➜ READ, NARRATE, &amp; DISCUSS<br>“in vīllā p.153<br>Preview vocabulary words that accompany the story. Read and narrate the dialogue in small sections.</p><p>➜ PRACTICE<br>Reread the dialogue of “in vīllā” on p.153 aloud, taking parts and using appropriate inflection. Translate lines 21-23 into English.</p><p>➜ EVALUATE<br>Check any new vocabulary words you defined today with Vocabulary Checklist 11 or the glossary beginning on p.193.</p>","","","Lesson","0","FALSE"
"alveary-rec7kjonSr0OBz5kh","alveary-rec1AZ6LKrdiy1Iac","33","1","45m Latin 1 (Independent Study) - Lesson 65","<p>Stage 11: Prope Amphitheātrum and In Forō<br>⍞ Materials: Cambridge Unit 1, Latin notebook</p><p>PREP: Read “prope amphitheātrum” and &quot;in forō&quot; Teacher's Manual p.102-103.</p><p>➜ RECAP<br>• Review Vocabulary Checklist words in Latin notebook.<br>• Review what has happened in the story so far (see “in vīllā” p.153).</p><p>➜ WRITE<br>Continue to infer and record meanings in Vocabulary Checklist 11 as you read the stories in Stage 11.</p><p>➜ READ, NARRATE, &amp; DISCUSS<br>“prope amphitheātrum” and “in forō” p.154-155 <br>Review vocabulary words that accompany each story. Read and narrate the dialogue in small sections.</p><p>➜ PRACTICE<br>Reread the dialogue of “prope amphitheātrum” on p.154  aloud, taking parts and using appropriate inflection. Translate lines 4-6 (Grumiō's first lines) and 10-11 into English.</p><p>➜ EVALUATE<br>Check any new vocabulary words you defined today with Vocabulary Checklist 11 or the glossary beginning on p.193.</p>","","","Lesson","0","FALSE"
