"course_custom_id","assignment_custom_id","assignment_week","assignment_day","assignment_name","assignment_description","assignment_teachersNote","assignment_linksUrl","assignment_type","assignment_duration","assignment_graded"
"alveary-recnKzHCs6UvKzvtd","alveary-recYQMEQ67FOknxu0","30","1","30m Shakespeare: Grades 5-8 - Lesson 30","<p>⍞ Materials: The Winter's Tale</p><p>➜ INTRO<br>In this scene, we will encounter a puzzling stage direction: &quot;He exits, pursued by a bear.&quot; One question that interpreters ask is, did they use a real bear? At the time, chained-up bears were used as live entertainment. Many have speculated whether or not the Bard would have used an actual bear in a live performance. Since using live bears raises many safety and ethical concerns, artists have since found fun ways to enact this scene. If time permits, read the article from Folgers of the same title as the line to learn more.<br>∞ Article Link: Pursued by a bear</p><p>➜ READ, NARRATE, &amp; DISCUSS<br>Act 3 Scene 3 - Act 4 Scene 2 p.105-125 &quot;Thou art perfect,&quot; - &quot;disguise ourselves.&quot;</p><p>• Consider the role of fate in the play. Why is Antigonous killed but Perdita spared? Why do you think Perdita is being spared?</p><p>• EXTRA HELPING<br>Have students finish the character quotes if there are any remaining quotes. Afterwards, they can do the Royal Shakespeare Company's Create a Bear exercise.<br>∞ Link: Character Quotes<br>∞ Link: Create a Bear</p>","","https://planning.alveary.org/links.html?id=recnKzHCs6UvKzvtd&term=3&week=30","Lesson","0","FALSE"
"alveary-recnKzHCs6UvKzvtd","alveary-recZ20nMeoFaZ1nrw","31","1","30m Shakespeare: Grades 5-8 - Lesson 31","<p>⍞ Materials: The Winter's Tale</p><p>➜ INTRO<br>Let's watch a clip and see a 'fool' or a silly person who is mocked and made fun of.<br>∞ Video Link: Act 4, Scene 3</p><p>To accompany our reading today, we will do a fun and informative exercise, Act Like a Fool! In Shakespeare's day, audiences loved foolish characters. In The Winter's Tale, Autolycus is the play's fool. In Act Like a Fool, students will try to play the role in the most ridiculous and funny way they can.<br>∞ Link: Act Like a Fool</p><p>➜ READ, NARRATE, &amp; DISCUSS<br>Act 4 Scene 3 - Act 4 Scene 4 p.125-145 &quot;When daffodils&quot; - &quot;Come, strike up.&quot;</p><p>• What role does Autolycus serve in the play? What type of fool do you think he is?</p>","","https://planning.alveary.org/links.html?id=recnKzHCs6UvKzvtd&term=3&week=31","Lesson","0","FALSE"
"alveary-recnKzHCs6UvKzvtd","alveary-recZ5l9KxzvUFiL15","32","1","30m Shakespeare: Grades 5-8 - Lesson 32","<p>⍞ Materials: The Winter's Tale</p><p>➜ INTRO<br>Act 4, Scene 4 is a challenging scene. One helpful framework to understand the scene is [secret-reveal] or [deception-truth]. Each main character has a secret that must be revealed. While reading, let's ask: What are those secrets? What needs to be revealed? If time permits, let's take a look at Exploring Act 4 in the Extra Helping.</p><p>➜ READ, NARRATE, &amp; DISCUSS<br>Act 4 Scene 4 p.145-165 &quot;Pray, good shepherd,&quot; - &quot;to die when I desire.&quot;</p><p>• Contrast Perdita and Florizel's motives at the celebration with Polixenes and Camillo's motives at the celebration. How are they different?</p><p>• EXTRA HELPING<br>For more information, take a look at Exploring Act 4.<br>∞ Link: Exploring Act 4</p>","","https://planning.alveary.org/links.html?id=recnKzHCs6UvKzvtd&term=3&week=32","Lesson","0","FALSE"
"alveary-recnKzHCs6UvKzvtd","alveary-rectPRRg4v3UZ0gTP","33","1","30m Shakespeare: Grades 5-8 - Lesson 33","<p>⍞ Materials: The Winter's Tale</p><p>➜ INTRO<br>Act 4, Scene 4 is a challenging scene. One helpful framework to understand the scene is [secret-reveal] or [deception-truth]. Each main character has a secret that must be revealed. While reading, let's ask: What are those secrets? What needs to be revealed? If time permits, let's take a look at Exploring Act 4 in the Extra Helping.</p><p>➜ READ, NARRATE, &amp; DISCUSS<br>Act 4 Scene 4 p.165-191 &quot;Why look you&quot; - &quot;be matter in it.&quot;</p><p>• Would you ever love someone if it brought conflict to your family or country? How do Florizel's values of love and duty seem to conflict in the scene?</p><p>★ Extra Helping<br>For more information, take a look at Exploring Act 4.<br>∞ Link: Exploring Act 4</p>","","https://planning.alveary.org/links.html?id=recnKzHCs6UvKzvtd&term=3&week=33","Lesson","0","FALSE"
"alveary-recnKzHCs6UvKzvtd","alveary-recgcipYp5C13VoIQ","34","1","30m Shakespeare: Grades 5-8 - Lesson 34","<p>⍞ Materials: The Winter's Tale</p><p>➜ RECAP <br>How does the sheep-shearing festival go from a joyful celebration to a moment of crisis for Perdita and Florizel?</p><p>➜ READ, NARRATE, &amp; DISCUSS<br>Act 5 Scene 1 p.195-213 &quot;Sir, you have&quot; - &quot;good my lord.&quot;</p><p>• How has Leontes changed from the beginning of the play to this scene? What has caused his transformation?</p>","","","Lesson","0","FALSE"
"alveary-recnKzHCs6UvKzvtd","alveary-recEbaKdMK2GpAO08","35","1","30m Shakespeare: Grades 5-8 - Lesson 35","<p>⍞ Materials: The Winter's Tale</p><p>➜ INTRO<br>Before reading the famous scene on Hermione's Statue, let's read an article on the scene and note the lines they cite. While reading, we should feel a sense of magic and enchantment in this scene.<br>∞ Article Link: Hermione's Statue</p><p>➜ READ, NARRATE, &amp; DISCUSS<br>Act 5 Scenes 2-3 p.213-235 &quot;Beseech you, sir,&quot; - &quot;Hastily lead away.&quot;</p><p>• How does the final scene tie together the themes of reconciliation and renewal? What characters experienced renewal?</p><p>• EXTRA HELPING <br>Have students play the review game The Winter's Tale: Path to Reconciliation.<br>∞ Link: Winter's Tale: Path to Reconciliation</p><p>Watch a clip of Aslan's breath. C.S. Lewis was an English professor and was very familiar with Shakespeare's works. There is an intriguing parallel between The Winter's Tale and The Lion, the Witch, and the Wardrobe. Watch the scene, Aslan's breath, and see if the students can spot the parallel. Consider too how the breath of God is used in Scripture to create life (Gen. 2:7), resurrect the dead (Ezek. 37:9-10), and to impart the Holy Spirit (John 20:22).<br>∞ Video Link: Aslan's Breath</p>","","https://planning.alveary.org/links.html?id=recnKzHCs6UvKzvtd&term=3&week=35","Lesson","0","FALSE"
"alveary-recnKzHCs6UvKzvtd","alveary-recnaWqr7KD2uzYT1","36","1","30m Shakespeare: Grades 5-8 - Lesson 36","<p>Exam Week</p><p>➜ EXAMS<br>Answer question(s) related to course.  Questions will come from: The Winter's Tale</p>","<p>★ Shakespeare: Grades 5-8 — TERM 3 EXAM QUESTIONS<br>· (GRADE 5-6) The Winter's Tale: Describe your favorite scene or character from the story. Why did you like this particular scene/character? Provide details from the story in your response.</p><p>· (GRADE 5-6) The Winter's Tale: What was a conflict or misunderstanding that was resolved in the play?</p><p>· (GRADE 7-8) The Winter's Tale: Choose one and give as much detail as possible:<br>- Why does King Leontes wrongly accuse his wife, Hermione, and what are the consequences of his actions?<br>- Is King Leontes a good man? Why or why not? <br>- How does the story shift from tragedy to comedy? What events make this possible?</p>","","Exam","0","FALSE"
